Dates,Scores,Reviews
Aug 23 2011,positive, he is familiar to people living in the middle georgia area as the entertainment man since his entertainment reviews run in newspapers and are shown on television there 
Aug 23 2011,positive, the one day is july 15th and in 1988 as they both graduate from the university of edinburgh dexter and emma have a friendly night together there is sex and on ems part at least there is love this is still a movie in which the girl is reckoned to feel love sooner and with more loyalty dex assumes he is handsome and commanding enough to be an adventurer and a flake with a field to play and no urge to commitment but ive only told you the half of it or less than half they are also anne hathaway and jim sturgess two pretty actors with a lot of talent but quite helpless with any notion that they might be making an attempt on real and ordinary people this is from a bestselling and allegedly beloved novel by david nicholls who has done his own script for a movie directed by lone scherfig a danish woman who directed an education i havent read the book and i dont think i will but the structure of the movie is cute and inane over the years we keep up with em and dex every july 15th why well i suppose it seemed like a sweet and artful idea to someone and it does permit all manner of fatuous graphics to tell us heres that lovely day again all of which get in the way of a more interesting possibilitythat we might truly follow a relationship over a period of say twenty years what kind of friends or lovers only think of each other on st swithins day why is the real pattern of obsession drift memory and forgetting reduced to a weird hallmark occasion and why should anyone cater to this fancy when two edible young stars are in sight with every sign of developing intelligence they know and we know that theyre coming together because movies cant resist concepts like true love and made for each other yet in life of course such creeds are not reliable and people do all manner of things in defiance of casting and the intractable laws of movie alliance we insist on being stupid im not going to spoil one days story except to say that the movie acts as its own spoiler with a drastic intervention that may be a nervous defense mechanism against the films accumulation of sweetness as well as a way of getting off after all july 15th could go on and on past retirement and dementia a movie needs a resolution the biggest advantage the form has over life none of this sounds promising especially if you consider that these two people live through the years without any marked sense of the world and what is going on its true that dex becomes an odious television host on what is called a show for young people and in fairly broad strokes we see how his early flakiness prompts a kind of moral downfall so em goes through a stage when she loves him but really cannot like him all the greater pity that ems gradual progress from working in a mexican restaurant and being a school teacher leads to her becoming a novelist i can buy that but i deserve to know about the book she writes it seems to be a success how it shifts the balance in her mind and promotes an adult personality any real novelist would know enough to write dex offand even to make him a warning figure in an expose novel but that courage or critical observation would break the cultural class system of made for each other which weighs more heavily in one day than the british economy blair and iraq global warming or the rampant advance in britain of electronic technology to say nothing of the new aristocracy of shits in other words dex and em are never allowed entry to the real world such as weve seen in the 7up series of documentaries and yet the film is worth seeing in great part because i think ms scherfig has genuine talent you see this most of all in the careful treatment of some of the supporting charactersabove all dexs parents who plainly were not made for each other but who have learned ways of working it out that is a great lesson for the rest of the film for instance our madeforeachother couple do come together after years of being passing ships then for a moment clouds of dismay and unease drift across the bright blue of happinessand that would have been worth exploring because thwarted longing can be easier to sustain than close company in the end however the reason to see this very lightweight film and the reason why it may touch you is because hathaway and sturgess have become the objects of our emotional investment there are difficulties with hathaway she is meant to be british but cant help sounding american at times try as she might she doesnt have it in her to repress her brighteyed radiance she ages in only minor and flattering waysno one puts on weight and she isnt allowed to acquire the demanding selfishness of a creative personality never mind hathaway improves all the time and i can believe there might be something grand coming as for jim sturgess last seen in peter weirs the way back he is a clever deft actor when he has to listen to his dying mother patricia clarkson tell him that he needs to change his ways struggling feelings cross his lovely but debauched face like toothache together hathaway and sturgess deliver one important dividend they make us feel we have been on a journey with these people you could watch one day and feel excited by a stunning proposition suppose you made a movie about two real friends in the twenty or so years after they graduate instead one day is just a gimmicky new way of doing an oldfashioned love story but well hear much more of sturgess hathaway and lone scherfig
Aug 22 2011,neutral, this is jeff bayer and i dont update this site very often if youd like to listen to my current movie podcast you can find it at moviebscom plot based on the novel by david nicholls dexter sturgess and emma hathaway spend the night together after college graduation and then are shown each year on the same date for many years after sometimes they are together sometimes not whos it for fans of the book will appreciate seeing this come to life also if youre a fan of missed opportunity loves stories youll enjoy it expectations hathaway normally delivers while i havent felt the same about strugess plus it seems like a good gimmick to tell a romance scherfig directed an education and i loved that film ending they try not to end the movie on a downer which is a good call but i really could have used that feeling at the beginning of the film questions did the movie start at one minute after midnight on july 15 also why make dex so unlikable without giving me a reason to root for the two of them to be together rewatchability no thanks though my wife will be reading the book so it might be fun to watch the film with her and learn the differences from book to film one day feels like a gimmick that unfortunately never quite works its july 15 over and over again throughout the years dex is selfish sex crazed a drug abuser and extremely unlikable emma likes him correction emma loves him at times do you know what this does for me it makes me dislike emma a little bit how could she like this guy so much not only that im not a supersappy nice guy who always feels like i finish last i know this because i also dont care for ian and cant stand that emma leads him on its a romance i never want to happen i dont ever feel like i get to know the people around dexter and emma the perfect example is on one july 15 when dex is visiting with his new girlfriends family its some game where you whack someone in the face with a newspaper dexter doesnt listen and takes an early swing nailing his girlfriend that kind of physical comedy is funny but has nothing to do with me feeling connected to these people the gimmick means youre only in these moments for a little bit of time i found myself waiting for the next knowing they couldnt spend too much time in any specific place with 20 years to cover
Aug 22 2011,positive,  two appealing stars and a director of talent throw themselves against a glib highconcept story until youre worn out from hoping it turns out better theres promise in it but no matter how gracefully or handsomely or smoothly made it is it never offers more than that promise and as it fizzles along you stop rooting for it bit by bit even though it recovers some near the end adapted from david nicholls novel one day tells the story of emma and dexter who graduate university on july 15 1988 and mark the date by nearly sleeping together instead they become friends  albeit with a constant strain of romance between them  and the film revisits the twists and turns and shapes of their lives which sometimes intersect on each july 15 for the next two decades there are jobs and lovers and spouses and houses and madcap vacations and joys shared and accidental pains inflicted bookish emma is more enamored of playboy dexter than he of her but even in the satyric revels that constitute his life he feels the strength of their bond over the years various moments between them throb with romance but they never quite get there and so each goes on to the wrong relationship or in his case a series of them with the nagging sense that the right person has been there all along emma is played by anne hathaway and dexter by jim sturgess and you couldnt ask for more personable or comely performers in the roles hathaway does a credible english accent and manages as in the devil wears prada to look mousy or ravishing as required sturgess playing a broader range than in across the universe or 21 is able  though fittingly for his role he still sort of coasts on that young paul mccartneypuppy dog thing hes got going alongside them rafe spall son of timothy invests emmas mismatched beau with a real savor of inner pain camouflaged  badly  with a façade of merriment handsome likable stars cant overcome an artificial story about two college chums hathaway and sturgess who nearly become lovers one july 15 and are revisited annually on that date for 20 years scherfig an education has craft and skills but the storytelling is leaden and distancing but the performers cant puncture the phoniness and artificiality at the heart of the film that job falls  or should have  to director lone scherfig who most recently delivered the dazzling an education which plays with somewhat similar themes and tones but without any sense of makebelieve or manipulation scherfig still displays fine craft the film is quietly beautiful and occasionally gorgeous but she cant make the characters come alive in such a cardboard situation in a sense one day is a bottle quite like an education but scherfig never fills it with the least bit of lightning the flaw finally might be in the material having not read nicholls novel i cant comment on its literary merit or on the fidelity of the adaptation but i sense that the device of the recurrent midsummer visits to the characters might feel less contrived on the page than on the screen where time spans are more abbreviated characters states of mind and heart are less readily revealed and ironies of fate are more crudely telegraphed unfolding as chapters in a novel a series of momentous july 15ths might acquire weight in this film though it feels obligatory and shallow and one day despite its attractiveness never manages to find a way to bring the conceit fully to life if you purchase a product or register for an account through a link on our site we may receive compensation by using this site you consent to our user agreement and agree that your clicks interactions and personal information may be collected recorded andor stored by us and social media and other thirdparty partners in accordance with our privacy policy use of andor registration on any portion of this site constitutes acceptance of our  user agreement updated 442023  privacy policy and cookie statement  and your privacy choices and rights  updated 12312023  2024 advance local media llc all rights reserved about us the material on this site may not be reproduced distributed transmitted cached or otherwise used except with the prior written permission of advance local
Aug 21 2011,negative, if youre looking for a great romance this isnt it one day is a drag i wish it had been only one day but it is many many days spread over nearly 20 years the poster for the film shows anne hathaway and jim sturgess embracing in the street in a hot and heavy kiss this is what we like to call false advertising if only there had been a memorable embrace by anyone in this movie anything to latch onto the gimmick derived from david nicholls novel is that students emma and dexter sort of hook up on the last night of college in england in 1988 and then try to meet on that same date july 15 every year through 2006 for a film like this to work you need an immediate connection to the characters or you need the two characters to be extremely charming clever and likable so that it doesnt really matter what they are up to or you need what theyre up to to be so diverting that it doesnt matter much if the characters lack connectivity or likability one day offers none of these things emma and dexter meet and meet and meet she is a waitress and wannabe writer he is a tacky tv host they love each other but mostly as friends and emma has strict platonic rules to follow when they are together emma and dexter lack chemistry and they find that their visits often lack luster if theyre bored by their recurring encounters imagine how we feel cliches abound dexter is into drugging and drinking his mother is dying of cancer emma shacks up in a loveless relationship with a dullard time marches on marked by changing hairstyles and bad british accents typewriters become laptops its kind of a contemporary same time next year minus the witty dialogue nicholls cannot blame some soulless screenwriter for twisting his words because he wrote the screenplay i suppose director lone scherfig who did a terrific job with an education in 2009 was hoping we would greet each new rendezvous with heightened anticipation instead they become moments of dread when 1993 flashed on the screen i thought oh dear god does that mean we have to sit through 13 more of these if you purchase a product or register for an account through a link on our site we may receive compensation by using this site you consent to our user agreement and agree that your clicks interactions and personal information may be collected recorded andor stored by us and social media and other thirdparty partners in accordance with our privacy policy use of andor registration on any portion of this site constitutes acceptance of our  user agreement updated 442023  privacy policy and cookie statement  and your privacy choices and rights  updated 12312023  2024 advance local media llc all rights reserved about us the material on this site may not be reproduced distributed transmitted cached or otherwise used except with the prior written permission of advance local
Aug 21 2011,negative,   ive read several articles about this movie that compare it to when harry met sally because the two leads are friends before they become lovers i can see why they would say that but the relationship between emma and dexter is much closer to katie and hubble in the way we were than it ever is to harry and sally although never does this movie even approach the greatness of that 1970s classic nor for that matter does it come close to when harry met sally there are some nice moments in it but i would never call it a classic   the gimmick of the film  and it very much feels like a gimmick  is that we see two people on july 15th every year for 20 years it starts with the night of their graduation when emma a nerdy politically active girl were told and dexter a popular golden boy almost sleep together but  then decide  well he decides  that they should just become friends instead   over the following years dexter becomes a television presenter party animal and kind of a selfish asshole emma gets stuck in a dead job and in a relationship with a very unfunny standup comic the years roll on and dexters career tanks while emmas suddenly takes off as a writer they remain friends although its obvious that she has deeper feelings for him than he does for her until one day it all changes   its been said time and time again on the pages of this site that the most important aspect of a romantic film is that the audience needs to care whether the leads get together and they need to see that these two should be together frankly i never thought these two should get together and i only really cared because emma wanted it so much even if i never did see just why she wanted him so much   i think a big problem with the story is that it should have started a few years earlier like hubble i have the feeling that dexter peaked at university and the rest of his life was a slow sinking from that emma on the fringes of college life would have looked at him and aspired to his ease and popularity instead when we first meet dexter he behaves rather insensitively and he continues to be insensitive to emmas and everyone elses feelings for the rest of the film   anne hathaway delivers another brilliant performance although her english accent is rather dubious its so vague that i had no idea she was supposed to be doing a northern accent until i read an article that told me so despite the occasional flattening of her vowels however she is lovely as emma maybe she cant do the english voice but she does do the repressed english longing quite well   her other half doesnt fare so well sturgess does a decent enough job as dexter but hes nothing special he doesnt have enough charisma to make up for the characters faults and so i was left constantly wondering what emma and everyone else saw in him   by sticking to the films gimmick the story is forced to do one of two things either every important thing that happens to the two of them must happen on that date or the story is going to have to skip some important events the script opts for skipping important events which is fine except that it skips the night the two finally have sex for the first time picture when harry met sally without the scene where the two of them sleep together for the first time and then having sally just casually mention it in a later scene thats how i felt when it happened here   the book this movie is based on has been a best seller for the past two years and received critical praise i can only assume despite the script being written by the author of the novel that something was lost in the translation   i have that same feeling about the book being much better than this movie version in an interview david nicholls the author of the book and screenplay stated that the biggest difference between page and screen is the fact that you cannot film a characters inner thoughts the way you can describe them with words i personally disagree with that statement a well written script should convey exactly what the characters are thinking but it at least explains why the movie never delves very far beneath the surface actions of the characters most likely the book gives more insight into just what emma sees in dexter   i agree that anne hathaway gives another stellar performance she nearly overcomes her characters vague motivations such as why she stays so long in a deadend job and why she gets involved with the standup comic in the first place both of these decisions hint at a lack of selfesteem yet that issue is never fully explored   what empathy the movie musters for the characters is due entirely to her her subdued yet heartfelt pining for dexter almost makes you care what happens to them there are a few moments of genuine emotion but overall i was disappointed  fyi her accent sounded fine to my ears but then i havent spent nearly as much time listening to the english speaking as my brother scott has   and the july 15th angle definitely seems like a gimmick and since the movie makes such a big deal about the passage of time it seems odd that such scant attention is paid to the actual details of the changes in world events technology fashion and music over the years and with the exception of dexter going a bit gray at the temples neither he nor em noticeably age over the course of 2 decades   patricia clarkson has a few good scenes as dexters cancer stricken mother and ken stott is good as dexters loving but stern and emotionally repressed father we are never shown ems parents or told much about her backstory except that she is clearly working class while dexter comes from money   the only thing that one day reminded me about when harry met sally is that harry told sally that a man and a woman cannot be friends as the sex always gets in the way  the fact that emma wanted dexter so much and he just wanted to be friends is ridiculous  on their first date he gets naked and jumps into her bed  when on vacation he convinces her to go skinny dipping  he never lost sexual interest in her  had they in fact had sex that first night they would have likely never had any deeper of a relationship    the writing and editing is horrible  the scene where dexter needs desperately to speak to emma but cannot get ahold of her is incomplete  his father has just told him off and he needs a friend while she is off on a date  before they talk it cuts to another year  the gimmick of the years is annoying  they flirt with each other to nauseam  by the time they get to paris i wanted the movie to be over    patrick wrote that scant attention is paid to the actual details of the changes in world events technology fashion and music over the years  i disagree  many details are thrown in such as the different popular songs and the video game from 1995  when cell phones became popular emma tells dexter he will get cancer from it    the films biggest flaw is that dexter is a dick  he is rude as hell to emma at a restaurant  when an old college classmate offers him a job dexter insults him  when playing a game with a girlfriend he stupidly hits her so hard she bleeds  i did not like this shallow self centered idiot  emma could do so much better than him    dexter is an extravert while emma is an introvert  he took her places and gave her experiences she would never have had without him  she meanwhile provides a female companionship that is is not made complicated by sex  it is a rather flimsy basis for a relationship   i never became emotionally invested in emmas and dexters song and dance and was thus not moved by the ending  the book maybe great this film however is anything but
Aug 20 2011,positive, one day is an unconventional love story told in an unconventional style the conceit of dropping in on them once a year on st swithins day july 15 to check their rocky progression from the 1980s through to the 21st century is as arch and penetrating as it is effective in stripping the story of any trace of flabby exposition and getting to the heart of the infinite complexity of relationships events piled on events are less important than the neat summation from year to year of where emma anne hathaway and dexter jim sturgess stand in relation to themselves and one another  it begins in 1988 as the two graduate from college and fall drunkenly into one anothers arm its less impersonal than it sounds at least for emma though events prevent them from sealing the deal as it were they decide to become friends the which they do with a fervent devotion that survives miscues crosspurposes thirdparties and the ebb and flow of their fortunes its obvious even to them that they are soul mates but of what specific variety eludes them as emma waits for dexter to grow up and dexter waits for emma to find her inner worth its not an easy wait and there is at no time any guarantee of a happy ending dexter discovers the allure of the blonde girlfriend emma discovers the mixed blessings of surrendering to ian rafe spall the desperately unfunny standup comedian rafe spall who makes himself far too emotionally available and cant believe his luck when it seems to pay off written for the screen by david nicholls from his novel of the same name the script reflects its literate origins its intelligent without being selfconscious using telling details and witty wordplay such as emma describing the smell of her shabby first london flat as that of onions and disappointment the excellent writing is illuminated by equally excellent performances hathaway evincing a ferocious honesty and growing strength beneath the vulnerability of emmas selfdeprecating bon mots sturgess finds the sweetness at odds with itself in dexters boorishness not just with emma but with his dexters disapproving father ken stott and gentle mother patricia clarkson whose unconditional love for her son doesnt wear blinders spall brings a vivid complexity to ian making clear his palpable understanding that he and emma are wrong for each other but is nonetheless unable to resist the temptation to try its the perfect tragic counterpoint to the soul mates misconnecting and by comparison makes those misses all the more wrenching one day is a love story that redefines what perfect timing is unblemished by soggy sentiment it is nonetheless a film with a full voracious heart tempered with a surprisingly clear head when it comes to romance funny tragic droll and very very smart its the thinking persons love story 
Aug 20 2011,positive,bookbased drama is too heavy for younger teens
Aug 20 2011,negative,one of the most painfully unromantic romance dramas ive ever seen
Aug 20 2011,negative,the fractured chronological foundation doesnt translate to film with the character arcs stifled by the fragmented glimpses at their stories
