Dates,Scores,Reviews
Jun 6 2019,positive, five years after godzilla defeated the mutos in san francisco and reduced a sizable portion of the city to rubble cryptozoological agency monarch is on the verge of being put under united states military control but before that can happen scientist dr emma russell vera farmiga and her teenage daughter madison millie bobby brown have been kidnapped by the unscrupulous jonah alan charles dance and his band of mercenaries their goal is to awaken the godlike monsters dubbed titans monarch has been studying around the globe from their slumber believing that the destruction and carnage these creatures leave in their wake will help the earth heal from centuries of misuse on the part of the human race but their list includes the mysterious monster zero also known as ghidorah a threeheaded behemoth who may not be of this world and instead of restoring the natural balance this vicious beasts goal might just be the complete eradication of all of humanity monarch scientist dr ishiro serizawa ken watanabe enlists dr russells estranged exhusband mark kyle chandler to assist him in the search for the kidnapped mother and daughter he understands her work better than anyone so the feeling of dr serizawa and his trusted fellow scientist dr vivienne graham sally hawkins is that he is their best option to stop to alan from awakening these titans but his resolute hatred of godzilla potentially the only creature capable of destroying ghidorah could prove to be a catastrophic roadblock for the monarch team mark blaming the kingly creature for the death of his son in san francisco five years prior i thoroughly enjoyed director michael doughertys godzilla king of the monsters it made me smile that does not mean i think it is as memorably great as gareth edwards 2014 hit godzilla which birthed this socalled monsterverse for warner bros or that it is as giddily enjoyable as jordan vogtroberts 2017 adventure kong skull island proved to be it also cannot hold a candle to ishirô hondas 1954 japanese classic that started this giant monster craze 65 years ago that magnificent motion picture standing the test of time something fierce but dougherty the mind behind inventive low budget horror gems krampus and trick r treat has an obvious affinity for the toho studios creatures and not just the titular star along with ghidorah both the usually benevolent mothra and the fiery rodan are also utilized here the director showcasing all four in action with consummate skill rodans entrance is particularly fantastic the pterodactyllike monster birthed from inside a mexican volcano and subsequently proceeds to lay waste to an entire village with blistering fury before finding itself in conflict with both godzilla and ghidorah out in the middle of the ocean its a stunning sequence one that is delivered in true late 1980s early 1990s toho godzilla sequel splendor the unabashed silliness of their clash juxtaposed with devastating respect for the might and muscle of the creatures thats suitably incredible at the same time also much like many of those japanese epics from the tail end of the 20th century the human component of this story grows increasingly asinine as events progress cowriting the script with krampus collaborator zach shields and working from a story the pair dreamt up with godzilla and kong skull island scribe max borenstein doughertys screenplay is unquestionably stupid alans plan never makes much sense and his indifference when he realizes that ghidorah isnt part of the natural order but instead an alien invader intent on domination is demonstrably absurd as for dr emma russell her motivational flipflops are impossible to keep track of let alone understand making it difficult to care whether or not she is going to be reconciled with mark let alone invest emotionally when shes inevitably forced into a fight for her own survival its also a tad strange just how quickly monarch has developed as a scientific defense force in the span of five years the organization has essentially become the monsterverses version of marvels shield complete with secret underwater headquarters where theyre able to monitor godzillas movements and a huge flying fortress that allows them to zip around the planet in no time flat granted theres a similar agency in the latter toho godzilla films so the fact monarch morphs into the earth defense force given that name in godzilla final wars or the global defense force as called in godzilla unleashed isnt a big surprise its just the speed in which they suddenly have all of this technology and equipment available to them thats hard to buy especially considering theres a major plot point regarding the us government wanting to put them under the control of the pentagon meaning theyre not a military organization still there are sequences of such staggering beauty not the least of which is a journey to godzillas underwater layer where dr serizawa gets a heartfelt close encounter or the birth of mothra from her cocoon beneath a central american waterfall and i really loved how much dougherty appreciated the size and scale of the various monsters i found the climactic showdown in boston to be well worth the wait and while id rather we stop staging these clashes shrouded in darkness and sheathed in rain that doesnt mean i could take my eyes off the screen for a single second of the ghidorahgodzilla smackdown its likely i was as close to being inthebag for this sequel as anything ill see and review this summer and i feel i need to admit that i adore doughertys previous films as already stated i love the most recent godzilla and had a heck of a good time watching kong skull island most importantly im as devoted to the japanese godzilla pictures as anyone and while id never say ive liked all of them even the ones i dont particularly care for id watch again at the drop of the hat if the opportunity to do so were to arise heck composer bear mccreary backcountry even manages to work in yûji kosekis mothras song and akira ifukubes iconic original godzilla theme into his magnificent score and its quite possible i might have shed a silent tear the first time the latters thunderous refrains splashed upon the soundtrack none of which means that i think godzilla king of the monsters is perfect or that everyone will enjoy it near as much as i did it does have flaws and its missteps are egregiously obvious but i was able to look past most of those as i let the joy of seeing mothra and rodan soar through the sky in mortal combat and the euphoria of ghidorah and godzilla locked in a lethal embrace sweep over me in continuous waves i had a blast watching doughertys take on these legendary creatures and it goes without saying ill be heading to the theatre again to see this sequel for a second time relatively soon we are dedicated to creating a distinguished user experience and a website rich in content with solid execution our reviews aim for critical analysis of films many aesthetics while talent interviews offer insight into the filmmaking process  1999  2024 moviefreakcom  all rights reserved  no content may be copied without permission  all film titles and photo materials are the property of their respective owners  design and implementation by sokumediacom 
Jun 6 2019,positive, then war broke out in heaven godzilla and his angel mothra fought against the dragon and the dragon and his angels called rodan and others fought back but he was not strong enough and they lost their place in heaven the great dragon was hurled downthat ancient serpent called the devil or king ghidorah who leads the whole world astray he was hurled to the earth and his angels with him just look at that cross subtle is not how one would describe godzilla king of the monsters instead its awesome in every sense of the word inspiring a sense of genuine awe as well as being yknow pretty cool its also quite stupid the overall plot and the humans who inhabit it are either overstuffed or underbaked some characters are given far too much attention and narrative importance while others are vacuous avatars for various monster movie tropes nononsense military leader aisha hinds snarky soldier oshea jackson jr nonamerican ecoterrorist charles dance goofballbutbrilliant tech guy bradley whitford i dont recall any of these characters names and i dont have to the actors all seem like theyre having a good time embodying these stereotypes especially whitford who is totally hamming it up the basic plot centers around a family of scientists mark and emma russell kyle chandler and vera farmiga and their daughter maddie millie bobby brown there was a fourth russell a son and brother who died during the battles in san francisco from the 2014 godzilla film a plot detail intended to ground the characters decisions as motivated by grief but often feels like attempting to add pathos to a film that doesnt ask for it since that tragedyand somehow in connection with kong skull island a film i havent seenthe russells have been part of monarch a covert research group with a mission of studying the notsodormant titans thats what they call the big beasties they have developed an audio device macguffin the orca which is used to somehow control or speak to the titans when emma maddie and the orca end up in the hands of ecoterrorists trying to set the titans free it prompts mark to rejoin monarch which is being led by godzillas ishiro serizawa ken let them fight watanabe and vivienne graham sally hawkins much like director gareth edwards approach with the 2014 film godzilla king of the monsters is at its best when the titans are shown to full scale in all their glory with the puny humans staring up at them in fearful wonder there are some marvelous images generated herei would dare to call some of mothras moments beautiful its what makes the original trailer so frissoninducing and transcendent when the characters spout off silly lines or unfunny jokes it distracts from the films purpose very much akin to a priest or minister attempting humor in a sermon while preaching in a vast and lofty cathedral were not here for your jokes pastor just let us gaze at the light shining through the stained glass feel the weight of the hymns and organ joyfully partake in the eucharist to find the glory thank you malick as godzilla is portrayed as the rightful and good king over the titansindeed he is the king of kings and lord of lordsthe connections here between godzilla and his divine namesake shouldnt be dismissed as superfluous even within a silly summer blockbuster of giant cgi monsters duking it out in various global locations such an aweinspiring religious spectacle which is also about humilityabout when not to attack but to simply beis unique and praiseworthy in our cultural ethos when the prophet isaiah saw the glory of god in isaiah chapter 6 his response is to cry out woe is me for i am undonefor mine eyes have seen the king the lord of hosts its an appropriate response to coming facetoface with a god or a godzilla
Jun 6 2019,neutral,a noisy movie with a couple of exciting or visually arresting moments but also with a lot of filler and gratuitous content full review in spanish
Jun 6 2019,neutral,it must have been tough saying lines that make no sense in a story that is incomprehensible i imagine them all  dance hawkins watanabe  at the bar each night trading bonkers lines of dialogue theyd had to say that day as a kind of drinking game
Jun 5 2019,neutral,despite the talent from brown farmiga and chandler the story is a simple succession of cheesy events full review in spanish
Jun 5 2019,negative, the new story follows the heroic efforts of the cryptozoological agency monarch as its members face off against a battery of godsized monsters including the mighty godzilla who collides with mothra rodan and his ultimate nemesis the threeheaded king ghidorah when these ancient superspeciesthought to be mere mythsrise again they all vie for supremacy leaving humanitys very existence hanging in the balance first and foremost this film did not waste any time when it came to showcasing godzilla or the other monsters that in itself is a huge major win for this film seeing as though the previous godzilla 2014 took practically an entire hour before they showed the creature at all moreover this sequel starts off with the aftermath of the previous film to help continue the story in terms of the narrative it was nice to see the stories connect and address the gravity of the situation when giant monsters have destroyed an entire city in addition to this the level of destruction in this film was really on par with what we could expect from giant monsters fighting speaking of monsters we get a whole lot more in king of the monsters it would appear that any criticism the previous godzilla movie received for having a lack of monsters had been heard loud and clear by the movie studios the inclusion of multiple monsters was probably this movies strongest asset there was a nice variety of monsters that casual godzilla fans may not be acquainted with however the initial draw will come from the more classic monsters that have been advertised like mothra ghidorah and more when it came to the more wellknown monsters they thankfully didnt remain onedimensional during the movie  many of them were given a combination of various attack moves or powerups to help make their battles more interesting while im on the subject the monster battles are exactly what people expect and king of the monsters does mostly deliver in that regard many of the fights were constructed in a manner that almost felt like a professional wrestling match there were many moments in the film where the drama and suspense would build up and youd find yourself practically cheering for this or that monster at any given time besides the monsters most of the actors handled their roles just fine  i just want to highlight the one actor that felt the most compelling and that was ken watanabe he had a certain presence in the movie that just made you want to pay attention and listen to him as the voice of reason it was refreshing to see his role expanded much more this time around one element that was also essential and nicely done in this film was the inclusion and growth of the monarch company the benefit of this organization is that it becomes a practical medium for the audience to obtain information in a reasonable way the positive with monarchs role is that the film is able to provide a lot of additional mythological lore about the monsters which just so happen to also be homage to the much older japanese godzilla films starting with the minor issues first i think that the random bits of humor in the movie were hit or miss in a vacuum the jokes or humorous moments were chuckleworthy at best but when you think about the movie as a whole the humor really didnt serve any beneficial function it unnecessarily broke the tension or the sense of urgency that the monsters posed between this sequel and godzilla 2014 film the tonal shift became much lighter and i dont think that was a good direction to take again its minor issue but in hindsight it became rather noticeable how unnecessary it was for the film another minor issue in the film was some of the cinematography that was utilized during the monster battles the reason why this was a minor issue is because it wasnt a frequent occurrence but it was unfortunate that it would happen during some of the monster battles basically what would happen is the camera shots would be too tightly zoomed in during the fights and this would happen while the scenery was poorly lit it made some of the actions scenes hard to make out as for the last minor issue with this film youll be able to tell pretty early on that this movie is rather predictable unfortunately this film doesnt take very many risks with its characters or monsters so that basically leaves you to easily guess the outcome of most situations you might start to notice that the film will telegraph situations during a really intense moment and after the fourth time or so the build up of anticipation starts to wear thin with those minor issues out of the way now we can talk about one of the major issues unfortunately while it was a commendable effort to include more monsters in the movie many of them were just wasted while the initial setup and promise of the film feels like there will be a major freeforall we just have a bunch of monsters become background noise to top that all off even one of the primary monsters in the film was a complete and utter letdown this particular monster gets hyped up so much and even has some pretty interesting moments in the film however when its all said and done their entire existence was for nothing as for the biggest problem in king of the monsters that prize goes to the all of the humans in the movie except for ken watanabes character and their personal drama while the movie studio clearly heard the criticism of not having enough monsters they apparently missed the memo that the human drama is not needed at all the motivations for some of the main characters are pretty dumb and almost straight from a comic book villains story for a monster movie taking time away to focus on the human characters personal drama was a huge distraction  as a matter of fact king of the monsters is 2hrs and 11 mins long and it most definitely wouldve been better served to remove the family drama elements to save a solid 20 mins of time to make matters worse many of these irrelevant issues would come up right in the middle of the climatic monster fights all of that rising action and tension gets broken every time we take time away from the monster fights to focus on a characters personal issue i dont know how anyone wouldve thought that would be a good idea at all but one of the best monster fights in the movie has to take a break just to show us an update on how some family is doing in the midst of the fight godzilla king of the monsters is a monster movie that feels like a restaurant that just cant get your order right its like when you ordering a hamburger with extra ketchup and no pickles when you finally get your burger they give you the ketchup packets on the side which is fine but you still find two strangely pickles hiding under the bun so let me address this human problem with a bit more clarity because i dont want there to be any confusion with my criticism right now godzilla king of the monsters is falling into a similar trap that the michael bay movies would succumb to itll give you a lot of the good stuff you wanted the transformers but it wont take the time to filter out the unnecessary things either human drama there simply needs to be a better balance when it comes to the monsters and the human drama in these films i say that because i believe there is a built up expectation for audiences to come and see monsters fight the monsters should be the lead characters in the film and receive the most screen time besides that the humans should be complimentary or secondary characters rather than trying to fight for the audiences attention in other words the only human drama that is necessary in these films should be any drama that is directly related to the monsters themselves the moments in the movie that show the humans trying to deal with the monster problem are great the moments when theyre trying to deal with their family marriage or whatever else is not so great im sorry no im not but i dont care about a familys personal issues while a group of large monsters are destroying the world right outside the humans in these movies can serve the purpose of  informing us about the monsters be affected by the aftermath of the monsters and even have some relationships with the monsters since many of the humans in this movie have a weird inclination to want to touch the monsters faces regardless the moment the focus goes away from the monsters and onto the humans and their personal issues the film has betrayed its primary purpose which is to be a movie about monsters  with all that being said yes this movie did some great things with the monsters yes it does have some great action and id say it had some entertaining moments its ultimately an ideal popcorn flick that is worth seeing in theaters if you youre willing to ignore the parts of the movie that have nothing to do with the monsters the story is nonsensical but they give you so many monsters to distract you youll probably be more forgiving about it as a fan of monster movies myself and despite the many issues i had with this movie id recommend to check this out be sure to stay until the end of the credits for a bonus post credit scene too godzilla king of the monsters is in theaters now  be sure to follow emans movie reviews on facebook subscribe on youtube or follow me on twitterig emansreviews for even more movie news and reviews
Jun 5 2019,negative, the third film in legendary pictures monarch cinematic universe after gareth edwards 2014 godzilla and jordan vogtroberts kong skull island godzilla king of the monsters coursecorrects the lack of the titular beast in the first movie but also expands on the elements that werent so popular theres a glut of unnecessary dull dumb human characters and while the monster fights are frequent they often look murky and lack visual dynamism unfortunately this movie misses the gorgeous cinematography of guillermo navarro who conjured the awesome aesthetic of pacific rim or larry fongs striking visual palette in kong skull island watching both godzillas im left wondering if well ever see the king titan clash under clear skies the excitement of seeing this beastly royalty on screen is dampened by the restrictive storm of dusty smoky greys and browns its a visual dirge that made me ache for the breathtaking halo jump from the 2014 movie or practically any monster shot from skull island honestly check my earlier review i took a lot of flak for unashamedly loving that movie seeing the sheer number of iconic beasts and the loving fanservice liberally slathered on screen should have been a joyous thing but sadly theyre competing for screentime with a phalanx of hollow grating human characters its bad enough director michael dougherty squanders the scenerychewing charles dance we also have to endure the human slice of dry white crustless bread that is kyle chandler  vera farmigas character motivations are astoundingly stupid and cliched bradley whitford delivers naff quips zhang ziyi espouses vaguely asian mysticism and ken watanabe returns to intone superseriously millie bobby brown gets a little more to do than most but the family dynamic between her character chandler and farmigas is illdefined and has no satisfactory resolution oh and theres an utterly wasted sally hawkins thomas middleditch aisha hinds avid stathairn joe morton anthony ramos and oshea jackson jr to name a few theres simply too many human characters that whenever we lose sight of the titans the movie becomes a trudge in that regard godzilla king of the monsters suffers from the same issue the transformers movies had where the spend way too much time with an inordinate number of unlikeable characters delivering terrible dialogue and doing idiotic things what could have been a lean mean clash of creatures ends up a monotonous meander between muddylooking incomprehensible battles that aside the bear mccreary score is aces and theres a couple of unintentionally hilarious moments that helped me through this overstuffed undercooked pretender to the crown if youre a fan of the 2014 movie you may enjoy king of the monsters at facevalue there are plenty of callbacks to the rich history of godzilla and the promise of more gargantuan tussles in future but as a casual fan i was bored heres hoping adam wingard can right the ship with next years beastly battle royale we hope youre enjoying brwc you should check us out on our social channels subscribe to our newsletter and tell your friends  brwc is short for battleroyalewithcheese regular type person by day film vigilante by night  spent years as a 35mm projectionist he got taller and now he gets to watch and wax lyrical about all manner of motion pictures  daryl has got a soft spot for naff horror and hed consider anime to be his kryptonite
