Dates,Scores,Reviews
Jul 8 2020,negative, godzilla king of the monsters 2019 is a spectacular mess this is an ugly tensionless blockbuster where characters do stupid things while staring at computer generated skyscrapersized monsters battling it out in mundane fashion its a neverending assault on our visual auditory and common senses now what i just mentioned may be a selling point for some of you and with that i say more power to you if you come out of this thoroughly entertained thats great i wish i couldve had that experience  director michael dougherty who cowrote the screenplay with zach shields molded this story  a continuation of warner brothers monsterverse that includes the previous godzilla 2014 and kong skull island 2017  with a flat lifeless energy visually the action is depicted as though it were photographed through mud often taking place at night during a rain storm or blizzard or in the middle of a dust cloud an early set piece happens in antarctica of all places where a nighttime snow storm obscures our vision badly its all chaos with no clarity one of the major gripes some audience members had with godzilla 2014 was the lack of action with the monsters or titans as theyre described this time the action is tripled and yet we arent rewarded because the visuals are so damn murky is it too much to ask that an action scene take place in the middle of the day while its sunny outside its unfortunate that a talented cast is wasted with such undercooked material oshea jackson jr david strathairn ziyi zhang and sally hawkins are all exceptional actors and yet are given nothing to do are tossed to the side or are simply forgotten about as the plot progresses poor vera farmiga she is saddled with a character who defies all logic her dr emma russell has developed a machine that can communicate with the titans through sound waves and yet her motivation isnt to control them so much as to let nature balance itself out theres a strange bit of dialogue in which she explains how civilization has destroyed earths ecosystem and the emergence of the titans is natures way of correcting itself regardless of the substantial loss of life that will come of it basically shes thanos but with a phd  safety is not treated with much urgency among these people emma knowing full well how hazardous her work is willfully brings along her daughter madison millie bobby brown to her secret laboratory to witness her experiments play out it doesnt help that the compound is then ambushed by ecoterrorists lead by charles dance in an attempt to steal emmas technology this leads to emmas exhusband mark kyle chandler going on a personal quest to save emma and madison chandler is the only rational character we get he clearly sees the danger of the titans and yet his warnings fall on deaf ears chandler exudes the same kind of dadintellectualeveryman quality that sam neill brought in jurassic park 1993 but is let down by a far lesser narrative the plot settles into repetitiveness as our characters travel across the world on a super jet witness a titan fight just to be caught up in the mayhem and having to escape before being crushed and then traveling to a new destination to do it all over again for a movie where the action is the selling point there is a surprising lack of it amongst our human characters when they are not running towards or away from danger they simply stand around a command center looking at monitors or out of windows the art direction has such little ingenuity that a scene taking place inside of a submarine looks like it could have happened on the super jet also the set design does not distinguish the two locations well enough the story is so underwhelming that a situation involving twins is brought up as though it were important but is then thrown away with no real relevance or impact ive heard of actors making cameos in a movie but its rare to see an actual plot point be treated like one i found myself squirming in my seat during godzilla king of the monsters as a means of keeping myself engaged theres very little here that i found fun entertaining or enjoyable at any level its a drag of epic proportions im jealous of those who will like this i wish i couldve seen the movie they saw
Jul 7 2020,positive,everything my soul needed kaijus mercilessly destroying each other destruction an epic music score cheesy lines and beautiful cinematography full review in spanish
Jun 28 2020,positive, the postcredits scene its been around for a long time much longer than the classic ferris bueller plea for the audience to finally leave in fact animal did something similar at the end of the muppet movie seven years earlier mostly because of the marvel cinematic universe theyve become even more popular as of late in my opinion the number one best of these is from a marvel film spiderman homecoming being that it was released worldwide on the same day i consider it to be the greatest practical joke ever played upon movie theater audiences the second best to me was at the end of kong skull island even though i knew the film was a litmus test to see if what had been started in godzilla could continue as a franchise it was still an amazing surprise to this longtime kaiju film fan the promise set forth with that postcredits scene has now finally been realized with godzilla king of the monsters its been five years since the battles between godzilla and the mutos wreaked all kinds of destruction and showed the world that monsters exist the organization monarch has been locating and subsequently keeping an eye on these creatures known collectively as titans one of their lead researchers is emma russell vera farmiga who has developed a machine called the orca that mimics the frequencies titans use to communicate after the first successful test she and her daughter madison millie bobby brown are kidnapped by alan jonah charles dance and his team of ecoterrorists monarch recruits emmas exhusband animal behaviorist mark kyle chandler to help track down his family and the orca in the process they discover that godzilla has been straying from his usual migration patterns heading directly into the path of jonah and his plan to loose all of the known titans upon the world godzilla king of the monsters henceforth to be known as gkotm is a very worthy successor to the previous films amping up the monster action and even giving us a framing plot thats just as good as kong and better than the one in godzilla its also the big budget version of these creatures weve been waiting for since the summer of 1998 the human element is well thought out with characters whose fates you get genuinely concerned about who cause you to inch toward the edge of your seat when theyre in peril these arent cookie cutter central casting characters wandering around like supporting players in a slasher film just waiting to get stomped or chomped instead these roles were filled with actors of a quality caliber returning for a second round with the big guy are sally hawkins ken watanabe and david strathairn joining the fight with them are bradley whitford thomas middleditch aisha hinds oshea jackson jr and in a somewhat familiarfeeling dual role zhang ziyi also keep an ear out for a cameo actor to be called a familiar name of course what you truly want from any godzilla film old or new is monsters the character designs the gkotm effects team came up with are amazing they have taken the classic kaiju a lot of us have grown up loving and given them the upgrade that goes above and beyond a fans wildest dreams i genuinely think the creators of the original japanese creature suits would and should be proud of the design work in this film not only does gkotm give us great monsters it expands the mythologies of these beasts the focus is primarily on the big four from the toho films godzilla mothra my personal favorite rodan and king ghidorah yet were also given a glimpse into what totals according to the films scientists seventeen different species sure this is a blatant setup for future films and it would ring more as such if this wasnt already the third entry in the franchise as well as a fourth having finished principal photography with several winks to longtime fans gkotm delivers the kaiju mayhem and serious storytelling that should satisfy all audiences and yes theres another nice postcredits scene hearst television participates in various affiliate marketing programs which means we may get paid commissions on editorially chosen products purchased through our links to retailer sites
Jan 17 2020,negative, what if i were to say that a summer blockbuster was boring worse yet what if i were to say that a summer blockbuster starring vera farmiga ken watanabe sally hawkins oshea jackson jr and more were boring what if i were to say that said summer blockbuster wasted its cast its simple premise and its handful of provocative themes and what if i were to tell you that a random pa accidentally spilled their bottle of mountain dew voltage all over the camera staining 75 percent of the film an opaque shade of blue i cant corroborate that last statement but i canas much as it pains me to do soverify the rest in what appears to be a response to godzillas reception five years ago godzilla king of the monsters triples down what audiences were clamoring for thats more mayhem more laser breath and yes more monsters however all of that comes with a caveat more lens flares more michael bayhem more awkward cuts and less cohesion in both fight scenes and pacing make for a ride that goes on for way too long and still ends before it begins dont peg me as some plotdriven square though the main issue with king of the monsters isnt necessarily its plot its just how apparent it is just how left of center it exists without enough care to either blossom or completely get out of the way that plot concerns a socalled cryptozoological agency monarch as they fight against a trio of godsized monsters that includes dragontype destructor rodan mothra the giant moth and for all the franchise fans out there the threeheaded king ghidorah again there arent many plot devices here the entire plot is a device in and of itself and while that would be fun in more secure hands it instead seats the audience with a handful of dreadfully dull characters the closest to a conduit exists in the form of dr emma russell farmiga and her daughter madison millie bobby brown both of whom have their own turbulent relationship with the family patriarch mark kyle chandler alongside them are science experts ishiro serizawa watanabe and ilene chen ziyi zhang who in their infinite wisdom let in the little fact that ghidorah is godzillas arch nemesis they naturally decide to pit godzilla against the new team of threats things get scaly things blow up things get really dark really dusty and then really bright again thanks to a cacophonous light show of visual effects rinse repeat the end but despite this schematically sound setup king of the monsters tries its hand at a semblance of commentary directorcowriter michael dougherty and cowriter zach shields build the film around environmentalist ideologies that dont go much of anywhere its idiosyncrasies point to more genrebending potentials but the film instead uses this base as filler add in the fact that the film exists to bathe in destruction and it ends up at the south end of an alreadyextraneous moral compass this isnt to say that the entire film is preoccupied with some sort of message however that would only be the first 80 minutes or so which come out to a very long first twothirds the arc is almost entirely dependent on tone as well and while the film starts much more akin to gareth edwards godzilla it veers farther into cartoon territory without telegraphing its shifts or recontextualizing its earlier scenes its closest efforts in doing so are personified with dr rick stanton bradley whitford a joke dispenser who feels stuck in an entirely different film instead the unifying motif is its platinum color palette courtesy of lawrence sher the cinematographer behind movies such as war dogs and the hangover trilogy its all blue all the time here save for the wide shots of the fiery abattoir that comes to be and if he and dougherty are feeling generous there might be some red in there as well its economically shot but not fun to look at often lacking a sense of scale or grandeur each monster each crash and each blow are so isolated that the film doesnt feel light on its feet but void of weight instead cordcutting once carried the promise of reducing live tv costs but with most services nearing a 100 per month that statement checks less every day that said there is a handful of cordcutting services with reasonable monthly prices below we list them maybe youve just seen oppenheimer and have the strongest urge to marathonor more fun yet rankall of christopher nolans films or maybe youre one of the few who havent seen interstellar yet if you are then you should change that immediately the dystopian epic is one of nolans best and with that incredible twist in   which netflix country has interstellar for whatever reason the hunger games series isnt available in the same countries around the world youll find the first and second aka the best installments in hong kong for instance but not the third and fourth its a frustrating dilemma especially if you dont even have a single entry in your region which is   which netflix country has each movie of the hunger games
Jan 10 2020,positive,ill say this is probably going to be one of the best event movies of the year it succeeds in the scale of what this movie should be and what fans hoped it would be
Jan 10 2020,positive,  the gareth edwardsdirected 2014s godzilla  is by no means a bad film that may not come as a ringing endorsement but it makes sense given the impact that film had on the cinema goers of the world while praised for its sombre tone and appreciation of scale the film was nonetheless criticised for its reluctance to show its titular monster in all his kaiju glory legendary pictures seems to have heard the outcry of audiences everywhere and have seen fit to produce godzilla king of the monsters a film that knows no sense of the word restraint  in this movie there are several different bouts between monsters the size of skyscrapers after godzilla emerged to defend the modern world from destructive titans five years ago hes taken a muchdeserved sabbatical from being defender of the earth that is of course until a griefstricken mother takes it upon herself to unleash the worst titan of them all king ghidorah in a misguided attempt to save the planet for future generations  to go into the story further would be tantamount to actively repelling viewers from the cinema as it all boils down to a series of plot contrivances put in action for the sole purpose of getting two monsters within fighting distance of each other the dialogue is a mix of bad jokes and technical mumbojumbo to describe it as jargon would be an insult to intelligence and does just enough to get you to the next fight without being completely irritating in godzilla king of the monsters its all in service of action so its a good thing said action is wildly entertaining  whether youre a longtime fan of the pantheon that is godzilla films or a newcomer to the monster mash its hard to imagine not being entertained by whats on screen what used to be people in rubber suits battling stopmotion puppets can now be appreciated with an attention to detail that often goes unnoticed in blockbusters still as fun as it is to watch the film feels perhaps appropriately given godzillas massive jaw a little long in the tooth if not for the massive scale of the action demanding to be seen on the big screen id say this is a film best viewed in a format where you can skip ahead to the best parts
Jan 9 2020,positive, by dan tabor film critic its been five years since godzilla reboot decimated the multiplexes that film was an artier take on the monster film directed by gareth edwards monsters rogue one that seemed to focus more on the human story than the giant lizard namesake that has spawned 30 films since then there has been a refocus of the series thanks of course to marvel to franchise up these monster films this rethink was introduced in the follow up kong skull island which setup not only one of cinemas most beloved monsters but also a mythology that hinted at legendary who produced these films would be bringing tohos entire rogues gallery of monsters to this new cinematic universe this was very exciting news to longsuffering godzilla fans who have waited patiently to see these monsters unleashed onto a new generation cribbing a page or two from avengers infinity war godzilla kotm takes place five years after the events of the first film the once shadowy monarch organization has come to prominence as humanitys monster liaison with the revelation that 17 of these apex predators known as titans are hibernating around the planet or they were until they were awakened by a sonar device called the orca wielded by a group of ecoterrorists lead by colonel alan jonah charles dance aka tywin lannister from got who want to rebalance the world by allowing the titans to cleanse it the film begins with dr emma russell vera farmiga the monarch scientist who developed the orca  which can control the titans through bioacoustics  getting kidnapped along with her daughter madisonmillie bobby brown its then up to her estranged husband and former monarch scientist dr mark russell kyle chandler to navigate kaiju battles around the world while bringing his fractured family back together blessedly the first titan the terrorists bring back is godzillas infamous nemesis king ghidorah the three headed dragon also known as monster zero godzilla kotm wisely ditches the arthouse pretense of the first reboot and delivers a rockem sockem old school kaiju beatem up unlike his predecessor director michael dougherty krampus trick r treat isnt stingy with the goods either just minutes into the film godzilla is on screen in all his glory doing just what he does best laying waste to anything that gets in his way we soon learn that mankind once worshipped the titans as gods and some are benevolent godzilla mothra and some are in league with lucifer himself king ghidorah the film culminates in the brutal and breathtaking spectacle of team godzilla taking on team ghidorah sure its campy and a bit goofy but its the right direction for these films and the right audience to target since godzilla belongs to the monster kids both young and old there were moments watching godzilla kotm when i was once again a bedazzled 10 yearold kid watching godzilla fight king ghidorah for the very first time cheering on the good guys hoping godzilla triumphs again it says a lot that a film can still inspire that kind of awestruck reaction from a 40 something film geek who sometimes thinks he has seen it all but this movie managed to do just that time after time loud over the top and utterly unrelenting godzilla king of the monsters is the wrestlemania of kaiju films and makes no apologies for it
Jan 7 2020,positive,   for more than 50 years phoenix magazines experienced writers editors and designers have captured all sides of  the valley with awardwinning and insightful writing and groundbreaking report and design our expository features narratives profiles and investigative features keep our 385000 readers in touch with the valleys latest trends events personalities and places
Dec 6 2019,positive, im not a godzilla person or at least i wasnt until 2014 when i was a year into dating a certified godzilla person and gareth edwards godzilla was released and i was shocked to discover that i was weirdly into giant monsters beating the shit out of each other i even told my grandpa who i thought was a godzilla person that this new one was pretty good he looked at me sideways and said quite calmly aly i think youve lost your mind well maybe i did because i married that godzilla person watched from the sidelines as he dove in headfirst into 65 years of godzilla movies and wrote an opus about them had a baby with him and watched godzilla king of the monsters with said godzilla person and son of godzilla person not once but twice  twice  since receiving a review copy of the dvdbluray the baby tried to eat my face after the first viewing  parenting win this is all a longwinded way of saying i never would have predicted that i would be in the apparent minority of people who loved godzilla king of the monsters this was the blockbuster that critics chose to lambast upon its release in may because like the 2014 film the humans are onedimensional because unlike the 2014 film there are too many monster fights those are criticisms i dont agree with or understand because theyre exactly what make king of the monsters a good godzilla movie maybe even a great one if unironically loving alien covenant and to a lesser extent prometheus has taught me anything its that sometimes you have to let go of caring about the human characters and root for the monsters and  or robots instead the central family of vera farmiga kyle chandler and millie bobby brown and their emotional journeys are fairly milquetoast their names are emma mark and madison for crying out loud and the parents separated after their son andrew was killed during the events of godzilla  but who cares while some of them play a more active role in the story literally waking monsters theyre really nothing but human witnesses of a world that must change in order to undo the damage humans have done to it this story is too big for humans to be either the protagonists or antagonists some fall one way or another of course but its the monsters  the titans  who are the real heroes and villains some like godzilla and mothra want to save the world others like ghidorah and rodan want to destroy it none of them really care about the tiny humans who either try to help in the tiniest of ways fuck up in some majorly royal ones or wisely flee at the sight of real tangible gods  you see that photo at the top thats it thats the movie godzilla has always worked best as an allegory for the consequences of human destruction whether its nuclear testing or climate change do you think those consequences give a shit about whatever story weve been telling ourselves for generations to make ourselves feel better about how small we are  the best example of this blending is the discussion of motioncapture performance both godzilla and ghidorah were performed by motioncapture artists each one of ghidorahs heads was played by a different actor and dougherty calls this the natural evolution from the man in the rubber suit in the original toho films hes not wrong and this is a pretty decent way to recontextualize a method of acting that has been underappreciated at least since the days of gollum most tellingly though dougherty smiles throughout every single one of his talking heads most directors undoubtedly love what they do but it rarely shows in special features even taika waititi sounds bored out of his mind during the thor ragnarok commentary so its pretty wonderful to see one who is so genuinely enthusiastic about his film and the franchise in which hes playing its worth watching all the special features for doughertys contributions alone another aspect of king of the monsters that i adore is its reverence and incorporation of world mythologies into godzilla lore i could probably go on about that forever but the dvd has me covered a dorky 15minute featurette called monsters are real interviews various professors and cryptozoologists about this very topic its not necessarily the best special feature  i would say those would be the evolution of the titans and monarch in action collections  but its worth a view if only because it leans so hard into the campier aspects of godzilla for better or for worse and thats ultimately the deciding factor on whether or not king of the monsters is for you the science isnt any stupider than what youd find in star wars or the like the humans are just humans the monster fights are and i dont say this lightly the fucking tits this movie is beautiful on bluray and the special features are actually special so overall id recommend adding this to your collection should you find yourself a godzilla person and not a total stickinthemud
Nov 22 2019,positive,the monster fights alone are worth seeing on a huge screen just dont go looking for a realistic plot or science
Nov 22 2019,positive,as the puny humans flail godzilla the cary grant of giant monsters emerges with his dignity intact
