Dates,Scores,Reviews
Jul 10 2019,negative, you can tell a lot about a country by the way it writes about godzilla godzilla is the son of the atomic bomb explained the original films producer tomoyuki tanaka he is a nightmare created out of the darkness of the human soul meanwhile gareth edwards lauded and commercially successful godzilla in 2014 was critiqued for a lack of nuance when it came to the atomic age rather than offering caution about nuclear energy summised godzilla expert ed godziszewski the new film almost gives you the idea that nuclear weapons are actually the answer to everything if the wests last godzilla outing seemed to have an intriguing take on warheads then king of the monsters feels like it almost lusts for nuclear conflict it is astonishing to see a movie series that was once focused on assessing nuclear technologys vices now suggesting that nuclear holocausts are necessary and beautiful and  more times than is safe to count  relying on atomic weapons to save the day this might sound very confusing and you are correct to think that the thing about king of the monsters is it makes absolutely no sense not in a fun campy way either i could chart every scene of the movie for you but why any of them happen is absolutely beyond me crucial character work happens off stage all the time charles dance in a atrocity of a role reveals in passing that he has been working with vera farmiga who up until this point we thought was his hostage and this is not lingered on or explored this is i cannot stress enough one of the most crucial pieces of information in the whole movie another character dies in such a turgid fight sequence that it took me 20 minutes to realise she wasnt just off screen nobody even mourns her passing this is because in king of the monsters  part of a series literally built on exploring the consequences of human powerlust through the heightened lens of science fiction  there are absolutely no consequences to anything it pays lip service to the idea of consequence the way all epic cinema does in the postavengers age it suggests all extras in its decimated townscapes are evacuated though never really lingers on how but we are never left with any idea of the damage being done by the monsters that roam throughout this movie we do not see if the few civilians given screen time are saved or killed or what impact battles have on those who survive yet its a movie based on characters who made it through the conflict of the first film but even their ptsd is unclear do they love godzilla fear him hate him everyone seems to just change their opinion on him depending on what the movie requires there are moments when the film almost dares to pause and think not many mind  at one point ken watanabe says theres no time for debate which is actually the one time in the film i would have killed for one  but sometimes it manages to take a moment to provide us with a slow moment of terribly written dialogue in one ziyi zhang  in a welcome return to western blockbusters because she knows how to present the spectacular with poise  explains to kyle chandlers dr mark russell that slaying dragons is a western concept while in the east they are seen as messianic this concept is not really expanded on much or it is i suppose but not by her character and not in any sort of order other characters praise godzilla and the monsters as ways of saving humanity but who says it again just depends on who is needed to say it rather than who has any reason to think it every character has something akin to motives and every character does things these two factors however rarely come together to affect each other on the note of ziyi zhang at one point in the movie she appears in a completely different location intrigued by mothra and then in the next scene she is back with the main cast it turns out according to wikipedia that this is because she is playing twins this twin literally only appears in this one tiny vignette doesnt say any lines and could honestly be the same character when did it fall back to imdb to explain plot points to me its also a movie that falls back on so many lazy lazy tropes it staggers me this is godzilla  the ultimate trope  its allowed to fall back on the archetype it comes from but wider cinematic clichés for example this character died off screen so are they really dead or this character says im coming which everyone believes but actually theyre sacrificing themselves are so bored so overused that they dont feel like homage but fromage all of this adds to a movie that seems to like godzilla and the other monsters simply because theyre just cool to look at this is fair the cgi is great most of the time ghidorah is tough to watch in a postdrogon world but it defeats the point of a movie about nuclear weapons a film in which the drive is to see all these allegories for thermonuclear devices is aesthetically staggering but it doesnt entirely match up to the truth and the power of the cold war as a storytelling device which is nobody actually wants to see them the greatest threat is just knowing theyre latent gareth edwards got that this film absolutely doesnt godzilla 2014 was a huge turning point for the franchise japan even went back to it leaving behind the kaiju traditions of men dressed in lizard suits to bring in some cgi they got the exceptional hideki anno  a man whose opus neon genesis evangelion practically gets off on the true depths of human trauma  to direct and write its a movie that overwhelms that is filled with banality that presents godzilla as a diplomatic and bureaucratic nightmare as much as a deity it is also fascinated to go into the wider implications of every part of its mythos down to exactly how dangerous the half life of his atomic breath might be its not a perfect film but it got a lot of love for the right reasons it told a compact story well godzilla king of the monsters tells a big story very very poorly by the third act i did not care who lived or died in part because i no longer really knew who lived or died it has a diverse and wideranging cast but it is not charming or particularly representative theres a short haired woman of colour who i think shes a pilot shes trotted out the same way my overwhelmingly white secondary school kept putting my one black friend on every prospectus cover to suggest that her being there is as relevant as giving her something to do this kind of surface level inclusion means the film is more interested in ticking boxes than in giving life to the ensemble it gathers together meaning i just dont care about their personal stakes then again neither does the script in the third act the cast of burgeoning famous actors are all sent on separate missions which have no real reasoning behind them and which just happen on rails as if to give everyone a little bit of screen time theres one moment where a mission in a submarine aims to shoot nuclear missiles at godzilla underwater i just i cant and then this is scuppered by a vaguely familiar background actor saying sorry but the missile launching facilities were destroyed in the crash or something similar what is the crash i couldnt tell you because this is a movie of collision after collision the characters decisions from that point on then are not the product of a logical sequence of decisions that impact on each other but caused by completely inexplicable external parties forcing characters this way or that this is the films constant way of suggesting characters act the way they do they have no choice people tell us no medea had no choice hedda gabler had no choice these people never present or explore the many avenues they can no longer go down to get to no choice it is almost impossible to pick apart all the reasons i found to loathe godzilla king of the monsters without sitting you down to watch it and pausing every five minutes to decode but that would involve us buying tickets for a movie that should be killed off faster than most nuclear programs and this is part of a cinematic universe a universe one that they will not stop reminding you of all film so many references to king kong just so they can weave these two beasts together for another dreary cash cow in 2020 the constant reminders that this isnt the end made me wish i was about to be wiped out like something out of the bbcs threads we have seen grandeur enough times on the big screen now to know it can be clear intelligent and as driven by characters as it is by plot everything from the incredibles to captain america civil war to game of thrones proves in its own way these can be done godzilla king of the monsters wants to cash in on these successes but puts in none of the work avoid it like a nuclear bomb site this is the sort of film thatll make you think cinema is dead
Jul 8 2019,positive,this is a film that fixes some of the previously problems in this universe but it also makes some new mistakes but i was never bored and it absolutely delivers the action mayhem and destruction you want from the genre
Jul 3 2019,positive,godzilla king of the monsters doesnt hold back on the big monster fights and its definitely the best godzilla film to date from hollywood
Jul 3 2019,negative, for a film series that has long since outstayed its welcome the latest in the very first superhero saga  xmen dark phoenix dir simon kinberg rated m  seems to be in an awful hurry to wrap things up the culmination and likely finale of the film series that began long ago with xmen in 2000 and has seen actors and storylines come and go with the occasional timetravel retcon here and there is a zippy little thing that nevertheless seems bursting at the seams and sagging with the weight of a series that just cant seem to end already returning to ground covered in the muchmaligned xmen the last stand this film follows the xmen as they face one of their own jean grey sophie turner who does well to hold the whole thing together in a cast of sleepwalkers when exposure to cosmic rays gives her immense uncontrollable powers one gets the impression from dark phoenix that the filmmakers are trying to make up for the sins of that previous film but this one commits too many of its own in trying to play it safe to fare any better packed with actors who seem desperate to simply run out their contracts particularly jennifer lawrence as mystique and evan peters as quicksilver whose brief appearances here may as well have featured them picking up their paychecks the action itself is at least solidly entertaining and occasionally even thrilling indeed there are moments of inspired genre filmmaking that occasionally elevate the whole operation boosted by a reliably bombastic hans zimmer score the inclusion of a nonsensical and unnecessary alien subplot slows things down enormously and there is little in the way of catharsis or a sense of an ending here  if it is to be the end of this iteration of professor x magneto cyclops and the like theyve gone out less with a bang than a whimper rating twoandahalf stars the problem with the fledgling megamonsters series that began with 2014s godzilla followed by kong skull island and now the woebegone godzilla ii king of the monsters dir michael dougherty rated m has never been the monsters themselves the series has always had the ability to deliver agreeably epic visuals of titanic monsters ripping into each other in giant tableaus like something out of a bosch painting no the problem with this series has always been the characters running around the monsters  the human element that somehow takes up so much of the filmmakers concern and yet remains so very boring godzilla ii picks up sometime after the first appearance of everyones favourite rotund superlizard and largely follows an estranged family kyle chandler vera farmiga and millie bobby brown as the actions of an ecoterrorist cell revive a coterie of longdormant giant monsters hiding beneath the earth globetrotting without feeling like it gets anywhere packed with quips without being funny and featuring muddy messy action devoid of excitement godzilla ii is a mostly pointless inbetween instalment before the inevitable king konggodzilla showdown to come rating two stars
Jul 3 2019,positive,maybe its time to include godzilla in the discussion of our richest cinematic franchises
Jun 27 2019,negative, its really hard to tell what kind of movie godzilla king of the monsters wants to be the predecessor to this garish nonsensical monster mash 2014s godzilla was a moody take on the famous kaiju sparing in its depiction of scaly flesh while some  including yours truly  found it dull it also amassed a vocal critical fanbase the followup seems to nod halfheartedly to artistry but its more interested in the brainless crashbang of a bunch of cgi creatures duking it out the cast is stacked with otherwise brilliant actors stuck in a borderline incomprehensible plot and forced to play second fiddle to monsters whose powers of wonder wear off fast this is franchise filmmaking at its most unnecessary a last gasp to salvage a series that seems to have little chance at survival because yes this is supposed to be part of a bigger monsterverse all leading up to a showdown between godzilla and king kong the latter of whom was featured in 2017s kong skull island those two dont go at it in king of the monsters directed by michael dougherty though there are some offhand mentions of the large ape instead this installment features some more wheelspinning and tedious exposition involving monarch the monster research organization thats this franchises version of marvels shield king of monsters focuses primarily on the russells a family that was caught in the rampage that made up the finale of gareth edwards earlier movie in which godzilla battled some mutos and saved san francisco but created a big mess in the process the stomping beasts killed mark and emma russells son and in their grief the couple split she vera farmiga went to live on a monarch research base with their daughter madison stranger things millie bobby brown emma has been building a sonic device that can control and subdue the monsters called titans meanwhile mark kyle chandler has dedicated his life to photographing wolves hes eventually brought back into the fold when emma and madison are kidnapped by ecoterrorists led by a scowling leader named jonah alan played by tywin lannister aka charles dance except  in a headacheinducing twist  that was part of emmas plan shes teaming with jonah against monarch because she misguidedly thinks she can save the planet by letting the titans roam free thinning humanity and its pollution like thanos before her emmas ostensibly noble intentions cause a litany of issues issues when it turns out that one of the ancient giants that monarch has been monitoring the threeheaded king ghidorah is especially cruel and powerful and not willing to submit to godzillas more benevolent impulses if this sounds needlessly confusing well it gets worse when you factor in that the script seems cobbled together from various unfinished drafts it casually drops references to characters and scenarios in a way that assumes the audience has a bigger investment in the narrative the film ever earns perhaps the most baffling moment is when its revealed with little to no explanation that ziyi zhang plays identical scientists on different sides of the world who may or may not be twins speaking of the cast its filled to the brim with otherwise excellent performers most of them either slogging their way through perfunctory technical dialogue or taking the whole mishegoss way too seriously the only one who seems to know what movie hes in bradley whitford who at least thinks all the nonsense is funny at times dougherty manages to create some arresting images of wings emerging from clouds theres a big brawl that ends in boston of all places  a dunkin sign tragically falls in the fight godzilla remains king mothras the queen and there are a few human casualties its not a conclusion that elicits many further questions but that doesnt mean the studio has skimped on the frustratingly obligatory postcredits scene in the tag dances jonah sets out to purchase one of the ghidorahs heads implying that it may return for the next round when presumably kong will get involved like it or not there will be another film in the godzilla universe but at that point  if youve even made it through the credits  youll probably have the same reaction i did who cares king of the monsters does nothing to prove that the monsterverse should continue when you cant get a crowd excited for kaiju fighting one another whats the point sign up here for our daily thrillist email get streamail for more entertainment and subscribe here for our youtube channel to get your fix of the best in fooddrinkfun
Jun 27 2019,neutral,its not very pleasant to look at it invests way too much in the character arcs of its blank cast and it still does the thing the 2014 film got dinged for
Jun 25 2019,positive,maintains the sagas general good standard which is forgotten with the same ease with which it is enjoyed full review in spanish
Jun 21 2019,positive,sometimes you have to be honest about the movie you really are  smashy smash if you can reconcile that then its not so awful
Jun 18 2019,positive, lets get this out of the way first in a movie that includes a triheaded dragon and a nakatomi plazasized spider mark kyle chandler is easily the most grotesque monstrosity this dude is introduced to us while hes shooting broll wolf footage for a knockoff planet earth yet somehow within minutes hes bossing around the entire global military on armageddon eve mothra vomits sticky webs but marks mansplaining is the vilest thing to come out of any mouth in the entirety of godzilla king of the monsters which is otherwise a damn good monsterstravaganza ever see what youre convinced is a terrifying murderer in your home only to realize that its nothing more than an article of recklessly discarded clothing disguised by poor lighting thats what screenwriter zach shields and writerdirector michael dougherty have done with the plot here wisely there isnt one oh sure it looks like theres a plot there just isnt bad ecoterrorists reawaken longdormant monsters hiding around the world to restore balance to the planet godzilla fights those monsters while being alternatingly helped and hindered by humans and mothra colorreflectionscom  thats not a plot thats nothing more than setup for longoverdue glorious kaiju fetishization hooray when it comes to intricately detailed toys imagination should ideally spark just as vibrantly when posing them as when smashing them into one another dougherty and company get that they spend significant time having rodan king ghidorah mothra and the titular gman preen and flex in atmospheric lighting it is somehow both beautiful and blissfully cheesy the creature design for ghidorah resembles early harryhausen stopmotion designs mothra is somehow equally endearing and terrifying rodan murders planes like hes being controlled by a malevolent giant invisible toddler godzilla has an atomic seizure admittedly they only fight each other a few times but the film never strays its gaze too far from them remember you can only blow your action figures up with firecrackers once a legion of typically insightful detractors have somehow surprisingly blasted godzilla king of the monsters for leaning too hard into the humans and away from the creatures maybe it felt that way to some but its literally just untrue the film doesnt go 10 consecutive minutesmost often less than 5without a monster on screen from the opening sequence to the final frames it is chockablock with kaiju juju the job of the humans is to give the camera a ride to the next monster sequence in its understandable obsession to prioritize the monster squad godzilla king of the monsters admittedly fails to synthesize a thesis worthy of the franchise its entirely possible that the american psyche simply does not easily permit the kind of condemnations of hubris and militarization that are trademarks of the best works in the series likewise making villains out of those who legitimately fear for the planets extinction may be a misguided narrative tactic at a moment when the united states is ghosting the global movement against the climate crisis however what dougherty and company have done here is fairly stunning not since the original jurassic park have massive cgi creatures felt this majestic and menacing long after memories of marks whining and interrupting have faded the sound of godzilla firing up his electrical barf will remain please note if one annoying character is able to ruin everything for you youre going to have a very exhausting road to november 2020
Jun 17 2019,neutral, since franchises and universes are the rage in hollywood this is legendary entertainments attempt to get in on the action  godzilla ii king of the monsters marks the third film in the series following on from two reboots godzilla 2014 and kong skull island 2017  if youre wondering where it goes next prepare yourself for godzilla vs kong which is slated for release in march 2020 as for this film it picks things up about 5 years after the original  the world now knows that monsters are real and the political fallout has been huge  thats particularly evident within a governmentrun organisation known as monarch  it was originally established to locate and destroy monsters to ensure mankind remains the dominant species  theres now a differing view held by some within monarch that the monsters or most of them are friendly and to kill them would disrupt the worlds natural order it turns out there are roughly 17 monsters on the planet including godzilla and a team of scientists have been studying their genetic composition  it may sound ridiculously dangerous but the monsters are in a hibernating state  a catalyst is required to create drama and it comes in the form of an ecoterrorist dance with confusing motives  on one hand he wants to make money by trading monster dna but that seems counterproductive considering he wants to kill most living things on the planet in the same vein as the 2014 film id argue that the human characters in this movie have the charisma of a wet sponge  theyre a dull boring group of people who between them magically have the answer for every problem  its part of the reason why theres so little tension in the movie  these characters should have died countless times but help andor good fortune always arrives at the last possible moment  the only actor worthy of a mention is bradley whitford the west wing who adds a splash of comedy to break up the tedium its the monsters who should have provided all the excitement but writerdirector michael dougherty struggles to creating something meaningful amongst the chaos  we can see a myriad of monsters duking it out the threeheaded dragon looked cool but its largely the same stuff from scenetoscene  i wish id kept count of how many buildings were destroyed  im sure there were humans in them but its best not to think about that
