Dates,Scores,Reviews
"Feb 23, 2024",negative," Unlike some (many?), I haven’t grown weary of superhero films as a genre. What I have grown exhausted by are specifically Sony-made Spider-Verse movies that try to walk the line between standalone works while also incorporating just enough Spier-Man-adjacent references to frustrate and infuriate viewers. I wish the makers of Madame Web had simply stayed away from all things Spider-Man (which is virtually impossible, once you understand the full breadth of the story). Instead, they drop in what they think are sly nods and easter eggs that are neither subtle nor clever. Much like the rest of the screenplay (it took four people to write this!), the references are ham-fisted and all-around sloppy, and leave us with the promise of a better sequel that I can almost guaranteed you will never be made. Let me give an example: the film is set very specifically in 2003, and there’s a character named Mary Parker (Emma Roberts), who is probably eight months pregnant. Please feel free to do the math on who her baby is. She’s married to a man (whom we never see) whose brother is Ben Parker (Adam Scott) and who is really looking forward to being an uncle to this newborn—all the fun, none of the responsibility (that’s what he thinks). And no, I don’t consider any of this spoiler territory because the character names are right there on IMDB, and Scott is prominently featured in the trailers. All of this nonsense is a tease that never pays off. At one point, there’s a baby shower for Mary, during which the women in attendance have to guess the baby’s name. The game is interrupted before the inevitable name drop, so I’m thinking that reveal is coming at the end of the film (which it probably was at one point). But no, there aren’t even any mid- or post-credits scenes in Madame Web to tuck away such a choice nugget of web-slinging joy. But of course, anything involving the Parkers is shoehorned into the mostly unrelated story of Cassandra Webb (Dakota Johnson), whose mother (Kerry Bishé) was killed in the rainforests of Peru while searching for a rare breed of spider whose venom might be the key to curing any number of diseases. She is also very pregnant, and in the company of security specialist Ezekiel Sims (French actor Tahar Rahim, most recently seen in Napoleon), who betrays her when she finds the spider and accidentally shoots her before absconding with the specimen. But a tribe of locals with mysterious spider-like powers (and outfits that look a lot like Spider-Man’s duds, if they were made on Gilligan’s Island) show up to try and save her by injecting her with the aforementioned spider venom. The mom dies but baby Cassandra lives and is sent home to live out her years in New York's foster care system. Cassandra grows up to become a paramedic (alongside partner Ben Parker) and after a near-death experience in which she almost drowns, she starts having visions of things that will happen in the immediate future, things she can change if she does something different or gets someone else to change their behavior. She sees herself and other people die, and so she does all that she can to save everyone in her visions. We also find out that Ezekiel is a little more adept at seeing the future than using the spider venom repeatedly, and he envisions three young women in various spider-themed costumes and powers defeating him in a fight. So, he hires a computer expert (Zosia Mamet) to track them down so he can kill them. Ezekiel actually functions as a costumed individual who leaps and crawls and has the general acrobatic skills of a certain Spider-Man who won’t actually exist for a couple of decades. During the course of her day-to-day happenings, Cassandra just happens to run into all three of these young women (minus their powers) around the city, including a rich kid whose parents are never around, Julia Cornwall (Sydney Sweeney, complete with schoolgirl outfit); Anya Corazon (Isabela Merced), who has been living with her immigrant grandfather illegally in Cassandra’s building; and skater punk and general troublemaker Mattie Franklin (Celeste O’Connor). Cassandara saves their lives when Ezekiel attacks them on a train, and they are basically stuck together for the rest of the film, although the police seem to think Cassandra has kidnapped them. Like many aspects of Madame Web, it’s a running gag that never pays off. As mentioned, most of the film is about the potential for something cool that we never get. The only time we see the three young women in their admittedly cool superhero costumes are in visions of the future. We’re not even given their future superhero names (for the record, two of them are different incarnations of Spider-Woman in the comic books, while Corazon goes by the name Araña), probably because they don’t want to make fans mad that these are in any way Spider-man related. In broader terms, first-time feature director S.J. Clarkson wants us seeing the Madame Web identity as someone who uses her powers to see the connections between people before the world makes them happen. As the film goes on, Cassandra is able to see further into the future and make more sweeping changes and adjustments to the world-to-come that makes her immensely powerful and able to lead the team of young women to fight crime down the road, presumably enhancing them with venom from this rare spider. Who the hell knows? Placing the Parkers in close proximity to Cassandra seems to serve no purpose, at least not in this story, but the implication is that somewhere down the line this powerful spider might be the reason that this universe’s Peter gets his powers, and not some radioactive arachnid. Again, it’s all about teasing the potential without actually seeing it to any kind of satisfying conclusion. And it makes the entirely of Madame Web frustrating in its best moments and downright infuriating in its worst. I also realized while watching this movie is that, while Dakota Johnson is fully capable of turning in great performances when given great material, she’s not quite capable of elevating mediocre material. She’s as bored and uninvested in her character and this movie as we are, and it clearly shows. Madame Web feels like it was chopped up and re-assembled from another, probably equally poor film, and the result is a wildly uneven, uninspired mess. Did you enjoy this post? Please consider supporting Third Coast Review’s arts and culture coverage by making a donation. Choose the amount that works best for you, and know how much we appreciate your support!  Steve Prokopy is chief film critic for the Chicago-based arts outlet
Third Coast Review. For nearly 20 years, he was the Chicago editor for
Ain’t It Cool News, where he contributed film reviews and
filmmaker/actor interviews under the name “Capone.” Currently, he’s a
frequent contributor at /Film (SlashFilm.com) and Backstory Magazine.
He is also the public relations director for Chicago's independently
owned Music Box Theatre, and holds the position of Vice President for
the Chicago Film Critics Association. In addition, he is a programmer
for the Chicago Critics Film Festival, which has been one of the
city's most anticipated festivals since 2013. Support Third Coast Review and our coverage of Chicago arts and culture by making a small monthly pledge on Patreon or by making a donation on PayPal. Enjoying Third Coast Review news and reviews? Please consider supporting our arts and culture coverage by making a small monthly pledge or making a donation via PayPal. Choose the amount that works best for you, and know how much we appreciate your support!"
"Feb 23, 2024",neutral,"This movie isn't bad, it held my attention throughout, but it is mediocre. It lacks the kind of compelling action, humor and drama of the better Marvel movies."
"Feb 22, 2024",negative,"Despite its amazing cast lineup, From tonal confusion, to a near laughable script, There was not one single redeeming quality this film had to offer."
"Feb 22, 2024",negative," 
Written by five writers (including Matt Sazama and Burk Sharpless of the aforementioned Morbius), Madame Web operates in a similar vein in all the wrong ways. It's not part of the Marvel Cinematic Universe, instead merely being a cog in Sony's live action Spider-Man Without Spider-Man-Verse, a half-hearted, corporate character rights-based attempt to expand the world of the web-slinging Spider-Man — without him being around — by focusing on characters adjacent to him. This time it's Cassandra Webb, gamely played by Dakota Johnson, who is living in New York City in 2003. She works as a paramedic with the superhero genre's most memorable modern uncle, Ben Parker (because of course she does), while largely keeping to herself and her cat. Briefly played by a wasted Adam Scott before he vanishes almost entirely from the movie, this movie's Uncle Ben is the first of many bizarre and painfully hamfisted references to other better superhero stories. And all of them land with dull thud after dull thud.
 
The more self-contained main narrative of Madame Web begins with Cassandra's mother who died giving birth to her after going out into the Peruvian Amazon in 1973 to research spiders believed to have healing properties. The awkward line explaining this — which was in the trailer and endlessly skewered because of the stilted way it sounds — is merely the beginning of the movie's unending and woefully poorly written dialogue. Much of this clunky verbiage is given to the otherwise solid actor Tahar Rahim, who plays the film's sad excuse for a villain, Ezekiel Sims. He delivers said lines while he tries to search out three teenagers that he believes will kill him in the future. It then falls to Cassandra to save them following an accident at work where she drowns and comes back to life — only to suddenly be able to see through time.
 
While not the most imaginative of premises, this sounds like it could be almost schlocky superhero fun on paper. Instead, it's a slog, as the film goes through the same motions over and over again with no spark to any of it. When Cassandra begins to discover her power, the way this is dragged out is more tiresome than thrilling. Though quite straightforward, the film explains her powers to us multiple times, demonstrating a severe lack of trust in its audience. When Cassandra then properly meets the three youths, Julia (Spokane's own Sydney Sweeney), Anya (Isabela Merced), and Mattie (Celeste O'Connor), they feel like cardboard cutout characters with no chemistry. This becomes increasingly perplexing as they get ditched multiple times, making it feel like even the film doesn't know what to do with them. The action they do get up to all feels empty — either brief or scattered CGI nonsense. Even a clumsy post-9/11 surveillance angle feels wildly undercooked for all that it is supposedly gesturing toward.
 
If there is one small saving grace, it is Johnson. She has been great in films like the surprisingly stellar Suspiria remake and the regrettably buried Am I OK?, though this film doesn't even let her have fun with its powers. One early scene at a baby shower sees her getting a laugh on delivery alone, but that is soon forgotten in the mess to come. Even if you overlook some of the technical distractions — like entire lines of dialogue that have clearly been rerecorded and are not actually being spoken by the characters — paying attention does the experience no favors either. While much has been made of the looming death of the superhero subgenre, Madame Web is the film that truly feels like it may put the genre in its grave for a bit. But like the film's protagonist, it will likely be resurrected again. One just hopes it has more life than this.
"
"Feb 22, 2024",negative," The year is 2004, and you are 16. It’s the end of July, so to escape the sweltering heat, you and your friends see a movie at the mall. The movie is Catwoman, starring Halle Berry, but it could be anything. All you want is to be in a place with air conditioning that isn’t your house. You and your friends spend so much on chips and salsa at the mall Mexican joint and cheap jewelry at Claire’s that you barely have enough wadded up cash from your summer job to cover the ticket. In years to come, you’ll have fond memories of those friends, the virgin strawberry daiquiri you ordered, and even the cheap jewelry. You will remember nothing about the movie, except that it was bad. The year is 2024, and you’re 35. It’s February, and to avoid staring at the dead grass outside your window, you go to the theater with friends. The movie is Madame Web, starring Dakota Johnson, even though it should be something, anything else. Maybe it was the only movie that worked with everyone’s schedules, but like, come on. You’re an adult, you don’t want to see Poor Things or American Fiction?  You and your friends have full-time jobs, so you can get drinks beforehand, and even spring for popcorn at the theater. As the film starts, you’re hit with a wave of nostalgia, and it is decidedly mixed. The movie’s effects are terrible. The performances are flat, the character motivations barely existent.  And yet, as you watch, the flavors of restaurant salsa and syrupy mocktails flood your senses. The phantom weight of a tiger’s eye energy bracelet rubs against your wrist.  While the early-adolescent memories Madame Web inspires are good, the movie itself is undeniably a mess of the Catwoman variety. That the film is set in 2003 almost reads like an in-joke, because its whole vibe radiates the “how do we make a superhero movie/why are we even bothering?” ethos that defined comic book adaptations from 2000-2005.  If you’re looking for a nostalgic afternoon spent hooting at an incompetently made movie with your friends while you slam Clearly Canadians and cartons of Hot Tamales in the back row, you’re in for a treat. In all other cases, you’re better off spending your time and money elsewhere. Madame Web follows Cassandra Webb (Dakota Johnson), an EMT in New York who grew up an orphan after her mom died while studying spiders in the Amazon. After a near-death experience, Cassie gets visions that allow her to see a few moments into the future. These visions bring her in contact with a trio of teens (Sydney Sweeney, Isabela Merced and Celeste O’Connor) who are each being targeted by a creep in a suit (Tahar Rahim, trying and failing to force an American accent). It turns out Rahim’s baddie, Ezekiel Sims, is the guy who killed Cassie’s mom and made her an orphan! He’s after the girls because in the distant future, they’ll be superheroes (with powers they currently don’t possess, but whatever) and kill him. The plot threads binding these story beats together are as delicate as an actual spider’s web, albeit woven by a drunk spider. This is the kind of movie that repeats lines three different ways so that you can’t miss the implications of what people are saying, only to jump to a scene where a character drops a piece of exposition that makes no sense.  Characters behave in ways no normal human would. At one point Cassie decides she needs to go to Peru to find herself, and just…gets there seconds later (by now she’s wanted for presumably kidnapping the teens in her care, so how she managed to hop an international flight last minute during a historically heavy crackdown in airport security is beyond me). You see where this is going. Madame Web is “bad movie podcast” bad. It’s “Make-your-own-MST3K” bad. It’s also “Bored teenager with spending money” bad, which can be kind of fun if you’re a) a bored teenager, or b) a bored adult looking to replicate that experience, but with all of the things you couldn’t treat yourself to when you were a bored teenager. "
"Feb 21, 2024",negative," They’ll be laughing at this one for decades. Awkward, sloppy, staggeringly incoherent, there is little evidence to suggest that anyone involved in Madame Web knew what they were doing. The catastrophe extends all the way to the top of the queue. Dakota Johnson, struggling to hide her disinterest from the outset, takes an inherently awful screenplay and somehow makes it worse. Sydney Sweeney wears the look of a performer who forgot to learn her lines. Meanwhile, Tahar Rahim, the charisma-free villain of this cack-handed superhero tale, is forced to compete with some hideous post-production interference. The screen is fine; the projector isn’t broken, and the speakers are correctly fixed – it’s just bad overdubbing. Like, really, really bad. Sony did not arrange an advance press show for critics – I can see why. What, you may ask, is Madame Web? Comic enthusiasts will tell you she’s a mutant clairvoyant, a beloved staple of the Marvel cannon, and a helpful chum to your friendly neighbourhood Spider-Man. ​For the uninitiated, the cinematic version exists in some far-flung corner of Sony’s so-called Spider-Man Universe – which is to say that this bafflingly disorganised feature has nothing to do with the Tom Holland Spidey pictures. But it might be a distant cousin to the decrepit Venom franchise. Or something. It matters as much to me as it does to anyone else in this baggy, bewildering film. Squint your eyes and - if you’re lucky – you will just about make out the plot. A preposterous epilogue introduces Constance Webb (Kerry Bishé), a poorly sketched scientist researching spiders in the Peruvian Amazon. The year is 1973 and a pregnant Constance is obsessed with rare arachnids and their alleged healing powers. Why, exactly, we’re not entirely sure – but everything goes sideways after Constance’s moustachioed explorer pal, Ezekiel Sims (Rahim), shoots her in the chest, steals her magic spider jar and leaves her for dead. Luckily for Constance, the magical Amazon spider people show up (stop giggling down the back) to save the baby. Fast-forward 30 years, and Cassie Webb (Johnson) is all grown-up. Our moody protagonist knows very little about her mum, and why she died chasing spiders in the jungle. Cassie isn’t really a people person, but hey, she’s a New York paramedic – a real-life superhero without the stupid costume. Her one and only friend at work (Adam Scott’s Ben Parker) thinks there’s more to Cassie than meets the eye, and he might be right. Across town, meanwhile, the slippery Mr Sims appears to have used his magical spider power to acquire a vast fortune. Alas, our grumpy baddie is haunted by nightly visions of his own death. Sims, it appears, will die at the hands of three Spider-Women, and so he makes it his mission to find them before they find him. What he doesn’t count on, however, is a stranger messing with his plan and, following a near-death experience on the job, Cassie acquires powers of her own. She can see into the future, which means she knows exactly what’s going to happen to the aforementioned Spider-Women (Sydney Sweeney, Celeste O’Connor and Isabela Merced). I’d love to tell you more, but I might die of boredom. ​Some Marvel fans might appreciate the Ben Parker subplot. Mr Scott is, essentially, playing a younger, sexier Uncle Ben from the Spider-Man flicks. However, the inclusion of a story in which Ben and Cassie attend a baby shower for the unborn Peter Parker, ranks among the stupidest moves in comic book film history. Spare a thought for SJ Clarkson, the British filmmaker tasked with managing this sorry, pitiful exercise in blockbuster entertainment. Her film boasts no less than five screenwriter credits (always a troubling sign), and occasionally looks and sounds as if it is being edited in front of us. The relentless product placement is hilarious (three cheers for Pepsi, the film’s fizziest co-star). The action sequences are useless, the dialogue is all over the place, and the grainy special effects appear unfinished. It’s an ugly, toneless film, a superhero feature without charm, without humour, without spectacle. It seems unfair to point the finger at its leading woman – but Johnson is genuinely appalling. She looks fed up here, and guess what? I know the feeling. A film so bad, it would almost put you off going to the cinema."
