Dates,Scores,Reviews
"Feb 20, 2024",positive," Let’s be honest here, most people had made up their minds on this film before ever going to see it hadn’t they? It’s okay to admit it, best being honest with these things. In fact any film that falls under the Sony’s Spider-Man Universe franchise – with the exception of the Venom films (Tom Hardy is bulletproof) – is likely to find itself fired upon by the web shooters of, well, the world wide web! But for those brave few who dared venture into the cinema, is this “the worst comic book movie ever” or “one of the most ramshackle films ever released”?  Madame Web, adapted from the Marvel Comics Spider-Verse character, sees New York City paramedic Cassandra Webb (Dakota Johnson) undergo a near fatal experience, that seems to unlock abilities within her that she never realised she had. Abilities gifted to her at birth. Abilities that allow her to see fragments of the future, and when she sees three teenage girls attacked by a brutal masked man, she must act to save them. Not realising, just how connected all these people really are to her. Including this vicious attacker. So…Madame Web is in so many numerous ways a bit of a tangled messy web indeed (certain lines of dialogue, the odd wooden performance, some logical leaps) and thus will do nothing to dispel all the talk of superhero fatigue and the genre’s nosedive in quality perceptions. But, call it the pre-release overblown anti-hype that Twitter, sorry X (sigh), have relished basking in, but this writer ended up really enjoying the experience.  S.J. Clarkson’s film just had something about it that won us over and is nowhere near the blight on comic book cinema it is being made out to be. Be it the well-worn (so to speak) costumed superhero stuff taking more of a backseat to a rather rollicking slasher-inspired Final Destination-esque horror thriller with some campy detours, or some entertaining characters that you are quite happy to spend time with, the whole mad little experience is endearing rather than tiring.  Madame Web is a bonkers movie that is as imperfect as it gets, from its tangled lore down to its wacky creative and filming decisions but it is also infinitely more interesting than other assembly line super capers for this very reason, and is largely its own thing rather than a tick box venture in universe building. All in all, it is a good night out, with a pigeon-saving, people-avoiding, new kind of hero and a finale that plays out like Highlander’s final set piece had it been sponsored by Pepsi! Chalk Madame Web up as one of those so called “disasters” that a select few (*raises hand) will gladly go back to and enjoy every time (Jonah Hex, Spawn, Howard The Duck) rather than an empty husk of a movie that you forget about as soon as you leave the cinema (Ant-Man and the Wasp: Quantumania) or truly a title deserving of worst comic book film ever (Fant4stic).  Maybe we are going slightly mad (it finally happened…), but we can foresee a certain crowd embracing this fun flick down the line. This Madame caught us in her web clearly!"
"Feb 20, 2024",negative," Madame Web (2024) exists in one of those weird places where it is so silly, so ridiculous, and so outrageously inane that it’s almost worth seeing for the sheer calamity of it all. Some may see that as a positive. If there’s one criticism that has remained constant for superhero films (particularly the Marvel/Disney ones), it’s that they have increasingly felt factory produced. More and more, they lack personality. You can’t really say the same about this. As a Sony production, it does contain tons of identifiable traits – but not in the way it was possibly intended. This is not a good movie. In fact, it might be one of the worst comic book blockbusters of recent memory. But hey, it’s better to be remembered than forgotten, right? In style, tone, and execution, this feels like a relic of the past. Back before CGI and special effects made anything possible, superhero films had to work around obstacles to make us believe that people could fly, leap tall buildings, or shoot laser beams out of their eyes. Sure, sometimes you’ll get a legitimate hit like Superman (1978). Other times, you’ll end up with something campy like Captain America (1990). Something tells me that deep down, Madame Web wanted to be the latter. Director S.J. Clarkson (who also co-writes with Matt Sazama, Burk Sharpless, and Claire Parker) inject little hints – whether it be a line of dialogue, camera move, or edit – that makes me wonder if this was meant to be more tongue-in-cheek. At least that’s what I’m hoping. If this was always supposed to be a straightforward origin story, then it fails on all counts. Visually, Clarkson’s direction (in coordination with Mauro Fiore’s cinematography) incorporates dramatic camera moves that are reminiscent of music videos. The frame spins and twirls in exaggerated angles, sometimes going completely upside down. Flashing lights and hyperactive cutting swing us back and forth in time and place. For a story that heavily features a shifting timeline, this approach makes sense. But when it comes to the action, the disorienting style takes away from the cohesiveness. We can’t really tell what is going on, it’s all a barrage of images hurtling at us with little sense of rhythm. The biggest victim in all of this might be the pacing. Because the narrative barrels forward without ever letting us catch our bearings, it feels like it is stuck in the first act. There is a notion that everything we see is a set up for something else, but there’s no payoff to satisfy our suspicions. The writing does little to help things along. The character work is flat and uninteresting, and in some cases, completely absent. We learn that Cassandra Webb (Dakota Johnson) is a NYC paramedic who lost her mother in childbirth. What she doesn’t realize is that her mother was studying a special breed of spiders in Peru at the time (why a nine-month pregnant woman would be deep in the Amazon to begin with is anyone’s guess). As fate would have it, one of these spiders bit Cassandra’s mother, thus endowing the yet-to-be-born Cassandra with the power of clairvoyance. She can see into the future and can visualize the results (and consequences) of choices made in the present. This gift, unfortunately, comes with a set a problems. Ezekiel Sims (Tahar Rahim) – who worked with Cassandra’s mother back then – has also been granted this ability. For reasons I will not describe, Ezekiel has become fixated on killing three young women – Julia (Sydney Sweeney), Mattie (Celeste O’Connor) and Anya (Isabela Merced) – and won’t let anything stand in his way, including Cassandra. Whew, that’s a lot of ground to cover, isn’t it? Essentially, the plot takes on a similar structure as The Terminator (1984), in which Cassandra must protect three lives – all of whom play an important role in the future – from a near unstoppable force. And that’s about it. I wish I could say there was more to it than that, but the film operates strictly on the surface. We don’t learn much of anyone beyond basic attributes. In some instances, their actions defy logic altogether. When Cassandra tells the three women to lay low and not draw attention to themselves, they respond by going to a diner, meeting a group of boys, and dancing on a table to Britney Spears’ “Toxic.” I understand this is supposed to be set in the early 2000s, but was there no other way of showing that? If you were trying to get away from a killer, would your first inclination be to dance on a table for everyone to see?  God bless Dakota Johnson. She is a talented actor who – in the right project – can deliver a performance of warmth and authenticity (see her work in The Peanut Butter Falcon, The Lost Daughter, and Cha Cha Real Smooth as prime examples). As Cassandra Webb, she adds a dash of sarcastic wit that makes the character more interesting than it should be. There has been lots of rumors and speculation over Johnson’s involvement with the film, the fact that she (as of this writing) has not seen it yet, and her “curious” interviews in the promotional campaign leading up to its release. It’s almost as if she can see the writing on the wall, and instead of taking things seriously is out there having as much fun as she can. We see it in her performance as well. Even though the movie has a lot of speed bumps, Johnson at least appears to be enjoying the chaos. Madame Web might appeal to those with a morbid sense of curiosity – just to see what all the hubbub is about. If you’re one of those people, then by all means watch it and enjoy. But for those looking for a superhero movie with good action, well developed characters, and an engaging story, then you are in the wrong place. I’m a firm believer that to know what a good movie is, one needs to know what a bad one is as well. I think we all know where this one lands."
"Feb 20, 2024",negative,"This movie was not good enough for theaters, streaming, or your direct-to-DVD bargain bin. It made Morbius look like Citizen Kane. It dangles Spider-Man references at us like keys in front of a cat."
"Feb 20, 2024",negative," The Sony Universe of Spider-Man adjacent movies continue with Madame Web, yet another baffling and nonsensical adventure of absolutely nothing. While the movie is absolutely not as terrible as most are making it seem, it’s still a story that goes nowhere, until it’s seemingly even more disappointing end game. The lesser-known Marvel Comics character in her own movie, along with some much more interesting characters we don’t actually get to spend time with. Read on for my Madame Web review.  Madame Web is a Spider-Man character made popular by the 90s animated Spider-Man series. The comic character is one of the hero’s lesser-known villains, but apparently was the right choice for Sony to make another Spider-Man villain into a kind of anti-hero. The story of Madame Web tries to make the character into an actual hero, but it does so in very strange and odd ways. The movie is about Cassandra Web (Dakota Johnson), a Paramedic in New York who begins to experience visions of the future after a brush with death.  Despite being a movie about a Spider-Man character that cannot ever mention Spider-Man, Madame Web gets dangerously close. And I can’t understand why. There’s a whole side story about Peter Parker himself. Cassie’s partner on the job is Ben Parker (Adam Scott), a young uncle of Peter Parker. Throughout the movie, Ben is seen taking care of his sister-in-law, Mary Parker, as she is pregnant with a son. Part of the third act climax is also about how Mary and Ben are caught up in this adventure of Cassie’s.  Madame Web also teams up with Cassie with three young women who are other Spiderverse characters from the Comics. The three women, played by Isabel Merced, Sydney Sweeney, and Celeste O’Connor, are characters who will eventually get powers and become various spider-woman characters from the comics. These three characters and the chemistry between their actresses make them so much more interesting than the main lead. More interesting than anything Johnson does in the movie.  And while I don’t want to spoil anything in this Madame Web review, let’s just say that the girl’s history and their story don’t get much importance in the movie. Which is one of the more disappointing elements of Madame Web. A movie that had the framework and potential to be pretty great, but gets lost in its convoluted mess. There are hilarious moments, and some pretty funny back-and-forth between the 3 girls, the ultimate climax feels more like a setup than any kind of resolution to the story audiences just saw. All in all, a disappointing entry into more Spider-Man movies without Spider-Man, that continues to make us wonder, ‘why?!’"
"Feb 20, 2024",negative," It seems a little cruel to dogpile on a movie that has been bashed even before it was released. But for the life of me, I’m having a really hard time coming up with anything kind to say about Madame Web. All those seemingly infinite resources, and this is what the filmmakers come up with? Perhaps this is the beginning of the end of the unshakeable hold that superhero movies have had on the box office for the past decade and a half. Now, to clear up a little confusion about where this movie fits in the superhero genre, yes, it is a Spiderman spin-off and Spiderman is a Marvel character. But no, Madame Web is not part of Disney’s Marvel Universe. Sony holds the licensing to Spiderman and all its spidey off-shoots. When Spiderman does cavort with Thor, Iron Man, The Hulk, etc., it’s with the express permission of Sony executives. You don’t get the feeling anyone involved with the film tried very hard. Dakota Johnson sleepwalks her way through the portrayal of Cassie, a misanthropic paramedic whose mother died giving birth to her in a jungle where she was researching exotic spiders with curative powers. Granted, Johnson was given a ridiculous, cliche-ridden script, but had she inserted a little emotion, perhaps a whiff of irony here and there, her performance might have been more memorable. Cassie inadvertently finds herself in a position to protect three teenage girls who have caught the lethal attention of one Ezekiel Sims (who coincidentally had a nefarious connection with Cassie’s mom back in the jungle). Played by Tahar Rahim, (Napoleon, The Mauritanian), he is one of the most lackluster, forgettable villains to stumble across the big screen. Should he rain down hellfire on the girls who he dreams are destined to kill him, or should he buff his nails? Does anyone really care? The entire film seems like one long, tiresome setup for a sequel, a goal that is sadly (but perhaps fortunately for viewers) out of its reach. Products recommended by At Home In Hollywood are selected by our editorial team. We often receive free samples of these products. Some of our features include affiliate or sponsored links. If you buy something through one of these links, we may earn an affiliate commission or other compensation."
"Feb 20, 2024",neutral," Reviewed by Dennis SchwartzThe female British filmmaker S.J. Clarkson (“Toast”/”Banshee”), with a number of TV credits, directs this dreadful clairvoyant superhero movie that has trouble getting off the ground. Clarkson co-writes it with scriptwriters Matt Sazama, Burk Sharpless, and Claire Parker. They base it on the story by Sazama, Sharpless & Kerem Sanga.It’s a Spider-Man spin-off that tells the absurd enigmatic Marvel publishing’s standalone origin story of its superhero heroine, who first appeared in the comics in the 1980s as a secondary character. The role is played by Dakota Johnson as an aloof heroine, seemingly not concerned her dialogue would be a joke if it was funny or that her talent is wasted in such an empty role.In 2003, Cassie Webb (Dakota Johnson) is a NYC paramedic who has a near-death experience and a sad back story. One day she attains the mental superpower to see into the future and change it. Her first use of these powers is to save three teenagers–Julia Cornwall (Sydney Sweeney), Anya Corazon (Isabela Merced) and Mattie Franklin (Celeste O’Connor)–from being targeted by the dangerous madman Ezekiel Sims (Tahar Rahim), who possesses spider-like powers. We learn he was in the Amazon with her pregnant mom who was researching spiders before she died. Through his powers, which tie in with Cassie’s, Sims had a strong feeling his powers would one day lead to his death.Everything seems amiss in this dud, from the bland story, the poor editing and directing, and that an action pic could possibly have so little action.If I could show off my limited clairvoyant abilities, even I could predict this stinker will flop at the box-office and with the critics."
