Dates,Scores,Reviews
"Feb 17, 2024",negative," Sony’s Spider-Man Universe (SSU) was an idiosyncrasy long before Madame Web was conceived. 2018’s Venom revealed that star and executive producer Tom Hardy is a bizarre man in the best way possible. Venom: Let There Be Carnage upped the slapstick, puerile tone, and Morbius was a film allegedly best left unviewed (I did). The universe is doomed not to feature Spider-Man (those Disney MCU contracts are mysterious beasts), and their unusual efforts to differentiate themselves from the superhero pack have left them out of touch with popular and critical taste. The worst Madame Web could do was poke a few more holes in the sinking ship, and it’s such an odd swing that it fails to land even that. To be clear: the value of Madame Web and all the SSU is entirely divorced from quality in my book. As a longtime apologist of Fox’s X-Men series, I appreciate anyone working against the notion that superhero movies are bound to the MCU formula, or even a genre, for that matter. The X-Men movies were a mess, and I loved them for their highs and lows. The SSU has been all lows so far, but they’re throwing away narrow notions of superhero movies, too, which earns them a soft spot in my heart. The Venom movies are easier to forgive. They’re charmingly bad, anchored by a committed performance from Hardy that deserves the same beloved status Hugh Jackman earned in his decades as Wolverine.  How did they mess this up? First off, they made it an origin story. Boring, we’re over it, just have a scene where the new superhero’s powers are explained and get to the good stuff. We don’t need Dakota Johnson’s Cassandra Webb running around as a disgruntled paramedic, rejecting thank yous from kids and complaining about New York City traffic. An accident on the job awakens her ability to see into the future, which tips her off that three teenage girls are going to be murdered by a leeringly evil man with spider-like abilities (Tahar Rahim), and her intervention leads to the movie-long discovery of her powers. Only by the end is she truly Madame Web, and boy is it a slog to spend that much time on a plot everyone knows like the back of their hand. The good news is that there’s fun to be had along the way (mostly unintentionally). The script is a mess of blunt exposition that leads to some hysterically undeliverable lines, which is somehow topped by every single word out of Rahim’s mouth feeling like it was delivered in a sound booth far away from the set and entirely divorced from the tone of the scene. But what really exemplifies this film’s self-inflicted tomfoolery is a cat. Cassandra is a stubborn loner, you see, which must have made the writers think of Breakfast at Tiffany’s. So they give her a stray cat she calls Cat, as a fun reference. They mercifully resisted casting an orange boy to play the stray (you can’t outdo Orangey, the legendary cat actor featured in Breakfast at Tiffany’s). Instead, they cast an unmistakable rotund chonker to waltz onscreen and lap up some milk. Two things here. One, why would you cast an overweight cat as your stray? There’s no good answer to this one. Two, many adult cats are lactose intolerant, and even if the kitty can keep it down, cow’s milk doesn’t provide the nutrition they need. Cassandra may as well have given the cat a bowl of the film’s ubiquitous product placement, Pepsi, for all the good she was doing it. Or maybe the film is implying that she doesn’t care about the cat at all and is purposefully inducing diarrhea or bulking up an already big boy? Don’t worry, the movie isn’t that smart. They just made a minor plot point make no sense, a small thing amid major plot points that make no sense.  The other inexplicable, self-inflicted wound is the casting of Dakota Johnson. Her low-key, borderline petulant presence makes absolutely no sense as a burgeoning hero, and whether this incongruity is a positive or negative will entirely come down to personal taste. For me, she operated as a salve that nearly healed the whole thing. She never feels like she wants to be in the movie, and the most verve she brings is when she’s seemingly playing with the material, talking down to the very movie she’s leading. Johnson has long been making promotional work performance art (remember her takedown of Ellen DeGeneres?), and with Madame Web, she’s seemingly targeted this playful disdain for industry requirements on the ubiquity of superhero movies. Or maybe that’s just wishful thinking on my part, and she just delivered a terrible performance. Either way, the performance is hilariously off-kilter, as jarring and strange as all of Michelle Williams’ work in the Venom movies, hence, making it of a piece with the rest of the SSU. The SSU just happens to be awful, so bad some raise up the films as fun-bad. I’m not quite there on Madame Web, but I bet there’s a slightly worse cut of the film that could nudge me over the edge."
"Feb 17, 2024",negative,"At best this movie feels like it exists to tease a more interesting film and drop Spider-Man Easter eggs. In execution the characters are all underdeveloped, the performances wooden, and the few good ideas waste."
"Feb 17, 2024",negative," Sony’s fourth Spider-Man spinoff “Madame Web” was doomed from the beginning. Made in conjunction with Marvel, the superhero film features a passionless Dakota Johnson in her worst performance since the “Fifty Shades of Grey” trilogy. The story written by director S.J. Clarkson and three cowriters including the team responsible for “Morbius,” “Gods of Egypt,” “The Last Witch Hunter,” and “Dracula Untold,” is filled with ridiculous dialogue, and we get a second-rate villain played by Tahir Rahim who mutters his badly dubbed lines. You don’t have to be a clairvoyant to catch the warning signs, just watch the trailer. Paramedic Cassie Webb (Dakota Johnson) saves lives when she’s not being saved by her coworker Ben Parker (Adam Scott). After he rescues her from a submerged vehicle, she awakens with superpowers including clairvoyance. Cassie sees snippets of the future which begin as weird moments of déjà vu. When she begins to realize what’s happening (in “Groundhog Day” do-over style) her second sight puts her in the path of three teenage girls about to be murdered. The teens played by Sydney Sweeny (“Euphoria”) as nerdy white girl Julia Cornwall, Celeste O’Connor (“Ghostbusters: Afterlife”) as skateboarder Mattie Franklin, and Isabela Merced as brainiac Anya Corazon, are seen in Cassie’s visions donning cool Spider-Girl suits while battling the story’s villain Ezekiel Sims (Rahim) who wears a black Spider-Man suit. Cassie saves the girls, who don’t know each other when they come together on the subway, the scene filled with lackluster CGI. The saying, “A hero is only as good as its villain” is a cliché, but there is truth to that line in “Madame Webb.” Rahim, a good French actor whose breakthrough performance came in 2009’s “A Prophet” is dreadful as the story’s barefoot, dapper-dressed antagonist Ezekiel who speaks in an annoying low gravel. Rahim is in competition with Johnson for the film’s worst performance. “Webb” takes place in 2003, as evidenced by Britney Spears’s “Toxic” which spurs the girls to table dance in a roadside diner while expressing their love for the new jam. This is just before Ezekiel shows up trying to kill them AGAIN, only to be saved by Cassie. The song “Seven Nation Army” by The White Stripes would have worked better in the scene and it falls in line with the timeframe. When Cassie discovers an old photograph dated 1973 of her late mother Constance (Kerry Bishé) with Ezekiel in the Amazon jungle, she travels to the site where she encounters the leader of Las Arañas, a group of Spider-Men who travel across the treetops and we learn more of the Webb’s backstory complete with betrayal and a mythical spider. The film opens with the Amazon scene before jumping 30 years to NYC.  Apart from the bad and insensitive dialogue, Cassie asking her partner Ben (who can’t wait to be an uncle) if he wants to get shot in Queens has spurred an online backlash, the origin story’s biggest problem is that it’s 2-hours of setup followed by the credits. The film’s ending should have happened 45 minutes into the film leading to a fully realized Madame Webb mentoring the teens as they become Spider-Girls preparing to battle Ezekiel for the rest of the story. As is, we get glimpses of a much better film in Cassie’s visions showing the young women in great-looking costumes battling an older grey-haired Ezekiel. Pepsi’s product placement is so conspicuous that the film’s climax involves a fight scene on a giant neon billboard for the cola. “Madame Webb” follows Sony’s spider-verse spinoffs, “Venom,” and “Venom: Let There Be Carnage” plus the Jared Leto vampire flick “Morbius,” all of which are better than this hot mess.  Adam Scott, Mike Epps, Zosia Mamet, and Emma Roberts as pregnant Mary Parker (cue the music) are wasted in the film, the silver lining is at least they are not subject to much of the horrible dialogue. I like Dakota Johnson; she’s given us many terrific performances including 2022’s “Cha Cha Real Smooth” but she is miscast as Cassie and for most of the film she delivers her lines with a lack of enthusiasm. I don’t blame her. The song “Bury a Friend” by Billie Eilish serves as a harbinger of bad films. It was featured in the trailers for “Madame Webb” and “Night Swim.” On the small screen, it has the opposite effect, as the foreboding track fits perfectly as the theme for HBO’s “True Detective: Night Country.” MAILING ADDRESS: 2003 8th Ave., #300, Fort Worth, TX 76110PHONE: 817.405.9318EMAIL: hello@fortworthreport.orgOur MissionWe pledge to produce high-quality objective local journalism that informs public decision-making, addresses the quality of life of our community’s citizens, holds our policymakers accountable and tells our readers’ stories by listening to them and making sure they are valued and understood. In all that we do, earning the trust and respect of our audience is paramount. Our reporting will be free to all who access our primary digital channels."
"Feb 17, 2024",negative," Yikes! I’ve made a habit and a living from pulling the wings off the more pitiful creatures caught up in the Marvel and DC Universe, but arriving at Madame Web with Fortinbras timing some two days after its release, I find the carcass stripped clean by critics and audiences alike; this is a bad movie we can all agree on as the nadir moving forward. This is multiverse, meta-verse, cobblers-o-verse stuff from Sony, licencing the Spiderman universe from Marvel but somehow not having the rights to show the main character; ie a worthless property. I remember the speculation when all this potential with IP was initially being unlocked, they’d say; imagine a film about Miss Monneypenny! But who wants that? She sits at her desk and flirts with the male staff. That’s all she does; make her do anything else and she’s just not Miss Monneypenny anymore. There’s absolutely nothing in Madame Web’s universe to make it worth exploring for supposed fans of this genre. So set your self-serving gobbledygook threshold to overload and let’s get stuck in. Instead of the aged psychic grandma in the comics, this Madame Web is Cassandra Webb, a spunky NYC ambulance driver played by Dakota Johnson, the daughter of a woman who had her health restored by mysterious spider-men after giving birth in the jungle in Peru in 1973. Why a heavily pregnant woman in 1973 would be in a jungle investigating spider people might seem like an issue until you set eyes on Tahar Rahim, so good in A Prophet, now looking like Benedict Cumberbatch playing Manuel from Fawlty Towers and speaking the same kind of English-as-she-is-spoke, except the words never come out of his mouth. ‘You have no idea of the torment and torture of dying all over again…can you imagine how frustrating it’s been trying to identify someone you’ve only seen in a vision?’ Sigh. What’s gone so wrong for SJ Clarkson’s movie? So, it looks like they planned this movie as a religious nativity scene around the birth of Andrew Garfield’s Spider Man, then re-did it around Tom Holland’s incarnation of Peter Parker. There’s continual compelling visual evidence through sound and music that it’s 2003 and not 1993, for all the difference that makes. There’s time-specific adverts for Pepsi and Beyonce and characters discuss how Britney Spears’ Toxic has just come out. Webb’s co-ambulance driver is Adam Scott from Parks and Rec but he’s so old now he’s playing Peter Parker’s Uncle Ben so that Madame Web can help him with his mad rush to the hospital for the birth of Spiderman. Madame Web also goes to a baby shower for Ben’s sister Mary (Emma Roberts) and has prophetic visions of the future that may not come true. Meanwhile Ezekiel Sims (Rahim) has a vision of a gaggle of costumed and accessorised Marvels/Justice Society/Who cares? spider-girls killing him, and is tracking down the young women and kill them first. All you need to know is that Madame Web’s badly-edited deja-vu visions enable her to change the future, save the girls and kill the baddie. Madame Web wins out in annoying fashion because although she claims she can’t control her powers, she gives every scene a do-over when she doesn’t get what she wants and the audience have to watch the same action over and over again with different outcomes. Similarly, the film-makers seem to have had several do-overs at adjusting the time-period, characters and storyline here, with tell-tale dialogue not synchronised with the images. Sydney Sweeney is amongst those buried in the jumble; Johnson can’t do anything as a character who spends her recreational time staring at her own birth certificate in an effort to remind herself (and us) of who she is. Nor can Johnson do much with a scene in which Madame Web rescues the girls by stealing a taxi and driving it through the window of a restaurant, an act which fails to arouse any consequence in a fakey New York that looks like it was smooshed together from old photographs and adverts. ‘He can climb on walls, how is that even possible?’ the hipster spider-girl team ask about Ezekiel Sims, opening up another confusing question; I thought Peter Parker was trying to protect his own identify, rather than the existence of all super-heroes ever. Perhaps that’s why his birth takes on an almost Biblical reverence here, with Uncle Ben as Joseph? It’s hard to find the right words to close out this gibberish gumbo of remixed, re-hashed lore but somehow Madame Web provides it in the climax. ‘When you take on responsibility, great power will come.’ Sony had Madame Web written by the guys who wrote Morbius, they were so pleased with how hard that turd flushed; I wouldn’t trust them to empty my bins, and yet here we are. The verdict is in; file Madame Web along with Elektra and the most annoying, confusing, unwanted cash-grab spin-offs at the end of the comic book era. I’m blaming the distributors. Nothing else to see except this and Memory so as depressing a double bill as I can remember. Interesting to see the bullet Sydney Sweeney dodged. Actually, the three kids were impressive, thought the superhero costumes plain awful. Who in their right mind could have greenlit such nonsense? This is pretty much a prequel and Dakota Johnson just looks plain puzzled to be in it. The whole alternative future notion is quite clever but gets boring quickly. At least I saw them months apart, but they’re both bleak but in different ways. Being able to see a minute into the future is like a cheat code rather than a super-power; no chance of losing out while you’re resetting every time things go against you, so, like Spiderman’s fluid, her powers dry up whenever she really needs them. I think constant recutting has rendered this film as gibberish, I genuinely can’t imagine this getting green-lit on that script. It’s also worth noting that all the MCU and DC hate is directed towards female led films, indicating that male fan-boy angst is driving the collapse of these franchises. Interesting gender perspective.  Did they hammer Black Widow as well? It looked like they re-shot stuff to bring in that other element. It wasn’t much of a concept and giving a glimpse of what the teenagers could do was like a credit sequence. Just awful. So much manoeuvring. Yet I genuinely didn’t get who these girls were, or what this had to do with Peter Parker being born, or why there were no other superheroes apart from Ezekiel Sims, it was like reading the manual for a product you can’t use, written in a language you barely speak. They can have that quote for the poster. I’m both a big Marvel and Dakota Johnson fan. I found this awful. Just. Awful. There are a couple of scenes with dialogue that sounds like Artificial Intelligence wrote it, which is not a compliment. The marketing folks were more than “devious” when it came to the trailer, but they had to do something to make it look watchable – don’t want to spoil anything for those who venture forth. Now to be sure, I don’t think it is the worst superhero movie ever made. I think the best way to sum it all up is it looks like it was produced and directed in the time period it is actually set in, which also is not a compliment. Dakota is so much better suited to Cha Cha Real Smooth and Peanut Butter Falcon-type roles. A superheroine…nope. Felt like an Elektra period Marvel movie, compromised, ham fisted product. Johnson good in the films you mention, but has an impossible role to play here. That chat either the spider people was awful, and the stuff between Rahim and Zozie Mamet was absolute cringe. Did they change the time period after it was shot? I couldn’t work out exactly what had gone wrong, but something did. Pulling Kraven the Whatever he was from last year suggests it’s a turkey as well. You can’t tell from the trailer quite how off the rails this goes. Not good. You comparing it to Elektra was all that was needed to sink this ship.
Even Psychic Grandma could have foretold that Sony would screw this up! Why couldn’t Sony have just made a Psychic Grandma movie, that’s what the fanboys want. Maybe not with her in it, but set in that universe? Oddly enough, that’s one of a blizzard of problems here. Madame Web has intimate do overs, so can’t lose as a superhero. Of course her ability to use her super powers comes and goes, just like how Spidey’s web fluid runs out at key moments when the narrative suits. It’s kiddie stuff. Out of curiosity, was there any dumb sinister six stuff here? No vulture? No morbius? Have they given up on the dream of a sinister six movie without the guy the sinister six are supposed to fight? No nothing. I’m sure there are better placed than me to get the easter eggs that are usually jammed into this; I was out the door before any post/mid credits malarkey, but apparently there’s none. It seems to be about establishing this all girl spiderman alternative team but they don’t seem to have names, character or even costimes; the way they appear in the trailer is somehow outside the scope of the film. No venom, no anything, I can’t even see what a fanboy would get from this. Maybe on your second watch, things will click into place. To be honest, all the bad press had me kind of interested. And the trailer actually looks kind of interesting. But still pretty sure I’ll pass. This demo site is only for demonstration purposes. All images are copyrighted to their respective owners. All content cited is derived from their respective sources."
"Feb 17, 2024",negative," Madame Web, Sony’s latest entry in its ongoing Spider-Man universe, is a tangled mess. Not winkingly fun enough to be camp, it’s an embarrassment of dull action, sloppy plotting, and a protagonist who seems like she wishes she were anywhere else. Dakota Johnson (Persuasion) plays Cassie Webb, a New York City paramedic whose driving skills are her greatest skill before she becomes clairvoyant. Her second sight activates after she nearly dies on the job, granting her visions that first feel like déjà vu, then evolve into her seeing a mysterious man attacking three teenage girls. The seeds of Cassie’s power come from the Peruvian jungle, where her late mother, Constance (Kerry Bishé), decades earlier searched for a spider that could cure various illnesses. Upon learning the amazing arachnid also grants people wall-crawling powers and super strength, a colleague, Ezekiel (Tahar Rahim, Napoleon), double-crossed the pregnant Constance, shooting her and stealing the spider. Red-suited spider men laughably drop from the jungle canopy to help but only manage to save the baby, along with a suitcase full of convenient photos and journals. Flash-forward to 2003, where the adult Cassie has a work partner named Ben Parker (Adam Scott, Severance) who’s excited to be an uncle—the only Spidey-related tangent the film has. Meanwhile, Ezekiel has become wealthy but obsesses over a recurring vision where the teens kill him once they develop special powers and their own spider gear. “Every day that goes by, my appointment with death grows closer,” he says. That holds true for us all, although it’s not clear what Ezekiel does with his precious time beyond sit in a high-rise, drive a Corvette, and growl at Zosia Mamet (Molli and Max in the Future) as a tech-savvy underling. After fate places Cassie in the girls’ proximity, Cassie intervenes when Ezekiel, in a spider suit, crawls on subway ceilings and more without anyone noticing. New Yorkers are notoriously blasé, but come on. Set in Queens, New Jersey, and the Peruvian jungle by way of filming locations in Massachusetts and Canada, the film’s screwy geography is the least of its problems. Four credited screenwriters—Matt Sazama, Burk Sharpless, Claire Parker, and director S.J. Clarkson—barely develop the story or these characters. They don’t even bother to have Cassie do proper CPR, which is a key plot point. (She just does chest compressions, not the breaths the American Red Cross recommends.) Johnson has become known for her dry, deadpan delivery in interviews, but that demeanor here reads as if she’s tired and miserable. As the teens, Sydney Sweeney (Anyone But You), Isabela Merced (Migration), and Celeste O’Connor (A Good Person) bicker between table-dancing at a diner while they’re supposed to be lying low. The action, such as it is, often involves Cassie driving a stolen cab or ambulance. The film cares nothing for continuity or basic common sense, with her driving the same smashed-up cab before and after popping down to Peru. Clarkson (Anatomy of a Scandal) films Cassie’s visions at varying speeds, repeating the same moments until Cassie realizes she’s seeing the future. The less said about the wispy, weblike special effects, the better. The context of Madame Web as a film is more interesting than anything onscreen. The Ringer this week and NPR previously covered how Sony legally must churn out something related to Spider-Man every few years or lose the movie rights to the friendly neighborhood web-slinger that Sony has held since 1999. Sometimes that generates pop culture magic, such as with the recent Tom Holland-led Spider-Man trilogy or the animated Oscar-winning Spider-Man: Into the Spider-Verse. Other projects, such as the Tom Hardy-led Venom films, have a B-movie goofiness that’s hard to resist. Madame Web essentially kicks the rights issue down the road until another project like this year’s Kraven the Hunter arrives, further enmeshing Spider-Man within Sony’s clutches. Although Spidey can’t legally untangle himself, viewers at least can tap out—and should. Valerie Kalfrin is an award-winning crime journalist turned freelance film writer whose work appears at RogerEbert.com, In Their Own League, Script, The Hollywood Reporter, and other outlets. Also a screenwriter and script consultant, she’s passionate about challenging stereotypes about gender and disability. Let’s tell better stories and tell stories better."
