Dates,Scores,Reviews
Mar 24 2024,positive,love all roberts films this one is no different
Mar 23 2024,neutral,pretty good photography not much of a story liked the trippy norse mythology stuff could have made a bit more of it
Mar 17 2024,positive,if the northman isnt robert eggers best movie its at least his boldest its finetuned and pinpoint beyond what youd expect from an already exacting director and the stunning ensemble cast is entirely dedicated to their profound roles  all led by alexander skarsgård and anya taylorjoy    
Mar 12 2024,positive,beautiful story of revenge very raw emotion and an all around great viking movie alexander skarsgård absolutely delivers in this and put so much into this and the supporting cast also holds up this captivating tale a must see for anyone who is into viking lore or a fan of alexander skarsgård
Mar 5 2024,positive,almost like a classic sword and sorcerer film but with no regard for the genres conventions which makes this film standout and stand above
Feb 29 2024,negative,mediocre pretty basic story nothing really surprising or departure from what youd expect forgettable
Feb 28 2024,positive,what a great surprise immersed in the beautiful and creative shoots i really loved this movie this movie made me remember why i love movies this much and inspired me in my cinematography
Feb 27 2024,negative,i do not  see what the critics see in this even with great cinematography it was not good
Feb 21 2024,positive,eggers finally fulfills the promise he showed in his earlier work a gorgeous and bold epic that both feels old fashioned possibly ancient even and excitingly new
Feb 14 2024,positive,because of its length lack of character development or even story depth it might not be everyones cup of tea but if you look at it from a different perspective than you usually look at movies you appreciate it for what it is a brutal revenge tale with great cinematography
Feb 9 2024,positive,in a landscape thats been very fond of vikings in recent years its nice to see a departure from the often poorly realised historical and instead venture into the mythical the fantastical    based on the story of amleth the original inspiration for shakespears hamlet this film is unapologetically cryptic and mysterious while telling a cohesive and thrilling tale    the wealth of historical accuracies to the time period are worth 5 stars in themselves seriously look it up but going into this film expect to see a work of fantasy and let yourself get lost in it you wont be disappointed
Feb 4 2024,negative,this movie was absolutely dreadful from start to finish the writing was completely incoherent and nonsensical none of the plot threads made any sense whatsoever the attempts at symbolism fell completely flat the tone shifted abruptly and inconsistently between scenes it honestly felt like the writer was just making things up as they went along with no planning or forethought    even setting aside the abysmal writing every other aspect of this movie was equally incompetent the acting was laughably bad the cinematography was amateurish the pacing was horrible the runtime was absurdly long considering there was no actual story being told the whole production comes across as some film students first attempt at an artistic movie that tries way too hard to be profound but ends up revealing only its own pretension    the northman has earned its place among the worst movies i have ever seen the writing is the most glaring weakness but every single component is flawed do not waste your time or money on this total disaster of a film easily one of the biggest cinematic misfires in recent memory
Feb 4 2024,negative,apparently some reviewers think a pretty movie must be a good movie  this one is visually sumptuous but plagued by long boring stretches the worst choreographed medieval fight scenes since movies in the 50s moderate acting nicole kidman barely shows up too long some goofiness that is hard to take seriously in a movie that wants oh so bad to be serious   never mind that the writers only read the cliff notes about vikings  i give it two stars because i am a sucker for a viking movie
Jan 29 2024,positive,like all of eggers films if you dont fully understand the lore youll likely be stuck at times although mostly good i think it may be eggers weakest film yet 
Jan 22 2024,positive,cinematography is crispy epic combined with crafty engaging storytelling now this is a fůcking viking movie folks skål
Jan 20 2024,positive,after being blown away by the vvitch and then seeing the masterpiece that is the lighthouse i knew that eggers had something special with the northman a fantastical epic about revenge and death this film is a visual marvel that hooked me instantly amazing performances interesting story and brutal fight scenes have me rating this one a 45 stars brilliant film
Jan 18 2024,negative,probably the worst movie i have seen in a long time weak plot and horrible acting even the special effects lame  dont waste your time on this disaster fooled by the high rotten tomatos rating dont believe it
Jan 16 2024,positive,prepare for a tale of vikings vengeance and the road to vallhalla when prince amleths father is murdered by his uncle he embarks on a quest of vengeance against the traitor who killed his father beautiful in its aesthetic and brutal in its violence eggars brings the world of norse mythology to life
Jan 13 2024,positive,absolutely gorgeous stunning on every way
Jan 12 2024,negative,i was thoroughly unimpressed
Jan 7 2024,negative,unbelievably bad dont waste your time 
Jan 3 2024,positive,movie was awesome if you liked conan the barbarian from the 80s with arnold then you will enjoy this the action is great and the mythos is excellent alexander is good in this movie along with the supporting cast it really made me feel like i was watching arnolds conan from the 80s worth watch for sure
Jan 2 2024,negative,great cast   movie  meh x 10
Jan 1 2024,positive,very likely the greatest viking movie that will ever be made exciting emotional authentic i am entertained with every repeat viewing
Dec 31 2023,negative,very long and mostly boring the northman tribal scene way too long and stretched out a lot of unnecessary filler and repeated dream scenes then the final fight on top of an active volcano where the sulfurous fumes and heat would kill any living thing but it these two they kill each other story line runs along most viking movies but movie did have hope of the didnt stretch it out so long 
Dec 30 2023,negative,i have no idea why this movie has high ratings  it is 95 generic filler from any generic vikings movie and the remaining 5 is a script that a 12 year old could have written  is it that anyone will watch  and fear to criticize  a movie with the massive clan of skarsgårds in it  any single episode of the vikings series is better than this waste of time
Dec 26 2023,negative,viking slasher kits how are vikings portrayed in this movie every second someone gets butchered by a brutal viking after 30 minutes we were laughing about the stupidity of it all the artificial kits acting and the butchering was getting really annoying and we were laughing because everything was so overdone
Dec 25 2023,negative,one of the worst movies i have watched bad story and bad acting
Dec 13 2023,positive,a beautiful film with brilliant protagonists and a well written plot the northman is a must watch for fans of norse mythology
Dec 12 2023,positive,good but not great there are some parts midway and at the end that just makes no sense at all really detracted from a solid movie overall i liked this movie
Dec 8 2023,positive,not as good as the directors the lighthouse but it does a great job of showing norse mythology and mysticism definitely one of the best film about vikings if not the best
Dec 6 2023,positive,great revenge movie looks beautiful as one has come to expect from a robert egger film acting is good score is superb it can drag at times but i wasnt able to take my eyes off the screen a true representation of viking life as you can get i presume anyone who is into norse mythology and all that stuff will enjoy this
Dec 1 2023,positive,great movie bit slow at times
Nov 30 2023,positive,well shot good characters decent score
Nov 16 2023,negative,i was pretty bored watching this yeah the action is cool and scenes felt epic but at the end of the day i didnt care and it wasnt memorable
Nov 12 2023,positive,a revenge movie that is violent brutal and bloody with a stunning cinematography this is probably one of my favorite movies of 2022
Nov 12 2023,negative,maybe not the worst movie ever made but with every minute that goes by one is convinced that its characters and director are desperately trying to reach that mark
Nov 11 2023,negative,disappointing a cinematic masterpiece authentic to the age  ultimately boring and will be forgotten in two minutes thanks to a lack of any real relationships between any characters whatsoever not one character with an actual personality  just some cardboard cut outs reciting overwrought lines in heavy accents for two hours mostly tedious
Nov 10 2023,negative,im really concerned that professional critics gave it a good review i have lost faith in rotten tomatoes   just a bad movie for every reason
Nov 6 2023,negative,not goodreally not good at all plot was subpar boring slow burn without the suspense depth or profundity which would be needed to make it interesting  making something slow doesnt make it more deep or meaningful in this case its an absolute snooze with no payoff   i rarely feel like i get nothing from a movie and that it was a complete waste of time but this was one of those cases
Nov 1 2023,negative,they should rename this movie to the southman for how quickly this movie went south     a glorified snoozer skarsgård has an absolute rig though
Oct 30 2023,negative,you can barely tell what the characters are saying the plot is all over the place and in the end the hero and villain dies would recommend to my worst enemy
Oct 6 2023,positive,a revenge movie is nothing new but this is something else brutal and bloody and at times beautiful this effort does comes as a sort of modern day shakespeare  one of 2022s best movies
Sep 28 2023,positive,i love this movie and i love this era
Sep 12 2023,negative,i watched this movie for anya taylor joy i did not care so much for the manly men doing manly stuff and making manly guttural noises it was alright
Sep 11 2023,positive,the northman was pretty solid
Sep 10 2023,negative,ive heard this is good so im quite looking forward to it but i have a suspicion i might just find it a bit tryhard in its authenticity    hmmm  having watched it im not sure quite what i thought of it  its diverting but takes itself a bit too seriously particularly considering how silly a lot of it is  its the ageold tale of someone done wrong and putting things right in a kinda questy way with stuff happening along the way  i have to say it didnt half go on 136 minutes  i was totally get a move on for a large chunk of this film and i suspected i knew exactly how it was going to end from the first minute and i wasnt far wrong  not that i really cared by that point    i didnt love this and i didnt hate it  but having finished it a lot of the comments i found id made whilst watching it were on the negative side  a lot of it is very dark  not in mood but in visibility which actually hasnt been a big problem this year so far  there are also a lot of silly accents involved some of which are more consistent than others and its surprisingly wordy for whats described as a brutal viking saga and it spends too much time using old norse or something subtitles  we all know thats what they spoke all the time so dont pretend they only did it when they were angry  there was also far far too much shouting at the sky going on and a silly number of heads being chopped off    it does however always look very good  its well filmed apparently robert eggers can be relied upon here but this is the first of his films ive seen  whilst it might have shared roots with hamlet but i was very much reminded of this version of macbeth  its not in black and white but it shares a lot of the same style when you can see whats going on  additionally the scenery is beautiful  i have a strong suspicion that iceland was heavily involved wikipedia tells me it was but most of it was actually filmed in northern ireland  i suspect the cast probably didnt overly enjoy the filming experience though   theres a lot of wandering about in the mud or the sea involved    and its got a very impressive cast indeed  theres a lot of wellknown names involved in this  possibly one might argue too many wellknown names without them necessarily knowing what to do with them  alexander skarsgard certainly isnt underused though  and he does a decent job but he was unlucky considering he has just come off playing matsson in succession and it does feel at times that this role is just a much earlier version of that here hes a viking disrupter  of the rest of the cast id say anja taylorjoy comes over the best for me  its also funny seeing klaes bang playing the prick but in viking times as opposed to more modern times  but when you look at some of the other names involved nicole kidman ethan hawke willem dafoe bjork and various other recognisable faces its hard not to feel they were a bit wasted    all of which sounds a bit negative about the film doesnt it  maybe im being harsh because it certainly looked good and it felt good  but when i actually thought about what it was doing it wasnt entirely clear what it contained  its also very hard to describe what genre it falls into  horror action thriller drama  it all felt a bit style over substance which didnt stand up to close inspection for me  maybe i just shouldnt have inspected it so closely   so if you want to watch it just try to do so without thinking about it too much and you can currently stream it on sky or rent it in any of the usual locations
Sep 9 2023,positive,i found it refreshingly different  if your looking for a epic like the show vikings nope this isnt a transgenerational saga like that  its a one mans journey of a spiritual reckoning n revenge only to find that he wasted his time seeking revenge when he could have had family n life  then again it wouldnt be able to draw on the theology and historical story that created the imagery n amleth path in the first place
Sep 2 2023,negative,hamlet with nordic names sprinkled in dont believe me amleth is just hamlet with the h moved to the end jester friends skull makes an appearance uncle kills dad and moms in on the whole affairyeah no one has peripheral vision and the plot holes could sink atlantis
Aug 31 2023,positive,the northman     this historical thriller sees the protagonistamleth a viking prince as he journeys to exert revenge on the man who usurped his fathers throne after killing him    the northman is visceral with a consistently grim tone    theres a lot to praise about the northman from the brilliant direction of robert eggers to the performances given by the cast the cinematography is also a marvel the world painted here is striking and enlivened with brute action and a killer score    the subject matter in the northman may be hackneyed and probably isnt driven by a lot of character development but as a whole it is an utter viking movie    7510
Aug 28 2023,negative,i just couldnt get into it  compared to game of thrones this movie was a neanderthal violent movie  kind of corny
Aug 27 2023,negative,absolutely horrible movie if you wish to waste any time watching it shame on you  i found out the hard way by watching this mess
Aug 27 2023,negative,absolute rubbish save yourself 2 hours and never turn it on could have been really good with the actors involved but is utter crap cant believe i stayed with it till the end thinking it may get better
Aug 25 2023,positive,great film the most historically accurate viking film yet 
Aug 25 2023,positive,those who have read norse mythology and epic tales of vikings will absolutely love this movie no soft shit just straight viking
Aug 24 2023,negative,god i couldnt take it after 30 minutes too pretentious and over the top theres no depth to the characters and the dialogues were lacking 25 hours of vikings preying howling and rage screaming cliche stuff
Aug 14 2023,negative,not the best story line unless you like stories to not pan out like you thought they would
Aug 13 2023,negative,slow start  the story line is laughable and unrealistic  he goes his entire life waiting for the opportunity to avenge his father  free his mother by killing his uncle yet he disappoints at every opportune time  just no
Aug 12 2023,positive,the part i read before posting has to do with your mindest  to be honest this is a great revenge tale movie  the gore and sex doesnt in my mind detract from what could be called the john wick of the nordic realm
Aug 7 2023,positive,an original and engrossing take on the revenge tale that does not follow common cinematic tropes well executed and structured with an amazing score and breathtakingly shot this film has some quirks and some oddities woven in but what is on display is original and very engaging and enticing great twists in the narrative and a satisfying climax the acting and accents engross you in the scandinavianviking life and the scenery especially in iceland is incredibly captivating some of the long tracking and action sequences are equally impressive some of the visual effects and action sequences were lacking though but this did not diminish how the film lands overall    setting conflict character dialogue theme plot and climax a    audience engagement do you feel runtime no    top genres  action adventure drama fiction    runtime  217    genres rating action  7 adventure  8 drama  7 fantasy  8 history  7 thriller  7    genre average score 73 directing 8 cinematographylighting 9 storynarrative 8 structure 9 dialogue 9 scoremusic 10 editing 8 acting 8 characterization 9 mise en scènevisual design 9 visual effects 7 costumesmakeup 8 lasting impact 8 originality 10    overall 849 425 rt
Aug 5 2023,positive,fantastic film it deserves so much more praise more films like this should be made nowadays
Aug 5 2023,negative,poor scripting bad visual effects and a surprisingly bad performance from hawke make this cheap viking movie more of a knockoff than a knockout
Jul 30 2023,positive,amazing better with each watch 
Jul 29 2023,negative,lacks originality for all the uncle killing the king and the son coming back to avenge the father plots we have seenyou would think they couldve  done better besides the obviousavenge my father themethe story sucks does someone actually watch this at the end and think oh this is great impossible
Jul 28 2023,positive,i was looking forward to watching this but ended up being disappointed this wouldve been way better as a limited series or something with certain events in the beginning happening so fast to set the stage for vengeance it just didnt give time for one to feel any meaningful emotion towards really craving justice and this film clearly wants you to crave it in a special way with how the main character is the fighting regarding the main character didnt have much impact like it should either in my opinion theres plenty of movies out there where the hero is fighting and you find yourself tensed up or squeezing your leg without knowing it at first i didnt get that with this movie which made it awkward because i wanted to sure theres blood and gore but i think it was an issue with the fighting choreographer or lackluster stunt actors spoilers ahead and my biggest gripe was after all the stuff the main character went through to get his strength built up the rage the drive the weird magic he took part in and everything elseall of that to end with him having a fatal draw at the end against a dude who wasnt even in his prime anymore and kinda overpowered him most of the fight it just felt like a major letdown with hardly any satisfaction
Jul 28 2023,negative,this was your typical sundance type of film usually if it has that label its going to be horrible angles terrible story the idea of the plot is good but overall the details in between and how to get there terrible the only good part of this movie is him adopting the mantra he had of saving his mother and avenging his father made for some badass moments but overall just a horrendous movie in every way possible
Jul 27 2023,negative,woof wouldnt waste over two hours watching this hard to follow baseless story line the fantasy aspect makes this movie a reach and takes away from what the story could have been half a star is generous
Jul 21 2023,positive,yes this is viking hamlet  yes its awesome  a few of the artistic choices of the director will turn some people off to it but i thoroughly enjoyed this movie and loved how practical the sets and stunts were  i highly recommend this underrated movie and wish there were more like it
Jul 16 2023,positive,really like shakespeare and i have always been fascinated by the ancient vikings well the northman is a viking version of shakespeares hamlet a very dark version and of course vikings will be vikings so this is a very violent and very bloody movie on a grand cinematic scale  young prince amleth is about to become a man when his father king aurvandilis ethan hawke is brutally murdered in front him by his uncle fjolnir claes bang fjolnir then kidnaps his mother takes over the kingdom and sends assassins to kill amleth  amleth must flee his home his land and his mother he barely escapes and he swears vengeance on fjolnir and everyone that has wronged him and his family  i will avenge you father i will save you mother i will kill you fjolnir   amleth  amleth begins a bloody hatedriven quest to kill his uncle fjolnir he embraces hate and anger evil and vengeance so much so that his vision becomes blurred he is obsessed with hate for his uncle and killing him and everyone that stands in his way  i am amleth the bearwolf son of king aurvandill the war raven and i am his vengeance  amleth  this movie holds nothing back it is visually detailed in a brutally violent bloody mess and the film is almost unapologetic about it in a viking sort of way i mean it is vikings that is what vikings do  the movie is just beautifully shot and the actors are just amazing nicole kidman alexander skarsgård ethan hawke william dafoe björk anya taylorjoy  if you like shakespeares hamlet and you do not mind all the blood and violence you will like the northman but even if you dont know the story of hamlet it is a really good viking movie
Jul 15 2023,neutral,a very grounded and realistic take on vikings and north mythology the music is a real standout in the film and so is the acting from alexander skarsgård and anya taylorjoy but i would also say that this film was a bit of a drag with its run time
Jul 10 2023,positive,a compelling and frequently brutal insight into the lives and spiritual beliefs of early medieval northwestern ie germanic europeans the cinematography is outstanding and the acting is excellent the story may feel familiar  its drawn from the same folk history as is hamlet and the director was inspired by 80s cult masterpiece conan the barbarian  but the telling is masterful
Jul 9 2023,neutral,the beginning sets up an emotional struggle that promises to be an interesting premise but ultimately falls under its own weight especially towards the end
Jul 3 2023,positive,artsy war film people are going to go into this film thinking its gladiator its not great cinematography and acting but it is slow at times with some action scenes i really enjoyed it but it may be too artsy for some
Jul 1 2023,positive,a little slow in the middle but good story and more original than i expected  nice twist
Jun 24 2023,positive,the northman transports us to a world both ancient and timeless where dark tales of honor and revenge unfold against a backdrop of aweinspiring landscapes and evocative atmospheres from the first frame to the last eggers directorial prowess is evident as he flawlessly weaves together a complex tapestry of emotions stunning visuals and captivating storytelling
Jun 18 2023,negative,awful who fights naked with swords next to molten lava  goes totally unscathed from the volcanic heat its laughable
Jun 18 2023,positive,a visionary mesmerizing film breathtaking shots combined with a manic attention to detail typical of the director where no historical detail has been overlooked intriguing epic and profound 1010
Jun 15 2023,positive,if you are a fan of robert eggers you already know his films either make you think the characters are on drugs or you are in this film he removes that wonder its the characters this is an epic revenge movie with plenty of action along side some trippy ass moments eggers takes a step away from horror to make what feels like an accurate portrayal of what life was like during the time of vikings    this movie didnt hit me until the following day i wait a day to review any movie i watch as it is but this one in particular settled in my soul while i slept its a dark and twisted ride that needed to marinate dont go into this film thinking you are going to watch a text book style period piece go into this film with an open mind or better yet a sedated one
Jun 13 2023,positive,badass movie one of the very few movies that i actually bough on dvd 1010 recommend
Jun 10 2023,positive,i will never forgive the world for allowing this film to flop the northman is a great film full of great action history and it is a great display of the artistry that film should this film has something to say and we should all listen the actors are well directed and clearly gave their all my only complaint is that willem dafoe did not have more screen time
