Dates,Scores,Reviews
Apr 25 2022,negative,this would have been a mediocre netflix movie  not something i wanted to pay to see in the theater  slow poor plot development and not the greatest acting
Apr 25 2022,negative,i am a robert eggers fan  the lighthouse is one of my favorite movies but i was not crazy about this one  there is plenty to look including some really well shot scenes but it was missing my favorite part of his previous movies great dialogue and characters  this felt like it was a historical super hero movie     they never delve too deep into any of the characters and they come off so one dimensional  his previous movies felt like taking a time machine and hanging out with some real people from the past but i never felt like any of the characters from this movie were real and the dialogue only contained what was necessary to advance the plot or some random viking rituals  the mythological elements in this movie were pretty neat i guess but didnt really fit into the movie in a coherent way
Apr 25 2022,positive,one of the best movies of the year
Apr 25 2022,positive,the movie was way too long it started around at night 1007pm showing i dont get out of the theater until 1250am like the plot twist at the end and understanding of the celtic culture back then the story had  questioning  parts where it felt disturbing but the action was good though
Apr 25 2022,positive,love the movie it was an awesome experience hopefully they have the next be even better just as good as the books
Apr 25 2022,negative,this movie had the potential to include an all time fart noise and failed naked dudes and odd chants made this film great though tbh 
Apr 25 2022,positive,fantastic storyline is insane
Apr 25 2022,positive,entertaining as hell great visuals
Apr 25 2022,negative,sad vikings sure they had a group or army thing going on
Apr 25 2022,positive,it was a slow burn that kept growing more intense as the film progressed the struggles and triumphs were as epic as the cinematography and the story did not disappoint
Apr 25 2022,positive,this movie was awesome please dont compare it to 300 or troy if you do your missing the point they wanted to make this as real as possible and they did just that with the real history and language of the northman culture yes there are slow parts in the movie but the story and dialog is amazing as well as the cinematography when it comes to the landscape when you go to a movie watch it as thats the only movie you have seen and stop comparing it to others just sit back and watch perfection at work not to mention the casting was insane
Apr 25 2022,neutral,its hard to compete with shows like netflixs the last kingdom but it was something to do on a saturday night would i see it again no but if youre really into viking stuff it might be worth checking out
Apr 25 2022,negative,movie was not that great
Apr 25 2022,positive,i was really excited to see this movie overall i guve it a 67 out of 10 a bit slow in areas but the acti g was very well done
Apr 25 2022,positive,the northman is entertaining and beautiful but the ultimately the movies message about violence begets violence could not transcend the films gratuitous violence and it makes the northman somewhat hollow
Apr 25 2022,negative,i love robert eggers hes made two very impressive movies with the vvitch and the lighthouse so the only reason i went to go see a vikings movie was because he made it im not a fan of viking stories so this review may be biased but this wasnt very good some scenes were really intense which made for an interesting watch alexander skarsgard and anya taylorjoy were the best part of the entire movie some of the arthouse technique approaches did not feel necessary to the story as they did in eggers previous films
Apr 25 2022,positive,it was a non stop adrenaline viking filled movie great acting great story a must see
Apr 25 2022,positive,incredible visuals with masterful music made for a great cinema experience
Apr 25 2022,neutral,this film had great potential however some parts did not make sense which caused the storyline to be a little confusing for some the first 30 minutes are action packed and feature some interesting fight scenes however shorty after you are met with 4060 minutes of nothingness the film also features a bizarre hallucination of a sword fight with a skeleton i personally believe that it would have made more sense to keep this as a real scenario rather than fiction regardless this film is worth a watch for those who do not get bored easily
Apr 25 2022,negative,great fight scenes but the the movie was slow and not very enjoyable
Apr 25 2022,positive,amazing story telling  incredibly intense as usual great acting and settings but with some great action thrown in this time as well
Apr 25 2022,negative,the storyline was okay it was the in between that was weird for me like the part where the king and his son acted like dogs and just some parts were just disturbing
Apr 25 2022,positive,literally the hamletlion king story in viking skin good fights and visuals acting is pretty stiff from the side characters nothing spectacular but nothing bad
Apr 25 2022,negative,good storyline not enough action had so much potential
Apr 25 2022,negative,the movie was very slow and too artsy it had brutal deaths but they were few among the many weird rituals also many plots made zero sense like skarsgard is part of a group that takes a guarded city in 3 sec but he leaves them to be a slave to his uncle to get his revenge instead of attacking with his new clan or when uncle leaves him at home to instead fight at a volcano instead of facing him at the home
Apr 25 2022,negative,it was the worst movie i have seen in a long time the story line was slow and predictably and not very interesting i left before it was over and i never do that
Apr 25 2022,positive,very rarely there comes a movie that is so good you gladly pay to see it one more time this is one of those movies great story tremendous acting and absolutely beautifully shot and what a soundtrack not to mention its a rarely seen historically accurate depiction of european history     masterpiece
Apr 25 2022,negative,maybe i went in with the wrong expectations from the reviews i expected great combat scenes a basic storyline and some half decent gore instead what you get is maybe 2 or 3 proper fights which are really underwhelming since they only feature a couple of people an over done storyline and some glimpses of gore when the film finished the entire audience was simply quiet there was none of the usual hubbub of discussion you couldve heard a pin drop everyone was pretty much amazed by the mess of a film theyd just seen really dont understand the positive reviews its a 510 film at best i get that the director was trying to put in a bit of icelandic history but it couldve been done in a much better way i guarantee even the positive reviewers will never rewatch this as its completely forgettable
Apr 25 2022,negative,besides the good cgi  fight scenes pretty drawn out  boring id recommend to stream last kingdom on netflix  save 20
Apr 25 2022,positive,robert eggers is definitely a filmmaker with talent and ambition the witch were both great movies the latter especially and showcased his incredible eye for visuals and penchant for slow burning horror and tension hes clearly adept at depicting a gradual descent into madness and thats on full display in the northman an epic tale of blood brutality and revenge where the louder a person shouts the more powerful they seemingly become alex skarsgard is a commanding presence in the lead role a hulking mass of sinew on a quest for vengeance when you break it down the story is nothing special somebody loses a loved one they set out to kill the person responsible its been done countless times but the time the film takes the atmosphere it develops and just how long it makes you anticipate the payoff makes it something truly special i felt that some scenes did go on too long and there are stretches where our hero is essentially handed pieces of the puzzle by spirits or soothsayers or enchanters who tell him exactly what he needs to do next like somebody is reading him the stage directions theres a lot about the film that is inherently silly like men growling at each other and howling at the moon as well as our hero hacking parts of his own hair off with a dirty knife then appearing in the next scene like hes just walked out of a salon also i was confused by lines such as ill see you at the gates of hell where you will die surely if youve reached the gates of hell youre already dead right these issues aside the northman is a bold and brutal epic that deserves to be seen on the big screen eggers continues to hone and evolve his cinematic craft and we can only imagine what hell come up with next
Apr 25 2022,neutral,so at least this movie is mostly pretty a surprisingly meh overacted film that seems to come from someone whos whole frame of reference of the viking age is from just pop culture seems like eggers just wanted to make a mediocre fanfilm for the tv show vikings disappointing
Apr 25 2022,positive,amazing film felt like im actually in that era great job
Apr 25 2022,negative,simply not good i have no idea what the positive reviews are about
Apr 25 2022,positive,i enjoyed it  ana taylorjoy was a delight as usual   beautifully shot stylized
Apr 25 2022,positive,the movie was amazing it had great storyline that perfectly complimented the dark and gore filled action scenes the acting aswell along with the special effects was superb was overall a tenten movie
Apr 25 2022,positive,very raw and exceptional
Apr 25 2022,positive,best movie ive seen in a long time
Apr 25 2022,positive,i feel overjoyed that i got to see this on the big screen with an audience my viewings of eggers films have massively grown since being the only one in the theater for the witch on opening night while others may have gone for cheaper tricks to get people into seats eggers focuses on historical tales and accuracies to create an atmosphere like few can i dont have any hopeful movies that i want eggers to tackle my only hope is he gets to make whatever his passions focus on next
Apr 25 2022,positive,great story line you really need to focus to understand the movie and whats going on be warned very gory and dark story line
Apr 25 2022,positive,love the details and settings but eggers needs to shorten his movies his average scripts overstay their welcome he made the same mistake with the lighthouse
Apr 25 2022,positive,great action and story
Apr 25 2022,positive,best alexander skarsgard film in a long time the northman had a very tale as old as time plot but with a sick twist definitely had a strong apocalypto vibe with icelandic  viking rhetoric strong effects and cinematography strong shout out to william dafoe nicole kidman and ethan hawke nicole kidman was a monster this is the one movie i actually liked her acting in the northman has definitely become one of my new top 5 favorites
Apr 25 2022,positive,fantastic movie i didnt think we would ever see again all the books ive read on the vikings seem to come to life on the screen not kid friendly at all but i consider this one of the best films i have ever seen its raw beautiful ugly and guaranteed to leave an impression
Apr 25 2022,positive,slow burn but intense
Apr 25 2022,positive,i cant figure out why people are giving this movie low reviews this movie was epic you should already know going in this is a robert edgars movie this isnt some pop hollywood bs this movie is bussin
Apr 25 2022,positive,the most epic movie of the year its a classic already
Apr 25 2022,negative,uhh honestly just know youll be confused the whole movie
Apr 25 2022,positive,i enjoyed it was a little boring but it payed off the plot was simple but good and theyre were definitely some plot twists and the performances from the whole cast are really good
Apr 25 2022,positive,just got back from seeing the northman a amazing movie very glad i saw it in theaters top notch story cinematography acting directing sound
Apr 25 2022,positive,excellent movie if only for the camera and lighting work skargard is amazing and draws you into his movie the locations the realism the weatherelements are on full display and play to the movies strengths a must see and i hope an award winner
Apr 25 2022,negative,i want my money back this movie was terrible
Apr 25 2022,positive,wowdont know what movie some folks watched  riveting brutal and revenge all wrapped up in a great cinematic experience  we saw in a xd theater and all i can say is wow
Apr 25 2022,positive,its one of the best films released since the start of the pandemic from totally unknown origins i also love that this film is angering all the evil people who want to destroy western culture so it gets an extra  from me
Apr 25 2022,positive,it was really good overall youre just watching the story of a viking set on revenge as the trailer depicts and nothing more decent graphics decent storyline great acting pretty good depiction of norse vs christian beliefs around that era     tw rape i enjoy the way they implied yet did not show rape that would have made it harder for me to stomach the movie its evident in history about vikings in the rapeandpillage mentality but thankfully they didnt show it
Apr 25 2022,positive,too much time wasted on the mystical aspect and not enough fight scenes it does not measure up to 300 or troy but was good
Apr 25 2022,positive,bloodshed betrayal revenge woohoo  but also a love story hmmm
Apr 25 2022,positive,an absolute gnarly piece of cinema
Apr 25 2022,negative,not what i was expecting slow moving really kind of boring which made it feel longer than it was
Apr 25 2022,positive,think conan as a viking meets saw
Apr 25 2022,negative,i love viking shows but half way into this movie i found myself hoping that it was almost over it had potential but it missed the mark in my opinion it was one of the worst movies ive seen in a while 
Apr 25 2022,positive,great action movie  i really liked it and want to see it again
Apr 25 2022,positive,like hamlet with vikings captivating raw experience not an ounce of fat on the movie you feel like youre there with them not watching something made to be viewed by outsiders for entertainment extraordinarily well done eyes were glued to the screen nearly the entire runtime
Apr 25 2022,negative,it was nothing like the trailer
Apr 25 2022,positive,awesome film and great balance of exciting revenge movie and well researched nordic ritual and culture
Apr 25 2022,positive,what an absolutely great movie
Apr 25 2022,neutral,first half is entertaining second half is ridicoulus there was so much opportunity for a better story but it feels like all the effort was spend on the visuals
Apr 25 2022,positive,i have to admit that i was a bit let down with this one it was marketed as a more relatable film from robert eggers yet i felt it was arguably his most distant the film features some exquisite cinematography and some detail oriented set pieces but i found the characters to be a b it less interesting from a film like the lighthouse where characters were meant to carry the plotnot the plot carrying the characters its definitely a well made film but id rather rewatch the lighthouse if i were given the option 
Apr 25 2022,negative,i have seen better on netflixwas not right
Apr 25 2022,positive,youll find no grand tale here nor any kind of complex mystic system what you will find is a broken son and a beautiful aweinspiring place full of mist and field and salty sea truly it was the year of our lord 895 ad
Apr 25 2022,positive,good action movie for the norse legends  however some of the dialog was difficult to hear and understand  all in all it was not a bad entertainment whether or not it was historically accurate of the people of the day
Apr 25 2022,positive,movie depicted life almost exactly as it was at that time  it was like a time machine  going back to that era
Apr 25 2022,positive,enjoyed the ride of this viking quest
Apr 25 2022,positive,ambitious and epic people complain that movies dont do anything original then sleep on stuff like the northman deserves a watch on a big dolby screen very intense
Apr 25 2022,negative,slow boring predictable really rotten pot smoked when they imagine this
Apr 25 2022,neutral,the movie just really wasnt what i expected too much mystical magical fantasy stuff which is just a writing gimmick to ignore real plot lines
Apr 25 2022,positive,incredible film just jawdropping watch if you have any respect for euro history will aid in dismantling the concept of eurocentrism
Apr 25 2022,positive,this is a great movie lots of action great story good acting non stop fighting revenge and honor
Apr 25 2022,positive,for revenge type story it was masterfully put together well paced visually stunning and a oscar caliber performance from skarsgard amazing movie 
Apr 25 2022,negative,fell asleep and that never happens at the theater expected so much trailer have away all good parts
Apr 25 2022,negative,boring and hardto follow
Apr 25 2022,positive,great story action and cinematography
Apr 25 2022,neutral,the preview was better than the movie the history channel told a better viking story
Apr 25 2022,positive,the northman a visual poetry intense beautiful a real saga of fire  ice
Apr 25 2022,positive,awesome movie for the more mature public would recommend not seeing if you have a weak stomach
Apr 25 2022,negative,bizarre perverse slow predicable and half the cast sound more scottish than icelandic we left early it was so bad
Apr 25 2022,negative,6 of us went 2 of us walked out within the first half hour none liked it also it hurt my ears
Apr 25 2022,positive,fantastic film paid a high level of attention to historical accuracy while interpreting norse mythology in a visually amazing way brilliant film
Apr 25 2022,positive,first off hes hott second its a great movie me and my husband were at the edge of our seats
Apr 25 2022,positive,great movie loved it 
Apr 25 2022,positive,a historical epic in every sense of the word nothing bad to say about it though its explicit content may be too much for some viewers
Apr 25 2022,negative,the storyline was terrible and it went on for way too long i would not recommend the movie
Apr 25 2022,negative,i hate writing bad reviews but i feel robbed of the two plus hours of my life ill never get back  the only redeeming part of this movie was the beautiful landscapes
Apr 25 2022,positive,was a thrilling adventure and true as possible historically
Apr 25 2022,positive,i walked out feeling pretty disappointed
Apr 25 2022,negative,it sucked and was boring i wish i could get my money back its beauty doesnt outweigh the dull boredom it induces i struggled to stay awake the entire movie
Apr 25 2022,positive,not horrible they did pretty good with lore however those looking for vikings should find a different movie reminded me of valhalla rising with a different story line
Apr 25 2022,negative,the best part was the ending
Apr 25 2022,positive,amazing film acting action and cinematography are all beyond reproach its an epic story please make more films like this
Apr 25 2022,negative,hard to follow the dialogue for me
Apr 25 2022,neutral,while i did not love this film i did not entirely dislike it i thought the cinematography and lighting was superb and there were some good twists i thought the dialogue choices for the film were a bit curious and slightly hard to follow and some of the stunts during fighting sequences did not always seem natural it felt fairly rehearsed i understood many of the norse mythology references and insets due to other exposure ive had to the mythology however i could see someone who is not as familiar being very confused as there was not much explanation offered
Apr 25 2022,positive,great cinematography great performances memorable visuals immersive to the setting great action pieces
Apr 25 2022,negative,i want to two hours back that i wasted of my life
Apr 25 2022,positive,both a solid revenge film and provoking look at norse beliefs and culture
Apr 25 2022,positive,well done  locations were great they story was good like shakespeare
Apr 25 2022,positive,excellent acting on all of the actors parts there are so many visual details that make it a must see in theaters otherwise missed on a smaller screen
Apr 25 2022,negative,eggers did a nice job setting the mood  the music the set the cinematography all align  and thats the only positive thing i can say about it  the plot is the most basic of revenge tales  it hits a single note  over and over and over again  my girlfriend was very eager to see this  i think she was excited by the promise of muscles  she literally fell asleep  i was very very bored
Apr 25 2022,positive,the revenge plot has been way over done in hollywood the ridiculous nudity could have been dialed back some and the actual fight scenes are way to short    music and production were pretty good as was acting william dafoe is brillant as aways cinematography was gorgeous and the movie wasnt to long very violent movie btw if you are in to that thing or not
Apr 25 2022,positive,i love eggars and again he delivers something i will watch for years to come a epic story of a hero who goes through everything just to reach his fate the attention to norse mythology is breathtaking and the cinematography is just perfect the sights in this movie will live in my head for the next week performances awesome and action top notch my only issue is that there is not enough action toward the 3rd act but who cares when the dialogue is exceptional go see northman it is spectacular and tense right to the very end
Apr 25 2022,negative,story was nothing new acting was terrible aside from skarsgard and his nemesis accents were all trash never should have cast nicole kidman  so many scenes were completely pointless i dont understand why anyone raved about this movie if you really want to watch it wait until its free im glad we caught it at matinee but now i see why there were like 6 people there
Apr 25 2022,positive,sooooo good amazing spin on hamlet and the historical genre highly highly recommend
Apr 25 2022,negative,i want revenge to get my money back 
Apr 25 2022,positive,the action was excellent the story and premise were superb highly recommended def more of a guy flick the woman wasnt as big a fan
Apr 25 2022,negative,i hated the green knight and this movie the northman was only a little better  it was much too long for a revenge story  the extra norse mythology only very minutely provided insight into the storyline  there was so much original language used that it was primarily like watching a foreign film and that could have been forgiven had it not been for the overarching weirdness of the norse mythology inserts
Apr 25 2022,negative,one of the most boring movies ive watched in a while overall weird and unnecessary dialogue with scenes which dont add to the storyline at all
Apr 25 2022,negative,it was funny but dont think it was meant to be the trailer was better than the actual movie
Apr 25 2022,positive,the northman is really good alexander skarsgård is a literal beast in this film the scenery is beautiful to look at the action is bloody and brutal and the rest of the amazing cast gives great performances if you can see this one in dolby cinema it is a great experience that amplifies the quality of the film in every aspect
Apr 25 2022,positive,i liked this movie its true that the trailers were a tad misleading this is more a melodrama with action sequences peppered throughout the story is one filled with love betrayal and of course vengeance the film boasts top notch production values editing and sound the actors perform superbly amongst the very realistic sets created for them my advice to the prospective viewer is to leave your expectations at the door youll be much happier for it there are twists in this films story theres mysticism and warlike raids tenderness and brutality pain and redemption love and finally hope
Apr 25 2022,positive,robert eggers can do no wrong his third film is by far his most commercial movie but it still stays true to his roots of bringing folklore to the big screen 
Apr 25 2022,positive,it was ok the acting was so so nicole kidman has got to stop with the plastic surgery she looks like an alien i had hope this film would fit the hype the trailers were the best part
Apr 25 2022,positive,a beautifullyfilmed epic take of revenge with astounding attention detail never quite strikes the raw nerve of madness that so engrossed this viewer in both the witch and the lighthouse however
Apr 25 2022,positive,good acting i thought the story could have been better
Apr 25 2022,positive,great movie dont expect a ton of action would love to see a conan movie  in this style
Apr 25 2022,negative,this movie is not an action movie it is drama very long drama i personally was kind of bored i like dramas however this one wasnt felt i like korean movies and watch dramas but this movie to me felt too long dragging yes the visuals are very good but it was boring i never felt that aww moment that clap your hands moment it was too long and hardly any action the movie is all talking they just made the point of him killing the person that killed his father stretched out i am trying not to give too much away to me it was too long and felt bored no aww moment or didnt felt the characters
Apr 24 2022,negative,very disappointed the trailer was very misleading  the movie was ok but wasnt what i went for was expecting war action but nothing then ending was horrible
Apr 24 2022,positive,bold dark violent and you kinda know where its going but the detail and performances are so rich you go along for the blood soaked ride  probably not a vegan first date movie but im glad i saw it on a big screen
Apr 24 2022,positive,it was good would watch again
