Dates,Scores,Reviews
Jun 6 2022,positive,similar to mel gibsons apocalypto in its brutality and superb action sequences but also very much shakespearean in its fatalistic narrative and poetic dialogue the northman is another robert eggers masterpiece and a further proof that he is one of the best directors we have right now although overly violent the film is to be respected for its staggering attention to detail in recreating this time period   the costumes sets cinematography and editing are all marvelous it is a truly epic artistic transportive piece of genrebending filmmaking that finally depicts vikings realistically instead of romanticizing them eggers really is a period piece auteur
Jun 6 2022,positive,the northman is stunning with its great cinematography beautiful location score and amazing performances by all the cast  the story is alittle basic but serviceable
Jun 6 2022,positive,i expected a better move with scarsgaurd in it felt cheap and rushed
Jun 6 2022,positive,from the beginning this movie strikes into your soul and never lets go     best film i have ever seen
Jun 6 2022,positive,the movie promised a lot and delivered under that expectation by being too bound to the adaptation of shakespeare if it went its own direction story wise it would have been much better
Jun 6 2022,positive,breath of fresh air 
Jun 6 2022,negative,i disliked the tone and setting it felt like it was really reaching for some type artistic flair and failed after watching several shows about vikings this was disappointment
Jun 6 2022,positive,it was a fun movie and really great if you are into the swordfantasy bit
Jun 6 2022,positive,i really love viking movies i understand the pillage and killing but this  film unnecessarily spends too much time on the violence i wasnt satisfied with the ending unfortunately chances for a sequel are laid to rest with a lengthy sword battle ending
Jun 6 2022,positive,a great entertaining movie based on a scandinavian folktale not your normal hollywood fare there is a hidden connection to hamlet making the movie even better
Jun 5 2022,positive,it is what it is its not for the eternal complainers
Jun 5 2022,negative,cmon  this was terrible
Jun 5 2022,negative,the northman cost me two plus hours of my life that i will never get back  the characters and dialogue were not compelling the plot did flow consistently the film should have ended 30 minutes earlier if you like viking movies i would recommend you find something else to watch
Jun 5 2022,negative,trailer cheats you into thinking it has anything to do with the typical vyking stories that you would like dont go see this movie its the biggest disappointment of the year
Jun 5 2022,positive,weird but not in a good way 
Jun 5 2022,negative,had to turn it off it got so bad creepy and gross and it doesnt get better
Jun 5 2022,negative,this movie was horrendous  i was so looking forward to it after being a fan of vikings show and last kingdom on netflix  this was such a let down
Jun 5 2022,negative,how can a viking revenge story be so utterly boring and lacking in excitement it was downright weird storytelling at times the pacing was lackluster and the characters were not compelling give me some last kingdom instead
Jun 5 2022,negative,this is an awful movie  i love viking movies but this isnt very good
Jun 5 2022,positive,the northman is first of all an insane experience  i was very hyped for this movie in specific because it is after all a robert eggers film though i must say i expected something a little different the movie is a viking story based on the sagas but its not an ordinary viking story that you would probably see on a show like the last kingdom or netflixs vikings it focusses on different aspects of nordic culture and the violence oh man the violence this film is fucking brutal visceral  with that said the word that really defines this film is unique eggers is able to tell a story in such an odd way that no other director would have thought about doing so tho the message the director transmits in other movies of his such as the witch or the lighthouse is harder to catch if there is a message on the northman after all i really did not see it i came out of the movie thinking about what eggers was trying to say with the film i really didnt come up with anything what doesnt makes the movie bad its just unexpected  not gonna lie got a little disappointed with some actors that are known at the eggerss movies such as anya taylorjoy and willem dafoe anya gets a lot of screentime but dafoe nails when he appears and he is on the screen for like 4 minutes claes bang an unknown actor for me destroys as fjölnir both him and skarsgård are able to make the final fight a fucking show an event such an epic battle  in conclusion i was very hyped for a philosophical journey with my man robert eggers which i didnt get but the movie is still amazing so incredible i screamed at every single kill that amleth had taken its so epic
Jun 5 2022,positive,phenomenal work of art
Jun 5 2022,positive,great movie absolutely loved it sound effects were a bit too loud maybe lowering the movie a bit would help
Jun 4 2022,positive,kind of a mixed bag i knew this was based off the story that inspired hamlet so i got the plot easy enough much more mythical stuff than i was expecting and also some less than clear plot points like him retrieving the sword not sure what i was suppose to take from that scene over all good movie it wasnt meant to be a morality piece the main character did seem to have a moment of clarity towards the end he was basically driven by revenge it is a very pretty movie lots of fantastic cinematography if you go into thinking its some epic its not bravehart more conan with a mix of hamlet
Jun 4 2022,negative,slow paced plot didnt appear to have a point  dark and hero not really a good guy  and my friend said it sucked
Jun 4 2022,positive,a brilliant movie with great attention to detail a tru epic that is masterfully shot its gripping and full of atmosphere easily the best movie ive seen this year
Jun 4 2022,positive,good movie if maybe a little too abstract  kidmans a bit of a distraction but if you like vikings and men yelling at each other then this ones for you  good performances although it did drag a tiny bit
Jun 4 2022,positive,great visuals in a different kind of epic action
Jun 4 2022,negative,i will never trust the paid  cheap movie critics anymore  the movie is almost good the plots looked good from the beginning to the third outstanding talented stars and performances but unexpected and non sense twisted just failure to deliver a cinematic masterpiece at the end
Jun 4 2022,positive,fantastic movie that is visually stunning and thrilling
Jun 4 2022,negative,yes the cinematography is exceptional  however that is all this movie has to offer  the plot is simplistic to say the least  there are long stretches where darkness reigns nothing is said and nothing is accomplished  there is very little character development other than the revenge motif  the plot is plodding and predictable  it is the prototypical viking revenge tale with no surprises  quite frankly boring
Jun 4 2022,neutral,i felt like i was watching a parody not a very interesting story overdone viking stereotypes gratuitous violence a very immature film
Jun 4 2022,positive,amazing movie from both a visual historical and story perspective
Jun 3 2022,negative,predictive poor texts cant believe i so it through   just go see vikings series its in all aspects way times better
Jun 3 2022,positive,norse mythology gotesque action vengeance movie made well
Jun 3 2022,negative,wow what a bad movie
Jun 3 2022,positive,this movie is for 2 types of movie watchers somebody who wants some crazy hardcore viking fights and somebody who wants a creative and artfully shot historical epic
Jun 3 2022,positive,awesome great movie
Jun 3 2022,positive,a cathartically terrific movie after an endless stream of plastic hollow corporate marvell flicks the northman is a jolt of authenticity this film is guided by one purpose the immerse the viewer in the viking world as it actually was not as how it can be contrived for a modern progressive audience the dark and foreboding ambiance is particularly good some unexpected plot twists but done in a digestible way great acting and best of all an accurate depiction of viking culture and religion
Jun 3 2022,negative,this movie was an incoherent fever dream  wannabe artsy cringeworthy and boring what can you expect from a movie that starts with a young boy farting and burping in unison with his father
Jun 3 2022,positive,robert eggers delivers the most brutal epic viking movie to date
Jun 3 2022,negative,how stupid are the critics why do i always ask rhetorical questions how dumb is this movie there i go again way too long boring with no center just a bunch of people who are going to kill each other and then have a big party in valhalla where theyll be slamming their flagons together and rejoicing about how badass they were when they were killing each other and where all will be forgiven reminds me of another stinker alexander but not quite as bad extremely faint praise
Jun 3 2022,positive,eggers does it again the northman is a masterclass in period film making with a twist great artistic expression is mixed with the gritty realness of the viking time period this is not a typical action revenge movie and its better for it but some viewers may be confused if they expect bog standard action
Jun 3 2022,positive,it was not what i thought it was going to be and was pleasantly surprised  i enjoyed how it went into some of the viking lore  also it was nice to see the main character was not just a warrior but someone with intelligence
Jun 3 2022,positive,story of a son avenging his family with a twist
Jun 2 2022,positive,great movie i will be buying it when it comes to bluray
Jun 2 2022,positive,i expected to be bored but it was entertaining some odd parts different than your typical vikings movie
Jun 2 2022,negative,truly dreadful not one original idea acting and accents so bad they are laughable so artsy that it forgets to be enjoyable gory and violent with music that makes you want to cut your own head off to avoid hearing it a waste of fine acting talent this remake has jumped on the bandwagon of historical fantasy trying to cover up its lack of originality with bloodier fights and utterly meaningless imagery succeeding only in punching below the weight of its predecessor
Jun 2 2022,positive,a dark eerie tragedy that entertwines the religious iconography of norse legend with unfettered brutality of viking living stunning visuals suspense and a heartbreaking tragic hero
Jun 2 2022,positive,good movie i recommend to watch it is entertaining and containing a lot of action and mythology
Jun 2 2022,positive,what do you want in northman  vikingsplenty of vikings  we got that
Jun 2 2022,negative,if i save anyone from wasting 2 hours on this crap i have done my job   have no idea what critic see in this movie stay away
Jun 2 2022,positive,this movie is a cinematic masterpiece  it is difficult to say what is best about this work  the story is very simple but it doesnt stop being deep and having important layers the photography is wonderful the costumes and the setting are impeccable the performances are magnificent without a doubt it is one of the best films of the year
Jun 2 2022,negative,absolutely bereft of any intellectual content guys with six packs wielding axes  absolute mindless guff the writer relies on so called shocking scenes of a headless man  this is a poor mans vikings series in film form  loads of stereotypical soothsaying mumbojumbo and long greasy hair and you have one lazyass film thats been done a million times 
Jun 2 2022,negative,absolutely terrible went in with high hopes left bemused and baffled that a production company and a director said this is a good movie its that bad
Jun 2 2022,positive,visually stunning but extremely violent
Jun 2 2022,negative,another pointless terrible movie from hollywood im sure the critics will think this is great with a twist and pretty much all characters dieting at the end simply thelma and louise in viking garb ending
Jun 1 2022,positive,all around a very entertaining movie if you have an appreciation for norse mythology and scandinavian history youll probably appreciate the northman i definitely enjoyed how the mythological  spiritual motives were woven into the characters arcs 
Jun 1 2022,positive,i was waiting for a very long time for this movie to come out i am huge eggers fan and loved the vvitch and the lighthouse two classics that i will always go back to again and again this was a little bit of a miss for me i felt like it was slightly forced as if i was watching a play at a theater rather than a movie maybe that was the intent
Jun 1 2022,positive,while not for everyone robert eggers viking epic is a bloody gorgeously shot tale of revenge that will surely later become a masterpiece
Jun 1 2022,positive,consider writerdirector robert eggers bloody viking revenge movie as a companion piece to 2021s the green knight both movies take mythical supernaturalaided tales of heroics and medieval masculinity and feed into the spectacle while also cleaving the legend to make way for a sense of humanity we follow amleth alexander skatsgard who is a displaced prince who has sworn to kill his treacherous uncle and rescue his mother nicole kidman its a tale so old that it inspired shakespeares hamlet though that play could have benefited from a climax involving two hulking naked men dueling to the death atop an exploding volcano the northman reminds me a lot of mel gibsons apocalypto a movie i described back in the day as an art film for jocks its immersive and impressive down to the exact detail and it doesnt shirk on the blood and combat its also unmistakably the work of eggers a very precise and idiosyncratic indie director whose prior movies felt like stylistic dares the camerawork is often long with single takes making all the visual arrangements and coordination that much more impressive its staggering that a studio provided eggers with 90 million to go make his version of conan the barbarian at a lugubrious 140 minutes theres enough sticky carnage to satiate fans of brutish medieval action movies but i appreciated how eggers keeps his story purposely streamlined and simplistic until a few keen reveals force the audience and protagonist to reexamine the assumptions and fleeting honor of vengeance in this harsh unfair environment of men outkilling one another its a movie that provides the red meat and then makes you question whether you might want to go vegan theres more that can be unpacked but i wish eggers had cut back at points this is a slow movie which does contribute to its mood and atmosphere but i also wish eggers had gotten to some of his plot points with a bit more haste and vigor the northman is transporting and bold and also more than a bit bloated you could laugh at some of its overthetop machismo but i feel like eggers is inviting criticism of that very machismo so enjoy the movie on one level where it indulges all the old world violence and then enjoy it on another level where it subverts and castigates the same old world violence or you could just watch for the glistening muscles famous faces bad accents bad wigs guttural score and weird imagery    nates grade b
Jun 1 2022,positive,so what stopped me giving this 5 stars    for me i loved everything about this film but without spoiling it i did not want ambiguity i wanted more fantasy i wanted a genuine scandinavian tale of myths    the directing the pace everything else is awesome
Jun 1 2022,positive,i like the movie and the how it was filmed i also like the detail and how the history was mixed with the lore and mythology but im also a film nerd most of the audience will not get that and thats sad
Jun 1 2022,positive,introduction  the northman was a film that i had mediumlevel expectations for and although at times i felt that it could meet those expectations the film continuously fell flat the cast was packed with stars that honestly didnt mesh well with me but also wasnt hindered due to the names involved helmed by alexander skarsgård in the leading role of amleth the pacing began quite wonderfully with the tale of revenge being centerfold throughout the film after the slaying of ethan hawkes character king aurvandill i wish however that the pacing stayed relatively the same throughout the runtime of this film as we quickly go between time skips to showcase travel and climactic moments in the story ruining what could have been a fantastic tale showing the vengeance sought by that of a man who has only known one thought his entire life    leading roles  there were some heavy hitters in this film for sure the skarsgård family is full of talent and this is yet again true for alexander in another role where i feel he did a great job of showcasing not only the character but the poor writing of said character many times throughout the film he felt almost flat which like many things in this film was explained by a narrative device this choice to limit range and depth did nothing to aid in the quality of the film whatsoever outside of skarsgård the other performances were incredibly hit or miss king fjölnir was honestly one of the better castings claes bang showcases a tremendous amount of range in emotion yet felt misdirected towards the latter end of the film bangs emotion begins to feel molded by the plot rather than by logic which in the situation threw me as a viewer olga portrayed by anya taylorjoy was decent as she tried to forward plans set by amleth throughout the film thus becoming his love interest which for me felt rather underwhelming there wasnt much chemistry and this was even more so made questionable by the somewhat incestuous undertones between amleth and his mother leading me to judge the blossoming relationship as that of an ironical statement that he was repeating his fathers life choices by taking on olga as his partner nicole kidman portrays queen gudrún amleths mother where she puts on a very overthetop and slightly confusing performance her character is obviously meant to be that of a deranged person with a cold heart but often the emotional weight of that pairing is let down by her exaggerated personality and tone of voice outside of these few roles not many are given the screen time to be noteworthy in my opinion    pacing  time skips big cuts and interesting cinematography choices gave way to what i feel is one of the weaker aspects of this film starting from the point of amleth as a child where we see the love for his father king aurvandill is strong this bond is quickly severed all pun intended after the king is beheaded by his own brother fjölnir whom of which assumes the throne for some time amleth goes on the run where he is soon after adopted by another group of vikings and raised to be a strong fighter we jump immediately to his adulthood where after a raiding scene he is reminded of his oath of revenge and thus begins his journey to find and kill his uncle to not spoil the film for those whove yet to watch we are taken on a convoluted journey that allows for only periodical time shots during the night which bogs down the beautiful greens and blues from the scenery in which filming took place this focus on nighttime although explained isnt as fulfilling of a plot device as it is intended to be the final thirty minutes of the film were quite cluttered with shifting motives which i assume were meant to be shocking or heavily weighted on the character but felt more like an emotionless brick the ending of the film wasnt bad per se but it did leave much more to desire from such a largely hyped movie    overall thoughts      this was a movie i really wanted to enjoy but felt that it could have done far more to grow the characters i dont think the acting was much of a problem but more so the script which tries to be far too convoluted than what the runtime allows for if youre into the viking genre and want a decent film to view you may like this one dont expect a ton in terms of narrative as the film sets its eyes on the spiritualreligious ideals that are setup early on in the movie had this part of the movie been done better i honestly think i may have enjoyed it more but due to that and the often bad writing i give it the rating of 35
Jun 1 2022,positive,superb the cinematography was just amazing acting was astonishing lost the track of time watching this at the theater wouldve been marvelous 
Jun 1 2022,negative,i went into this movie with my fingers crossed  unfortunately there wasnt a single thing i found interesting about this film  the acting was off and the story line wasnt good
May 31 2022,negative,boring slow silly  no story worthy of the name  no action worth seeing  just an awful movie
May 31 2022,positive,so great i loved it at the movies twice and already own it digitally
May 31 2022,positive,wow uniquely and amazing moviethis movie is purely art with a strong performances specially by skarsgårdtaylorjoykidman and hawke with astonishing cinematographydirection and score
May 31 2022,positive,good movie great acting editing sound film plot etc it is violent so not for kids but if you want something to pass the time its worth the price of a ticket
May 31 2022,negative,the rt on this movie really makes me question trusting them anymore this script could have been written by a high school drama class just so stupid it was amazing if you want a decent viking movie the last kingdom leaves this piece of residue in the dust
May 31 2022,positive,the northman masterfully paves his way to valhalla    the northman takes your breath away in a brutal and epic way    the northman is undoubtedly one of the best cinematic experiences of recent years it is an epic journey through the legend of amleth shaped by the vision of one of the greatest talents in cinema today robert eggers an exquisite technical sample on how to direct a film    northman explores the violent character of the human being in an immersive hypnotic and wild way it flourishes with a rather ambitious narrative and a story about revenge power struggles and destiny the representations at times symbolic of valhalla helheim the valkyries among others are masterful moments within the film added to the superb performances its staging and its soundtrack this film is undoubtedly one of the best of the year and in recent years
May 31 2022,negative,could have been a epic movie but instead it was disappointing and a little boring i was so pumped for this movie and i wanted to love it 
May 31 2022,positive,an epic historical film directed by robert eggers based on the legend of amleth a viking prince who sets out on a quest to avenge the murder of his father by his uncle he is a figure in a medieval scandinavian legend the direct inspiration of the character of prince hamlet full of an amazing cinematography and incredible artistic shots it is a cinematic experience for the ages it truly has an authentic and gorgeous aesthetic incredible acting and a brutal and bloody revenge tale that is quite memorable the surreal imagery along with the sounds and the score make it a hauntingly beautiful movie
May 31 2022,negative,im sorry this was horrible and false advertising if youre looking for an epic viking tale of taking back a stolen kingdom dont waste your time
May 31 2022,positive,although the movie is a bit of a disappointment which is greatly increase due to the fact i thought it was going to be an amazing movie which we all so desperately need the cinematography fighting scenes and acting is pretty damn good the movie lacked a little in the storyline and seems rushed at the end
May 31 2022,negative,the plot was hard to follow the movie had too much gratuitous violence and was difficult to follow at times
May 31 2022,positive,it blends lots of themes in a sensitive and stylish way  the film is immersive and transports the viewer into an older world visually and in value systems and beliefs  its use of supernatural themes and the way they there was no divide between that and the real world was clever and thought provoking  excellent casting gave believable portraits of the characters  nicole kidman was particularly unhinged
May 31 2022,positive,fantastic movie the reviews had me a bit scared but its worth it to ignore the critics and give it a watch the combat  the story  the character development  the music  the location  best film of the year
May 31 2022,positive,incredible movie held me like a vice the whole time i love norse history so the attention to detail and the depiction of the shamanistic aspects of norse religion was simply incredible
May 30 2022,positive,awesome viking revenge tale that seems very accurate to what it mustve been like at the time there were some surprises and the cinematography was crazy gorgeous visuals
May 30 2022,positive,if you liked the green knight youll like this    the northman is viking hamlet amleth and it has its ups and downs the production quality is gorgeous the sets costumes and locations are immersive and thoroughly believable there are some standout performances from alexander skarsgard anya taylorjoy ethan hawk and claes bang willem defoe is along for a few scenes as well the film goes to pains to depict aspects of viking culture and beliefs that make for those not already in the know for seriously weird and trippy viewing parts have a hallucenigenic quality if you have made a study of the eddas and icelandic sagas you will find a staggering amount of imagery related to them woven into the film if all you know about viking culture comes from watching the mcu thor movies you may have enough to muddle through somehow despite high production values and great performances i just didnt like it very much
