Dates,Scores,Reviews
May 6 2022,positive,i liked it this movie seems to polarize people  you like it or hate it i read the reviews here but i wanted to see it myself i dont think theres anything like this movie out there it does bring you back to the viking era theres violence and gore but i dont think it was gratuitous i thought it blended well the acting was terrific ive seen the actress in other movies and shes great the northman was good too the mix of cgi was well thought out and didnt take over the movie like something from marvel
May 6 2022,positive,one of the best medieval movies ever a revenge movie and historical accurate cant wait to have it on bluray
May 6 2022,positive,this is really is a cinematic masterpiece one word spectacular   not for the squeamish  amazing film   
May 6 2022,negative,if i could give this negative stars i would  i would rather watch paint dry than watch this long convoluted movie with the worst acting ive seen again
May 6 2022,positive,mesmerising and really gripping even if bleak enjoy the gotesque skullduggery
May 6 2022,positive,unexpected and entertaining a liveaction saga bloody and mystical just be patient
May 6 2022,positive,they kept the legendary feel of the sagas and the images and mythology was amazing the actors knew what they had to do and they nailed it i was totally absorbed
May 6 2022,negative,the movie is not that good i gave it a 55
May 6 2022,positive,sure not everything works but more things land that dont  and when it hitsit slaps there are a few scenes in particular which taken in isolation are amongst the best in film today the northman is more ambitious and much larger in scale than  eggers previous films the vvitcvh and the lighthouse as a result the film feels a bit rough around the edges and where his previous works are polished gems the northman feels more akin to a large uncut diamond the romantic element of the film felt a bit rushed and the storys resolution left something to be desired however more than anything eggers succeeds at bringing close the alien world of 9th century viking europe in a lovely arthouse form its feral barbaric and spiritually raw ohand its bloody and yet i cant help but wonder what the northman would be if eggers had retained final cut of the film and if a24 had taken on the project themselves
May 6 2022,positive,entertaining and a good story felt like a made for netflix kind of movie but still good if you need to chill for 2 hours
May 6 2022,positive,a little long but it did entertain really great twists  turns in terms of lighting it was very dark loved the plot and story line thoroughly enjoyed the action and movie
May 6 2022,positive,movie was just ok for hype it wasnt worth it
May 6 2022,positive,it was weird i if they took out the weird part maybe a higher star
May 6 2022,negative,gratuituous violence no character development woodenly acted
May 5 2022,positive,its fascinating that this is both a really weird and really straightforward movie it takes some magical realist turns but some of those turns give you the rundown of the major plot points that are to come get sword fight on lake of fire volcano leave behind maiden king queen odd choice it seems like they wanted to raise up questions of fate but everything followed his prescribed fate to a tee without much wrestling with that fact but the prophecy and the similarity to hamlet which is drawn from the scandanavian legend of amleth this film is based on makes this a familiar story so there were no real surprises the nicole kidman bit might function as a solid twist for some people but you have ethan hawke and the kid acting like wolves in front of a smiling willem dafoe a witch with beads coming down to be her eyes a skelly fight etc these things work together to make it engaging thats for sure the true reason this gets a 4 beyond alexander skarsgaards insane physique and physical performance is that it undeniably immerses you into this nordic culture and this icelandic scenery many images were stuck in my mind days after seeing it and thats a testament to crafting an atmospherethe most elusive and most impressive of a directors duties
May 5 2022,neutral,interesting at times but more weird than anything beautiful shots i just wished the first hour was more like the last 30 min
May 5 2022,positive,another stunning cinematic masterpiece i have seen so many bland saccharine corporate movies over the last year it was really refreshing to see something so visceral and compelling
May 5 2022,positive,not the perfect movie i so wanted it to be but the performances and artistic direction combined with the world building and lorethrilled me i just wish the pacing before the final act could be smoother and the film was 1520 mins shorter
May 5 2022,positive,the northman is a fantastic movie if you want a by the numbers revenge thriller then this is not the motion picture for you the narrative structure tends towards the artsy side of the scale but is handled well overall incredible scenery punctuated by intense violence the northman is a thoughtful story that some may find overindulgent but i found just the movie i wanted to watch in this age of reboots sequels superhero movies and just plain bad lazy movies this movie stands out as a wonderful example of the art of high cinema
May 5 2022,negative,extremely slow odd and we almost walked out i dont understand why people thinks it is great because it isnt for many reasons in my opinion if you find the previews a little strange wait until you see the movie
May 5 2022,negative,it was the most confusing movie i have possibly ever seen
May 5 2022,positive,the northman plays like a subversive version of gladiator maximus with mommy issues while it isnt a straightforward crowdpleaser it is compelling and gripping throughout its run time and its guaranteed to boost your testosterone
May 5 2022,negative,this was by far one of the worst movies ive ever seen i was so excited to see this movie when i saw the trailer completely mislead by the trailer nothing but a weird mystical dull revenge movie the violence was expected but how they did it was just ridiculous for someone who watches all the viking shows and movies this was such a disappointment we got up an walked out when his mom kissed him we had simply had enough no charcter development way to loud could barley understand what people were saying just terrible
May 5 2022,positive,best film ive seen in years
May 5 2022,positive,like eggers previous films the northman is beautiful haunting and brutal the movie takes its time and plays out unapologetically faithful to the mythology on which it was built fantastic performances across the board and keeps eggers touch in every frame see it on the big screen
May 5 2022,positive,it was good but weird
May 5 2022,positive,fantastic that era of history is so underexplored this film captures the brutality and the mysticism so perfectly if you liked the witch or the lighthouse you will like this
May 5 2022,positive,its definitely not for everyone  think hamlet but with vikings  some imagery is visual expressionistic theres also some fantasy elements  overall i liked the movie  but i dont think the general public will appreciate it they seem to like spoon fed movies made for simpletons
May 5 2022,positive,this film is basically is probably one of the best films of the year gives a realistic take on realworld history that most hollywood movies dont touch on when scorcese was talking about cinema this is the type of movies he was talking about
May 5 2022,positive,a great movie i didnt expect to like it so much nevertheless do not overestimate expectations this is a strong drama in the stunning style of the early middle ages with their customs and culture or rather religious obscurantism
May 5 2022,positive,cinematic and a worthwhile watch on the big screen  excellent performance from the cast though i didnt find the leading man charismatic at all  despite a strong start the story goes a bit soft near the end and the ending was somewhat rushed    nevertheless a trippy norse epic worth sampling
May 5 2022,positive,hard to follow and while the actors face good performances the storyline itself was la king
May 5 2022,negative,this was just an absolute mess ive only walked out on 2 movies in my life and i just barely didnt walk out of this one and while i didnt walk out 4 other people did at the showing i was at visually it was great but they kept adding trippy spiritual scenes in an attempt to be deeper i guess but they did a terrible job with them want an idea of what im talking about how about when the father and son are asked to act like crazy dogs while growling and barking at each other for 5 whole minutes then the shaman getting in their face and tells them to prove that their men so the son pushes hard andfarts seriously this wasnt meant to be funny they meant it as some part of religious ritual and it was supposed to be spiritual utterly stupid movie so disappointing
May 5 2022,negative,i see a lot of films and left halfway through the northman two reasons both violence related  the amount and manner of violence was over the top      also and perhaps more importantly is how the director choose to show the violence  close camera shots throats slit faces  skulls smashed blood lots of blood  ironically a man sitting two seats away from me seemed to be in pure ecstasy with every violent scene i could hear and see him taking it all in enjoying the vision of pain suffering and death  a smf    not my kind of movie
May 5 2022,positive,it was different but not a bad movie
May 5 2022,neutral,very nicely shot  and wild wild story line its a 253 for me 
May 5 2022,positive,i felt it dragged on at times but for the most part it was incredibly engaging though the revengedriven plot was not hard to figure out the journey to the revelations was still enjoying to watch artistically this film was spectacular in look and feel  it felt epic i personally really enjoyed the mystical elements of the mythologies would definitely recommend
May 5 2022,positive,incredibly well done and entertaining fantastical too  just the right amount of everything
May 5 2022,positive,a shot of testosterone
May 5 2022,positive,so far id say its the best movie of the year in my book
May 5 2022,positive,ethan hawke makes the most of his limited screen time while the rest of the cast draws you into a dark fairytale the plot isnt groundbreaking but how its executed is worth the price of admission 
May 5 2022,negative,very violent and tedious
May 5 2022,negative,northman went south early viking ships approaching land next scene men on horseback arriving back from battle what did i miss  nicol kidman showed up on the wrong set she should have been at rupenzel the music not music was basically loud sound effects that did nothing for the movie  i just cant believe anyone actually liked this crap  if you saw gladiator and gave it 5 stars that was the bench mark northman isnt worth 30 seconds of gladiator i only stayed in the movie because friends took me otherwise i would have enjoyed being at home sleeping btw the movie was in black and white for all intents and purpose if you are smart and avoid this movie be sure to bypass it on netflix as well
May 5 2022,negative,the first time i looked at my watch was about 30 minutes in and i new this was going to be a rough ride  this is a long slow moving dull revenge story the violence is incredibly uneven feeling very pg13 early on and then over the top by the end i dontmind violence in fact it was notoriously absent at the beginning which made the ending almost absurd at times  this huge cast overactive the heck out of this and honestly the movie is just weird a lot  i know they were going for the norse mythology to me it failed on so many levels this will most likely be on my list of worst of the year
May 5 2022,positive,visually appealing good story line
May 5 2022,positive,the viking theme with the special effects made this a hit  glad i went to see it
May 5 2022,positive,a very strong revenge story with a very artistic style to it that you would expect from robert eggers
May 5 2022,positive,the northman is what i had hoped it would be based on the trailer the cast and robert eggers i wanted bigtime epic quest i got a seriously epic quest i wanted intensity when it was needed and subtlety as well i got each quality but especially beautiful intensity i wanted what i perceive to be nordicicelandic mythology played out in ways that seemed authentic for me so i wanted viking clashes ships at sea carrying warriors and their hard fought spoils i wanted dark pagan magic in the form of shamanic figures casting spells and foretelling fates i got that all  the production values on the northman are what you can only hope for  locations production design art direction sound visual effects are stellar and obviously its a gorgeous film from opening to the closing shot much credit to niamh coulter for set decoration as well  most of the credit will go leads skarsgård and taylorjoy  writerdirector eggars and cowriter sjón for this outstanding screenplay and directorial choices to fully bring out the main themes and ideas of the film as well as the realism and barebones screaming mad rush of the chosen time place people and cultures   skarsgaård is spoton perfect casting imo his experience physical presence and power and his great range as an actor screamed for him to play amleth anya taylorjoy has been a big favorite of mine for years now shes a remarkably skilled actor and along with her extraordinary singular beauty she is a riveting presence on the screen   kidman is wicked fiery and fearlessly smoldering bang embodies the figure youre to hate so well hawke was surprisingly convincing dafoe was a hoot though alltoobrief i can say the same for bjorks intense cameo i thought both young actors as two of the youngest sons were both quite good   im sure a good many viewers are giving this lesser reviews due to how it ended but im not one of those looking for all my heroes or protagonists to get it all and live happily sappily ever after im a big grownup boy and i know thats not how this story line is likely to play out my advice watch lifetime and read nicholas sparks  this film knocked me out people woofrigginhoo 42 stars
May 5 2022,negative,too long loud and ridiculous
May 5 2022,neutral,visually artistically cinematically stunning however it was like a 2hour viking dream sequence
May 5 2022,positive,norse hamlet  enough said
May 5 2022,negative,did not enjoyed neither the story or all the violence  
May 5 2022,positive,dude honestly one of the best revenge stories ever such a great movie i cant say it enough absolutely go see it in the theaters before its too late
May 5 2022,positive,movie to dark and too loud and was in hurry for it to be over
May 4 2022,positive,robert eggers is at it again with another artistic film the northman is a revenge film that follows viking prince amleth on his quest to avenge his fathers death this film contains so much surrealism yet realism at the same time is what made films like eggers other film the lighthouse so exquisite the special effects in this film were both special and effective especially in multiple fight scenes like the raid on the slavic village the acting performances from alexander skarsgård anya taylorjoy ethan hawke and willem dafoe was excellent last but not least the music in this film composed by robin carolan and sebastian gainsborough was so powerful and emotional i was filled with so much excitement i personally think that the northman is one of the greatest films ever made and i honestly think this film has the potential to become an oscar winning film
May 4 2022,negative,very slow i went to sleep 3 times
May 4 2022,positive,watched this today a few hours ago i was a bit uneasy of paying the extra fees for the cinema for reclining chair that was not even that reclining but did not have a say in the matter but pay i went alone and had to wait for almost 10 minutes for the film to start due to a technical issue in the cinema with each minute getting closer to midnight i was getting anxious and contemplating to leave and just ask for a refund     however i decided to stay and be patient once the movie started i realised i was going to watch something i have never seen before quite like it this movie has everything you could imagine this movie was not created for the woke culture and the im offended by even the sight of a bee kind of people these days this movie takes you places you will never be in your wildest dreams    the nicole kidman character was such a wonderful surprise i sank into my seat that wasnt even reclining i must say the movie was worth all the fees i could ever pay it was worth the admission of every film i have ever watched before i kept saying they deserve more than what i paid more than my mortgage the work they put into it deserves so much from film and story lovers everywhere    i have to say every critic who gave or even thought or spoke of giving this film less than five stars should be fired from their jobs immediately and never be able to watch a film remotely like this ever again to every audience member so many who chose to give less than 5 stars stuck to cartoon and family friendly films please thats all you deserve to ever see
May 4 2022,negative,worst movie ive ever seen in a theater prince amleths voice is over modulated the plot was very obvious it was shot very dark if movies werent so expensive i would have walked out
May 4 2022,positive,i liked the story line and the location scene of the movie
May 4 2022,positive,there were some terrific things and some not so terrific things about this movie  on the good side a few good plot twists cool nordic vibe including bad a prophecy scenes great views of iceland excellent accents  acting from anya taylorjoy  nicole kidman  on the notsogood side 1 super gross ultraviolence if you liked the 300 2 they took alexander skarsgaard a ridiculously good looking man and made him look awful  he spent half the movie hunched over filthy and growling like a beast and yes i get that was part of the premise but still icky to watch 3 it was wayyyyy too long and didnt pass the momstaysawake test in the middle but i woke up for the last 13 and felt like i didnt miss anything by falling asleep for a while and last but not least 4 it was just too depressing  i mean im not asking for a rom com here but this movie was dark and glorified revenge violence  with everything going on in the world right now that might not be the best message to be spreading we might all end up blind  toothless if everyone runs with it
May 4 2022,positive,great movie not just a dumb blockbuster action movie but it really gets into native european faith     great camerawork as well and acting the storyline is kind of basic but the rest makes up for it
May 4 2022,positive,straight forward no nonsense tale of revenge  also nicely weaved subtle elements surrounding the involvement of the gods  just enough of it to maintain the flavor of norse mythos without overdoing it  fantastic film
May 4 2022,positive,a bit slow in the beginning and confusing  send half picked up and easier to follow
May 4 2022,negative,wanted to love this movie but i didnt played like kill bill which i adore without any semblance of a sense of humor the hyperviolent action sequences were well done the photography was spectacular the script was ridiculous if you like overwrought acting swelling music and and swelled lats and unexplained and unexplainable plus downright goofy voodoo magic camouflaged as viking myth then this will be your perfect cup of tea i prefer my coffee smart ultraviolent and funny thank you very much
May 4 2022,negative,the same scenes shown in the trailers are great but it depicts a proper action movie and not a half spiritual  half slow path to revenge which was the case all along the movie   its a good movie to watch at home  not so much to watch in the cinema
May 4 2022,negative,boring convoluted and disappointing
May 4 2022,positive,best movie i have seen in years the movie does a great job at drawing the viewer into religious ceremonies and experiences that are extremely odd from a christian perspective those scenes pull you in allowing you to experience them with the characters leaving you with an innate understanding of the emotions the characters are experiencing what is happening and why but without overt exposition it is one of the best displays i have ever seen of religious experience in film and it is done over and over throughout the piece the characters are far more real than the 1dimensional characters we are normally given in the film amleth battles with who he is supposed to be and who he wants to be with what he remembers from his childhood and the reality around him it is a phenomenal and very real tale of coming to terms with childhood trauma and deciding who to become i enjoyed every second and was sad when it ended i cannot wait for more from this director
May 4 2022,negative,awful  bad dialogue bad story line everyone looked the same why did kidman do this
May 4 2022,positive,disneys longawaited liveaction remake of the lion king is stellar their decision to reset it in vikingera iceland is a bold daring move which deserves our applause
May 4 2022,negative,not what  expected  jumped all over the place no real plot  all about revenge
May 4 2022,positive,i understand if other people didnt enjoy this movie all that much for those who liked robert eggers previous entries however this movie was a splendid treat the atmosphere and the rawness of the movie kept me glued the whole time and the viewer is rewarded with a developing plot that unravels into a shocking surprise towards the end and questions whether the ends justify the mean fantastic movie and highly recommend if slowburns are your thing and norse stuff lol
May 4 2022,positive,surprisingly good great cinematography good acting  i went in expecting a typical action film but this movie is much more than that
May 4 2022,positive,good story and acting quite violent but that was expected
May 4 2022,positive,havent been real impressed by a movie in a while the northman was the perfect actor and the women with him as well great classic tale but with the best ending ive seen in a long time
May 4 2022,positive,very hard to understand because of the heavy accent
May 4 2022,negative,this was a fantasy movie and i was expecting an action movie
May 4 2022,positive,its complicated half of the things are so good but the other half is cringe and over the top at least the director good or bad is making an impact
May 4 2022,negative,it was ok nothing like gladiator thats for sure
May 4 2022,positive,greatest movie ever other than interstellar
May 4 2022,negative,  i watch all the viking shows  but this movie doesnt take the time to make you care about any of the characters the lead simply walks around standing awkwardly with his head down and kills people  the only part i enjoyed was him as a young boy admiring his father  dont waste your time with this one
May 4 2022,negative,nonsensical mix of violence and the supernatural the plot is a typical revenge movie that fizzles out in the end with no hero   norse mythology gods used to confuse the name even elicits that the northman is located elsewhere other than in the north fact is they were all northmen except for someone from scotland  the only redeeming feature was the accents of the dialogue being norwegian come danish
May 4 2022,positive,a brutal masterpiece that takes its time although not for everyone the northman immerses us in the story of the viking amleth with stunning visuals an intense score brutal action and the age old epic tale of vengeance under the fantastic direction of robert eggers  not a viking battle fest of nonstop action but  a slow burn story that takes its time utilizing both style and substance absolutely incredible i truly felt the intensity of this film and i hope you do too
May 4 2022,negative,horrible movie i wouldve paid extra to end it sooner
May 4 2022,positive,awesome film it has an amazing story
May 4 2022,positive,one of the most original films ive seen in a very long time some of the scenes were amazing to watch and make you wonder how they filmed them i could see it getting nominated for best cinematography
May 4 2022,positive,the movie too slow it dragged on a lot
