Dates,Scores,Reviews
Oct 18 2008,positive, film critic bob mondello reviews director peter jacksons version of the classic 1933 movie king kong this fullcolor digitally generated kong nearly doubles the length of the original  and mondello says its worth nearly every minute      melissa block host      lord of the rings director peter jackson has said that the 1933      blackandwhite king kong is the film that made him want to be a      moviemaker dino de laurentiis had already revisited the story in 1976      but jackson wanted to look at it again  and our critic bob mondello says      his 200 million remake is a beast thats a beauty      bob mondello reporting      there was never much doubt that the special effects would be spectacular      the trailer makes the film look jurassic kong      soundbite of king kong screaming      mondello  but were you expecting much from the script  well it takes a      while to get everybody to skull island about 70 minutes but its time      extremely wellspent  nearly every line of dialogue fleshes out      characters you thought you knew but in ways that make them more      interesting  denham the movie director who discovers kong for      instancehe used to be flashy successful wellfinanced  now hes a      jokey huckster played by jack black whos on the run from creditors      soundbite of king kong      mr colin hanks  as preston youre finished denham      mr jack black  as carl denham dont worry preston  ive had a lot      of practice at this      mondello  ann darrow the beautiful blond starlet who fay wray played      almost entirely as a screamer is now a plucky vaudeville performer with      a fairly complicated worldview as well as ideas about the character      shell be playing      soundbite of king kong      ms naomi watts  as ann darrow if she loves someone its doomed      mr black  as carl denham why is that      ms watts  as ann darrow good things never last mr denham      mondello  little does she know  and there are brandnew characters      too  a preening matinee idol a pair of shipboard heart of darkness      fans who look like huck finn and his buddy jim and a lovesick      screenwriter whos great with words for ann on the page but not with      words to ann on the ship      soundbite of king kong      unidentified man  good legs  sea legs  yeah sea legs  yeah  not      that you dont have good legs  im just making conversation      mondello  lots of character development on the way to skull island  and      then the fleshing out gives way to flesh in danger in encounters with      lizards the size of trucks bats the size of biplanes and bugs big enough      that instead of swatting them our heroes shoot them  jackson knows the      original movie so well that there are lots of little treats for fans      along the way  lines music even a dance that show up in slightly      altered form this time      there are things that jackson sells too hard  a brontosaurus stampede      that wears out its welcome before it wears out the beasts for instance      but most of the time jacksons enthusiasm for sensory overload carries      you along with him in a t rex sequence for instance that goes      airborne at about the point that any other director would be ending it      and turns into a vineswinging mindblowing ape du soleil routine      soundbite of king kong growling scream      mondello  all this plus the only tragic love story this year that comes      close to rivaling the one in brokeback mountain  though it may not      have occurred to you that the way to kongs heart is through his funny      bone thats more or less what jackson tells us  naomi watts and a      digitally enhanced andy serkis make the interspecies bonding work and      happily they do it without turning kong into the tale of a girl and      her 25foottall puppy  in fact at the screening i attended there were      lots of tearyeyed adults as the lights came up after the credits      this could have been the running time of course at three hours and      seven minutes the film is undeniably longer than it really needs to be      i estimate that if jackson had taken an ax to all the repetitive boring      stuff and sequences that dont wring you out like a dishrag either      emotionally or from sheer panic he could easily have made an excellent      king kong at three hours and five minuteseasily  im bob mondello      soundbite of king kong screaming      michele norris host  youre listening to all things considered from      npr news       lord of the rings director peter jackson has said that the 1933      blackandwhite king kong is the film that made him want to be a      moviemaker dino de laurentiis had already revisited the story in 1976      but jackson wanted to look at it again  and our critic bob mondello says      his 200 million remake is a beast thats a beauty       mondello  but were you expecting much from the script  well it takes a      while to get everybody to skull island about 70 minutes but its time      extremely wellspent  nearly every line of dialogue fleshes out      characters you thought you knew but in ways that make them more      interesting  denham the movie director who discovers kong for      instancehe used to be flashy successful wellfinanced  now hes a      jokey huckster played by jack black whos on the run from creditors       mondello  ann darrow the beautiful blond starlet who fay wray played      almost entirely as a screamer is now a plucky vaudeville performer with      a fairly complicated worldview as well as ideas about the character      shell be playing       mondello  little does she know  and there are brandnew characters      too  a preening matinee idol a pair of shipboard heart of darkness      fans who look like huck finn and his buddy jim and a lovesick      screenwriter whos great with words for ann on the page but not with      words to ann on the ship       mondello  lots of character development on the way to skull island  and      then the fleshing out gives way to flesh in danger in encounters with      lizards the size of trucks bats the size of biplanes and bugs big enough      that instead of swatting them our heroes shoot them  jackson knows the      original movie so well that there are lots of little treats for fans      along the way  lines music even a dance that show up in slightly      altered form this time       there are things that jackson sells too hard  a brontosaurus stampede      that wears out its welcome before it wears out the beasts for instance      but most of the time jacksons enthusiasm for sensory overload carries      you along with him in a t rex sequence for instance that goes      airborne at about the point that any other director would be ending it      and turns into a vineswinging mindblowing ape du soleil routine       mondello  all this plus the only tragic love story this year that comes      close to rivaling the one in brokeback mountain  though it may not      have occurred to you that the way to kongs heart is through his funny      bone thats more or less what jackson tells us  naomi watts and a      digitally enhanced andy serkis make the interspecies bonding work and      happily they do it without turning kong into the tale of a girl and      her 25foottall puppy  in fact at the screening i attended there were      lots of tearyeyed adults as the lights came up after the credits       this could have been the running time of course at three hours and      seven minutes the film is undeniably longer than it really needs to be      i estimate that if jackson had taken an ax to all the repetitive boring      stuff and sequences that dont wring you out like a dishrag either      emotionally or from sheer panic he could easily have made an excellent      king kong at three hours and five minuteseasily  im bob mondello  npr transcripts are created on a rush deadline by an npr contractor this text may not be in its final form and may be updated or revised in the future accuracy and availability may vary the authoritative record of nprs programming is the audio record
Oct 18 2008,positive,kong is not without its flaws but sometimes you just have to throw your hands up in the air wave them like you just dont care scream at the top of your lungs and just go with the rollercoaster ride thats what this film is
Feb 28 2008,negative,overlong by half hedonistically animated and decadently selfindulgent king kong is beastly to be sure but there is little beauty here
Jan 15 2008,positive, theres an old joke about a 500pound gorilla sitting anywhere he wants to that suitably applies to the leading monkey of king kong and i aint talking its titular star having successfully transferred legendary literature epic the lord of the rings into one of the biggest cinematic franchises in history director peter jackson has decided to follow that up with a threehour remake of the classic that made him fall in love with films with jackson now in the position of being one of the few directors thats a household name who can do what he wants the syndrome has begun where people seem unable to stand up to him and question his decisions around the middle of 2005 it was announced that universal had originally asked jackson to deliver a cut of the film at around the two and a bit hours but he wanted to go with his three hour version and they acquiessed theres always a tough line to draw between keeping a filmmakers vision intact and delivering a product that will do business  too much one way and a film becomes a lifeless soulless vehicle robbed of any emotional core too much the other and it can become a bloated selfindulgent mess that only a small handful of film enthusiasts will ever really warm to maybe they shouldve put their foot down in this case kong is an entertaining adventureaction film that certainly looks like the 200 million it cost has some pretty intense action and popcorn thrills for all audiences and thankfully understands that effects should be used to enhance the emotion and narrative of a story rather than be a crux for it to fall back on indeed at times whether it be the great opening shot in new york zoo to the drawn out reveal of kong himself it actually reaches points of great filmmaking yet too often it falls into traps  action sequences drag out way too long setups range from clunky to great and back again characters change behaviours and attitudes on a dime whilst others never change at all dialogue is clunky humour is scant to nonexistent and pacing veers wildly the net result is our level of interest often swamps between compelled and bored the product too schizophrenic and unpolished to be of real interest or rewatch value jackson obviously has put a lot of love into the product and it shows but unlike say lord of the rings in which he had so much background material that a three hour film barely covered it here he only has merian c coopers 1933 original story  one that was a cinematic classic in its time and certainly a big leap forward in terms of visual effects but much like the similar star wars forty years later wasnt exactly a movie notable for its inventive narrative taking that familiar albeit thin story and stretching it over twice its original length means that jackson has had to reinvent some key parts of it and does so with mixed success never quite overcoming the inherit flaws that come with both the original story and stretching out said material to its current length the first and weakest act sets up the characters and situation but takes over an hour to do it the logic here seems to be that the filmmakers are given time to develop most of these characters so that when they get killed well feel empathy for them trouble with that thinking is that we have to like or at least feel for all these characters and we dont watts and to a lesser extent black are the only ones of any interest as in that whole time theyre the only ones that get any development aside from that all weve got a bunch of onedimensional forgettable gruff sailing crew including an utterly vain actor a feral kid a stern first mate who loves lecturing the feral kid a geeky personal assistant pudgy film crew members and a sawyeresque captain who only seems to complain and look brooding andy serkis at least realises his human character of the ships cook is merely a caricature and plays up his cameo yet others eg brody try their best with some clunky setup for their character and ultimately end up a waste of space despite some impressive background matte shots the opening spends a bit too long on the ground of new york showing us watts and black having a run of bum luck and how fate brings them together still these scenes are necessary setup so are understandably inserted in and the two actors make the trite developments endurable they also play better than some of the early scenes onboard the ship where we get to see the aforementioned dull as dishwater crew what does work well in this first act is the suspense elements  jackson delivering a handful of really well done scenes the talk of the castaway pickup the first entrance into the fog the native attack and capture of ann that are appropriately foreboding and eerie despite one clunky misfire with the mate giving a long winded monologue that bluntly draws to clueless jimmy an analogy between their present situation and joseph conrads literary classic heart of darkness this leads into the second act within skull island itself which essentially plays out like jacksons attempt to do an entry in the jurassic park series most of the films action is concentrated here in a bunch of quite thrilling action sequences that suffer from the stephen sommers syndrome of trying too hard  sacrificing credibility in favour of making its sequences bigger and wilder a brontosaurus stampede is visually cool but goes on for far too long is truly stupid in terms of how the human characters are involved and contains some surprisingly slipshot effects a vampire bat attack serves only as filler in an already too long film a lot better is the bug pit scene which is suitably icky and at least one of the few bits of the film that feels slightly fresh theres also a cool action sequence between ann kong and some trexes which starts out well then turns into a overblown vine swinging affair before coming to a bonecrunching great ending where this act works is the establishment of kong and anns relationship easily the films strongest aspect jacksons languid pacing works to his advantage here giving us a little time to get to know kong as a character and understand him  such as a cute sequence in which ann performs her vaudeville routine for him and he responds with fun babylike tantrums and glee or the very sad scene of his capture the third act is back in new york and the famous climax which pretty much everyone is familiar with before it gets to that comes the theatre breakout brody looking soppy and watts tearing up over going back into showbusiness before being snatched by kong again like the second act theres many sequences that drag out most notably here kongs long rampage through new york and then transport of darrow to the empire state however once it reaches the building it becomes pretty thrilling with some great shots and visuals of the biplane attack performances are a mixed bag naomi watts is a great actress and delivers as always with a quality job that whilst not up with some of her other work nevertheless shows her commitment and really engages us as an audience  especially in some of the quieter moments jack black like will ferrell always seems to do the same old overblown schtick to me which i never particularly like yet here jackson has him playing against his usual grain more understated and serious than were used to seeing and it shows off a decent actor with potential underneath that could really shine not so well played is brody a man of obvious talent but a character so vapid and useless that brodys dour presence inhabiting it sucks the life off the screen especially in the nonaction scenes the rest of the cast ranging from bell to hanks all do serviceable jobs but none of them are given decent roles so dont get to do anything with their limited screen time visual effects are sometimes too rushed but work well for the most part the score is a little too bombastic but again works well for the material for the most part pacing veers wildly at times it drags on at other points its almost skips too fast over some  watts and brody share a moment talking in the corridor on the ship then suddenly it cuts to a very pretty scene with naomi on the stern of the ship crying against the sunset during a film shoot in that scene she spots brody and gets emotional and the next scene after that they make out in one of the cabins  the pair suddenly went from her insulting him to falling in love what did i miss with such a long voyage to the island the film also quickly jumps from kongs capture to his return to new york yet once there it takes an age before it hits the famous empire state building sequence when kong was announced one wonders why did they need to remake it and the final product offers no real answer to that question short of more impressive effects good remakes should improve upon their originals in every way not just in flash bang but in the core substance as well  with the exception of the konganne relationship aspect this fails to do that if you have a love for the original story or film then most certainly youll see the fun andor love this if you dont then while you probably will enjoy it the assorted flaws in its structure will stand out like sore thumbs and ultimately take away from it ultimately kong is a good film  its not a soulless endeavour like many a tentpole blockbuster its one obviously crafted with love and care and attention to detail yet its not a particularly memorable or even interesting one either certainly not when compared too some of the other remakesequel blockbusters of late which are more entertaining and emotionally engaging because they were tight and handled their familiar characters and plot elements far better a bit more time in the editing room couldve lifted it into great blockbuster territory  instead weve got a sporadically entertaining escapade that never captures our hearts like it so desperately wants too
Nov 1 2007,positive, i gave my heart to peter jacksons gargantuan king kong at the moment when the grizzled giant gorilla gave his heart to naomi wattss ann darrow as the scene opens theyre on a high ledge over skull island where the terrified wannabe actress realizes the big galoot who carried her off in the palm of his hand is her protector not her enemy a vaudeville veteran she tries to communicate by entertaining him with old routines kong is enchanted a spark of understanding passes between beast and beauty and lo the cinemas most venerable interspecies love story is born again theres a similar moment of crossspecies magic in the chronicles of narnia the lion the witch and the wardrobe directed by jacksons fellow new zealander andrew adamson it occurs early when lucy georgie henley the youngest of the pevensie children first emerges from the wardrobe into the enchanted land of narnia there she encounters a faun james mcavoy with hooves for feet an umbrella in his hands and a diffident english charm rather than pound his chest and roar he invites her for tea the two most eagerly anticipated hollywood entertainments of the holiday season are packed to the brim with all manner of digitally enhanced beasts mutants and slimy creatures centaurs and minotaurs talking beavers and the lion king aslan populate narnia a faithful politely rousing adaptation of c s lewiss beloved tale dinosaurs giant centipedes and the vilest and most phallic maneating slugs youll ever encounter pop up in the spectacular king kong its zoology that draws us into the theaterjust ask carl denham jack black the flimflam moviemaker who exhibits kong as the eighth wonder of the world but in both epics its the intimate moments that keep us there narnia brightly lit and kidfriendly has an appealingly oldfashioned feel to it adamson codirector of shrek wisely doesnt try to hipify the tale leaving its curious blend of medieval pageantry christian fable and childrens bedtime story intact lucy and her siblings have been packed off to the country to escape the blitz but encounter greater perils in narnia which has been turned into an eternal winter under the cruel reign of the white witch tilda swinton narnias greatest concession to contemporary movie fashion is in its elaborate battle which owes a debt to jacksons lord of the rings but thats fitting without the success of that movie narnia would never have been made and without rings on jacksons resume no one in his right mind would have given him three hours and 205 million for a king kong remake the gamble has paid off kong is a showy stateoftheart popcorn movie faithful to the spirit of the 1933 original but generously adrenalized with the best effects money can buy it takes more than an hour to get to kongs entrance the real fun doesnt begin until denham his screenwriter jack driscoll adrien brody and the ships crew crash on the island that time forgot where the natives are beyond unfriendly and the smallest bug is the size of an overfed housecat from here the movie goes into a delirious hourlong free fall of nonstop action highlighted by a marauding herd of brontosauri many battles later just as youre feeling enough is enough  jackson moves on to the famous third act kong in chains in new york kong on the loose kong on the empire state building his beloved blonde trying to ward off the lethal biplanes the remarkable thing is how deeply you believe in their emotional bond aside from blacks and brodys characters most of the supporting roles are forgettable or worse but you couldnt ask for a better ape credit goes not just to weta digital but to actor andy serkis who as he did with gollum in rings provided the physical moves that are the template of kongs character but its the look in wattss eyes that seals the deal actionmovie performances dont get much respect but what watts brings to this role is extraordinarya daredevils physicality a wistful melancholia an ironyfree emotional investment and needless to say a scream that could shatter glass
