Dates,Scores,Reviews
Aug 4 2007,positive, peter jacksons king kong is a massive fetish object  his christmas gift to himself for bringing home the bacon and the oscars with his lord of the rings trilogy hes unquestionably a master and this is unquestionably a piece of work  an impassioned act of tribute to jacksons favorite movie the hoary old 1933 original  but i cant really call it a masterpiece i found it diverting yet exhausting a nineteencourse meal from a chef who insists on feeding you long after youve unbuckled your belt and called it quits this kong rumbles on for three hours and seven minutes twice as long as the 33 version and also twice as long as jacksons previous and i continue to think his best ode to starcrossed love heavenly creatures yet the movies length isnt really the issue aside from a few flabby spots it flies by the problem is jacksons eagerness to wow you hes like a little kid making you sit through an epic reenactment of his fantasies using his toy dinosaurs and gorillas and not just one or two toys but dozens of them when the tramp steamer venture finally arrives at the desolate skull island after about an hour of screen time the heroes  including struggling actress ann darrow naomi watts obsessed moviemaker carl denham jack black and playwright jack driscoll adrien brody  spend lots of time running away from dinos bats large and disgusting bugs and a director with a serious case of overindulgence after a while the spectacle becomes like a blunt object grinding into your forehead in all versions of this tale the beasts tragic error is to fall for a blonde jackson has blithely retained the materials sexist and racist elements in some schools of thought the story is a warning to black men to stay away from white women naomi watts ann darrow is a comedienne who wins kongs heart by doing vaudeville routines the erotic subtext of the 1933 version who can forget kong pulling off fay wrays clothes and sniffing his fingertips and also the 1976 version is gone replaced by a sort of teddybear affection that goes both ways ann and kong think of each other as lovable pets she also asserts herself with kong but not nearly as much  or as amusingly  as jessica lange in the muchcriticized 76 remake king kong is curiously humorless for a movie about a 25foot simian going mooshy over a dame even at its sprawling length it scarcely has room to breathe jackson is always rushing along to the next thing and even the sporadic attempts at beauty like the overtly hallmarkcard moment when ann and kong enjoy a sunset and she teaches him the word beautiful a moment sappily reprised at the end are banal happily lost inside his weta kingdom in new zealand jackson appears to have forgotten what people are about he gets a terrible performance from adrien brody who seems restless  hes not a greenscreen actor by temperament jack black does orson welles lite cranking his damn camera when all hell is breaking loose jackson clearly identifies with carl denhams relentless showmans instinct but all we see is an arrogant twit willing to get everyone killed just to make a name for himself some of king kong is entertaining if oversold a fight between kong and one trex would be fine and was fine in the original but jackson has kong fend off three of them at once until we can finally enjoy a showdown between the big ape and the toughest of the dinos the new york of the 1930s is to use a clich lovingly recaptured though its a new york known only in movies king kong is far from a failure of energy or imagination  jacksons enthusiasm is often infectious and the critical rhapsodies probably refer to the sheer big thick moviemovieness of the thing i succumbed more than once its good parts are enough to recommend it with serious reservations but dear god i wish jackson would shake off his addiction to gigantism his apparent need to punch everything up three times as much as it needs to be as the creators of another bigmonster remake a few years ago found out size isnt everything
Jul 14 2007,positive,mr jackson not only improves on the original he somehow seems to create the film that king kong was always meant to be
Jul 10 2007,positive, not just the ape but the budget cowriterdirector peter jackson forked out millions of his own dosh to finish this film the way he wanted it has that labouroflove look about it you could pitch the story from the back of a fag packet hollywood director accompanies skeleton crew plus a couple of actors to an island off sumatra where they discover a giant gorilla that takes a shine to the lead actress by means never entirely believable they bring the beast to new york where it is exhibited in chains at a theatre on broadway ape escapes finds girl and climbs the empire state building cue army and air force much screaming this latest version no 3 is so well made that discrepancies in the script and holes in the plot dont make any difference because you sit there with your jaw on the floor amazed by the bare brilliance of it jackson takes his time to set the scene gather his characters find the boat the director carl denham jack black has been grounded by his producers for wasting their money on footling safari pictures he grabs a camera and legs it out of there picking up an unemployed vaudeville clown called ann darrow naomi watts from outside a burlesque theatre and tricking playwright jack driscoll adrien brody into staying on board by the time they are at sea there is a warrant out for denhams arrest and ann is finding driscolls advances anything but unwelcome they reach skull island in a fog and immediately are faced by natives who live in caves protected from the rest of the island by a high wall and a gaping chasm they are not the topless patronisemyethnicpurity types who can be bribed with hershey bars they are vicious savage and superstitious the first thing they do after subduing the white invaders is string ann up in a wooden contraption that carries her across the chasm as a sacrifice to the great kong that part of the island where the natives never go is like conan doyles the lost world only scarier because the animals and insects have been supersized which makes you wonder about mrs kong and the kong kiddies where are they are they if not why not resistance becomes futile at this point anns ability to create a kind of rapport with this wild creature is neither sentimental nor beyond belief kong saves her many times from the carnivorous dinosaurs and she repays him with her trust it is unspoken unexplored and due to watts performance and kongs empathy the centre holds for this is the heart and blood of the film  beauty and the beast king kong is a bmovie dressed up to look like the real thing the story  edgar wallace had a hand in it which explains a lot  is pure pulp the romance between a starlet and a big monkey is on a par with those daft scifi flicks about blobs taking over midwestern small towns and yet jackson treats it with the utmost respect and makes you believe not by throwing money at the cgi bods okay he does but by caring so much its contagious like spielberg he is a film fan neither arty farty nor a snob he understands that genres have rules and you break them at your peril michael cimino broke them in heavens gate james cameron didnt in titanic jacksons king kong works on several levels as a monster movie a love story a boys own adventure a thriller a period piece and if looks could kill wed all be dead because every scene and every location has been immaculately prepared it is not difficult to think of half a dozen plot defects  whats ann doing walking about the streets of new york at night in a white satin dress with snow on the ground in mid winter  but they really dont matter the centre holds when you walk out of the cinema at the end something has changed is it the world is it you did the earth move ann teaches kong a sign word he uses it tentatively as they sit together at the top of the empire state building with the sun coming up over the hudson and the biplanes circling the word is beautiful
Feb 22 2007,positive,a phenomenal popcorn movie that eclipses the original in several respects but inevitably owes a huge debt to the powerful imagery and innovation of the 1930s landmark
Jan 25 2007,negative,this lackluster cure for insomnia might have been more palatable without so many distracting digressions and pared down to a manageable ninety minutes or so zzzz zzzz zzzz
Sep 28 2006,negative,despite admirable chest thumping and watts wonderfully enhanced scream there is still only one true king
Sep 25 2006,positive,naomi watts distinguishes herself in a luminous starmaking turn as ann  warm funny charismatic and far more than youd expect from the damsel in distress
Sep 10 2006,positive,jackson puts his passion for epics to good use and creates film magic
Jul 1 2006,positive, at one point in king kong naomi wattss ann darrow is desperately trying to read the mind of the giant gorilla which has claimed her as his new toy she fears that hes already bored with her and is about to hurl her off a cliff so she tries to entertain him with the moves shes learnt from her career in vaudeville she bounces through a soft shoe shuffle segues into an egyptian dance tosses in a handstand and somersault and finishes with a little juggling but at the end of the routine he looks more bored than ever he could be one of the jaded moguls who ruled the hollywood jungle in 1933 the year in which the film is set  harry cohn say whose nickname happened to be king cohn but as his gaze softens and he turns towards the horizon ann realises that all he really wants is somebody to appreciate the sunset with him kong is no king cohn after all hes an aesthete this doesnt mean that writerdirector peter jacksons highly anticipated kong remake is skimping on the schlockier attractions of merian c cooper and ernest b schoedsacks venerable creature feature kongs home skull island is jurassic parkonsea teeming with an array of land sea air and swamp monsters bent on demolishing all living things as grotesquely as possible and they really are experts in the art you laugh you shudder in oldfashioned bpicture style without ever losing sight of the fact that what youre watching is anything but bgrade its the most playful film of the year  as well as one of the most serious loss of innocence is one of its themes humankinds disconnectedness from the natural world is another but its also about the evil that can lurk behind the old hollywood mantra the show must go on or as the films quasivillain the movie director carl denham puts it when he conceives the idea of trapping kong and exhibiting him as a freak of nature  we can all have a piece of it for the price of an admission ticket admittedly theres nothing new in that line the carl denham character in the original film was prompted by the same sentiment but jacksons version adds edge and ambivalence played with beadyeyed zest by the comic jack black whos been given all the best lines this denham is not just a huckster hes a passionate huckster who fancies himself as an artist this injects a faustian note  as if jackson is sending up his own obsession with moviemaking by floating the suggestion that he too could be tempted into selling his soul in return for putting something as remarkable as kong up on screen the film begins in depression manhattan where the animals in central park zoo are only marginally more miserable than the new yorkers forced to find shelter in the shantytown next door yet the citys glories are there as well in the shimmering scenes of lights and skyline although its largely a digital creation augmented by sets built in new zealand the films new york has a wonderful solidity the tone of the script lightly pitched between satire and schmalz also carries you over the flimflam involved in getting denham and his film crew aboard a tramp steamer bound for the island with him are his stars bruce baxter played by kyle chandler having fun as a preening wannabe matinee idol and ann darrow who finds herself falling in love with the screenwriter jack driscoll adrien brody later when shes kidnapped by the islanders and given to kong as a present its driscoll who leads the rescue party as for kong himself although the computer has played a large part in his creation he could never be considered as anything less than real jackson has again drawn on the talents of andy serkis gollum from the lord of the rings and short of wearing a gorilla suit serkis has done everything possible to slip inside kongs skin as before his facial movements were recorded by the computer but this time they have been adapted to the bone and muscle structure of a silverback gorilla while the result avoids disneyfied anthropomorphism it leaves you in no doubt of what kong is thinking and feeling and what he feels for ann is something pretty complex the script wisely rejects all sexual innuendoes along with the idea of love at first sight its only after saving her from the islands other horrors and after shes adopted him as her protector that he responds to her charms hitching her on to his shoulder with the gruff insouciance of john wayne yet its a relationship that never loses its innocence later in manhattan we get a marvellously lyrical king kong on ice moment when the two of them venture on to a frozen lake in central park and slide around like children and in the climactic sequence atop the empire state building they reprise their first meeting by watching a sunrise together  the last kong will see for out of that sunrise comes a swarm of biplanes out to shoot him down as he tries to fend them off its as if hes making a lastditch stand against the future not surprisingly the script keeps the 1933 films famous concluding line  beauty killed the beast but this time it has a poignant new resonance as i said this kong is an aesthete  as is peter jackson
May 4 2006,positive,for the most part a chestbeating bananaeating riot
Apr 10 2006,positive,everything about director peter jacksons king kong update is bigger than the 1933 original thats too say the film is longer more technically elaborate and  by todays standards  more exciting than the original film
Apr 1 2006,positive,what could have been jacksons folly is a triumph the kind of romantic action spectacle that makes the big screen silver and provides boxoffice gold puts the prime in primate
Mar 27 2006,positive,despite uncessary padding and languid pacing king kong is a visually gorgeous spectacle that deserves to be seen on the big screen
Mar 25 2006,positive,this is a splendid matinee show and also easily the best blockbuster flick of 2005
Mar 18 2006,positive, james kendrick offers exclusively on qnetwork over 2500 reviews on a wide range of films all films have a star rating and you can search in a variety of ways for the type of movie you want if youre just looking for a good movie then feel free to browse our library of movie reviews
Feb 25 2006,positive,on the upside however that first hour is followed by a twohour roller coaster ride that climaxes with a breathtaking finale atop the empire state building in new york city
Feb 11 2006,positive,  watching peter jacksons version of king kong it is abundantly clear that the man feels as strongly about the original 1933 film as he did about tolkeins lord of the rings books one can really feel how earnestly he guided this film paying homage to the original while expanding on it more than just a little bit unfortunately the expansion is one of the problems with the movie but ill get to that in a bit   i dont suppose i really need to go into the story itself but there are a few changes from and additions to this version when compared to the 1933 film here ann darrow naomi watts is shown to be a stage performer at the outset of the film basically doing vaudeville shows during the great depression in order to make a living time is spent up front showing the state of things in new york city in regards to the struggle to survive in that devastating economic downturn to great effect we meet her coperfomers a tightknight little family including an elderly gentleman who passes for a father figure for her and we get to know at least ann and this gentleman well enough in the few early minutes of the film to really feel for them when the theater where they perform is unceremoniously closed down   cut to carl denham played by an unusually subdued jack black in a meeting with money men trying to pitch his movieinprogress and get more money to go shoot on location at the mysterious island indicated on a map which has just come into his possession he is portrayed as a man with a vision throwing his cinematic pearls before monied but ignorant swine the financiers have already sunk 40000 into his picture big bucks back then and decide to cut their losses and sell off what jack has filmed so far as stock footage   he talks his way onto the ship despite the captain not trusting him and also wrangles playwright jack driscoll adrien brody into coming along in order to finish the only partially done screenplay it turns out that the only reason ann decided to come along was because driscoll was writing the film and she was a big fan of his plays so one major difference is that instead of a lowly sailor driscoll is a well known and sophisticated playwright were also introduced to hayes evan parke who seems to play a role closer to that of the original driscoll and jimmy jamie bell as a young former stowaway out to prove himself   finally we find ourselves out to sea and on the way to the island it took a very long time to get to this point and we also spend what seemed to me to be an inordinate amount of time getting to skull island peter jackson took a while developing the relationship between jack and ann in order to make it more real for the audience the problem is that a lot of that effort went to support nothing more than jacks determination to not leave ann behind the real relationship in this movie is between ann and kong some of you reading this dont even go there   fortunately while a lot of time is spent showing the development of the kongann relationship it is time wellspent andy serkis the actor whose expressionsmovement is behind the cgi kong did a phenomenal job as did the animators of making kong real much like the original filmmakers the idea here was that the more fearsome kong was at the beginning of the film the more we would feel upon his death king kong and naomi watts really stole the show here no question   the time spent on screen showing the both of them was a joy to watch the process of the relationship changing from fear and curiousity to geniune caring and concern was completely believable however when the action shifted to the rest of the crew things did start to drag although the effects were spectacular there did come times where i found myself thinking isnt this scene over yet with a remake of such an iconic film one cannot help but make comparisons and many times throughout the film i asked myself why this one took three hours to tell the same story the original did so effectively in half that time   strangely the one character that i thought was going to be closest to the original was carl denham and he really wasnt i actually would have preferred to see jack black tap into some of his over the top energy to portray denham more like the barely supressed carnival barker that robert armstrong played in 1933 jack just never worked for me but not for the reasons i had expected going in i think it was more due to peter jacksons take on the character than the acting itself this denham was more human yes but he didnt strike me as the kind of man that would have the sheer force of will required to bring back the great king kong   towards the end of the film the scene where kong is introduced to the paying audience was quite well done and effective right through to where he escapes his bonds and rampages in times square there is a new sequence in this film showing how kong calms down once he finds ann and how they go off and reconnect like old friends until their peace is shattered by the military coming after kong   of course they eventually end up at the top of the empire state building but here again things seem to go on longer than they need to just for the sake of more screen time with kong and special effects when it does come down to the end and jackson focuses in once more on the characters it does all come together once more except for two things the weakly delivered it was beauty done killed the beast by jack black and the final scene between kong and naomi watts which looked like it was lifted straight from the end of titanic   final notes cgi effects especially for kong were flawless i did not for a second think i was looking at a cgi creation the scenes on the island with the natives might be too intense for the 7 and under crowd some of them looking really creepy and in extreme close ups that even creeped me out a bit   all in all a really good movie that could have been a great movie if it had 30 minutes or so trimmed from it of course the dvd version will probably be 4 hours long and will no doubt suffer for it  vic holtreman founded the popular movie news site screenrantcom back in 2003  and with the help of a talented editorial team turned screen rant into one of the mostrespected websites covering the film industry prior to starting screen rant vic had been employed as a door to door salesman construction worker car salesman waiter mechanical drafter mechanical designer system administrator and finally an seo specialist experience that became instrumental in screen rants success long before he started writing online he has always been a huge scifi fan  starting with the twilight zone and outer limits when he was still too young for kindergarten graduating to star trek reruns in the 70s and of course fully initiated by the original star wars hes also a big comic book fan and still buys them and lover of superheros action movies and the occasional horror flick the fates of several characters from the ballad of songbirds  snakes are unknown but one line from catching fire offers a hint about one dune 2s ending delivers an epic conclusion to this chapter of paul atreides story as the sequel also teases what is next for the scifi franchise obiwan kenobi is a character with many different abilities both in star wars canon and in legends however not all of these powers are canon
Feb 7 2006,positive,king kong sets a new standard for action movies and maybe for movie romances too you feel almost privileged to be in the presence of such an awesomely accomplished and exhilarating picture
Jan 26 2006,positive,why make a king kongfilm now since it has been recycled several times trotting out a new version exposes the story to how it still uses black and white tropes
Jan 23 2006,negative,it was an overabundance of enthusiasm that killed the story
Jan 23 2006,positive, this weekend one of the single most beloved cinema icons returns to the big screen to terrorize an entire new generation of fans sounds enticing doesnt it well of course it is but the question beckons is it worth your time and money weve got two different reviews to help you make your decision  thats right kids two viewpoints are now at your disposal by clicking below one positive and one pretty damned negative with anticipation building and hype at a fever pitch which camp are you going to fall into let us know below in our comments section once youve seen it let the games begin the samuel bayer directed remake stars jackie earle haley rooney mara kyle gallner katie cassidy thomas dekker kellan lutz clancy brown and connie britton and focuses on a serial child molester murdered by angry parents who returns with a burnt face and a razor glove to terrorize teens in their dreams
Jan 19 2006,positive,the only slipup is a forgivable one jackson continues to be reluctant to leave a world he has so magnificently created at a little over three hours king kong is a bit of a bumnumber
Jan 15 2006,positive,again jackson proves himself an unbeatable showman with the soul of a poet he crafts and composes his action sequences like symphonies with the most eyepopping crescendos
Jan 10 2006,positive,christmas came early this year in king kong
Jan 10 2006,positive,the first hour is a bore but a necessary gift to watts each remaining frame is awesome though i could have done without beautys version of a simian lap dance
Jan 7 2006,positive,potent stuff
Jan 1 2006,positive,jacksons king kong is a throwback film depending on you to approach it with a sort of wideeyed innocence you mightve forgotten you had its loud and unbelievable its supposed to be there arent any 25foottall gorillas in this world
Jan 1 2006,positive,three hours of magnificent escapist entertainment
Jan 1 2006,positive,i watched the last hour of the film with a knot in my stomach the result of a combination of the love story and the brilliant special effects
