Dates,Scores,Reviews
Oct 9 2020,positive, audeville performer ann darrow naomi watts suffers alongside everyone else during the great depression struggling to earn enough to eat  particularly after her revue is shuttered shes nevertheless hopeful that if she can just get an audition with legendary playwright jack driscoll adrien brody shell find her way to stardom but the competition is dishearteningly tough and the easiest fix is to resort to a disreputable burlesque show meanwhile hotheaded producerdirector carl denham jack black is in the middle of getting his latest picture shut down when he decides to flee to the waiting ship that hes paid to sail to a shoot at a mysterious destination hes obtained a map to a most exotic virtually undiscovered locale and hes intent on going  before the studio bigwigs can put a stop to the departure of the vessel the ss venture when his leading lady drops out carl is forced to snag the first size4 dame he can find  preferably one with a pretty face as luck would have it he crosses paths with ann in time to sucker her into joining the expedition carl is also silvertongued enough to trick driscoll who happens to be in a cabin aboard the venture to hand over the first 15 pages of a script  and to then get shanghaied for the journey from here the venture stumbles upon a craggy seemingly deserted landmass with a sizable wall that was surely designed to keep something very large out as the captain thomas krestschmann hustles to repair his ship carl and a few of his filmmaking crew wander onto the island where theyre attacked by natives in an eerie deviation from the former tone for the first time momentary horror movie notes creep into the picture which starts to resemble the chills of cannibal movies though the poor editing once again ensures that its a temporary ghoulishness in another pointless subplot first mate hayes evan parke and his young protege jimmy jamie bell trade observations about heart of darkness  made more insincere via histrionic voiceover moments these two are  by far  the worst pieces of the project with a ceaseless flair for the overdramatic director peter jackson does everything with largerthanlife characters exaggerated wideeyed enactments and intense stares swelling music rousing or ominous speeches in closeup and plenty of intricate details his details however are so overwrought and exhaustive that the end result is a whopping threehour production in jacksons world there are no bitparts the overabundance of players all receive so much screentime that the pacing suffers considerably the actors and actress are amusing but even when audiences get to know them all intimately it doesnt much alter the impact or emotions as they succumb to the horrors of skull island here the editing is correspondingly overthetop using visual gimmickry to generate false thrills  excessive manipulations that absolutely didnt need to be utilized jackson sticks with the great depressionera setting for this third major theatrical adaptation but he goes to much greater lengths to set the stage than in the 1933 version the introduction spends many minutes building up its characters and locations and financial hardships as if the roles needed some added sympathy to humanize them for their inevitable confrontation with the monstrously inhuman curiously the sexual undertones  or overtones  of the previous two iterations has all but vanished as a film enthusiast jackson does incorporate numerous nods to the blackandwhite classic borrowing exact lines or mimicking specific scenes but on a few occasions he duplicates a couple of the faults from the 1976 take which is one of the worst choices  or accidents  he could possibly make the love story between ann and jack is one such problem as its built upon an unconvincing montage that is as fleeting and insignificant as the running time is long monsters belong in bmovies to its credit jacksons update finally gives its title role the hitech cg makeover for which fans have been waiting some sequences are less convincing than others but the technology has improved to such a degree that its undeniably impressive to see kong during his most famous routines a bit of this is ruined as well however as the animators have attempted to duplicate primate movements so authentically that kong has lost some of his beastly identity mostly hes just a gargantuan gorilla  a rather predictable animal even if significantly overgrown in the end the adventure is ambitious to match the graphics but it isnt always effective in its extremeness especially during an unintentionally comical brontosaurus stampede in which the lumbering dinosaurs manage to sidestep all the tiny humans scampering beneath their enormous feet a later trex fight is far better as well as the aerial finale atop the empire state building though the choreography still favors explicit fantasy over muchneeded realism wherever it could get believable imagery it definitely should have gone for it yet this notion is sadly infrequent for all of its polish and spectacle and grandiosity the faults still drastically counteract the accomplishments designed by mike massie   20062024 gone with the twins  all movie related images  their respective owners articles on this site may not be distributed or reproduced without written consent
Jan 8 2020,positive,in an era of reduced expectations king kong is one movie where everyone studio and audience gets their moneys worth
Nov 19 2019,positive, with the success of 8220the lord of the rings trilogy clearly peter jackson had a tough act to follow yet jacksons followup another remake of the epic adventure 8220king kong proves to be the right project for a director who clearly understands the art of the action genre 8220kong does trudge along at times with a threehour running time but it still works thanks to the final twothirds in which each action sequence trumps the previous one 8220king kong follows a film crew to a remote island in the 1930s the films director carl denham jack black is desperate to finish his work and convinced that shooting on location in this remote land will be just what he needs to secure the pictures shaky financial backing among the people joining denham on this journey are ann darrow naomi watts a downonherluck actress and jack driscoll adrien brody a writer and friend of denhams once the group gets to the island they get more than they bargained for with a land full of prehistoric creatures and a 25foot ape which happens to develop an affection for darrow jackson takes a slow and methodical approach to the story with kong not appearing until over an hour into the film but like that first climb on a rollercoaster once the action picks up steam it is nonstop jackson fills the screen with one fabulous chase after another its like watching 8220jurassic park on amphetamines there are dinosaurs bats mansized insects  enough danger to fill three action movies but 8220king kong has more going for it than the action sequences at its core the film is a love story between woman and beast their love has a sense of credibility that gives 8220kong a touch of tenderness and jackson and especially watts deserve praise for making that relationship work this remake is sure to be compared to its two predecessors its been a while since ive seen the original and honestly my only memory of the 1976 version centers around me sneaking into a theater to watch the last half of the film a long story best saved for another day with that in mind i dont think im the one who can accurately compare the three films but i do know one thing  i enjoy a good action film just like the next person and this isnt just a good action film 8220kong is a very good one  sportswritermovie reviewer micheal compton now has reviews available on the web just go to  and click on the comptons critiques link for a quick hit of movies now playing in the area micheal can also be reached via email at mcomptonbgdailynewscom
Nov 6 2019,positive, once upon a time there was a 9 year old boy with an amazing imagination and on one fine day he saw a movie that would impact him forever  king kong directed by merion c cooper and ernest shoedsack shot in black and white and released by universal studios in 1933 king kong was such a success on its release that it saved the studio from going under years later when this little boy saw the mighty kong he was so taken with the movie and the concept of movie making that he fashioned himself his own cardboard king kong model used his mothers furcollar coat cutting the collar into fine threads and gluing strands of fur one by one on his model and then grabbed a movie camera to make his own version of king kong okay so that version wasnt a huge commercial success beyond his own living room but fast forward to the present what that 1933 king kong did do was create a love and desire in a young peter jackson that inspired him to become one of the consummate filmmakers of our time having helmed one of the true epics in movie history the lord of the rings trilogy jackson now had the means to do the film he had always held close to his heart  a big screen version of king kong and let me tell you right now  this is no remake or reinvention of a classic this film is a loving recreation of a timeless tale clearly a labor of love the memories held all these years by that 9 year old leap from the screen with every shot every effect every nuance every word every creature creation every beat of kongs heart true to the original film and story but with the added polish that is offered by todays technology peter jacksons king kong is a visual masterpiece the time is 1933 america faces the great depression ann darrow is a struggling vaudeville actress without income and without wanting to lower herself to performing burlesque ann has little in the way of prospects  that is until she steals an apple from a street vendor and finds herself rescued by carl denham a man with a slightly nutso streak in him denham can relate to anns little theft  especially since he just heisted his unfinished adventuretravelogue from the studio after execs threatened to pull the plug and funds some things never change rushing to get his cast and crew aboard a singapore bound steamer denham has another little problem his star has pulled out of the picture second problem  shes a size 4 and all costumes have been made luckily for him he met ann not only is she desperate for work shes a size 4 convincing her to sign on to the project is a bit tougher though like she has many options that is until she finds out that up and coming playwright jack driscoll has written the screenplay and is going along for the ride with all on board the ss venture sets sail from new york harbor but what no one realizes is that denahm doesnt plan on going to singapore always with an eye on his ego denhams true plan is to head for skull island and a mythical beast of mighty proportion with a slow build to the arrival on skull island jackson uses the time wisely to establish time place motive and characters but the fun really starts once man steps into this lost world paying great homage to the original film but with a cgi twist we are met with prehistoric dinosaurs carnivorous sea slugs a lost race of man that are more savage than anything ever depicted in a national geographic a brontosaurus stampede and tyrannosaurus triplets and of course king kong  all of which are used to establish the love story between kong and ann notable is jacksons use of the spiderpit sequence which was cut from the original but given new life here with some of the creepiest and crawliest arachnids ever seen despite the grandeur of the special effects it is the story of kong and ann that still touches the heart and is the essence of the movie be it ann using her song and dance talents to sooth the savage breast so as not to be eaten or crushed or waggling a finger at a tantrum throwing kong or kong tearing up trees tossing boulders and beating his chest in a huff over his frustration with ann be it man or ape the male species just dont get us females the story of true life is timeless and endearing and let me tell you kong is more a gentleman more gallant and more loveable than almost any man on the planet but leave it to the call of fame and fortune and ones man ego though to spoil everything and here that falls to carl denham seeing gold at the end of the rainbow denham has kong and his sweetie broadway bound with what we all know have terrifying results although the human performances are not as compelling as that of kong they are nevertheless not to be overlooked  and especially when it comes to jack black with his portrayal of carl denham black can finally be described as a movie star stepping out of type yet so in type blacks denham is an overthetop egomaniac that only adds to the underlying social commentary of the story dont be surprised to hear blacks name called out on january 31 2006 for a best supporting actor nomination oscar winner adrien brody takes on the role of jack driscoll with a performance that is weak wimpy and weepy one can easily see why ann would prefer to be with a great protectorate like kong and as for ann darrow this is one of the finest examples of perfect casting i have seen in many a day naomi watts is enchanting idyllic and golden clearly born to play in period pieces her range of emotion and adaptability in either a green jungle or concrete one is exciting to watch but it is her heart that radiates with her performance here simply magical  but the real star here is not the human actors nope that honor goes to the mighty kong himself great pains were taken to develop kong with such exacting detail so as to create a great ape that has weathered the ages but who really is an old softie inside complete with battle scars a droopy eye from a prior battle and even a broken jaw not to mention some pretty bad cavities kongs humanness is both touching and enlightening much of the success of kong goes to andy serkis himself filmed and then digitized with konglike fur who provides the fluidity and personality that create the most layered and emotionally fulfilling character of the film from the blink of an eye to a raucous laugh to a gentle touch of his finger to a darwinian ferocity it is serkis work that brings believability to the forefront for the first time in kong history we see kong moving on all fours  leaping jumping running it is kongs actions that set the pace for the film once on skull island and serkis is the one behind it  and of course what about those cgi guys calling on a good portion of his team from lotr they all outdo themselves here  and never more so than a pivotal battle sequence involving kong trying to save ann while suspended over a gorge battling the tyrannasaurus three and falling from tree to tree threatening to plummet all the way down before our very eyes mesmerizing dizzying heartstopping but just when you think youve seen it all they break out the climactic ending with airplanes kong kong and the empire state building whew  from set design to costuming of 1933 manhattan to the imaginative artisans responsible for skull island there is not a deficiency anywhere in this film even jackson and his cowriters fran walsh and phillipa boyens give the story a social conscience without becoming preachy or detracting from the original tale or the love at its very core  under the guiding and loving hand of peter jackson king kong proves to be mightier than any that have gone before and surely any that will come after from start to finish this is an extravaganza a classic and a love story that you will long hold in the palm of your hand as kong holds us in his
Jun 5 2019,positive,who would have thought a remake of one of the greatest films ever could rival if not surpass the original in jacksons capable hands thats just what king kong does
Feb 4 2019,positive,from dinosaur stampedes to toothandclaw fights with tyrannosaurs to the titular apes inevitable doomed climb up the empire state building kong version 30 is the very definition of spectacle cinema
Sep 18 2017,positive,its a pity that the film is such a miserable slog to start off because the second that it arrives on skull island it suddenly explodes into life
May 29 2011,positive, peter jacksons gripping 2005 remake rethinks the characters from the 1933 original turning its stark jungian fantasy into a soulless but skillful set of kinetic and emotional effects carl denham jack blackoriginally a selfportrait of codirector merian c cooperis now a comic villain personifying and thereby displacing the movies own cynical contrivances and hypocritical exploitation ann darrow naomi watts has lost most of her hysteria and gained an electra complex the putative hero adrien brody is now improbably a playwright a black sailor evan parke has been added to offset the jungle stereotypes and kong is anthropomorphized to the point of becoming first an audience standin for whom watts performs a few vaudeville turns then a christ figure
May 29 2011,positive,as it is a remake it doesnt have the shock lord of the rings possessed upon its release but this is a beautiful beast of a bmovie thrilling and touching
Aug 17 2010,neutral, hugedomains provides a 100 satisfaction guarantee on every domain name that we sell through our website if you buy a domain and are unhappy with it we will accept the return within 30 days and issue a full refund  no questions asked in most cases access to the domain will be available within one to two hours of purchase however access to domains purchased after business hours will be available within the next business day yes you can transfer your domain to any registrar or hosting company once you have purchased it since domain transfers are a manual process it can take up to 5 days to transfer the domain domains purchased with payment plans are not eligible to transfer until all payments have been made please remember that our 30day money back guarantee is void once a domain has been transferred once you purchase the domain we will push it into an account for you at our registrar namebrightcom we will then send you an email with your namebright username and password in most cases access to the domain will be available within one to two hours of purchase however access to domains purchased after business hours will be available within the next business day nothing else is included with the purchase of the domain name our registrar namebrightcom does offer email packages for a yearly fee however you will need to find hosting and web design services on your own if you wish the domain ownership information to be private add whois privacy protection to your domain this hides your personal information from the general public to add privacy protection to your domain do so within your registrar account namebright offers whois privacy protection for free for the first year and then for a small fee for subsequent years whois information is not updated immediately it typically takes several hours for whois data to update and different registrars are faster than others usually your whois information will be fully updated within two days
Aug 30 2009,negative,fails to match the simple handmade artistry of the original
Apr 29 2009,positive,a solid action film and okay remake
Jan 20 2009,negative, check out this musical montage of cinefantastiques favorite moments of vertiginous velocity featuring superheroes super spies and supersized monsters along with a cyborg or two acceleration biodrowskiso copyright 2020 performed by gothique with special guest blackmouth on piano and keyboards robert garcia and joe desris who wrote the cover story for cinefantastiques double issue on the 1966 batman television show and 1990s animated batman series recently had their book batman a celebration of the classic tv series published titan books its available from amazoncom here
Nov 20 2008,positive,every now and then an undertaking like kong comes around and it underscores the truly extraordinary accomplishment of directing a film
