Dates,Scores,Reviews
Sep 27 2023,positive, peter jackson draws on the original 1933 classic in his 2005 remake of king kong and the film is every bit the epic that one would expect the 1933 classic is iconic for its pioneering use of stopmotion technology it would also go onto inspire peter jackson to go into special effects lo and behold the oscarwinning filmmaker would tackle a remake after finishing up the lord of the rings trilogy after all the filmmaker knew he was going to make a remake when he was 12 years old the road got bumpy throughout the years but in 1995 universal pictures gave jackson an opportunity to remake the film as with any filmmaker he said no at first before coming around to it king kong was in the public domain at this point anyway the plan to film in 1997 is what would become a roadblock due to other remakes coming out production was delayed and jackson focused on the middleearth trilogy things would resume in 2003 jacksons films contain the same or similar set pieces but with modern technology allowing the filmmaker to do so much more instead of stopmotion technology andy serkis utilizes motion performance capture to depict the giant gorilla ill touch on the visual effects in a moment but i cannot say enough good things about them despite the modern technology this is a period film through and through jackson goes as far as paying homage to the vaudeville performances of the era ann darrow naomi watts a struggling vaudeville performer is hired by carl denham jack black for his new movie shes all set to decline before learning that jack driscoll adrien brody is the screenwriter denham is filming on ss venture which is captained captain englehorn thomas kretschmann what denham doesnt mention is that theyre really going to skull island not singapore its a recipe for disaster but not even a warrant for carls arrest is going to stop them before you know it the crew finds itself on skull island this goes as anyone would expectthe natives take ann as an offering to kong and they both flee into the jungle this was my first rewatch since seeing the epic film in theaters when it was released upon its release i felt that they could have cut out a half hour but that it would probably win an oscar for best visual effects lo and behold they won oscars for sound editing sound mixing and yes visual effects its only other nomination was for art direction which we now refer to as production design the thing with peter jackson movies is that there is a lot of care and attention that goes into the technical categories king kong missed out on a best picture nomination in an era before the category expansion i do not know if the film would get a best picture nomination under with the expanded field it just might but back to the films visual effects you cannot say enough good things about them when a filmmaker of peter jacksons caliber is directing a film you know that the visual effects are going to be topnotch there are a few scenes that draw back to the very iconic scenes that inspired them hell the work that went into building cgi new york is just astounding the first sequence in question is the fight between kong and the three t rexes the second sequence is the climactic ending with the empire state building of course both scenes go above and beyond what we see in the 1933 classic it helps that animators had the ability to work off of the previz animatics in designing the sequence for the big screen recreating the eighth wonder the making of king kong is a documentary that offers a substantial amount of insight into the film for instance peter jackson took naomi watts up to the 86th and 102nd observatories and even went up into the cone of the empire state building there were a number of years where the 102nd observatory had been closed but it more or less looks like it did in 1933 regardless their 2004 tour would inspire the interior design in the film watts and jackson also met fay wray in early march danielle solzman is native of louisville ky and holds a ba in public relations from northern kentucky university and a ma in media communications from webster university she roots for her beloved kentucky wildcats st louis cardinals indianapolis colts and boston celtics living less than a mile away from wrigley field in chicago she is an active reader sportsentertainmenthistorybiographiesselect fiction and involved with the chicago improv scene she also sees many movies and reviews them she has previously written for redbird rants wildcat blue nation and hidden remoteflicksided from april 2016 through may 2017 her film reviews can be found on creators
May 7 2023,positive,the visual effects are glorious  a circus of cliffhanging suspense sequences that go on and on and on but rather than just padding the story with gummy exposition and silly action jackson delves deeply into the psychology of the characters
Jan 7 2023,positive, king kong 2005 is an oldfashioned monster moviejungle thriller pushed to the limits with new technology by a filmmaker with both the skill and the heart to recapture the thrills of his adolescent moviehouse dreams its a remake of a 1930s classic via the wondrous creatures and primeval world of jurassic park and the devilmaycare cliffhanger spirit of raiders of the lost ark jackson sets it in the same era as the original 1933 filmthe depths of the depression in the early 1930swith naomi watts as aspiring actress ann darrow a young woman so desperate that she takes a job on a mysterious movie safari for director and adventurer carl denham jack black where denham was a reckless visionary in the original film jackson recasts him as a morally ambivalent entrepreneur who lies manipulates kidnaps and risks the lives of everyone around him first to get his picture and then to capture the mighty ape and get his prize discovery back to america in fact its a little too much of a good thing running almost twice as long as the original and filled with unnecessary side characters and spectacular scenes of man versus monster and ape versus everyone that go on long past the moment youd think he could sustain them jackson makes it all work with his showman instinct and his unconditional love of movies he fills all of those extraneous scenes and charactersespecially those involving the cabin boy jamie bell and the african american first mate evan parke his big brotherfather figurewith a love and respect that gives the film an emotional grounding and when jackson is at his best as an action craftsman you overlook the cgi overkill to marvel at the scenes especially the signature scene where kong takes on not one but three trex beasties while juggling lady love from hand to foot its astounding and fierce and as impressive as any spectacle of its era and of course there is the performance of pioneering motion capture actor andy serkis whose superb body language performance brings the completely animated kong to life he gives the creature an astounding personality a playful spirit and a sense of humor the interlude on the frozen lake in central park is joyous as he explores the ice and slides across it like a little kid and the chemistry between serkis beast and watts beauty much of it communicated through their eyes gives the adventure its love story adrien brody is our human hero jack driscoll andy serkis gets a flesh and blood role as the crotchety cook lumpy and in the process lands both of the films best death scenes and thomas kretschmann colin hanks and kyle chandler costar dont miss a single recommendation subscribe to the stream on demand weekly newsletter your email address will not be shared and follow us on facebook and twitter sean axmaker is a seattle film critic and writer he writes the weekly newspaper column stream on demand and the companion website and his work appears at rogerebertcom turner classic movies online the film noir foundation and parallax view
