Dates,Scores,Reviews
"Aug 21, 2011",negative," 
	I've read several articles about this movie that compare it to When Harry Met Sally because the two leads are friends before they become lovers. I can see why they would say that, but the relationship between Emma and Dexter is much closer to Katie and Hubble in The Way We Were than it ever is to Harry and Sally, although never does this movie even approach the greatness of that 1970s classic. Nor, for that matter, does it come close to When Harry Met Sally. There are some nice moments in it, but I would never call it a classic. 
	The gimmick of the film - and it very much feels like a gimmick - is that we see two people on July 15th every year for 20 years. It starts with the night of their graduation, when Emma, a nerdy, politically active girl (we're told) and Dexter, a popular golden boy, almost sleep together, but  then decide - well, he decides - that they should just become friends instead. 
	Over the following years, Dexter becomes a television presenter, party animal and kind of a selfish asshole. Emma gets stuck in a dead job and in a relationship with a very unfunny standup comic. The years roll on and Dexter's career tanks while Emma's suddenly takes off as a writer. They remain friends, although it's obvious that she has deeper feelings for him than he does for her, until one day it all changes. 
	It's been said time and time again on the pages of this site that the most important aspect of a romantic film is that the audience needs to care whether the leads get together and they need to see that these two should be together. Frankly, I never thought these two should get together and I only really cared because Emma wanted it so much, even if I never did see just why she wanted him so much. 
	I think a big problem with the story is that it should have started a few years earlier. Like Hubble, I have the feeling that Dexter peaked at University and the rest of his life was a slow sinking from that. Emma, on the fringes of college life would have looked at him and aspired to his ease and popularity. Instead, when we first meet Dexter he behaves rather insensitively and he continues to be insensitive to Emma's and everyone else's feelings for the rest of the film. 
	Anne Hathaway delivers another brilliant performance, although her English accent is rather dubious. It's so vague that I had no idea she was supposed to be doing a northern accent until I read an article that told me so. Despite the occasional flattening of her vowels however, she is lovely as Emma. Maybe she can't do the English voice, but she does do the repressed English longing quite well. 
	Her other half doesn't fare so well. Sturgess does a decent enough job as Dexter, but he's nothing special. He doesn't have enough charisma to make up for the character's faults and so I was left constantly wondering what Emma, and everyone else, saw in him. 
	By sticking to the film's gimmick, the story is forced to do one of two things. Either every important thing that happens to the two of them must happen on that date or the story is going to have to skip some important events. The script opts for skipping important events, which is fine, except that it skips the night the two finally have sex for the first time! Picture When Harry Met Sally without the scene where the two of them sleep together for the first time and then having Sally just casually mention it in a later scene. That's how I felt when it happened here. 
	The book this movie is based on has been a best seller for the past two years and received critical praise. I can only assume, despite the script being written by the author of the novel, that something was lost in the translation. 
	I have that same feeling about the book being much better than this movie version. In an interview David Nicholls, the author of the book and screenplay, stated that the biggest difference between page and screen is the fact that you cannot film a character’s inner thoughts the way you can describe them with words. I personally disagree with that statement (a well written script should convey exactly what the characters are thinking) but it at least explains why the movie never delves very far beneath the surface actions of the characters. Most likely the book gives more insight into just what Emma sees in Dexter. 
	I agree that Anne Hathaway gives another stellar performance. She nearly overcomes her character’s vague motivations, such as why she stays so long in a dead-end job and why she gets involved with the stand-up comic in the first place. Both of these decisions hint at a lack of self-esteem yet that issue is never fully explored. 
	What empathy the movie musters for the characters is due entirely to her. Her subdued yet heartfelt pining for Dexter almost makes you care what happens to them. There are a few moments of genuine emotion but overall I was disappointed.  FYI, her accent sounded fine to my ears but then I haven’t spent nearly as much time listening to the English speaking as my brother Scott has. 
	And the July 15th angle definitely seems like a gimmick. And since the movie makes such a big deal about the passage of time it seems odd that such scant attention is paid to the actual details of the changes in world events, technology, fashion and music over the years. And with the exception of Dexter going a bit gray at the temples neither he nor Em noticeably age over the course of 2 decades. 
	Patricia Clarkson has a few good scenes as Dexter’s cancer stricken mother and Ken Stott is good as Dexter’s loving but stern and emotionally repressed father. We are never shown Em’s parents or told much about her back-story except that she is clearly working class while Dexter comes from money. 
	The only thing that One Day reminded me about When Harry Met Sally is that Harry told Sally that a man and a woman cannot be friends as the sex always gets in the way.  The fact that Emma wanted Dexter so much and he just wanted to be friends is ridiculous.  On their first date he gets naked and jumps into her bed.  When on vacation he convinces her to go skinny dipping.  He never lost sexual interest in her.  Had they in fact had sex that first night, they would have likely never had any deeper of a relationship.  
	The writing and editing is horrible.  The scene where Dexter needs desperately to speak to Emma but cannot get ahold of her is incomplete.  His father has just told him off and he needs a friend while she is off on a date.  Before they talk it cuts to another year.  The gimmick of the years is annoying.  They flirt with each other to nauseam.  By the time they get to Paris I wanted the movie to be over.  
	Patrick wrote that scant attention is paid to the actual details of the changes in world events, technology, fashion and music over the years.  I disagree.  Many details are thrown in such as the different popular songs and the video game from 1995.  When cell phones became popular Emma tells Dexter he will get cancer from it.  
	The film's biggest flaw is that Dexter is a dick.  He is rude as hell to Emma at a restaurant.  When an old college classmate offers him a job, Dexter insults him.  When playing a game with a girlfriend, he stupidly hits her so hard she bleeds.  I did not like this shallow, self centered idiot.  Emma could do so much better than him.  
	Dexter is an extravert while Emma is an introvert.  He took her places and gave her experiences she would never have had without him.  She meanwhile provides a female companionship that is is not made complicated by sex.  It is a rather flimsy basis for a relationship.   I never became emotionally invested in Emma's and Dexter's song and dance, and was thus not moved by the ending.  The book maybe great, this film however, is anything but."
"Aug 20, 2011",positive," ONE DAY is an unconventional love story told in an unconventional style. The conceit of dropping in on them once a year on St. Swithins Day (July 15) to check their rocky progression from the 1980s through to the 21st century is as arch and penetrating as it is effective in stripping the story of any trace of flabby exposition and getting to the heart of the infinite complexity of relationships. Events piled on events are less important than the neat summation from year to year of where Emma (Anne Hathaway) and Dexter (Jim Sturgess) stand in relation to themselves and one another.  It begins in 1988 as the two graduate from college and fall drunkenly into one anothers arm. Its less impersonal than it sounds, at least for Emma, though events prevent them from sealing the deal, as it were. They decide to become friends, the which they do with a fervent devotion that survives miscues, cross-purposes, third-parties, and the ebb and flow of their fortunes. Its obvious, even to them, that they are soul mates, but of what specific variety eludes them as Emma waits for Dexter to grow up, and Dexter waits for Emma to find her inner worth. Its not an easy wait, and there is at no time any guarantee of a happy ending. Dexter discovers the allure of the blonde girlfriend; Emma discovers the mixed blessings of surrendering to Ian (Rafe Spall), the desperately unfunny stand-up comedian (Rafe Spall) who makes himself far too emotionally available and cant believe his luck when it seems to pay off. Written for the screen by David Nicholls, from his novel of the same name, the script reflects its literate origins. Its intelligent without being self-conscious, using telling details and witty wordplay, such as Emma describing the smell of her shabby first London flat as that of onions and disappointment. The excellent writing is illuminated by equally excellent performances. Hathaway evincing a ferocious honesty and growing strength beneath the vulnerability of Emmas self-deprecating bon mots, Sturgess finds the sweetness at odds with itself in Dexters boorishness, not just with Emma, but with his Dexters disapproving father (Ken Stott) and gentle mother (Patricia Clarkson), whose unconditional love for her son doesnt wear blinders. Spall brings a vivid complexity to Ian, making clear his palpable understanding that he and Emma are wrong for each other, but is, nonetheless, unable to resist the temptation to try. Its the perfect tragic counterpoint to the soul mates misconnecting, and by comparison, makes those misses all the more wrenching. ONE DAY is a love story that redefines what perfect timing is. Unblemished by soggy sentiment, it is nonetheless a film with a full, voracious heart tempered with a surprisingly clear head when it comes to romance. Funny, tragic, droll, and very, very smart, its the thinking persons love story. "
"Aug 20, 2011",positive,Book-based drama is too heavy for younger teens.
"Aug 20, 2011",negative,One of the most painfully unromantic 'romance dramas' I've ever seen.
"Aug 20, 2011",negative,"The fractured chronological foundation doesn't translate to film, with the character arcs stifled by the fragmented glimpses at their stories."
"Aug 20, 2011",negative," The title of the film One Day refers to July 15, though in truth, it refers to over two decades worth of that date. Beginning on July 15, 1988, when Brits Emma (Anne Hathaway) and Dexter (Jim Sturgess) graduate from college, attempt a one-night stand and then decide to remain lifelong friends instead, the picture checks in on the lives of the pair every July 15 through the present day. It's a high-concept gimmick that could go either way, and this one ends up parting straight down the middle. Emma starts out gawky, reclusive and toiling in obscurity, while Dexter is confident, charismatic and famous. The ensuing years impart the expected A Star Is Born career switcheroo, but the focus is mainly on the personal lives of these two best friends and whether they'll eventually decide if they should become romantically entwined or if they should even be buddies anymore (as Emma notes during one of Dexter's obnoxious phases, ""I love you, Dext; I just don't like you anymore""). Considering director Lone Scherfig's previous film was 2009's excellent An Education - one of the best films of recent years - it's impossible to consider the frequently choppy One Day anything besides a disappointment. Still, that's not to say it's a total washout: The movie nicely captures the whiplash collision of youthful optimism with strenuous reality, and Hathaway and Sturgess are fine together and even better in their individual scenes. I would be even easier on the film if it wasn't for the last-act tragedy, a grotesque and clumsy development that's less a logical procession of the story and more a shameless stab at multiplex manipulation and pandering."
"Aug 20, 2011",negative,Hathaway had better chemistry with James Franco during this year's Oscars than she does here with the terminally lame Sturgess
"Aug 20, 2011",negative,"     Confession:  I never read David Nicholls’ best-seller on which this romantic drama is based, and I simply cannot fathom why anyone would want to see such a depressing dirge about two young Brits whose lives seem to intersect every July 15th, St. Swithin’s Day, for 20 years, beginning in 1988.     Ambitious, aspiring writer Emily Morley (Anne Hathaway) and Dexter Mayhew (Jim Sturgess) meet just as they’re graduating from university, ready to launch forth into the world. Determined to continue their hastily forged friendship, they try to spend July 15th catching up and consoling one another. She’s frumpy and bespectacled, indicating ‘bookish,’ while he’s a wealthy, irresponsible womanizer. Of course, she’s secretly in love with him, despite having her hopes dashed with predictably regularity.     Eventually, Dex becomes a trendy late-night TV host, while Emma writes a successful children’s book. But their personal lives are a mess.  Drug-addled, hard-partying Dex impregnates and marries Sylvie (Romola Garai), an upper-class socialite, while dowdy Emma moves in with Ian (Rafe Spall, son of actor Timothy), a wannabe stand-up comedian.  It’s obvious that both of these relationships are doomed from the getgo. Meanwhile, Dex loses his devoted mother (Patricia Clarkson) to cancer.     Adapted for the screen by novelist David Nicholls and helmed by Danish director Lone Scherfig (“An Education”), it’s infuriatingly episodic, even tedious, never developing the characters beyond a tear-tugging layer of schmaltzy superficiality as the yearly scenes increasingly become shallow, redundant sketches about finding one’s soul mate.   Even more bewildering is the total lack of erotic screen chemistry between Anne Hathaway and Jim Sturgess. Don’t directors do screen tests anymore – to determine such things?     Having made such an auspicious debut in “The Princess Diaries,” Anne Hathaway has floundered through her past couple of roles (“Love and Other Drugs,” “Valentine’s Day”), despite making a fashion splash co-hosting this year’s Academy Awards with hapless James Franco . Jim Sturgess is best known for “Across the Universe.”"
"Aug 19, 2011",positive," With Anne Hathaway, Jim Sturgess, Patricia Clarkson, Ken Stott, Rafe Spall; Running Time: 108 minutes; Rated PG-13 (for sexual content, partial nudity, language, some violence and substance abuse); Written by David Nicholls; Directed by Lone Scherfig. ONE DAY is going to strike some people as a treacly tearjerker. For others it will be one from the heart. Those who like it will have to ignore its contrivance and focus on its emotional core, which is the story of two friends who become playthings of fate, with the true love they might have found in another story somehow always just out of reach. Screenwriter David Nicholls has adapted his own novel about two British college graduates who meet on July 15, 1988 and spend the night together. We follow them over the years on that date as their paths cross and recross. Emma is a mousy would-be writer who, in true Hollywood tradition, is played by the gorgeous Anne Hathaway, only wearing glasses. She gets a job waitressing in a greasy spoon and falls in with Ian, a co-worker and aspiring standup comic (Rafe Spall). Meanwhile Dexter (Jim Sturgess) gets a job hosting a youth-oriented television show and is so in-your-face that he becomes the TV personality that people love to hate. Neither Emma nor Dexter is living up to their potential, but as the years go by, life happens. Dexter’s mother, Alison (Patricia Clarkson), falls ill. Emma and Ian move into together. Dexter marries. Still the two stay in touch, making us think that this will be one of those stories where love and happiness doesn’t occur at first, but at last. This is the sort of story for people who can relate to the “one that got away,” or the great love of one’s life that was unrequited, or perhaps even the great love that briefly flowered but could not last. It is a story of memory and rueful regret, and the recognition that even if it was not meant to be, the other person in such a situation can still touch our lives in profound and long-lasting ways. With the movie covering more than two decades it’s also about growing up and growing older. What seems like success in our twenties may not seem the same in our forties. The things that appear impossibly out of reach at one stage of our lives may become achievable goals later on. As Emma and Dexter get older their priorities change, even as their friendship endures, and that’s an important part of the story as well. Anne Hathaway herself is a good example of these themes. Over the last decade she’s gone from movies like “The Princess Diaries” and “Ella Enchanted” to movies like “Rachel Getting Married” and this. She still does lightweight films like “Valentine’s Day,” but she’s reaching out for greater challenges as she gets older, even holding her own opposite Meryl Streep in “The Devil Wears Prada.” As Emma she explores the frustrations of young adulthood and the growing confidence that comes with successfully taking chances as she gets older. Jim Sturgess is less well-known – not yet a star – but he’s been quietly moving from film to film, building up his résumé with some good performances in movies like “21” and “The Way Back.” This may be his highest profile work yet. His Dexter is someone who could get by on glibness and good looks but wants more than that out of life, even if he’s not quite sure what. His character has to face a few hard knocks after coasting through his early life, coming out wiser for it. Daniel M. Kimmel is a veteran movie critic and author of a host of film-related books, the most recent being Jar Jar Binks Must Die… And Other Observations About Science Fiction Movies. He teaches film at Suffolk University and lives in Somerville."
"Aug 19, 2011",negative,A ghastly representation of longing and screen chemistry. It couldn't make the nuances of attraction more unpleasant if it tried.
"Aug 19, 2011",neutral,It's what a Nicholas Sparks movie would be if it were aimed at grown women rather than teenage girls.
"Aug 19, 2011",negative,"In one scene, we are told a boyfriend of Anne Hathaway's character left. At that point, I'm envious. How come he gets to leave and I have to stay?"
"Aug 19, 2011",neutral,"Hathaway is cast with the bum role here, and it crushes her: She spends too much of the movie blinking unconvincingly through those wire-rimmed owl glasses."
"Aug 19, 2011",neutral,'One Day' Drags on for an Eternity
