Dates,Scores,Reviews
"Aug 19, 2011",neutral," We paddle ahead of the industry standards by rigorously vetting casinos to spotlight only the most reputable and worthy options. But we don’t stop there. We believe in the limitless possibilities of online gaming. The canoe.ca platform is dedicated to providing top-notch online casino reviews, catering to a global audience. We are committed to serving players from different corners of the world, with a focus on delivering exceptional online gaming experiences. No matter where you are in the world, canoe.ca is your trusted guide to the world of online casinos, ensuring you have the information you need to enjoy a safe and enjoyable online gaming experience. At Gambling in Canoe, we are dedicated to providing the highest quality information to enhance your online gaming experience. Our team, comprised of specialized experts, employs a rigorous approach to evaluating online casinos. We meticulously assess various factors that contribute to a superior gaming experience, including game selection, bonuses and promotions, payment methods, customer support, and up-to-date Information. Our commitment to these stringent criteria ensures that our reviews are honest and transparent, empowering you to make well-informed decisions when choosing an online casino. Our team continuously tracks and analyses the latest global casino news. This includes new game releases, upcoming events, and other significant updates, ensuring our casino reviews are always current and accurate. We actively monitor the newest bonuses and promotions from online casinos worldwide. This crucial information helps you enhance your gaming experience and take advantage of the most attractive offers available. Canoe.ca experts compile detailed guides on various casino games. These guides are packed with tips and strategies to enhance your gaming skills and boost your entertainment level. We offer extensive information on the range of payment methods accepted by online casinos globally. This ensures you can manage your funds effortlessly, whether you’re depositing or withdrawing winnings. We help you identify online casinos that offer dependable and efficient customer support. Our goal is to ensure you have a smooth gaming experience with access to prompt assistance whenever needed. Identifying Red Flags and Warning Signs: We teach you how to spot red flags such as unrealistic bonuses, lack of licensing information, and poor user reviews, which can indicate a fraudulent online casino. Verifying Licenses, Certifications, and Security Measures: We emphasize the importance of playing at casinos that are licensed and regulated by reputable authorities and use the latest security measures to protect your data. Using Trusted Resources and Reviews for Safe Gambling Choices: Our guide is a trusted resource, providing honest and thorough reviews to help you avoid the pitfalls of fraudulent online casinos. The online casino world offers seemingly endless gaming options spanning slots, table games with live dealers or computer opponents, and niche speciality options. Below, we share key information about the rules, strategies, and unique features defining the most played real-money and free casino game categories. Slots come with spinning reels and a variety of symbols that payout prizes when matching patterns land. Their mega jackpots, exciting bonus rounds, and endless types/themes show why slots lead to casino popularity. Some favourite titles include Starburst, Gonzo’s Quest, and Bonanza. In roulette, players bet on where they think a ball will settle across a spinning numbered wheel. While seemingly simple, understanding inside vs outside wagers can help balance risks and rewards. Popular variants like European, American or Multi-wheel games exist. Employing basic blackjack strategy charts significantly lowers the house edge as players attempt to beat the dealer’s hand without exceeding 21 through hitting or standing. Atlantic City, Spanish 21 and Pontoon offer exciting twists. Poker blends gambling luck with elements of skill around personal hand rankings, reading opponents, when to raise/fold, and potential bluffing across its most popular version – Texas Hold ’em – alongside Omaha, Stud and more variants. In baccarat card game rounds, participants wager on which hand between player or banker will win based on closest to 9 points per traditional deck scoring. Natural winners, tie bets, and 6-8 deck options add engagement. Live dealer technology streams real human croupiers managing roulette, blackjack, baccarat and other classic table games in real-time with interactive features. Multiple camera views amplify authenticity. Crash games feature exponentially rising payout multipliers until the round suddenly crashes. Strategic timing for placing bets and cashing out before the collapse is key. Instant win scratch card style games offer simple entertainment with prizes that are randomly triggered and need no skill input. Many online casinos tested and ranked by Gambling in Canoe offer game demos in free-play mode before players transition to wagering real cash. Below, we summarize the key advantages and disadvantages of defining both formats to help you decide your preferred gaming experience. While casinos provide the branding and interface, the games and functionality are powered by specialized software developers. We outline major studios setting industry standards for mobile compatibility, game quality and innovative features. Play’n GO launched in Sweden in 1997, specializing in mobile-first casino game development, now releasing new optimized slot titles weekly spanning virtual bingo and table games too. Leading casino software pioneer Microgaming originated in 1994 on the Isle of Man, supplying acclaimed classic slot titles, jackpot networks like Mega Moolah, plus virtually every table game type. Established in 1999 in Estonia with offices across 14 countries today, Playtech drives innovations around omnichannel casino technology, including networked progressive jackpots and mobile live dealers. Founded in 1996 in Sweden before expanding into playing card printing a decade prior, renowned developer NetEnt provides superior animated slots, table games and realtime live casino streaming. Launched in 1999 in Atlanta, Realtime Gaming serves as a top choice for US-facing online casinos via its portfolio spanning slots, speciality games and recent live dealer additions in European studios. This Latvia-born live casino games leader, founded in 2006, rapidly earned awards for developing pioneering online versions of roulette, poker, and other games streamed with fully interactive features. Multinational slot machine creator International Game Technology from 1975 successfully leveraged land-based expertise into interactive casino after expanding online around 2011 following a leadership shakeup. Heavily design-focused developer BetSoft from London burst onto the scenes in 1999 with acclaimed 3D cinematic slots and niches in virtual races plus bingo before venue expansion into poker. Gambling sites featured on canoe.ca use tempting bonuses to acquire new members and encourage continued play. You have access to multiple promotion types, each with distinct advantages and pitfalls. We outline key offerings so players can evaluate the best options. When you first join a casino, they’ll likely greet you with a flashy 200% deposit match deal plus free spins or something like “deposit $100, play with $300!” While exciting, look deeper at critical things like how much you need to playthrough before withdrawing win money and timeframes before the offer expires. On top of welcome deals, some casinos give you more bang for your buck, even on your 2nd or 3rd deposits. These 50-100% reload matches work similarly to welcome offers but tend to let you cash out bonus funds faster once you hit lower playthrough requirements. Who doesn’t like some complimentary action? Free spin releases let you preview new slots risk-free upon launch while retaining associated wins. But confirm the number of rounds and title eligibility before playing. More VIP-focused cashback bonuses act like rebate rewards that refund small chunks of what you lost over a week or month. So, if you notice your play history showing a lot of entries in the “negative” column, cashback puts a few coins back by refunding maybe 15-25%. Of course, continued play is mandatory. Scoring free betting credit or spins just for signup sounds too good to be true. That’s because these rare deals impose nearly impossible playthrough rules relative to tiny gifts. VIP schemes provide personalized promotions, prizes, event access and more for high-volume players. Rating levels dictate cashback rates and unlock additional reward potential over time. Moving money conveniently while upholding security remains vital for enjoyable online gambling. Below, canoe.ca experts outline the most globally supported banking channels accepted by regulated gambling sites. Amid thousands of gaming options online, determining trustworthy sites that will treat customers fairly elicits warranted caution. While no singular factor guarantees outcomes, familiar markers signal vetted processes. Reputable sites prominently display credentials like eCOGRA certification, United Kingdom, Kahnawake, Malta, Curacao, or other licensing numbers. These indicate compliance with heavy operational rules and auditing procedures imposed by renowned gambling oversight agencies. Actively scanning for the SSL “padlock” icon confirms betting portal connections utilize modern data encryption. This shields exchanged information from external surveillance or hacking vulnerabilities. While casino gaming and sports betting offer recreational enjoyment, establishing play time limits and budget caps and using available self-exclusion tools remains important. It also proves vital to know your local jurisdiction’s stance towards real money gambling and adhere to set policy. Gambling in Canoe guides help equip players with the best practices and informed choice sets for navigating regional gaming frameworks. But avoiding potential pitfalls requires personal accountability as well. At Gambling in Canoe, we guarantee a first-class online gaming experience by offering the most current and precise details. Our dedication to delivering clear and truthful evaluations, combined with our commitment to staying abreast of the latest developments in casino news, bonus updates, and the iGaming industry, ensures you’re always in the know."
"Aug 19, 2011",negative,"The result is a rom-com with ambition, keen to actually develop the characters and to mix a few tears with the laughs. Well, the effort is admirable, the movie not so much."
"Aug 19, 2011",neutral,"Why don't they just pick that day annually to stay under the covers and let fate blow over? They could save themselves a soap opera's worth of stilted heartache, drug addiction, family issues, divorce, death and generic romantic hokum."
"Aug 19, 2011",neutral,"Miscasting aside, there's simply very little excitement to the film since you can see where it's going -- chances are even just by reading this review -- right from the start."
"Aug 19, 2011",neutral," The Church publishes the Monitor because it sees good journalism as vital to progress in the world. Since 1908, we’ve aimed “to injure no man, but to bless all mankind,” as our founder, Mary Baker Eddy, put it. Here, you’ll find award-winning journalism not driven by commercial influences – a news organization that takes seriously its mission to uplift the world by seeking solutions and finding reasons for credible hope."
"Aug 19, 2011",negative,"Sometimes, a successful play or a popular book-even a comic book-has qualities that just don't transfer to the screen. One Day is based on a best-selling novel, and the producers hired its author, David Nicholls, to write the screenplay, since..."
"Aug 19, 2011",positive," Following the same template as the ingratiating source novel by David Nicholls (who also wrote the screenplay), One Day charts 20 years of a relationship's ups and downs in one-day blips. Touching down on the same day, July 15, every year, One Day starts in 1988, with study-in-contrasts classmates Emma (Hathaway) and Dexter (Sturgess) falling into bed with each other on their last day at university. Emma – nerdy and socially conscious in an abstract, petition-writing way – nervously strips down and puts on Tracy Chapman for make-out mood music; put off, the posh, glib Dex shrinks back: ""Maybe we can just be friends."" It's a wonder their story doesn't end there. Yet they soldier on as just that, lifelong friends who fumble  – sometimes together, sometimes not – through the newly adult landmarks of first jobs and failed love affairs. Perhaps inevitably, the book's structure plays in a more gimmicky way onscreen. It strains credulity that a single calendar day could have so many discrete, capital-D dramatic occurrences, and the way in which Dexter and Emma's relationship evolved on page – leisurely, with time and expanse for interior exploration and character specificity – is reduced here to Polaroid-like portraiture. There are, in short, 364 days' worth of blanks to fill in for each of those 20 years, and the film's tiny yet defining filigrees – as when twentysomething Dexter casually plays with Emma's hair, in an intriguing push-pull between platonic intimacy and lightly soused foreplay – are so few that their hey-look-at-that! rarity ruins the subtlety of detail. There was a lot of hubbub about the casting of American Anne Hathaway as Emma, and indeed the trailer did seem to hone in on her more awkward wranglings with an accent. But she matures plausibly, from the gawkiness of young Emma to the steeliness of middle age. Sturgess, saddled with a caddish character, is less compelling, but he does provide the film's only spot of unloosed, raw emotion. Everything else feels too precisely and too compactly assembled for much impact. You could argue it's the structure that's so distancing, yet director Lone Scherfig's last film, the overpraised An Education, was just as detached. But where her cool-to-touch adaptation trumps the book is in how it cuttingly conveys the way stasis settles in – how whole years can whiz by without one's circumstances changing one whit. (It's why a lot of us stop keeping diaries: It's just too damned depressing to flip from year to year and recognize the same complaints, the same calls to action never heeded.) That – the illumination of our limitations, our awful habitualness – probably wasn't the effect this wannabe-epic of romantic yearning was going for, but it's a considerable accomplishment nevertheless. A note to readers: Bold and uncensored, The Austin Chronicle has been Austin’s independent news source for over 40 years, expressing the community’s political and environmental concerns and supporting its active cultural scene. Now more than ever, we need your support to continue supplying Austin with independent, free press. If real news is important to you, please consider making a donation of $5, $10 or whatever you can afford, to help keep our journalism on stands."
"Aug 19, 2011",neutral,"Tastelessly tasteful, the movie dwells in some fevered upper-middle-class fantasia where problems of the idly rich are all that matter in the world."
"Aug 19, 2011",positive,One Day is such a cannily crafted tale of love and loss that you're always aware (and kind of hate) just how much it's manipulating you and yet get caught up in it anyway.
"Aug 19, 2011",neutral," 
ALL OF US STRANGERS  Film of the Year, LGBTQ Film of the Year and LGBTQ Screenplay of the Year: Andrew Haigh BARBIE Director of the Year: Gr...
"
"Aug 19, 2011",negative, The county board could use its budget power to force change on the Sheriff’s Department. But it won’t step up even after years of grim headlines.
"Aug 19, 2011",negative,"'One Day' has its moments, but feels more like its plot's 20-some years in sitting through the rest of the dreck to get to them. (Content Review for Parents also available)"
"Aug 19, 2011",neutral,A gimmick movie where the gimmick hurts the storytelling and possible emotions the audience might feel.
"Aug 19, 2011",positive,"Nicholls has proven a faithful shepherd to his fictional creations, who banter and rant at each other with the practiced elan of the aging couple they're clearly meant to be."
"Aug 19, 2011",negative,It suffers from a casting error in one of the two leads and its director seems to have contemplated three or four different endings and then just thrown up her hands and decided to include all of them.
"Aug 19, 2011",negative,"As 1992 rolls around, a sense of dread sets in: Are they really going to do every single year?"
"Aug 19, 2011",negative,"Long before the credits roll, you may find yourself wishing your life could flash before your eyes, to end the monotony of this relentless turning of calendar pages."
"Aug 19, 2011",positive,"Amid sharp banter, the film poignantly captures how lives meander and take unexpected turns."
"Aug 19, 2011",neutral,"  A great hue and cry arose across the pond last year when it was announced that American Anne Hathaway had been cast as Em, the less-than-glamorous British heroine in the film version of the best-selling novel “One Day” — basically “When Harry Met Sally” with a four-handkerchief twist.    The new film’s action takes place every July 15, beginning in 1988 and continuing for two decades or so. Working-class Em hooks up with the handsome, more affluent Dex (British actor Jim Sturgess of “Across the Universe”) on the day of their college graduation in Edinburgh.    They’re not always together on July 15 — in 1990, he’s partying with a naked woman in Paris, and Em is underemployed as a manager at a Mexican restaurant in London. She eventually moves in with a smitten colleague, a failed comedian (Rafe Spall, son of Timothy) she doesn’t quite love.    Returning to London, Dex acquires a measure of stardom — as well as a taste for cocaine, booze and promiscuity — as the host of a cheesy late-night music program on TV. On one of their several reunions on various July 15s, including a skinny-dipping episode, he rudely brushes aside her concerns about his hard-partying lifestyle, which is taking a toll on his career.    Her relationship founders, but the comedian’s parting gift is to encourage her literary ambitions, and sure enough, her first book is a best seller. By this point, the self-pitying Dex — who’s lost his mother (Patricia Clarkson, in a small role) to cancer and his TV show — has hit rock bottom. A short-lived marriage (to Romola Garai) that produces a daughter and an unhappy new career does little to reverse his downward trajectory.    At some point in the late ’90s, Em and Dex decide they were fated for each other after all. It’s easy to see how Dex would be attracted to the newly self-confident Em. I had more of a problem understanding why Em would want anything to do with Dex, a substance-abusing jerk who is anything but charming.    I might be able to get past that if Hathaway and Sturgess had any chemistry. There are no sparks whatsoever, and that’s always a deal-breaker for me in romantic films.    “An Education” conveyed a wonderful sense of time and place, something that’s largely missing here — if it weren’t for title cards and the occasional shoulder pad, it would be hard to tell whether you’re looking at a scene from 1996 or 2006.    David Nicholls, who adapted his own novel for the screen, doesn’t work the same alchemy that Nick Hornby created from Lynn Barber’s memoir for “An Education.” There’s far too much on-the-nose dialogue (“She made you decent”), plus Nicholls adds an extremely schmaltzy ending chapter that wasn’t in his book.    Even with his hair grayed up, Sturgess in no way physically conveys the middle-aged man he’s become toward the end. Hathaway, though, suggests Em’s life journey beautifully, and she’s the best reason to see “One Day,” if you must. "
"Aug 19, 2011",neutral," Emma (Anne Hathaway) and Dexter (Jim Sturgess) have the kind of
relationship that women and men sometimes find hard to handle:
They're friends, not lovers. But the potential for sex is always
there, from their first meeting in the late 1980s to their periodic
reunions over about two decades of British cultural change. It's a classic case of opposites attracting. Emma is studious
and somewhat insecure; Dexter is outgoing and overconfident. Emma
aspires to be a writer; Dexter is happy to be host of a TV show.
Emma is sexier than she thinks she is; Dexter can't live without
sex. They'd make a great couple, if only they could get on the same
page — or the same stage. It seems that they both have some growing up to do. But as often
happens in such stories, tragedy lurks. It also lingers, as we
dawdle with one of the characters way past what should have been
the ending. Based on a book by David Nicholls, ""One Day"" fails to make us
care about the young couple at its center. Working from a
screenplay by Nicholls, director Lone Scherfig maintains a lively
pace, and she elicits spirited performances from Hathaway and
Sturgess. The problem is a story that may have worked as a novel,
but never quite gels as a film. It's a big disappointment coming
from Scherfig, whose drama ""An Education"" (2009) was a model of
concise yet engaging storytelling. ""One Day"" also squanders the talents of Hathaway, who was
terrific in last year's ""Love and Other Drugs."" She brings to Emma
an appealing vulnerability. As Dexter, Sturgess — who has appeared
in films from ""21"" to ""Across the Universe"" — deftly balances charm
and smarm."
