Dates,Scores,Reviews
Apr 4 2024,positive, within a jammed pack year of joining this website joining the extra film podcast to getting married to the love of my life to losing one of the closest people ive ever known to becoming the proud father of a beautiful puppy it has been a eventfully game changing year in my life and while all these things were going on the year in film was slowly become one of my favorites the year that was 2018 will go down as the best year of the decade for films with the 2010s  not only was it one of the best years in terms of movies from week to week but the quality of the films and the elevation of genres throughout the year was extraordinary from starting off the year with paddington 2 to ending the year with if beale street could talk im still catching up with films because of the consistent richness that was 2018 this was pound for pound the best year for foreign language films documentaries independent films as well as a very solid year for big blockbuster movies it was also rich in films that shaped or changed the way i thought about the world around with some films making me want to become a better overall person by the closing credits i dont know how 2019 could top 2018 but i will be interesting in seeing how it try to top the best year in film since 2007 we do encourage you to listen to episode 308 to hear more about our picks but as we do every year listed here is my top 20 of 2018   while theyll love me when im dead is a great investigative doc into the life of orson welles wont you be my neighbor is one of the most moving charming important documentaries of the decade the documentary about fred rodgers is more about the man and his philosophy than about the innocent show he was making as stated in the film fred rodgers was a revolutionary and he was completely ahead of his time by the end of the film there is a clip from one of the major news networks taking show at his work blaming this generations laziness on mr rodgers and thats wrong because sufficed to say i wish we had someone like mr rodgers around that was deeply religious and faith based and innocent but also radical and talk about things no one else wants to talk about on tv let alone on a childrens program and by the end of the film all i could do is marvel at the life that was fred rodgers director morgan neville is the new king of documentaries and im fascinated in what subject he will tackle next click here to listen to our full review  this was my first introduction to the main podcast and whod of thought that debra granik long awaited follow up to winters bone would connect with me in such fantastically layered and real way the two lead performances here from thomasin mckenzie and ben foster are so authentic that i felt like they were really father and daughter thus their connection their bond is so real to me it takes the ideas of something like captain fantastic a film i enjoy a couple years ago and expands them into a discussion over the treatment of veterans what a home and a family should be and what personal independence is i wasnt a fan of winters bone but i was a huge fan of this movie and i hope it doesnt take almost another decade to get another film from her about people that we never get to see a lot and the lives that they live click here to listen to our full review  this was the film that took me so long to see this year and from the moment it starts i was hooked i love how chloe zhao makes this film almost feel like a biopicdocumentary within this narrative structure its as real as it could get and feels like something that is personal to everyone that is making it this movie can strikingly beautiful but also being touching as well as you watch brady slowly but surely try to put his life back together it is a film about someone trying to continue their life and live out their dreams but also about coming to an understanding about needing to know when it is time to let things past and move on and find a new passion this is all he knows and all he thinks he has and by the end of the film he realizes that their might be more than that eight seconds it truly a special film and its one that i will regret the most not seeing on the big screen this year click here to listen to our full review  alfonso caurons most personal film of his career is his most visual striking film since children of men the simple story of a maid taking care of a wealthy family in mexico is not only beautiful from what you are seeing but the story feels so real and from the heart that you cant fall in love it it did take a while for it to get going for me but once this movie gets into it mid act twist this movie goes on another level and left me wanting to see it again i wasnt able to see it on the big screen but that didnt stop me from loving thank you netflix for giving cauron a chance at making his vision come true click here to listen to our full review  when i wrote my review for paul schraders bombastic struggle between of mans relationship between religion and climate change i struggled myself in getting out words to describe what the movie was doing to me and i think that was the point this movie challenged me in ways that many films this year did not and leaves you with lasting images that make you question your beliefs and what you are doing to protect this world i said that schrader was making a battle cry with a sermon of a script and he picked the perfect vessel to deliver that sermon in ethan hawke who gives the best performance of his career and of the year click here to listen to our full review  what can i say that many have already said about what i think will go alongside mad max fury road as one of the best action films of the decade from the helicopter chase to the motorcycle chase through paris to the fist fight in the film director christopher mcquarrie takes you on an adrenaline fluid ride with characters we have spent five films with but take the time to give us a story that is built from the bones of the rest of the franchise tom cruise is showing what i believe upon rewatch to give one of the most layered performances of his career and you can really feel when watching this film that this might be the one time ethan cant fully complete the mission and save everyone the film lays down this tension from the get go and never lets go long live the best franchise in hollywood and heres to 2021 and 2022 when we get to accept our next mission click here to listen to our full review  one of the biggest surprises of the year became also one of the most original story of the year in a film that follows the last three days of a young mans probation we are taken on a world of emotions and a look at the city of oakland that is a real as any experience in any other major city this movie is personal and that is because of the script written by the leads of the film in daveed diggs and rafael casal who take their personal struggles and complaints of the city they live in and make them connect within the large world and struggles that many in their communities deal with on a daily basis with biting humor tense cultural relevance and the best use of hip hop ive seen in film in a long time this movie is this generations do the right thing and i cant wait for the next project by these two truly special talents click here to listen to our full review  between the conversation on race the two co lead performances of john david washington and adam driver and the confidence of spike lee as a master filmmaker this film brings us a timely story of the past while connecting it back to our modern times this is a wakeup call as well as a cautionary tale that mixes in pure nostalgia of the past and style of 70s blaxploitation films in a world that seems so divided and angry it took spike lee to bring it all together and make us laugh and cry but also make us think click here to listen to our full review  the love story shown from kiki layne and stephen james is the most romantic realistic relationship i was on screen this year the family dynamics and their values are perfectly portrayed in a script that is a love letter to james baldwin  barry jenkins balances real life issues of accusations of rape as well as mass incarceration as well as it being about innocence and how the color of your skin doesnt matter if someones mind is made up about you and he does it all with a tender loving eye behind the camera jenkins along with nicholas britells score paint a beautiful portrait of these characters and the environment and time they live in if i had more time to digest this movie it might have made my number one but i also think this movie will be like moonlight and only grow in my love for it barry jenkins is the real treasure and is slowly turning into one of the best living filmmakers on the planet click here to listen to our full review  there are so many things i love about this movie the opening the empowerment the political story that is just as interesting as the heist itself widows is a deconstruction of a heist movie taking the genre to new and exciting heights the best ensemble of the year and twist that due to the marketing of the film surprised the hell out of me and then brought this movie to a whole another level its so layered and has a lot going on and while it doesnt work for everyone this movie clicked for me at every single moment by the end of this movie i wanted to see more i wanted to be a part of a chicago world building that hasnt been as good since the dark knight making that city as much of a character as the actors in the film if you didnt see widows please see it i wish more people were talking about this movie because this is a prime example of what we can do when we give visionary directors like steve mcqueen and amazing writers like gillian flynn the resources to make not only just a great genre film that is within their style but a full on masterpiece click here to listen to our full review let us know what you think do you agree or disagree wed like to know why leave a comment in the comment section below or tweet us insessionfilm to hear us discuss our insession film awards and our top 10 best movies of 2018 subscribe to us on itunes stitcher soundcloud or you can listen below 
Jul 24 2023,positive, synopsis ethan hunt tom cruise and the imf team join forces with cia assassin august walker henry cavill to prevent a disaster of epic proportions arms dealer john lark and a group of terrorists known as the apostles plan to use three plutonium cores for a simultaneous nuclear attack on the vatican jerusalem and mecca saudi arabia when the weapons go missing ethan and his crew find themselves in a desperate race against time to prevent them from falling into the wrong hands finally we reach dday i have been reviewing all films from the mi franchise for the past week and now it is time for the best and craziest movie yet if you want you can check my thoughts on the other films by clicking each ones title mission impossible mission impossible ii mission impossible iii mission impossible ghost protocol mission impossible rogue nation oh my god  these are the three words that kept coming out of my mouth while watching fallout in a world where we barely have any real action anymore since everything is or uses bits of cgi it is a huge breath of relief to be able to enjoy such jawdropping mindblowing outstanding action set pieces i know i have been writing this a lot throughout these reviews but this one completely floored me this is going to be the action movie to beat for a few years  maybe until the next mission impossible installment who knows my heart pumped like it never did before the stuff that tom cruise actually does which is basically everything is unbelievable truly unbelievable like you will have to get home and search for behindthescenes videos to understand how were they able to pull those sequences off he runs like hell jumps from building to building you probably already know about the story of his broken foot performs a halo jump a military parachuting free fall where the parachute is open at low altitude and the drop is performed at 25000 feet insanely drives a motorcycle through paris streets pilots a helicopter  you got it right this is the reason why the mission impossible saga needs to continue if it stops there is never going to exist another film series that can bring such realism and incredible stunts like mi does it is undoubtedly the best action franchise of alltime at least regarding the action set pieces there is no possible comparison with any other movies i am writing this because the ending might bother a few people i have been having some bad luck with endings this year there are a lot of films that i have watched and loved almost everything about it but then its ending disappointed me in some way avengers infinity war a quiet place and some more i hate when directors tease a particular end which would be a shock and something entirely unexpected and at the last minute they back off and take the safe route christopher mcquarrie does that but fallout might be the only movie where i understand why he did it i do not want to go into spoilers territory so i will justify it this way if mcquarrie chose the bold ending fallout would probably be an a but the franchise would have to end as well if it wanted to continue to be successful by choosing the safe route he guarantees the sagas vitality but the film suffers from the issue in the last paragraph since everyone is going to leave the theater thinking oh i wish they would have gone with that ending this is a minor issue that i have apart from another one regarding the first acts pacing this is the longest movie of the saga and mcquarrie already answered why not to this question in particular but he did admit that this film was structured around the action set pieces usually this is a problem because it is often awfully executed never create a movie without writing your story and characters first however this is the sixth film of the franchise and pretty much every significant character has been in the previous installments  nevertheless this justifies why the first act delivers so much information which causes the plot to start a bit convoluted it eventually organizes itself and it becomes a simple story filled with predictable twists and turns that ultimately accomplishes its mission to support the fantastic action sequences please do not expect some oscarworthy screenplays from mi movies because if you leave disappointed due to your unrealistic expectations thats on you as always the cast is sensational and every character that we love and care about come back to one hell of a ride i already blabbed about cruises courage but there are a lot of exceptional performances simon pegg benji and ving rhames luther are a hell of a team providing some needed comic relief moments in such an actionheavy film rebecca ferguson ilsa faust continues to be incredibly captivating michelle monaghan julia has some screentime to shine and alec baldwin alan hunley also brings his agame sean harris solomon lane returns in style and henry cavill walker proves to be a fantastic addition to the saga by being the protagonist of some of the most potent handtohand combat in the series besides the action every technical aspect is seamless the cinematography is absolutely gorgeous there are so many beautiful wide shots and some of them are a true filmmaking achievement the score is remarkable as it usually is in the mi movies and it helps to raise some goosebumps in the vertiginous scenes people with a fear of heights are gonna have a hard time with this one the editing is perfect and the tone and pacing are very wellbalanced with the help of rhames and peggs characters who bring some stops to the extended action sequences the driving around paris sequence could have been shorter there is still that sense of urgency and the frenetic pacing which provides a significant level of entertainment mission impossible  fallout is the best film of its franchise and one of the best action movies of alltime regarding the execution of said action set pieces tom cruise proves that he is an icon if not the biggest icon in action film history through dozens of runs jumps and god knows what more mcquarrie brings his fantastic technical attributes to this movie and uses an exceptional cast to interpret remarkable characters a simple yet captivating plot supports the excellent action and it still carries a few predictable twists only a few nitpicky things forbid me from giving this film an a but i promise you it will definitely be in my top10 by the end of the year go see it on imax now
Jun 22 2023,positive, vague visages mission impossible  fallout review contains minor spoilers christopher mcquarries 2018 movie on paramount features tom cruise henry cavill and ving rhames check out the vv home page for more film reviews along with castcharacter summaries streaming guides and complete soundtrack song listings continuing the narrative of his successful 2015 film mission impossible  rogue nation writer director and now coproducer christopher mcquarrie breaks with imf tradition and commands the directors seat a second time with mission impossible  fallout aka mi6 when it comes to sheer quantity of triplecrosses double agents remote control gizmo toys oneliners stunts and rubber mask fake outs mission impossible  fallout outdoes its predecessors the big question now however is whether the longevity of this franchise is finally taking its toll on the overall quality once again impossible mission force imf agent ethan hunt and his spy fraternity face the impossible task of saving the world from an apocalyptic catastrophe this narrative thread continues to be the bread and butter of the franchise dating back to brad birds mission impossible  ghost protocol 2011 yet even with slight alterations to the standard apocalyptic tale the fallout plot remains largely superficial window dressing consistent with its predecessors it is the castcrew chemistry and stunts that are the true selling points mcquarrie spices things up a bit by bringing back mi5s villain solomon lane sean harris he is a radical anarchist hellbent on taking revenge on hunt and the world striving for maximum suffering to yield epic peace lane is a constant reminder to hunt of his past failures and deepest fears from mi5 to mi6 lanes character shifts from more of a strategist to an anarchist harris acting in mi6 as a doomsday prophet is excellent  yet not as energizing or entertaining as seen in mi5 his portrayal of anarchy is far more subdued and dull than that of heath ledger as the joker in christopher nolans the dark knight 2008 this time a new challenge to the imf is the tight cia leash around hunt and his crew as the top spook august walker henry cavill keeps a careful eye on them with orders to terminate if they go rogue walker presents the main physical threat to hunt individually while lane taunts the imf top agent psychologically both target hunts heart and neither characterization is sufficiently strong the best relationship dynamic is between hunt and mi6 agent ilsa faust rebecca ferguson another carryover from mi5 she continues to add new energy and a coolness factor to this veteran franchise more importantly as a femme fatale archetype faust presents a relationship challenge for hunt restoring to this franchise its cagey team conflicts yet the adrenaline rush of the action sequences is the primary audience pleaser surpassing rogue nation which had midtier heist stunts fallout jumps an even bigger shark with such style and grace that one cannot help but wonder in awe of the absurdity mcquarrie presents on screen cruise effectively turns hunt into a mix of captain america and evil knievel chucking reality straight out the window throughout the stunts mcquarrie and film editor eddie hamilton create a terrific visual narrative flow and cinematographer rob hardys use of both medium and long shots in the imax format is especially impressive pushing the imax format to its limit comparable to nolans the dark knight whether it is paris night cityscape during an intense halo jump or car and boat chases during the day each mi6 frame pops with texture and exquisite attention to detail the best example of the crews talents does not come from the more dangerous moments but rather from the smaller ones mcquarries directorial expertise shines during a tightly storyboarded fight sequence inside a paris nightclub bathroom in this scene the camera is both wide in scope and tightly focused there is a constant sense of dread and with hardly any crosscutting mcquarrie infuses this imminent danger into the audiences view the mi6 editing is lightning fast and crisp the direction and tone of the film is a hybrid of sorts it combines the grittiness of the bathroom fight from true lies 1994 and the cold precision of the restroom scene in jeongbeom lees the man from nowhere 2010 due to a real sense of immersion in this scene one feels the pain the characters are experiencing the audience remains grounded in the heat of the moment and is never playing catch up due to choppy framing or blocking of the shot finally one must consider the tom cruise factor the essence of the film itself cruise once again proves he is an actor sewn from a unique material that is all his own his ability to be both mentally and physically capable of pulling off all his stunts is unparalleled the fact he learned to fly a helicopter for a chase sequence that rivals cinemas best  including bullitt 1968 and the french connection 1971  makes the film worth the price of admission what merits criticism however in the mi6 depiction of hunts scripted wholesomeness we now have a version of this character whose feats of strength and sense of moral justice come off as two dimensional and rather cartoonish hunt is no longer the genuine somewhat flawed guy who first endeared viewers back in 1996 based on the reported influence that cruise has on the franchise films one assumes this specific portrayal of hunt is based on the actors wishes for the character i suspect that mcquarrie is afraid of challenging cruise who gave him big breaks with films like jack reacher 2012 and mission impossible  rogue nation mcquarrie may feel a sense loyalty to cruises vision not his own and based on the way he scripts ilsa faust it is obvious that he can write morally confused characters now imagine what mcquarrie could do with ethan hunt by the end of mi6 the biggest question left isnt about how one can top these stunts but what constitutes the next stage in ethan hunts character arc overall mission impossible  fallout is a good summer flick that wont let you down if youre searching for cinematic entertainment mcquarrie has proven himself to be an excellent director for future installments and probably worthy of taking the helm of dc comics film division at warner brothers jj abrams should stay on as a longterm producer of the mission impossible films because he helped mold the series in a sustainable franchise however its tom cruise who may be the issue cruise must cease playing hunt sooner than later if not now otherwise mission impossible films could turn into a form of spy selfparody outdoing the worst of the final roger moore james bond films when it comes to explaining this to cruise in a polite but matter of fact manner that might prove to be the most impossible mission of them all peter bell petergbell25 is a 2016 master of arts  film studies graduate of columbia university school of arts in new york city his interests include film history film theory and film criticism ever since watching tcm as a child peter has had a passion for film always trying to add greater context to film for others his favorite films include chinatown blade runner lawrence of arabia a shot in the dark and inception peter believes movie theaters are still the optimal forum for film viewing discussion and discovering fresh perspectives on culture 
