Dates,Scores,Reviews
Jul 9 2020,positive, mission impossible  fallout 2018 is the best entry into the mission impossible series and is the best action film since mad max fury road 2015 throughout this latest adventure we hear super agent ethan hunt utter the phrase i wont let you down while that plays as a crucial element in the plot we can also examine it from the actor who delivers the line tom cruise at fifty six years young seems to be talking directly at us  the audience  letting us know that he will give us exactly what were looking for high octane action and death defying stunts cruise is one of the last movie stars of his kind combining his immense screen presence with a keen understanding of how to entertain he is the ultimate showman able to adapt to changing times although he has had his fair share of duds he never goes into a project without full commitment think about this the mission impossible series has gone on for over twenty years and is only getting better where many action stars fade the older they get cruise rushes forward pushing the limit both physically and mentally for our enjoyment but fallout isnt just the tom cruise show here now is the emergence of christopher mcquarrie as an elite action director the previous entry mission impossible  rogue nation 2015 was great fun and had plenty of intrigue but fallout tops it with its set pieces intricate plotting and breathless pacing the balance between practical effects and cgi is perfectly handled to a larger degree is an emotional factor that catches us off guard we get all the thrills that we expect and yet mcquarrie who also wrote screenplay sneaks in a character study that makes the material all the richer the cinematography rob hardy is assured and confident we see everything clearly the framing allowing us to witness cruise in full view of his numerous stunt work eddie hamiltons editing cuts between shots with clarity at no point is there confusion in the geography of a set piece lorne balfes score is pulse pounding calling to mind the feel of a crime thriller breaking the episodic nature of the series fallout acts as a direct sequel to rogue nation this time we see ethan dealing with the moral dilemma of being an agent  whether or not its better to sacrifice one life if it means saving millions more that idea has always existed in the background of the previous entries but here is where it comes to full fruition ethan is a man who cannot fathom making the hard choice he would rather sacrifice himself than see a single person perish its that weakness that causes ethan and his partners luther ving rhames and benji simon pegg to lose a case of plutonium into the hands of bad guys putting many lives at risk but that weakness is also ethans greatest strength motivating him to track down the plutonium with unrelenting obsession why does ethan feel the need to go out on a limb even when the goal appears unreachable the answer is the same with many other movie heroes because he has to ethan saves lives because he must and he does it like no one else along for the ride is cia agent august walker henry cavill assigned to keep a watchful eye over ethan and his team theres also the reappearance of the mysterious british agent ilsa rebecca ferguson and solomon lane sean harris the villain of rogue nation who has returned with destruction and chaos on his mind after an early expository scene mcquarrie puts his foot on the gas and never lets up fallout constantly moves even the quieter character driven moments are designed with urgency ethan tackles his mission like a mad man and cruise tackles his role in the same vein cruise performs a halo jump goes on high speed chases in a truck in a car and on a motorcycle through the streets of paris engages in a brutal hand to hand fight inside of a nightclub bathroom  and this is all happens before he famously broke his ankle jumping from one rooftop to another the shot is used in the movie all throughout mcquarrie makes the precise right decisions on how to depict the action the bathroom fight scene is done with no music allowing us to hear and feel every punch the motorcycle chase is shot from three angles in front of the bike to the side and from behind ensuring that we can see cruise is the one driving it narrowly missing being smacked by a passing car during a rescue operation a character is stuck inside of a truck slowly submerging into the seine river the camera inside captures the rising water sideways like a growing wall coming to take its victim mcquarries biggest improvement as a director is by building the tension all the way up to the climax in rogue nation and mission impossible  ghost protocol 2011 the key set piece always happened right in the middle of the plot causing the third act to sink just a bit that is not the case with fallout in which the final showdown is a spectacular feat of imagination execution and fearlessness i dare not describe it to you and spoil the fun not enough can be said about cruises fantastic performance not only in the physical sense at one point he runs so hard that it looks like hes about to take off but also as a dynamic fully developed character to ethan every life matters occasionally mcquarrie will bring the narrative to a standstill and focus in on cruises face during a moment of emotional conflict where he is faced with a decision he simply does not want to make every instance of this is effective causing us to understand that ethan is not a machine but a flesh a blood person whose acts of violence against others leave a lasting effect mission impossible  fallout is the kind of movie that causes people to fall in love with movies the craftsmanship is stellar the performances are great the action aweinspiring and the story deeply involving being a film fan means being in a constant search for an experience that puts us on the edge of our seats and grab the armrests with excitement this delivers that in spades as cruise says i wont let you down  and he certainly didnt
Jul 5 2020,positive,youll be witness to incredible helicopter chases savage fistfights and peak adrenaline full review in spanish
Jul 1 2020,positive, i walked out of mission impossiblefallout 2018 still trying to catch my breath from the 147 minutes of nearrelentless action after an afternoon of thought i had a review outlined in my head ready to write up the next day and then while i slept the sleep of the just brian tallerico went ahead and published a review that says most of what i wanted to say but much much better in sum this film is elevated action believe the hypeall of it writerdirector christopher mcquarrie doesnt mess around we come to action films for action and mcquarrie doesnt subordinate the other filmic elements to the action he carefully molds the action to incorporate other elements into a flowing organic whole character theme location that shot of the arc de triomphe the fight scenes are shot and edited to achieve complete vieweridentification with ethan hunt tom cruise especially one scene that comes off as a quieter more coherent and more exciting version of the casino fight scene in black panther 2018 therere also a couple of callbacks to the henry cavill of the man from uncle 2015 during the paris chase sequence speaking of the paris chase sequence did you know that the cruise of every shot in the foot chase had an ankle that had yet to fully heal you can read about that the 106 halo jumps and a truckload of other insanity in this piece about the stunts having said all that i was surprised to find good acting see this penetrating piece by david ehrlich and a ludicrously complex but logical and thematically resonant plot the film is about hunt trying to make up for a failed mission and having to choose the lesser of two evils at every turn he tries to make good choices but everything just keeps biting him in the ass the refrain of the film were working on it a plan alludes to hunts greatest strength and weakness relying on skill and resources over forethought the film portrays itself as a conflict between saving the many angela bassetts cia director erica sloane and saving the near alec baldwins imf secretary alan hunley but the more accurate conflict is between chess and dd in the end the film barely agrees with helmuth von moltke no battle plan survives contact with the enemy
Jun 30 2020,positive,i firmly believe that if tom cruise can die its going to be filming a mission impossible movie
Jun 20 2020,positive,the film feels tougher and less polished in all the right ways while simultaneously being bigger and more sweeping than ever before its the best of what the mission impossible franchise has to offer
Apr 14 2020,positive,every action sequence in this movie is thrillingly staged with visceral perfection
Jan 10 2020,positive,tom cruise runs on screen for ten straight minutes which means highlevel action enjoyment
Nov 11 2019,positive, it is strange to think that this film franchise a reboot of a 1960s tv series starring martin landau and barbara bach is 22 years old this year however after five films and a global gross of more than 26bn tom cruise is back as ethan hunt in the latest instalment of the mission impossible franchise with  mission impossible  rogue nations christopher mcquarrie back in the directors chair mission impossible  fallout sees ethan hunt cruise and his team try and prevent a nuclear threat from escapee solomon lane sean harris while being under the watchful eye of cia agent walker henry cavill what mcquarrie does in this sixth instalment is to integrate a comfort zone  with pegg ferguson and rhames back as hunts associates there is a familiarity and camaraderie that highlight the fact that his professional attachments are now stemming into the personal in a way it reminds audiences that imf is more than a job to hunt  it is his family given the traumatic events in the first film all those years ago we finally see the emotional effects the job has on hunt and the importance of what he has turned his back on  a normal life at 56 years old cruise shows he has the strength to take on such a physical role taking on more deathdefying stunts that easily surpass the previous mi films including one that caused a notable foot injury he reminds audiences why he is one of hollywoods leading men although the new boy in the franchise cavill is great as cia agent walker whose physicality and detached demeanour makes a perfect foil for hunt pegg and rhames provide the occasional comic relief while ferguson and kirby deliver cool and collected performances even though this is his fourth feature film fallout shows mcquarries confidence as a filmmaker despite the occasional uneven pacing he incorporates plenty of twists and turns that allow the recent syndicate narrative to come full circle in addition rob hardys stunning cinematography makes each scene incredibly sharp combined with exciting sequences such as adrenalinefuelled motorcycle chases to one of the best bathroom fights in recent cinema fallout is easily one of the most thrilling action films this year easily exceeding its predecessors in terms of action story visuals and direction mission impossible  fallout shows that there is still life in the franchise and with mcquarrie at the helm the future looks bright
Oct 29 2019,positive, from the indie darling to the tips you need for day one of the biggest games to classic cheats and codes cultured vultures has you covered when it comes to gaming join cultured vultures as we bring you some of the biggest news from the world of wrestling whether its wwe news or something from across the sea lets talk shop what started in 1996 as a film adaptation of a late 1960s tv series gradually turned into one of the highest grossing film franchises of all time as one who tends to avoid the violence and glamour of action spy films i chose to sit out the mi series for most of my life i didnt expect too much upon seeing mission impossible  fallout to an extent i got what i asked for theres explosions gunshots and literal cliffhangers but with solid characters and a good story the film left me constantly guessing where the plot would go next tom cruise returns in the sixth installment of the mi series as ethan hunt an agent with the impossible missions force whos tasked with saving the world from nucleararmed terrorists like jason bourne or jack ryan hes another american answer to james bond at the same time hunt is clearly weathered from years of the same old mission where he once tried to settle down and have a normal life we learn that his absence from the world scene has made it a more dangerous place his latest mission involves the recovery of three plutonium cores which have fallen into the hands of the international terror group known as the syndicate once his mission becomes compromised he is forced to make a decision between rescuing his colleague luther stickell played by the everwonderful ving rhames and accomplishing the mission he chooses the former rescuing his friend and winds up losing the plutonium cores while his colleague lives to see another day hunts decision results in the plutonium falling further and further into the wrong hands as he begins his quest to find the plutonium old friends and foes emerge from hunts past forcing him to decide which is more important  the fate of his loved ones or the fate of the world the story almost has a goldeneye feel to it the protagonist is a borderline rogue agent willing to bend the rules in order to accomplish the mission unlike bond though hunt has more humanity in that hes willing to put the lives of others before the success of a mission cruise gives a solid performance as the personally compromised ethan hunt i never once lost interest in him and was able to bond with the character from the start  the remaining ensemble give stellar performances as well usually apart from the protagonist we have plenty of throwaway characters replete with oneliners and slapstick gags in vain attempts to provide comic relief often failing we dont get that with this one they pop up every now and then but only when necessary every actor does his or her part with their given character who have their own strengths and weaknesses in the story plus the film also stars angela bassett  always one to give your film an extra iq point granted mi  fallout does have its weaknesses the runtime 2 hours and 28 minutes serving up the biggest one while we have a compelling plot with thrilling moments it does tend to drag towards the end were all on the edge of our seats which is fine but when the climax keeps going and going the suspense tends to dull the senses but hey at least the movie kept me in my seat until the credits unlike say valerian and i dont mind being stuck on a rollercoaster so long as i know the cars are moving closer to the edge is this the best action film in the world no is it the best in the mi series probably probably not ill let the fans decide on that one for me it gets a passing grade it could have been chopped down by 20minutes but even then it never loses its audience  and thats what you must shoot for when telling a story  some of the coverage you find on cultured vultures contains affiliate links which provide us with small commissions based on purchases made from visiting our site we cover gaming news movie reviews wrestling and much more  gamezeen is a zeen theme demo site zeen is a next generation wordpress theme its powerful beautifully designed and comes with everything you need to engage your visitors and increase conversions
Oct 17 2019,positive, it would seem impossible but the mission impossible film franchise keeps getting better and better for 22 years now paramount pictures has produced one excellent action film after another in this series and the latest entry may be their best actioner yet written and directed by christopher mcquarrie mission impossible  fallout delivers the most thrills the highest level of tension and the greatest number of how the hell did they do that action sequences of any of the m i films so far as if thats not miraculous enough its leading man is the 56yearold tom cruise and hes still giving this series his absolute all he runs jumps hangs from the rafters and performs one amazing stunt after another impossible incredible in this outing cruises spy character ethan hunt spearheads one of the impossible mission forces most dangerous assignments a terrorist organization called the apostles is threatening nuclear proliferation if their anarchist leader solomon lane sean harris is not released pronto the apostles will return the three stolen plutonium warhead cores theyve stolen upon his safe return hunts team including venerable supporting players luther ving rhames and benji simon pegg arrange a gobetween to get their hands on the warhead cores first but theyre doublecrossed at the exchange by an unknown player the nukes are now loose while imf team licks their wounds and that inspires cia chief erica sloan angela bassett to send in one of her own to chaperone the imf teams rescue mission hunt doesnt like being babysat especially from a macho thug like cia agent walker henry cavill in that serious mustache youve heard so much about the two alpha males dont trust each other and their conflict makes for truly delicious tension in every single scene they have together nonetheless they must find a way to bond for the sake of the mission and soon hunt is posing as an arms dealer to sidle up to a black marketer named white widow with walker in tow the widow is played with coy charisma by vanessa kirby from the crown and she still has her regal bearings even though shes playing a crook here adding further complications to the rescue mission are the plethora of thugs that the white widow employs and they dont trust hunt et al either making a perfect storm is the inclusion of ilsa faust rebecca ferguson their mi6 counterpart from the last movie she shows up with a vendetta against terrorist lane and hunt doesnt know if she can be trusted is she on the allies side or has she gone rogue whats walkers real role in the mission and what angle is alec baldwins hunley playing especially since he was cia in the last film before taking over the imf all these untrustworthy characters trying to work together makes for exciting tense and drolly funny interplay this outing is almost as entertaining while theyre all standing around arguing as it is when they are running around and saving the world however the set pieces are truly a cut above the quality one finds even in this fantastic franchise in fact in set piece after exciting set piece audiences will be blown away by how adroitly conceived and choreographed they all are theyre complex take place in busy locations and deliver maximum thrills throughout  a fist fight in a nightclub bathroom turns into a bareknuckled brawl that would make john wick envious a rooftop chase turns into a thrilling obstacle course for hunt rendered all the more impressive by its use of london locales and cruises acrobatic leaps and bounds and an extended car chase through the streets of paris is as amazing for all its different twists and turns on the streets as it is in the cat and mouse plotting with players turning against each other on a dime im sorry franc yet the best is saved for the last 30 minutes when mcquarrie literally employs a ticking clock and sets up an actual cliffhanger for his storys climax again most of what were watching onscreen occurs in real locations not in makebelieve green screens filmed in a contained studio this all looks incredibly real and most of it definitely is that includes cruise doing things like climbing up a rope hundreds of feet above the ground to hijack a flying helicopter granted hes probably supported by wires that have been taken out in post but hes still hovering way above the landscape few stars would ever endeavor to do something so dangerous but it makes this franchise all the more fun because its leading man relishes such challenges in a summer that has seen too many sequels already this one stands out from the crowd as its crown jewel we may be six films in but if theyre going to be as continually terrific as this the action franchise should go on and on even without the aging cruise in the lead that probably wont be any time soon though especially if he can still show the moves he demonstrates so ably in this one theres no slowing him down or this superior franchise for that matter  jeff york has been writing film criticism online since 2011 his weekly blog the establishing shot is read in 27 countries and he was a film critic for the examiner online for six years covering mainstream cinema as well as horror until the magazine shuttered in 2016 jeff comes from the world of chicago advertising and hes also an illustrator whose work has appeared in hundreds of periodicals including playboy the chicago tribune and w magazine jeff is an optioned screenwriter an original member of the chicago indie critics cic and belongs to both sagaftra and the international screenwriters association you can find his reviews on rotten tomatoes as well
Sep 2 2019,neutral, mission impossible  fallout had the best opening weekend of the entire series with 612 million and another 946 million overseas this is the film tom cruise broke his ankle on and the film henry cavill just had to have a mustache for that made those reshoots for justice league have such disastrous results the sequel has a whopping 97 fresh rating on rotten tomatoes and an 86 metascore on metacritic critics and the general moviegoing audience emphatically and enthusiastically adore this film and personally it doesnt register why the mission impossible franchise is so cherished by movie lovers writerdirector christopher mcquarrie sean harris as villain solomon lane and rebecca ferguson as former mi6 agent ilsa faust all return from mission impossible  rogue nation this is the first film where a director and a villain have returned from a previous film the technical aspects of the film are the easiest to admire and the action sequences are outstandingly breathtaking the big action sequences include the parachutefree fall sequence with ethan hunt tom cruise and august walker henry cavill the bathroom brawl with hunt walker and john lark hunts motorcycle chase hunt running and jumping across rooftops and the insane helicopter chase its ridiculous in a good way how much room cinematographer rob hardy annihilation ex machina gives each sequence these are scenes made for seeing and experiencing in imax you can tell that the majority of the stunts were pulled off practically and green screens and computer generated effects are utilized minimally the most impressive sequence is the motorcycle chase because tom cruise races through the wrong side of traffic without a helmet in the circle around the arc de triomphe in paris but the helicopter chase features cruise climbing up a rope dangling in the air while the helicopter is airborne these sequences are extremely open with perspectives that not only make you feel like youre with tom cruise being just as nuts and exhilarating as he is but also seem to be making the statement that cruise is still crazy enough to do the majority of his own stunts at the age of 56 despite his saggy jowls many on social media were claiming that mission impossible  fallout is nonstop action over its nearly 150minute runtime but that doesnt seem to be the case the film seems to be attempting this never ending adrenaline rush found within the likes of films like mad max fury road and speed but it fails to do so the action is superb but everything in between is extraordinarily dull missing the first and third films in the franchise may have contributed to that but theres not much to miss here if you havent seen the other films in the franchise hunt obviously still cares about his exwife julia meade michelle monaghan but currently has a connection with ilsa faust the spy element of the sequel feels so cliché and predictable as every twist and big reveal can easily be predicted even if this is your first mission impossible film the inclusion of a bomb in a mission impossible film feels explosively juvenile at this point and you legitimately have no investment in these characters whatsoever with every mission impossible film thats released it seems like its main purpose is for tom cruise to be like mad tvs stuart and yell look what i can do before partaking in extracurricular activities a man in his fifties should probably be distancing himself from to be fair cruise is still more than capable of doing incredible action films and is generally a part of films that aim to be exciting for everyone fallout is extraordinary if you scrutinize without any sort of context the film knows how to make your pulse race and your palms sweat as you gasp for breath but the story is the same as any other mission impossible film and the sequel is basically dead as far as any sort of emotional acting goes theres no substance here and impressive action doesnt make up for a defused storyline
Sep 1 2019,positive,  comicbookmoviecom andor the user who contributed this post may earn commissions or revenue through clicks or purchases made through any thirdparty links contained within the content above   disclaimer as a user generated site comicbookmoviecom is protected from liability under the dmca digital millenium copyright act and safe harbor provisions content herein has been submitted by users who have agreed to our terms of service and community guidelines comicbookmoviecom will disable users who knowingly commit plagiarism piracy trademark or copyright infringement comicbookmoviecom and best little sites llc are not liable for inaccuracies errors or omissions 
