Dates,Scores,Reviews
"Dec 11, 2023",positive," I’m a Godzilla casual. An awful lot of movies take up mental real estate in my head, and it must be said, movies featuring Japan’s large reptilian son aren’t really among them. Nothing against the Big G! The first appearance of the iconic kaiju in 1954 is absolutely a classic. 2016’s Shin Godzilla is beloved by me since it merges giant monster action with a clever satire of inefficient bureaucracies. As for the rest? For the most part, my belief was that Godzilla movies were disposable fluff. In the old days, you’d stick people in uncomfortable rubber suits, have them stumble through a cardboard mockup of Tokyo, then call it a day. Later, CGI wizards took the place of the suits, but the song remained the same. Big monster, unsuspecting urban area, cardboard characters and cityscape, wash, rinse, repeat. There’s more to it than that, and there’s a reason Godzilla has been rampaging through movie screens for nearly seventy years. A wide variety of stories can be told featuring him, some of which can have an emotional impact that hits with the force of atomic breath. Don’t believe me? I direct your attention to Godzilla Minus One, a kaiju movie with equal amounts of heart and spectacle. In the closing days of World War II, Koichi Shikishima (Ryunosuke Kamiki) has decided not to die. He’s a fighter pilot, a skilled one, yet he’s been assigned kamikaze duty. So he lands his plane at an airbase on the remote Odo Island and tells the men there of mechanical issues. They can’t find anything wrong with the plane, and they suspect Koichi is a liar and a coward. They have bigger problems. Overnight, it comes ashore. The locals speak of it in whispered tones, a creature the size of a dinosaur. They call it Godzilla, and when it attacks the men, Koichi has a chance to kill it. He freezes up. Fails. When Koichi awakens the next morning, he learns that Godzilla has disappeared into the sea after slaughtering most of the men. The only other survivor is Tachibana (Munetaka Aoki), who burns with hatred toward Koichi. Two years pass, and Koichi returns to the ruins of Tokyo. He learns his parents were killed in a firebombing. He has nothing, like so many others, and shame follows him like a shadow. Life moves on, and so does Koichi when he meets Noriko Oishi (Minami Hamabe), a young woman who has vowed to care for a young child (Sae Nagatani). The two of them join Koichi and, over time, they build something that looks like a family. Then, America tests an atomic bomb at Bikini Atoll. The bomb works. So does the radiation, which mutates the formerly dinosaur-sized Godzilla to skyscraper heights. The creature destroys a number of battleships as it makes its way to Japan. It’s an unstoppable force that must be stopped, and it may be the means for Koichi to achieve redemption. I try to admit when I’m dumb,* and try to learn and grow beyond my buffoonery. One way I’ve been dumb is the assumption that a Godzilla movie is a showcase for stuff getting wrecked and nothing more. It’s true that Godzilla Minus One does have some jaw-dropping moments of mass destruction. Director Takashi Yamazaki had a budget of around $14 million to make this film, and the end result looks as if it cost ten times that. He was quoted as saying, “…the staff and I have worked together to create a setting where Godzilla looks as if “fear” itself is walking toward us, and where despair is piled on top of despair.” That’s accurate since this is the first time I can recall Godzilla being scary. Instead of us seeing a giant monster wrestle another giant monster, Yamazaki shows us a force of nature, an earthbound god that exists beyond human concerns.  But where my assumptions are elegantly proven wrong is in Yamazaki’s script. He does the impossible by writing a Godzilla story in which we deeply care about the human characters. We’ve got an effective drama about people rebuilding their lives in post-war Japan, about the effects of PTSD and survivor’s guilt on soldiers and civilians. Wisely, time is spent getting to know these people and their lives. That means when Godzilla stomps ashore, it matters what happens to these characters. It was so effective that when a major kaiju attack took place, I was genuinely worried that Koichi and Noriko’s little handmade house would be destroyed. Consider that if you removed the Godzilla parts, you’d still have a damn fine movie. I wouldn’t want to be an actor on a project like this. It feels tricky, since you’d need to balance the usuals (staring into the sky awestruck, running, screaming) with the creation of a lived-in character. To be sure, there are some stereotypes here (the tormented veteran, the supportive pseudo-spouse, the scientist with theories nobody believes), yet the cast pulls it off with aplomb. I liked Ryunosuke Kamiki very much as the damaged Koishi. He does a cool thing with his performance where we’re initially meant to think he’ll die heroically to make up for his actions on the island, then he shows a change in Koishi. We see him discovering that he has things to live for, people to fight for, instead of a fiery death in the name of honor. It’s a performance that’s both smart and subtle. Godzilla Minus One is one of the strongest blockbusters of 2023, a movie I could see easily smashing its way onto my best of the year list. Are there other Godzilla movies out there as skillful as this one? I have no idea, but I’m pleased and kind of stunned that we have this one. Do yourself a favor and see this on the biggest screen possible."
"Dec 10, 2023",positive," Toward the end of World War II, kamikaze pilot Kiochi Shikishima (Ryunosuke Kamiki) lands on Odo Island for a mechanical problem, but only he and mechanic Sosoku Tachibana (Munetaka Aoki) survive an encounter from an ocean god the locals named “Godzilla,” a gargantuan lizard bigger than a Tyrannosaurus rex that really dislikes being shot at. Kiochi returns to his devastated home town following the war, reminded of his cowardice daily by neighbor Sumiko (Sakura Ando). With so few people remaining, he permits a young woman, Noriko (Minami Hamabe), and an infant to stay with him in what’s left of his parent’s home. Finding dangerous but lucrative work removing sea mines with other displaced locals, Kiochi discovers the Sea God of Odo Island has been affected by the atomic testing on Bikini Atoll, appearing larger and more powerful than before. Occupied, war-torn, and disarmed, Japan is already hanging on by a thread, but a living disaster is about to strike a nation with no means to defend itself… and no one is coming to save it. Following his Japanese introduction in 1954 as the first of over 30 Toho films, there isn’t a film fan alive who doesn’t know the name “Godzilla.” Following a low point in 1998 (sorry, Matthew Broderick), it wasn’t until 2014 that Godzilla appeared in the Monarch storyline films for Legendary that an American production won over fans with their Hero-zilla. To commemorate the big guy’s 70th anniversary, Toho announced Minus One — written and directed by SFX supervisor Takeshi Yamazaki — recasting Godzilla as a force of nature exacerbated by human arrogance. The new film not only hammers home that actions have consequences but tells a human story of existence in a war-torn land with an impossible apocalypse marching toward them. It’s a tall order even for the undisputed King of the Monsters to unleash something new, but with modern moviemaking effects and seven decades of stories in the history books, where will Minus One rank among all the Godzilla movies to date? The trailer paints a disturbing and dangerous picture of Godzilla, but Kiochi’s story is the lens through which viewers experience the rise of the monster. Questioning duty, blind obedience to government politics, and what it means to be a patriot, the all-too human arc from reluctant suicide pilot ordered to die into a determined fighter by choice is organic, heartbreaking, and cheer-worthy. His fear is as visceral as his regret, unable to fight when he was told to but also unable to let it go of his guilt as a survivor. While the ladies sadly take a back seat to much of this story in a time and place where men are front and center, the actions they’re able to take are salient nonetheless. Everything else is an unholy marriage between Dunkirk and Jaws served up with a side of raw courage, making for an incredible film in addition to being a great Godzilla movie. On land, this Godzilla appears like something from Jurassic Park by way of Cloverfield through a series of up-close POV shots; his movement only appears smooth as his temper flairs, especially in his irradiated larger form. Since the water is his natural environment, the only chance one has to avoid his piercing gaze is something else unfortunately gaining his attention. His atomic breath retains the popular blue energy glow working its way up from tail to mouth, adding an extruded dorsal fin plate like chevrons on a stargate as it powers up, retracting all at once when unleashed. What’s different is the effect upon whatever that weapon touches; remember the blast from The Iron Giant when it targeted a ship off the coast and thankfully missed? Even more incredible is the reported budget for delivering this blockbuster: $15 million, a tenth of what Legendary spent making Godzilla vs. King Kong. It’s long been a discussion among fans — no matter how cheesy the man-in-suit effects actually were stomping through model cities in slow motion — what it would be like if Toho employed state-of-the-art VFX in a new Godzilla film? That has now been decidedly answered, and it’s everything one could hope for. In addition to an Apple TV+ “Monarch: Legacy of Monsters” series, Legendary has also released a trailer for it’s next film — Godzilla x Kong: The New Empire — but after Minus One, it’s far more interesting to wonder what Toho will do next with their current success."
"Dec 9, 2023",positive," For nearly 70 years, dozens of Godzilla movies – the first appeared in 1954 – have been audience favorites the world over. This one isn’t really a monster movie per se. It’s about a group of people, and a nation, and how they react to this gargantuan presence. It’s no exaggeration to say this is a masterpiece by writer/director Takashi Yamazaki. The focal character is a kamikaze pilot in the last days of World War II. Koichi (Ryunokuke Kamiki) who makes a decision not to complete his suicide mission but to pretend his plane is having engine problems. He lands on an island. In the meantime, Godzilla returns after the U. S. military completes a nuclear test on Bikini Atoll. The creature, bigger and more dangerous than ever, slogs his way to Tokyo, smashing buildings, vehicles and people on his rampage. And to tell you more wouldn’t be fair. The realistic look of the movie – battle scenes, Godzilla pursuing a boat, people fleeing the monster – are riveting. To have a successful garden, you need to know when it is the best time to plant. Here are the best plants to start in May."
"Dec 9, 2023",positive," Por lo general evito recurrir a la hipérbole, a hacer declaraciones precipitadas cuando apenas llevo 24 horas de haber visto un filme, incluso tras verlo dos veces ayer, en su día de estreno, pero pues… aquí va: Godzilla Minus One es la mejor película del protagonista de la legendaria franquicia cinematográfica japonesa de Toho Studios. Es la definición de un big crowd pleaser, un apoteósico blockbuster realizado con el equivalente al presupuesto de una producción de A24 ($15 millones), repleta de asombrosas imágenes, desbordándose en inmensas emociones y poblada de personajes inmediatamente entrañables. Es todo lo que un largometraje de entretenimiento masivo debe aspirar a ser, a conquistar los corazones del público a través de la empatía, de la cautivante dramatización de sentimientos humanos, mientras estimula sus pupilas con un espectáculo hecho para verse en grande, todo envuelto en un perfecto y colosal empaque. El fantástico filme del cineasta Takashi Yamazaki no reinventa la serie, pero sí la devuelve a su pasado, incluso más atrás de lo que jamás se haya explorado en sus casi 70 años de historia. No tiene conexión alguna con ninguna de las otras entregas japonesas ni estadounidenses, ni pretende ser una precuela al clásico de 1954 del director Ishiro Honda. La trama se remonta al Japón post guerra, específicamente entre 1945 y 1947, y gira en torno a “Koichi Shikishima” (Ryunosuke Kamiki), un piloto kamikaze que aterriza su avión en la pequeña isla de Odo (fans de Godzilla reconocerán el nombre y anticiparán lo que se avecina) tras reportar supuestos problemas con el avión. Allí es recibido por el mecánico “Sosaku Tachibana” (Munetaka Aoki), quien tras examinar el vehículo, no encuentra fallo alguno. Son los últimos días de la Segunda Guerra Mundial, el imperio de Japón está de rodillas y “Tachibana” entiende y comprende lo que está ocurriendo: “Shikishima” le está rehuyendo a su obligación patriótica de morir con su avión, y es justo en este tira y hala entre el deber y lo moralmente correcto que el largometraje se debate a lo largo de toda su duración.  No han pasado ni cinco minutos de haber iniciado la proyección y Yamazaki ya ha establecido el dilema central de su libreto, y apenas dos minutos después, hace su espeluznante entrada el titán nipón, cuando gojira -la mítica criatura que habitaba en esa área, según sus habitantes- ataca el campamento y mata a la mayoría de los soldados luego de que “Shikishima” se paralizara del miedo al no atreverse a dispararle al monstruo. No bastaba con ya venir cargando con el peso de sus acciones pasadas -o, más bien, sus inacciones- cuando el piloto ahora también se echa encima la culpa de las muertes de estos hombres. El mero hecho de que continúe con vida es prueba de lo que él considera su mayor fracaso y los fantasmas, tanto de sus decisiones como de las vidas que no salvó, es la fuerza motora que impulsa el argumento y lo hace tan dramáticamente persuasivo. Verán, Godzilla Minus One no es tanto como un típico largometraje de Godzilla, sino más bien un melodrama postguerra, profundamente humanista, en el que el gigante forma parte del reparto.  Mucho se ha escrito sobre lo aburridos o desechables que son los personajes de esta saga, pero estos son argumentos generalmente hechos por personas que solo han visto las películas del llamado “Monsterverse”, o sea, las gringas. En las japonesas -y no es que los 33 largometrajes estén colmados de papelazos para los actores y actrices que aparecen en ellas- el componente humano tiende a ser un factor importante, y posiblemente no había sido tan valorado como lo es en Godzilla Minus One desde la cinta original. El retorno de “Shikishima” a las devastadas calles de Tokio expande el elenco a la vez que intensifica el melodrama al recrudecer el conflicto interno del protagonista, no solo por la miseria que lo rodea, sino también por cómo su vecina, “Sumiko” -interpretada por la excelentísima Sakura Ando-, lo fustiga por aún estar vivo. El muchacho halla consuelo a sus angustias en otros sobrevivientes de la catástrofe: en la amorosa “Noriko” (Minami Hamabe) y la bebé “Akiko” (Sae Nagatani), con las que forma un hogar, así como en sus compañeros de trabajo, con quienes sale a navegar para desarmar o detonar las minas que quedaron flotando en altamar.  Sin la atención dedicada al desarrollo de estos personajes y los vínculos entre ellos, Minus One pudo haber sido otro filme en el que el principal atractivo es ver a Godzilla haciendo pedazos una ciudad, pero el norte de Yamazaki no podría estar más lejos del simple despliegue de fabulosos efectos especiales. Su intención es hacer que el monstruo radiactivo se sienta verdaderamente monstruoso, algo que logra no solo a través del estremecedor diseño de la criatura -con su mirada penetrante y bestial fuerza bruta- sino mediante el poder de destrucción que guarda su distintivo rayo atómico, que esta vez se manifesta en pantalla con toda la pavorosa potencia de una bomba nuclear. No es inusual que uno le vaya a Godzilla en una de sus películas, pero aquí las lealtades del espectador -incluso las del mayor fan- están firmemente del lado de los hombres y mujeres en pantalla, lo cual hace que el tercer acto sea una experiencia sobrecogedora que alcanza estratosféricos niveles de emoción -con la ayuda de la estupenda banda sonora de Naoki Sato- y en el que el porvenir de la sociedad yace en el poder colectivo de los ciudadanos comunes, y no en ninguna agencia gubernamental, ejércitos ni sobrehumanos.  Godzilla no será sinónimo de “éxito garantizado”, y todo buen fan sabe que sus aventuras vienen de todos los colores y sabores, de lo sublime (Shin Godzilla) a lo ridículo (Invasion of Astro-Monster), de las ecológicas (Godzilla vs Hedorah) y socialmente (Godzilla) conscientes, a las que solo se tratan de ver a un montón de titanes entrarse a golpes por 90 minutos (Godzilla, Mothra and King Ghidorah: Giant Monsters All-Out Attack), pero ahí está el detalle que se le escapa a muchas de esas otras franquicias: Godzilla sabe transformarse y puede ser muchas cosas. Puede ser seria, puede ser tonta, puede moverse de la comedia a la acción y de la ciencia ficción al horror, subir al espacio y bajar al núcleo de la Tierra, pero siempre, siempre, siempre se esmera por ser divertida. Hasta las más malas tienen su encanto Al final del día, la gente quiere ir al cine a pasar un buen rato, y Godzilla Minus One es uno de los mejores que se vieron en el 2023. "
"Dec 8, 2023",positive,"The first Godzilla movie that made me cry, but also the first one that made me feel afraid."
"Dec 8, 2023",positive," Aun en el 2023 todavía persiste la idea de que en el cine de género es dominado por convenciones cinematográficas comerciales con casi ningún espacio para expresión artística. Si hay una película que desafía eso y podría aplastar permanentemente ese prejuicio, es “Godzilla Minus One”. "
"Dec 8, 2023",positive," One of the most infamous creatures in movie history is back in ""Godzilla Minus One,"" the 37th film in the franchise that dates back to the 1950s. The latest entry may be one of the best yet, combining a fantastic mix of chaos and mayhem with some stirring human elements that give it unexpected depth and heart. It's the film that Hollywood has been trying to capture for years, and have mostly failed. ""Godzilla"" takes place near the end of World War II with kamikaze pilot Kōichi Shikishima (Ryunosuke Kamiki) landing on Odo Island with mechanical issues. When the island is attacked by Godzilla, Shikishima freezes up in a critical moment, unable to save nearly everyone else on the island from the creature's wrath. The guilt from the incident weighs heavily on the pilot, who returns to Tokyo working as a minesweeper. Shikishima takes in a young woman named Noriko Ōishi (Minami Hamabe) and an orphaned infant named Akiko, who Ōishi rescued. The three form a makeshift family trying to start a new life after the devastation of the war, but just as things start to return to normal Godzilla returns — a more dangerous version of the creature encountered on Odo Island with nuclear tests conducted by the United States causing Godzilla to mutate into a seemingly indestructible force. One of the problems with Godzilla films, particularly American versions, has been the decision to go story heavy with only flashes of the monster (sometimes keeping the monster hidden for almost the entire film). Writer/director Takashi Yamazaki never falls for that trap in ""Minus One"" with the creature as much a part of the story as the human element. There are some wonderful scenes of destruction and Godzilla doing what fans expect, wrecking havoc. The sequences are spectacular with well-crafted special effects that really bring the creature to life. Just watching Godzilla be Godzilla is enough to make the film work, but what takes this film to another level is the way the audience really feels the aftermath of the devastation — the toll it takes on the human characters, especially the two leads. It's that unexpected human element, with some fun, well-developed supporting characters thrown in, that takes this Godzilla to another level. Sure, you have seen the monster before but this is Godzilla at his very best — a fun action film that also has a compelling story to be more than just chaos. "
"Dec 8, 2023",positive,"Most impressive is the writing and the emotional depth of the story being told. This is one of the great genre movies in recent memory, and I hope this team goes on to make more Godzilla movies moving forward."
"Dec 8, 2023",positive," If you have any interest at all in giant creatures, see this movie on the biggest screen possible. If you have any interest at all in the future of humanity, see this movie on the biggest screen possible.  Originally scheduled for just a one-week engagement in theaters, the run has been extended by distributor Toho International, which gave me an opportunity to sneak out from work and see it. Although the film is not “true IMAX” — see this detailed Polygon explainer — I went to Cinemark 17 IMAX, which has the biggest screen in Dallas, and a tremendous sound system, especially from my seat in the middle near the top.  The experience was top-level, both visually and sonically. Early reports suggested that it was an emotional experience as well, which I scoffed at … until the movie began and displayed the Toho label. I started crying.  As a young boy in the 1960s, I often watched our 10″ black-and-white television by myself, especially ‘creature features’ that often popped up on Saturday afternoons. Inevitably, that include the likes of King Kong (1933) and, of course, multiple Godzilla and other giant monster movies. Something about the monsters attracted, rather than repelled me, and I always found myself rooting for their survival. Was it because we had a family dog who was bigger than me? Was it because my father and older brother were bigger than me? Beats me. Whatever the source of my identification with these unsung heroes, I could never imagine seeing any of those movies on a big screen in a proper movie theater. Seeing the Toho opening credit instantly sparked a cascade of memories from watching dozens of Toho monster movies.  Godzilla Minus One begins on an island during the dying days of World War II. Claiming that his engine is in need of repair, kamikaze pilot Shikishima (Ryunosuke Kamiki) has sought refuge at the military airplane facility located on the island. Head mechanic Tachibana (Munetaka Ando) reports that the engine is not, in fact, in need of repair, but acknowledges that the war is, indeed, lost, and that further suicidal actions would be pointless.  Then the island is attacked by a giant lizard that bites soldiers in half and tosses their bodies hither and thither, stomping on more as it comes ashore, impervious to the weapons wielded by the soldiers in a panic. Tachibana urges Shikishima to his plane so that he can fire his weapons, including bombs, at the creature and kill it.  Shikishima is unable to fire his weapons, nearly all the soldiers all die. Only he and Tachibana survive; he is haunted and wracked by guilt.  Written and directed by Takashi Yamazaki, who made his initial mark in the U.S. with Returner (2002), the film develops the guilt-wracked theme throughout the drama that develops, as Shikishima ends up caring for Noriko (Minami Hamabe) and an infant girl who she found, orphaned in the wreckage of Japan. They form a make-shift family, struggling to survive. Another family unit is created when Shikishima finds a job, which leads him to the sea and an eventual reunion with Godzilla.  The monster attacks are terrifying in their intensity and brutal in their effect upon society. Whereas Shin Godzilla (2016), for example, was all about government  bureaucrats and how their endless squabbling impacted the citizens, Godzilla Minus One is all about the citizens and how they are affected by governmental inactions. In that sense, it’s an answer film to both Shin Godzilla and Oppenheimer (2023), which both focused on the decision-makers rather than the victims of those decisions.  You may have to be a longtime kaiju follower and fan to appreciate all the creative, cinematic choices that are made in Godzilla Minus One. Yet you need only be a fan of cinema and a human being to appreciate a movie that values life. This film has no internal logic and intentionally avoids the subject it is supposedly addressing. It is technically proficient visually, but poorly written and edited and unlike the original Godzilla substitutes the reality of the horrors of nuclear war with western-style blockbuster romance and last-minute rescues. Copyright 2010-2024 Peter A. Martin. All rights reserved. No portions of this material may be used without the express written permission of the copyright holder."
