Dates,Scores,Reviews
"Apr 7, 2024",positive," One year shy of its 70th anniversary, Godzilla makes a return to the big screen with a Tojo effort that makes the American renditions look like drive-in disasters in Godzilla Minus One. At the tale end of World War II, a Japanese kamikaze pilot (Ryunosuke Kamiki) makes an emergency landing on a small mechanics’ island where he hopes no one will figure out that he’s deserted in the face of fear. His worst nightmares are realized but no one will bear witness as Godzilla strikes and kills nearly everyone on the island except our protagonist and one mechanic. As he returns home, the destruction of the war has left the country reeling and with his parents dead, he seems adrift in his shame and frustration, returning to work as a necessity. It’s while working on a wooden fishing boat blowing up floating mines that he and his crewmates discover that Godzilla is back and will be heading for mainland Japan. They can’t stop him the first time but a crew of retired military seamen will certainly try to stop his eventual second arrival. While the film doesn’t entirely deal with the human devastation the war caused, nor the nuclear origins of Godzilla, it paints the Japanese people as beleaguered but undeterred in rising from the devastation and preventing it from happening again. That theme succinctly frames the post-war struggle of Japanese society and its intent to rise from the ashes stronger and better. It gives the narrative added resonance even with all the monster elements that make it fit within the long history of Godzilla films. The performances range from passive (Kamiki and Minami Hamabe as his wife) to excessive (Kuranosuke Sasaki as the gruff boat captain) with only Yuki Yamada as the young crewman who didn’t get to fight in the war due to his age striking the right balance. While those exaggerated performances fit better within a traditional Godzilla movie, this felt like it was trying to be a more crafty disaster movie than monster movie. To that end, the visual effects were largely good, though the opening sequence where Kamiki is landing on the island looked incredibly chintzy as if they wasted their budget on everything else and had to make do with the start. Beginning poorly can have its benefits but that’s a rare situation and this wasn’t one of them. Godzilla Minus One, in spite of its flaws, is an enjoyable film that hits its beats nearly perfectly, eliciting emotion with careful precision. The king of monster/disaster films remains such in his latest outing. While it might not be the dramatic interpretation we should have gotten, it’s still immensely entertaining."
"Apr 1, 2024",positive," “Godzilla Minus One” (2023) is set in post-World War II Asia and follows Koichi Shikishima (Ryunosuke Kamiki), a former Japanese kamikaze fighter pilot who is disgraced and feels guilt ridden over choosing to obey his filial duty of surviving over his country’s orders to die for his nation. As Japan begins to recover, Koichi cannot move on and follow his heart by marrying Noriko (Minami Hamabe). When Godzilla begins attacking Japan, he finds a path to redemption and is determined to stop Godzilla so Japan does not have to fall into ruin again. Japanese Godzilla movies were a staple of my childhood and a vague memory. I have not revisited them in adulthood nor seen the more recent installations. “Godzilla” (1998) starring Matthew Broderick was an utter disappointment, and “Godzilla” (2014) was barely a notch above though the subsequent MonsterVerse movies have shown some promise. “Godzilla Minus One” is critically acclaimed for a reason. It has excellent production values, has a majority Japanese cast and covers fresh territory by commencing during a time that has only been alluded to in the mythology: Godzilla was a dinosaur that mutated because of exposure to nuclear radiation. This Godzilla is thick. A friend with zero interest in seeing the film said that this kaiju has boobs, which is hard to unsee, but neglected to mention the giant thighs and butt. Godzilla is downright curvy, but objectifying this snowflake spiked overgrown lizard would be a mistake. According to the mythology, Westerners treat Godzilla like a monster, but Japan treats him as a destructive god. If they were describing Godzilla’s regeneration abilities, which renders the creature immortal, they are right. Equally intimidating is the laser-focused, red-eyed stare, which evinces a determination and focus that indicates brains backing Godzilla’s brute force. A favored feature is when Godzilla’s spikes rise and glow bright white blue to indicate when Godzilla is going to use their atomic breath, which has the effect of an atomic bomb though Hiroshima and Nagasaki are never explicitly referenced. The shockwave goes in and out like breath and wreaks complete havoc, blasting things away then sucking them back in. Godzilla becomes a sanitized, denationalized symbol of Japan’s conquerors in World War II-a chaotic, merciless death dealer. Godzilla’s attacks are random and undeserving, a force of nature, unlike the consequences of World War II, which were arguably earned. Initially it seemed promising that “Godzilla Minus One” was set in post-World War II Japan. I overshot my expectations and thought that the film would grapple with the atrocities that they committed during that era, but instead it deals with the defeat and demoralization. Koichi is easy to like since he is insubordinate to a bellicose regime so it is hopefully unlikely that if the film rewound, Koichi would not be caught doing anything that should earn him a ticket to hell. He still feels guilty because writer and director Takashi Yamazaki is still Japanese, and everyone has a certain degree of national pride so he frames this disobedience as a failure to protect the defenseless when he has the ability to fight. (There would be no need to defend people if Japan had not become allies with the Nazis and started attacking people….) As Koichi rebuilds his life, including saving Noriko, he cannot enjoy it. Noriko does not have a fleshed-out character. She saves babies, wants to live, and begs Kochi to confide in her. Yamazaki does a great job of showing that time is passing by showing the environment transform from ruins to solid structures, and the fashion changes from traditional to Western. When Noriko decides to get a job and wears a suit, it felt as if the camera treated her like the equivalent of Pamela Anderson running on the beach. In the end, her will to live becomes optional when Godzilla decides that he wants to take the same train that she is on, and she just appears to give up. Honestly same, girl. Same! No one is going to save Japan. The US even rescinds demilitarization and says, “May the odds be ever in your favor,” because it is too busy with the Soviet Union. The Japanese government gets nothing but shade from its citizens, and the characters deride their government as secretive and unhelpful. So a rag tag bunch of navy veterans, now family men and one former kamikaze decide to forge a plan to stop an immortal. While “Godzilla Minus One” sidesteps the awkwardness of Japan’s role by slamming its government, it was a little troubling how easy it was to find battleships and fighter planes that were supposed to be decommissioned. Yes, one ship is officially returned to Japan (only for Godzilla to immediately destroy it), but the nation that raped its neighbors is not someone that you want hiding weapons two seconds later. Yamazaki is using “Godzilla Minus One” to create an alternate history where the World War II Japanese veterans are not possible war criminals, but valiant defenders of people. The protagonist’s last name, Shikishima, happens to be the same as the Shikishima Squandron, which conducted the first successful kamikaze attack on the US. Ew. It comes from “Shikishima no Yamato Gokoro,” an Edo era Motoori Noringa’s tanka, a short poem, which is hung in the Yushukan war museum, which was built in the late nineteenth century, but honors kamikaze pilots in World War II. The poem reads, “If someone asks about the Yamato spirit [Spirit of Old/True Japan] of Shikishima [a poetic name of Japan]—it is the flowers of yamazakura that are fragrant in the Asahi [rising sun].” By erasing history as the aggressor and turning the Japanese into helpless, outmatched defenders, Yamazaki is getting the ordinary moviegoer, who may not even know about the horrors of the Pacific theater, to cheer for the Japanese to become a militarized nation again. By emphasizing their humanity against oversized, primordial monsters, human monstrosities are hidden from view. Japan has delivered inconsistent apologies for its torture of children and women whom they had the nerve to call comfort women, war supplies, public toilets, or female ammunition. Right wing elements in Japan try to suppress this history and claim it never happened. They even demand that other countries comply with their demands to take down statues memorializing their victims. If this movie existed outside of this push for revisionist history, alternate history would be understandable because not every movie about Japan must be a downer, but there should be some concern that our mindless monster movie may have a hidden agenda which outsiders are oblivious to. “Godzilla Minus One” gets awkward as the narrative trajectory finds everyone rooting for Koichi to become a sincere kamikaze pilot again. Yamazaki deserves credit for finding a way that does not feel overtly Orwellian to reverse the essence of being a kamikaze in the twentieth century context without reverting to its origins, i.e.  divine wind or used to describe a typhoon that scattered attacking Kublai Khan’s fleet of ships in the thirteenth century. Redefining kamikaze’s meaning is consistent with his rehabilitation of Japan by erasing history and feels like cheating, but as long as there is room for a sequel, which there is, maybe the next iteration will be less problematic so everyone can enjoy the monster mash spectacle in peace."
"Mar 29, 2024",positive,"Imagine asking not “how cool would it be if…” rather, “how can our monster test our fully-realized human characters, and “how can we use our monster as a tool of social commentary, a means to explore and critique aspects of the culture that created it?” "
"Mar 21, 2024",positive,"""Godzilla's properly menacing, the emotional [moments] work, [and it makes you] excited to see what Toho has coming next."""
"Mar 12, 2024",positive," While it might have felt like the cinema of 2023 was all about Barbie and the Bomb, there were plenty of other films that likewise made their marks, whether critically, commercially or controversially. Here, then, are my picks for the 10 best movies of 2023, followed by 10 worthy runners-up and other assorted superlatives. 1. POOR THINGS (Yorgos Lanthimos). The best film of 2023. Working from Alasdair Gray’s same-named novel, director Yorgos Lanthimos (whose 2018 release The Favourite earned my vote as the best picture of that year; go here) and screenwriter Tony McNamara have fashioned a true oddity, a Frankenstein Meets Forrest Gump flick filtered through a feminist focus. Emma Stone, taking a bold leap up to the level of today’s greatest actresses, stars as Bella, a suicide victim who’s brought back to life in the most fantastical way by quirky scientist Godwin Baxter (Willem Dafoe). Under the tutelage of Godwin, the childlike Bella receives an education within the strict confines of home, but as she matures, she realizes she wants to explore the outside world. And thus she takes off with a seedy lawyer (a hilarious Mark Ruffalo), growing ever more bold as she samples life’s perils and pleasures and in the process discovers her true self. To say that Poor Things isn’t for everyone is an understatement, yet those willing to go along for the sometimes gross yet always giddy ride will experience a movie that, much like Barbie, illustrates how a woman who knows nothing of our world’s crippling problems and prejudices might carve her own path in pursuit of becoming fully human and fully independent. 2. THE HOLDOVERS (Alexander Payne). No stranger to my 10 Best lists — The Descendants was my #1 for 2011 while 2004’s Sideways and 1999’s Election also placed extremely high — director Alexander Payne (working with scripter David Hemingson) serves up a small-scale gem that, by utilizing a 1970s setting, manages to recall the intimate cinema of that period. Paul Giamatti is perfect as Paul Hunham, a grouchy professor at a New England prep school. Despised by practically everyone, he’s given the unenviable task of looking after a group of kids with nowhere to go over the Christmas break. When he’s not hanging out with the school cook (Da’Vine Joy Randolph, matching her marvelous performance in Dolemite Is My Name), he’s spending time with the most troubled of the students (Dominic Sessa, an actual New England prep school student making a remarkable film debut). Full of humor and pathos, this is one of those unassuming treats that overpowers the viewer with its enormous humanist bent. 3. ALL OF US STRANGERS (Andrew Haigh). No movie from 2022 emotionally wiped me out as much as Charlotte Wells’ Aftersun, and no movie from 2023 emotionally wiped me out as much as Andrew Haigh’s All of Us Strangers. Paul Mescal proves to be the connective tissue: Delivering a performance in Aftersun that earned him a Best Actor Oscar nomination, he’s in support here; the star is Sherlock and Fleabag regular Andrew Scott, in a performance that should have earned him (but didn’t) a Best Actor Oscar nomination. Scott offers a wonderfully nuanced turn as a gay writer who sees dead people — namely, the parents (Jamie Bell and Claire Foy) who died in a car crash when he was a child. His time with his folks is intercut with time spent with his equally lonely neighbor (Mescal), but it’s not long before the two worlds converge. Rich in meaning and metaphor, and open to various interpretations, this is a rueful and haunting study about letting people in and letting people go. 4. OPPENHEIMER (Christopher Nolan). It was quite gratifying to see that both halves of the Barbenheimer phenomenon lived up to the hype, with the approving frenzy so ear-piercingly loud that it probably belonged in an IMAX production directed by Christopher Nolan. While Barbie offers sunshine and rainbow colors to go with its satiric and social themes, Oppenheimer understandably hangs under a mushroom cloud of darkly troubling sociopolitical issues. Cillian Murphy is excellent as J. Robert Oppenheimer, the physicist whose work on the Manhattan Project led to the creation of the atom bomb — as for the all-star cast surrounding him (Emily Blunt, Robert Downey Jr., etc.), Nolan hasn’t merely collected A-listers as if they were baseball cards but instead employs their characters to help round out Oppenheimer’s story, in the process lending greater import and understanding to the thorny proceedings. 5. ARE YOU THERE GOD? IT’S ME, MARGARET (Kelly Fremon Craig). Based on Judy Blume’s landmark novel, this focuses on 11-year-old Margaret Simon (Abby Ryder Fortson) and the circumstances that arise when her mom (a phenomenal Rachel McAdams) and dad (Benny Safdie) decide to relocate from NYC to a New Jersey suburb. With the full backing of Blume, writer-director Kelly Fremon Craig (The Edge of Seventeen) has fashioned a splendid coming-of-age film that’s both sensitive and perceptive — it steers clear of condescension, mean-spiritedness, and glib humor in order to truly understand the tribulations of not just Margaret but also her friends and family. This unfortunately proved to be a commercial underachiever — given what was dominating the box office at the time, perhaps they should have renamed it Are You There Mario? It’s Me, Luigi. 6. AMERICAN FICTION (Cord Jefferson). A formidable actor who has lent his support to everyone from James Bond to Katniss Everdeen, Jeffrey Wright finally lands the (leading) role of his career in this black comedy about Black literature. Wright delivers a beautiful slow-burn performance as Thelonious “Monk” Ellison, an academic author whose novels are rejected for not being “black” enough. After another scribe (Issa Rae) hits it big with a book called We’s Lives in Da Ghetto, a frustrated Monk writes a deliberately pandering novel in the guise of a fictional former convict (“Stagg R. Leigh,” from the similarly titled blues folk song) and then is flabbergasted when it’s a success. Few films from 2023 can match this one for sizable belly laughs, but the guffaws never obfuscate the issues at hand, particularly the reductiveness and stereotyping of the Black experience in America. 7. BARBIE (Greta Gerwig). What’s left to say about this cultural tsunami, a zeitgeist rattler so potent that even the usual armies of MRAs couldn’t disturb one strand of hair on its perfectly coifed head? (Not that they didn’t try; see the FOX “News” rants as well as all those down votes on IMDb.) Writer-director Greta Gerwig and co-scripter Noah Baumbach have created a colorful confection that benefits from the inspired casting of Margot Robbie and Ryan Gosling as Barbie and just Ken. The laughs are plentiful — some of the year’s biggest nyuks can be found in its digs at film school grads, Justice League fanboys, and Matchbox Twenty — but what makes Barbie truly work is its deft tackling of themes like existential crises, toxic masculinity, feminist self-worth, overarching capitalism, and the dangers of both the patriarchy and the matriarchy (the latter a key point conveniently ignored by the whiny detractors). 8. THE TASTE OF THINGS (Trần Anh Hùng). I certainly didn’t expect a porn flick to land on this list, yet here we are. To clarify, I mean “food porn”: Like Babette’s Feast, Eat Drink Man Woman, and others, this is the sort of film where one can get aroused not only by the mouth-watering shots of delectable cuisine but also by the filmmakers’ ability to allow the gastronomy and the philosophy to commingle. Think of it as the art of the meal. Titled La Passion de Dodin Bouffant in its French homeland, this lovely effort from French-Vietnamese director Trần Anh Hùng centers on a 19th-century gourmet (Benoît Magimel) and the woman (Juliette Binoche) who has served as his cook and lover for 20 years. I suppose the central romances in Fallen Leaves and Past Lives might hold slightly more urgency and currency, but those films didn’t offer co-starring roles to a vol-au-vent and a Baked Alaska. 9. THE TEACHERS’ LOUNGE (Ilker Çatak). Movies have long employed the high school to serve as a microcosm of an ailing society at large, and this German import can proudly and profoundly be added to the ledger that also includes the likes of Election, Brick, and the underrated Teachers. A middle school harbors a thief from within, and the teachers automatically assume a student is the culprit. But when an idealistic teacher (Leonie Benesch) arrives at a different conclusion and reports her findings, all hell breaks loose. As tense as any thriller, this slowly and masterfully introduces a host of real-world problems into its storyline, including the tendency of people to offer opinions without all the facts, the employment of social media to distort and distract, and the blurring of lines between ostensible heroes and villains. The non-ending is a letdown, but everything else merits a circled red A. 10. SALTBURN (Emerald Fennell). Certainly, it doesn’t feel like this divisive effort from writer-director Emerald Fennell (whose Promising Young Woman was my pick for the best film of 2020; go here) should be placed above some of the heavy hitters cited on my Honorable Mentions list below. And those folks who groused about this largely being a rip-off of The Talented Mr. Ripley weren’t entirely incorrect. Yet there’s something to be said about movies that take root in the mind’s eye and refuse to leave, and this one has lingered more than many on this list. This story about a young man (Barry Keoghan) worming his way into an aristocratic family’s everyday existence is occasionally predictable, but the daring nature of Fennell’s approach, the spectacular visual palate, and Keoghan’s letting-it-all-hang-out (literally) performance are anything but pat. It’s Gothic stateliness by way of Goth subculture — enter at your own risk. 2023 Movie I’m Most Sorry to Have Seen:
The Killer. I was initially going to go with The Exorcist: Believer, but since it was from the writer of Halloween Ends and Firestarter, it probably never stood a chance of being watchable to anyone but the easily startled. The Killer, on the other hand, hails from David Fincher, who’s made a few fine movies (Seven, The Social Network) over the decades. This dismal dud isn’t one of them. It plays like a John Wick flick for people who think they’re too good for a John Wick flick, and the problem with Michael Fassbender’s borderline incompetent assassin isn’t that he’s unappealing but that he’s a boring zero. 2023 Movie I’m Least Sorry to Have Missed:
Rebel Moon: Part One – A Child of Fire. Since it was made by a pair of QAnon nutjobs, I was initially going to go with Sound of Freedom, but why give them even the time of day? Rebel Moon, on the other hand, hails from Zack Snyder, who actually directed a pair of decent movies (Dawn of the Dead, Watchmen) decades ago but has been flailing since. So if even the fanboys who worshipped the silly Sucker Punch, the miserable Man of Steel, and that excruciating 15-hour cut of Justice League are turning their noses up at this one, then it must be a real stinker. For now, I guess Rebel Moon: Part Two – The Scargiver has dibs on 2024 Movie I’m Least Sorry to Have Missed. None of the reviews of ANATOMY OF A FALL mention the extraordinary performance of the young actor who plays Daniel, the son of Sandra Hiller’s character. What is his name?"
"Mar 12, 2024",positive,A surprisingly emotional melodrama bolsters what may stand as the most enjoyable Godzilla movie ever made in Yamazaki's call back to the nuclear creature's origins. 
