Dates,Scores,Reviews
"Dec 21, 2023",positive," This time of year is an intense time for me as a critic and podcaster. Between my holiday coverage at Hallmarkies Podcast and getting all the awards contenders watched I am woefully behind on my reviews. Therefore, over the next few days you are going to be seeing a lot of shorter reviews as I try and get my opinions out into the world. In this post we are looking at 2 recent blockbusters- one that feels like the last tired push from a corporate behemoth and one that continues on a decades-long tradition of moviemaking with heart and soul. Let’s talk about Aquaman vs Godzilla. For a long time I was one that defended comicbook movies against folks who said they aren’t cinema but it has become increasingly more difficult to do so in 2023. What should be explorations into popular mythmaking and escapism have turned into soulless corporate exercises of mundanity and money-calculated blandness. Such is the case in our last entry for the year Aquaman and the Lost Kingdom. In this final entry in the DCEU director James Wan has given us a laborious, reverential, self-serious slog. If you want to see an actual good blockbuster with compelling characters and action look towards Japan and Godzilla: Minus One. I have not seen all of them but I do think it is the best Godzilla movie I’ve ever seen. Ryunosuke Kamiki plays Koichi who is disgraced when he fails to be a kamikaze pilot in WWII and he cannot shoot the Godzilla monster that attacks his crew. This gives the entire story an emotional weight beyond the typical monster movie trappings of the franchise. Minami Hamabe steals any scene she is in as Noriko Oishi, Koichi’s partner. Like all the good Godzilla movies Godzilla: Minus One has something to say about war, nuclear arms, the environment and toxic masculinity. What does it mean to be a hero? This is something that plagues Koichi almost as much as the giant monster throughout the film! I also appreciate that all of the monster action is clear and I can see what is happening unlike the recent Godzilla: King of the Monsters made here in America. The music is also excellent. I never thought a Godzilla movie would be one of my favorite films of the year but that’s where we are. So there you have 2 would-be epics at theaters right now. I know which one I’d recommend and see again if given the chance! Happy moviegoing! "
"Dec 21, 2023",positive," How many of the human characters can you remember from the various Godzilla movies? Godzilla Minus One gives us a stirring central figure: Koichi Shikishima (Ryunosuke Kamiki), a kamikaze pilot in the waning days of World War II who abandons his suicidal mission, instead landing on remote island and claiming to the mechanics there that his plane malfunctioned. Just as they realize he’s lying, Godzilla attacks. Shikishima escapes, but most of the others don’t, giving him a double dose of survivor’s guilt when he returns to the devastated Japanese mainland. When Godzilla resurfaces, the monster embodies Shikishima’s deepest fears. Writer-director Takashi Yamazaki and his team of effects artists bring a thrilling immediacy and tactility to the monster sequences, but what I loved most about Godzilla Minus One is the way it evokes the sense of loss and mourning of the granddaddy of these pictures, 1954’s Gojira (Godzilla in the U.S.) “Is your war finally over?” Shikishima is asked near the end of the film. As long as our wars aren’t, we’ll need Godzilla movies like this."
"Dec 21, 2023",positive,"It gets the balance between drama and spectacle, and proper content. It has substance. "
"Dec 20, 2023",positive," With the franchise’s 70th anniversary imminent, Japanese studio Toho goes back to the beginning with their latest Godzilla film. Or rather, before the beginning. Sort of. You can view Godzilla Minus One as an alternate genesis for the iconic monster, as interpreting it as a definite prequel to the original – something barely alluded to in the text – can negate this new film’s tension. That said, the strength of the craft ensures it’s still an enthralling visual and dramatic ride, regardless of any nagging thoughts about how the film can possibly have a satisfying conclusion in its own right.The very first Godzilla film was set around the same time as its 1954 release, with the sea creature symbolising Japan’s overriding fears concerning the aftermath of the war and nuclear attacks. Godzilla Minus One takes these same ideas but places them in an even bleaker context. Starting in World War II’s final days and taking place across the following two years (as Japan rebuilds from the ruins), this thrilling film charts the green giant’s journey from being slightly bigger than a T-Rex – terrorising people on a beach – to city-conquering behemoth, thanks to evolutionary enhancement via 1946’s Operation Crossroads.Writing, directing, and leading the film’s visual effects team, Takashi Yamazaki delivers impressive, legitimately scary set pieces. And crucially, the time spent with the genuinely appealing human ensemble in between attacks is truly compelling; exploring post-war trauma, community-led resistance to government disinformation, and trying to salvage peaceful prospects within the most disastrous circumstances."
"Dec 19, 2023",positive," El mes de diciembre es ese inconveniente limbo en el que todo el mundo dentro de la cinefilia se apresura a elaborar y compartir sus listas de lo mejor del año, dejando por el camino muchos estrenos de última hora que parecen llegar tan tarde que no tienen puesto en la cola. ‘Godzilla: Minus One’ es uno de los casos más llamativos porque, no solo merece estar en todos los tops de 2023, sino que es, simplemente, uno de los mejores kaiju eiga de la historia. En un momento en el que Godzilla se mantiene como un personaje válido setenta años después de su primera aparición, gracias a series como ‘Monarch: el legado de los monstruos’ y la próxima ‘Godzilla y Kong: el nuevo imperio’, la creadora del asunto vuelve a contraatacar tras la singular ‘Shin Godzilla’, que convertía el desastre de Fukushima en una diana perfecta para explicar la ineficiencia burocrática de un gobierno acomodado e incapaz, recuperando ahora el poder alegórico del icónico monstruo en su versión más terrorífica y devastadora hasta ahora. De hecho, Toho vuelve a la original siguiendo la senda ideológica de la anterior, de nuevo planteando un país en ruinas con una casta en el que no se puede confiar y unos EE.UU. dibujados como el enemigo en la sombra, dejando la lucha contra Godzilla a los ciudadanos. No por casualidad, la película reutiliza la sintonía clásica de Akira Ifukube, que nos lleva a 1954, tan solo unos años más tarde del final de la Segunda Guerra Mundial, justo el periodo elegido para armar esta especie de precuela muy conectada con el film de Ishiro Honda. El resultado es uno de los blockbusters más apabullantes del año en cualquier género. Llegado en tiempo de descuento, pero marcando de chilena, Takashi Yamazaki insufla nueva vida al mito y nos prepara para la que puede ser un revival kaiju equiparable al de la trilogía de Gamera en los 90. Sin salirnos de las franquicias, vale, pero su presupuesto de unos 15 millones de dólares hace palidecer a toda la producción de Marvel y DC de este año, planteando incluso otras posibilidades de ritmo y uso de efectos especiales. Salvo ‘The Creator’ ninguna película de gran presupuesto de los últimos años ha explorado demasiado las posibilidades dramáticas de un uso estratégico de la tecnología. En sus monumentales escenas de catástrofe, ‘Godzilla: Minus One’ pone cada momento de espectáculo al servicio de una tragedia que nos fascina y aterra ver. Nada funcionaría sin su meditado enfoque de drama de posguerra de un periodo muy concreto de su historia, no solo en la forma, sino en sus temas de derrota, honor y resurgir. Esto, que se ha confundido con un problema de ritmo, hace que cada momento importe y el esfuerzo del personaje principal por superar su vergüenza y reintegrarse vaya, mano a mano, con las escenas en las que aparece Godzilla, sintetizando el drama de toda una nación en su experiencia particular. De hecho, buena parte de la película es casi una respuesta a ‘Oppenheimer’ desde el lado japonés, explorando el trauma nuclear colectivo de forma que sirve de contrapunto a la fascinación por la peripecia científica que transpira el éxito americano. Tras convertir la creación de la bomba atómica en una experiencia de viernes noche y palomitas en el multicine de un centro comercial, es imposible no pensar que hay mucho de Hiroshima en la forma en la que se presenta el uso del rayo característico de Godzilla, un momento preparado con la misma anticipación que la prueba de Álamo Gordo, pero con un propósito bien distinto. Sí, tenemos a un lagarto gigante que anda torpemente, pero esa representación fantasiosa resulta más temible y peligrosa en cuanto sintonizamos con lo que nos está queriendo enseñar realmente. No hay que ser muy avispado para captar que el ataque a Ginza está reflejando el efecto devastador de una fuerza inesperada— que aparece, claro, por efecto de otras pruebas militares americanas—, usando al coloso como avatar del terror atómico. Desde las ""quemaduras"" de Godzilla, a la forma angustiosa de reflejar el pánico civil o la presencia de una lluvia de ceniza negra... La imaginería es un catálogo de efectos de la bomba nuclear que explora todo lo que no interesaba reproducir en ‘Oppenheimer’, mostrando, de alguna manera, la cara de la moneda más “descortés” en una película supuestamente de espectáculo. Irónicamente, ‘Godzilla: Minus One’, entre sus varios recursos del cine bélico, recicla algunos momentos del cine reciente de Christopher Nolan, concretamente de ‘Dunquerque’, en algunas de sus escenas navales, que dan la distintiva personalidad marítima a esta entrega frente a las demás. De hecho, esta vocación ""acuática"" hace que tenga algunos momentos de pura aventura marinera que recuerdan a los momentos de peripecia más memorables de ‘Tiburón’ (1975), lo que convierte a Godzilla en una criatura más fiera y que crea lazos con el cine de terror animal más tradicional. Con más comentario social o más aventura, el resultado consigue un balance insólito entre el peso emocional y el gran espectáculo de efectos especiales perdido en el blockbuster americano actual, logrando aprovechar sus limitados recursos al máximo, poniendo en evidencia a las últimas entregas del monsterverse. Un hype que se explica sin matices y un éxito sorpresa de taquilla que evidencia un error de cálculo garrafal de algunas distribuidoras que no han medido la respuesta que tendría en salas, un testamento al poder de los rarísimos blockbusters con actitud y FX al servicio de la historia y no al revés. Con un equilibrio perfecto entre el cine de monstruos y el bélico, ‘Godzilla: Minus One’ funciona gracias a su parte humana, un drama construido sobre la culpa, que no se corta en explotar un énfasis militarista sobre el honor perdido con el que no se atrevería Michael Bay, y que explica el resentimiento nacionalista de un Japón que parece estar buscando reconstruir su orgullo tras un desastre al evocar el deseo patriótico de una nación casi emulando a una película de propaganda ficticia de posguerra, con un fondo tan populista y fascinante como peligroso."
"Dec 19, 2023",positive," Godzilla Minus One is a monster movie of singular power, using horror-infused kaiju spectacle to deliver an emotionally compelling story of grief, wartime trauma, and hope. Most importantly, its genre-leading visual effects scenes are complemented by richly soulful performances and humane themes of reconciliation and redemption. Godzilla has experienced a major resurgence in the past decade. The crowd-pleasing pugilism of the American MonsterVerse franchise continues to expand under the leadership of Legendary Pictures, while Godzilla’s Japanese owner-originators Toho have steadily released an array of more cerebral, mostly animated projects that explore Godzilla’s weirder, more eldritch dimension. Godzilla Minus One straddles the sensibilities of both, delivering world-class scenes of monster rampage, a story of considerable depth and pathos, and one of the strangest, most terrifying incarnations of Godzilla in the franchise’s seventy-year history. The filmhas a straightforward premise. In a Japan ravaged by World War Two, Godzilla’s attacks take the country “from zero to minus one”. In many respects the film, too, is direct and uncomplicated, as it hits every major story beat that any audience would expect from a Godzilla story. Urban destruction, fleeing crowds, the monster’s horrifying emergence from the ocean: all executed with percussive bombast and luminous visual flair. It features several extraordinarily satisfying action scenes which deliver thrilling moments of monster mayhem and display to jaw-dropping effect the mastery of visual effects for which the film is already beginning to reap major awards. But the film also has plenty of surprises up its sleeve. Several characters are forthright in their criticism of Japan’s government and the 1945-52 US occupation in ways that resonate with contemporary matters, undergirding the film with an intriguing (if coded) political critique. The score is operatic, grandiose, and spine-tingling. Perhaps most welcome, however, is the emotional sophistication of the movie, as it tackles substantial themes of historical responsibility, grief, and redemption, all channelled through the survivor’s guilt of protagonist Kōichi Shikishima (Kamiki Ryunosuke), a kamikaze pilot haunted by his inability to die his state-mandated wartime death. Everybody knows that Godzilla was originally a symbol or metaphor for the atomic bomb. Over the years, Godzilla’s meaning has grown and shifted, appearing sometimes as tragic, often heroic, sometimes cute and child-friendly. Godzilla Minus One brings out unexpected aspects of the creature’s original wartime resonance, focusing in depth on the abject struggles of ordinary Japanese people scratching a living in the ruins of a firebombed Tokyo. Their confrontation with Godzilla is rendered in ways that foreground their resilience, comradeship, compassion, and hope, imbuing what could have been a maudlin and grimdark affair with the warmth and humanity for which the screenwriting of Takashi Yamazaki, who directs, writes, and handles the film’s exquisite VFX, is rightly celebrated. And Godzilla itself has never looked better. Characterised as a radioactive island god saturated with vicious, bloodthirsty hate and rendered in extraordinarily lucid and gnarly detail, it delivers serious thrills and some unforgettable images. Godzilla Minus One is a superlative monster movie. See it!"
"Dec 19, 2023",positive,"I don't think it's a great film or anything... It's fine. It's got some good moments, but I didn't go crazy for it."
"Dec 19, 2023",positive,This is the film that Godzilla fans have been waiting for.
"Dec 19, 2023",positive," ★★★★☆In a rum week for American cinema — one in which the French have revamped the superhero template with The Three Musketeers: Milady — the Japanese have effectively humiliated Hollywood by delivering the best mega-monster movie since Peter Jackson’s King Kong in 2005, and at a fraction of the going price. "
"Dec 18, 2023",positive," It can be easy for audiences adoringly saturating themselves in Legendary’s MonsterVerse to forget all about Toho Studios’ ongoing age of Godzilla movies. Which is a shame, because the latest offering, Takashi Yamazaki’s Godzilla Minus One, is something to savour. The 33rd Godzilla film, and the 5th of the franchise’s Reiwa era, is beyond doubt the best Godzilla movie since Ishirō Honda’s seminal first almost 70 years ago. With Minus One explicitly celebrating Godzilla’s anniversary, it is a fitting a tribute to one of the biggest movie icons in the world.  At the end of World War Two, kamikaze pilot Kōichi Shikishima (Ryunosuke Kamiki) returns back to his family home in Tokyo only to find that it has been destroyed and his parents have been killed. Given that he is a kamikaze pilot however, returning home was never part of the mission plan, and he is chastised by those around him for not following through on his wartime duty. Along with his found family of Noriko Ōishi (Minami Hamabe) and the rescued child Akiko (Sae Nagatani), Shikishima tries to rebuild his life while grappling with survivor’s guilt. This is interrupted by Godzilla, who Shikishima had also confronted two years earlier in the creature’s infancy. Godzilla decides to devastate Tokyo just as the city has put the ravages of war behind it. Shikishima then joins a crew of private citizens who plan to destroy Godzilla once and for all. Minus One is a Godzilla movie first and foremost, but it is also an emotionally charged look at the morals of war, failure, and the value of individual life. While Honda’s Godzilla has been read as a statement about Japanese collective trauma, Minus One channels its ethical exploration mostly through one character – Shikishima, who feels responsible for the death of others as well as thinking that he does not deserve to live.  Godzilla is more than a harbinger of death; he is the very symbol of Shikishima’s perceived failure and shortcomings. You genuinely believe that he has it out for this big lizard without it feeling needlessly silly or unmerited. This personal struggle lends itself to an incredibly tense finale where Shikishima’s ultimate intentions are unclear, while also proving that sticking a massive radioactive monster in your film is no excuse to litter it with shallow human characters. Kamiki’s performance as the former pilot deserves a lot of praise; he wears the pain, guilt, and devastation at all times to help you become intimately enveloped in his struggle.  A drama about a kamikaze pilot’s survivor’s guilt would likely make for a solid drama in and of itself, but as already mentioned this is a Godzilla movie through and through. And the big man has rarely looked so good, with different eras of the character seemingly combining into one monstrous wonder. Yamazaki lingers on Godzilla’s devastation and powers as an unstoppable force of nature, evoking wartime and apocalyptic imagery to make this one of the truly terrifying incarnations of the creature.  Such is the detail put into his design and the atmosphere of dread he creates just by existing, he feels frighteningly real. A lot has been said online about the quality of the visual effects given the remarkably low budget (even if Japanese labour laws explain a large part of this). Yamazaki, who is also in charge of the film’s VFX, makes the most of what he can offer with some breathtaking set pieces. Godzilla’s rampage through Ginza is especially immersive, the camera almost never pulling back to wide shots so that you feel endlessly caught up in the unspeakable destruction.  Minus One strikes a remarkable balance between sombre and epic, with just a pinch of preposterousness to hark back to the cult favourites of the late 20th century. The storyline deliberately evokes some of the original 1954 film’s elements, concreting the sense that Yamazaki’s triumph is more than worthy of the name. Few kaiju movies seem capable of giving you gargantuan thrills while ensuring that there is a deeply affecting, political, and human core to the story. Godzilla Minus One is a welcome lesson on how to do exactly that."
"Dec 18, 2023",positive," It’s a standalone and surprisingly low-budget Japanese blockbuster which sees the scaly icon go back to his roots. It’s also the best Godzilla movie I’ve seen. Made to celebrate the 70th anniversary of his movie debut, the film swaps the bloke in the lizard suit for cutting-edge special effects which look at least $100million pricier than its rumoured $15m budget. Director and effects wizard Takashi Yamazaki plays to the big fella’s strengths. The trick is to make him utterly terrifying. But a rampaging, radioactive monster with killer breath isn’t enough to hold anyone’s attention for two hours. And Yamazaki stirs in rousing human drama and chewy post-war politics. Our hero is Koichi Shikishima (Ryunosuke Kamiki), a disgraced – in other words, still alive – kamikaze pilot. He ducked out of a suicide mission at the end of the Second World War and, afterwards, returns to a bombed-out Tokyo where he is spat at by one of his neighbours. His road to redemption begins when he forms a makeshift family with a big-hearted survivor (Minami Hamabe) and an orphaned child. But Koichi is not only haunted by his refusal to die for his emperor but by a previous run-in with the monster at the end of the war. After he’d sabotaged his engine, he landed at an island fighter plane repair facility. As a then medium-sized Godzilla came ashore, Koichi had him in his machine gun’s sights but didn’t shoot. The beast went on to wipe out scores of engineers with a blast of his red-hot breath. So, after a now beefed-up Godzilla flattens a Tokyo neighbourhood, Koichi volunteers for a citizen-led defence force. The plan to defeat the ever-growing beast is ingenious and, according to the ex-military scientist in charge, doesn’t rely on unthinking self-sacrifice."
"Dec 18, 2023",positive,"You wouldn’t believe a monster movie could make you sob, as well as think, but Godzilla Minus One does."
