Dates,Scores,Reviews
"Nov 9, 2020",positive," o one in the 21st century would have believed that Earth was being watched by intelligences greater than their own, for potentially millions of years. Humanity, as it reached its peak, was always too caught up in their infinite complacency, confident of supremacy over the planet. But in the cold, dark reaches of space, aliens have been plotting to take the valuable resources of this planet … by force. With a war of the worlds looming, Ray Ferrier (Tom Cruise) is the perspective of commonplace sensibility. He’s a crane operator at a shipyard, dependable above and beyond his coworkers, but still observant of union rules. And he struggles to provide for his two children, Rachel (Dakota Fanning, playing the perfectly precocious voice of reason) and Robbie (Justin Chatwin, donning the role of angsty, rebellious teen), while also hoping to bond with them and appear as a role model. But both are problems, considering that he’s divorced, sharing custody of the kids with his ex-wife Mary Ann (Miranda Otto), and competing with their wealthy stepdad Tim (David Alan Basche). “You’ve got nothing to worry about.” When Mary Ann drops the siblings off with their father for the weekend, Ray plans for an uneventful couple of days; after all, he’s a working man, and he needs his sleep. But before the day is through, a storm mysteriously materializes overhead, lashing out with freakishly antagonistic lightning bolts, forcing Ray and Rachel back into the house. When curiosity gets the better of Ray, he races into the center of town to investigate the commotion and the pinpoint target of all the electrical strikes. The initial alien appearance is unmistakably reminiscent of “Independence Day,” as furious clouds swirl above, hinting at an extraterrestrial invasion. But when the invaders do arrive, they come from beneath the ground, springing up on thin, nimble legs like mechanical octopi (or tripodal automatons). The level of destruction also matches that aforementioned sci-fi thriller, with buildings rupturing and cars getting tossed about as infrastructure crumbles. It’s also quite sudden. The action and adventure is quite significant, especially as panic takes hold and the attackers begin razing everything in sight. It’s here that some of the most memorable sets are designed, with a massive plane resting in sections across a lawn as the best of the bunch (though the wreckage conveniently leaves their parked van untouched), and when images of chaos and catastrophe are most potent (including a stream full of drifting bodies or articles of clothing raining from the sky). As if predicting the rise of the modern zombie craze, director Steven Spielberg’s vision of an alien takeover includes understandable paranoia, uncontrollable crowds of confused and violent survivors (and sprawling fleers), and the very worst qualities of humanity emerging triumphant (even for the protagonist, who is forced to make tough moral decisions concerning his family’s survival). As with most of his ventures, the film also puts children directly in the path of the annihilation, imparting a sense of innocence and greater unpreparedness, with parenting efforts a key point of contention and drama. Expectedly, adults are just as impulsive, incompetent, and ineffective as the screaming youths. Unfortunately, this somewhat realistic portrayal results in plenty of annoying moments as characters behave contrarily to larger-than-life heroes (and leads to an ending that can’t match the riveting start). But the carnage is more colossal than in most disaster movies, the sound effects are chilling, the sets are spectacularly ominous, the CG is impressive, and the desperation is more psychologically trying (though the PG-13 rating creates obvious limitations for the visualized atrocities). It may not be a masterpiece, but it’s a fitting adaptation of a seminal H.G. Wells sci-fi epic. Designed by Mike Massie | © 2006-2024 Gone With The Twins | All movie related images © their respective owners. Articles on this site may not be distributed or reproduced without written consent."
"Sep 11, 2020",positive,"War of the Worlds pulses with excitement, danger and palpable nervous energy that generates a legitimate and lasting awe."
"May 17, 2020",positive," In 1898 H.G. Wells wrote a novel called The War of the Worlds.   It told the fictitious story of an alien invasion taking over the earth.  In 1938 Orson Welles infamously narrated a radio broadcast of the ""invasion"" but since many listeners tuned in later they missed the announcement at the beginning of the shows stating the news broadcast wasn't real.  Mass hysteria ensued as the public really believed the Earth was being invaded.  Since then there have been numerous adaptations including television series, video games, comic books, and seven films. In 2005, Steven Spielberg (Raiders of the Lost Ark) helmed one of War of the Worlds films starring Tom Cruise (Top Gun).  On May 19th, for the 15th anniversary of the movie, Paramount Pictures is releasing it on 4K. Ray Ferrier (Cruise) is a blue-collar worker and a divorced father of two, Rachel (Dakota Fanning; Man on Fire) and Robbie (Justin Chatwin; Taking Lives).  When his ex-wife (Miranda Otto; The Lord of the Rings: The Two Towers) drops them off for a typical weekend visit, it is an average yet tension-filled exchange.  However, when a massive storm filled with lightning strikes disrupts power, it is only the beginning of a terror crammed a few days.  Those strikes, unbeknownst to the citizens of the world, were really alien transports to deliver the hostiles to their killing machines that were buried underground long ago.  Suddenly, cities all over the world are under attack against forces they can't possibly defeat.  These machines. At first, they are vaporizing people then suddenly they start capturing them, sucking out their blood from giant looking straws and then painting the countryside with the blood to use as fertilizer for their vegetation.  Ray must find a way to keep his kids safe as they travel to meet up with his ex-wife at her parents' home in Boston. Cruise, unlike many of his characters, plays somewhat of a jerk in this film but also portrays a quick-thinking individual who genuinely cares about his kids though he doesn't always show it.  Even at a young age, Fanning showed great potential as an actress here as we watch while she is practically forced to grow up almost overnight.  Chatwin plays a typical brooding teenage boy who challenges his father at every turn.  Tim Robbins (The Shawshank Redemption) plays Harlan Ogilvy, a deranged man who initially offers Ray and Rachel shelter but then goes crazy once he sees what the aliens are doing. The suspense keeps your heart pounding while the visuals are appealing to the eye.  If you are a fan of the genre this is one movie you should add to your collection. For more information about War of the Worlds visit the FlickDirect Movie Database. This release has been provided to FlickDirect for review purposes.
                For more reviews by Allison Rose please click here. Allison Rose, a Senior Correspondent and Critic at FlickDirect, is a dynamic presence in the entertainment industry with a communications degree from Hofstra University. She brings her film expertise to KRMS News/Talk 97.5 FM and broadcast television, and is recognized as a Tomatometer-Approved Critic. Her role as an adept event moderator in various entertainment industry forums underscores her versatility. Her affiliations with SEFCA, the Florida Film Critics Circle, and the Online Film Critics Society highlight her as an influential figure in film criticism and media."
"May 13, 2020",positive," Steven Spielberg would direct two films in 2005–the other being Best Picture nominee Munich.  After directing Tom Hanks in 2004’s The Terminal, he returned to the sci-fi genre.  While the film probably may not rank as high as E.T. the Extra Terrestrial or Close Encounters of the Third Kind, it manages to hold its own.  The story gets a fresh contemporary update and its to our benefit as an audience. Danielle Solzman is native of Louisville, KY, and holds a BA in Public Relations from Northern Kentucky University and a MA in Media Communications from Webster University. She roots for her beloved Kentucky Wildcats, St. Louis Cardinals, Indianapolis Colts, and Boston Celtics. Living less than a mile away from Wrigley Field in Chicago, she is an active reader (sports/entertainment/history/biographies/select fiction) and involved with the Chicago improv scene. She also sees many movies and reviews them.
She has previously written for Redbird Rants, Wildcat Blue Nation, and Hidden Remote/Flicksided. From April 2016 through May 2017, her film reviews can be found on Creators."
"Nov 18, 2019",positive," Tom Cruise may be making headlines with his recent behavior, but even Cruises bad boy antics cant sink War of the Worlds. The Steven Spielberg adaptation of the H.G. Wells novel features plenty of chills and thrills, making it one of the summers big-ticket releases that actually lives up to the hype. Cruise plays Ray, a dock worker and divorced dad trying to connect with his estranged children (Justin Chatwin and Dakota Fanning) during a weekend visit. The familys struggles take a back seat when a bizarre lightning storm proves to be the precursor to an attack by beings from another world. Cruise carries the picture, and even manages to make me forget about the fact that he might be having a very public mid-life crisis. Fanning is fine, but I cant help but think her career goes out the door when she reaches adolescence. Spielberg does a masterful job of building the tension and creating an effective science-fiction thriller. The films strongest moments come during two edge-of-your-seat sequences. The first attack is the films best, which really had me anticipating what was going to happen next. That sequence is nearly topped by an attack on a ferry that reminded me a lot of the final half of Titanic with its panic-induced hysteria combined with jaw-dropping destruction. These two scenes really push the envelope when it comes to the films PG-13 rating this isnt a movie for younger children but it helps enhance the effectiveness of the films rather grim feel. War of the Worlds does suffer from a disappointing final act. The usually reliable Tim Robbins is slightly out of place in a small role and the wrap-up seems rushed and rather convenient. Still, its much more satisfying than Spielbergs A.I. which left most audiences feeling frustrated and cheated. War of the Worlds doesnt reach the heights of Spielbergs last collaboration with Cruise, Minority Report, but it still sets the bar pretty high. With the exception of Star Wars, this may be the summer seasons best high-profile event. This weeks discount dud is The Hitchhikers Guide to the Galaxy (C) an average science-fiction adventure that probably will appeal more to the fans of the popular book and BBC mini-series that the film is based on. The plot is simple. Brit Arthur Dent (Martin Freeman) is rescued by his friend, an alien in disguise, Ford Prefect (Mos Def), right before Earth is destroyed. There were moments in Hitchhiker where I was mildly amused, including a musical number by dolphins right before they leave Earth, but for the most part, the dry British humor just fell flat. It was like watching a gag reel of all the Monty Python moments that didnt work. Part of the problem could have been the cast. Freeman and Mos Def just arent that dynamic in their respective roles. Hitchhiker does throw in small parts for John Malkovich and Bill Nighy, as well as speaking parts for Helen Mirren and Alan Rickman, but none is given enough screen time to connect. The best performance comes from Sam Rockwell, who plays the president of the galaxy as sort of a cross between George Bush and Jim Morrison. But even Rockwell isnt enough to prevent this from being middle-of-the-road. I can respect what everyone involved was trying to do in The Hitchhikers Guide to the Galaxy, but that doesnt mean I have to like it or recommend it to anyone else. The Hitchhikers Guide to the Galaxy opens Friday at the Plaza 6, where all movies are $1.50. Sportswriter/movie reviewer Micheal Compton is so tired of evil aliens in film, he is taking the rest of the summer off to find more cute and cuddly E.T.-like aliens. If he has time, he will answer your questions about films or aliens. Just drop him a line at mcompton@bgdailynews.com."
"Jun 5, 2019",positive,"Moves from one action set piece to another, seeing everything only through the eyes of its main characters, and in doing so avoids many sci-fi clichés."
