Dates,Scores,Reviews
"Oct 30, 2006",positive," One of the more solidly crafted science fiction films in a while, “War of the Worlds” is about as far from quintessential ‘nice’ Steven Spielberg as you can get – which is why that makes this one of his better mainstream entertainment vehicles since “Jurassic Park”. Taking the HG Wells original story and following it more closely than expected (from the tripod designs, to the all too rushed and almost anti-climactic deus ex machina ending), Spielberg creates an alien invasion movie that can be labelled the antithesis to the likes of “Independence Day” or the ilk. The reason? The personal perspective. Rather than showing off the bigger focus of said invasion and the ‘power players’ you’d see in the likes of these movies (world leaders, leading scientists, etc.) this stays purely locked on one disjointed family. After a quiet ten minute introduction which plays out like your average family drama – in this case a pissed off divorcee dad finds his kids a hassle whilst they simply resent him – the film kicks into gear. There’s two scenes involving conversations in two different basements that run for about five minutes each, other than that, this is essentially one non-stop action sequence that never lets up. Even those two quiet scenes are followed by two of the film’s best scenes, the first of which made me shudder from its impact – something I can’t recall doing in a movie in years. “War” is an example of what both true science fiction (not that Lucas swashbuckling fantasy kiddie stuff) and the B-movie genre can achieve. Koepp’s script has practically no plot short of some large broad strokes, character development is both minimal and predictable, various sequences do feel derivative and repetitive. Yet its enthralling and cleverly lays out its beats perfectly, almost never letting its pace drop and never falling into traps. There’s no attempts at humour, patriotic speeches, pontificating or politics. The dialogue practically never sounds too cheesy (aside from Tim Robbins, the one weak character in the film). Indeed I looked for it but the words ‘alien’ or ‘martian’ never appear, its simply ‘them’ or they come from ‘elsewhere’. As much as I enjoyed “Revenge of the Sith” and loved “Batman Begins” this Summer, both have some big flaws relating to their ambitious scripts which reached further than their writers could live up to – the result was some hokey dialogue or moments which didn’t feel right. Koepp’s script on the whole isn’t as well conceived or grand, but by keeping the focus tight and personal he avoids some of the pitfalls. There’s one or two creaky points such as the convenient newsvan scene which serves as exposition central (although its gotten over with quickly thank god) or the somewhat ridiculous second last ending, but Koepp for the most part keeps our knowledge of events limited to what our main trio know. The lack of character development won’t be seen as a good thing by some, even if the film uses that to its advantage by never having these characters break out into unrealistic monologues spilling out background information. Its a simple no frills cautionary tale that’s smartly told, no more or less. Make no mistake though, this is not a happy blockbuster – “War of the Worlds” is a bleak and desolate movie in a hardcore unrelenting way. In fact “Saving Private Ryan” (with the exception of its opening 20 minutes) is in many ways a ‘nicer’ Spielberg film than this. Its not an R-rated film but pushes damn close to that boundary and is more shocking than some with the stricter rating such as the last few minutes set within Robbins’ basement which involves both a brutal act and a hideous revelation about the somewhat mishandled ‘red weed’ element. Even quieter scenes ranging from Dakota’s shocking discovery whilst taking a piss to little moments of people caught in collateral damage cause chills. Performances are strong all across the board too. For the first time in ages Tom Cruise seemed to be playing someone other than Tom Cruise. Despite all the hype and somewhat ingratiating public appearances lately which haven’t exactly been beneficial to his public profile, seeing him in action on screen again you realise the guy is a solid actor. In a role that’s almost purely reactionary in tone and could be seen as somewhat hokey in other hands, Cruise brings a necessary gravitas. Kudos should go out to all the supporting cast too – Fanning finally seemed to be playing someone her age (albeit still too smart), Chatwin makes a rebellious teen character actually sympathetic, even Otto’s tiny screen time brings some of the film’s few smiles. Like I said the only bum note is Robbins. Not because of the actor mind you, but more the character. Whilst Spielberg’s film liberally borrows elements from plenty of other sci-fi great films, one wonders why he had to import the stereotypical gun nut style character with his incessant whinging – maybe to act as counterpoint to Cruise (if so he could’ve done a lot better). Up until that point in the film this had been a pure action movie, from then on it changes tone to become something darker and more suspense-oriented. Its also when the film changes from Cruise and company being merely reactive to somewhat proactive including a rather stupid bit involving cages and an alien orifice that’ll make me avoid getting close to female genitalia ever again. The end solution falls along the lines of Wells tale which seems almost anachronistic and all too much of a cop out that will leave modern crowds with a somewhat sinking feeling. The look of the film is superb. From the ILM effects which are far better and less cartoonish than they’ve been in a while, to the superb designs of the tripods – the only bum note are the aliens themselves which seem like an ID4/Carebear hybrid. The disintegration beams are beautifully handled, especially with their after effect which renders one scene in the film to look like something out of a Calvin Klein commercial. Spielberg also tries his hand at being Robert ‘trick shot’ Zemeckis with a single shot take revolving in and around a moving van. Not only is the shot good, its actually used for one of the film’s best ‘quieter’ moments involving Dakota working out her ‘personal space’. There’s various laughable continuity errors from the somewhat selective effects of the EMP to the way it seems the roads are magically clear for driving a car through but these are pure nitpicks at best and don’t retract from the film at all really. So what are the real flaws? By retaining such a simple premise the film does tread over itself – more than once our trio of family heroes escape death or injury quite conveniently. Scenes of mass panic and hysteria are done convincingly but are hardly new. I love the basement ‘roving eye’ sequence but it feels very “Abyss” water tentacle-ish, I enjoyed the disgusting display of human selfishness in the scene with people scrambling to get into the car – even though I saw the same scene in “Day of the Triffids” over a decade ago. Various shots and sequences borrow from the best of the genre and despite its well told edge, there’s an almost cold distancing effect the film generates though its hard to tell if that’s deliberate or not. At times it desperately tries to become something more by squeezing in bits of subtext about various issues ranging from parental to paranoia. Those moments feel forced into what is essentially a streamlined and pure entertainment vehicle. There’s been a surprising amount of above average mainstream films this season, which seem to just keep getting better. On a technical and visceral level though “Worlds” can fairly be called one of the best Summer films so far. It’s the Spielberg of old, simple but smart entertainment. It’ll be loved by his fans, but its far from perfect and the coldness and brutality (undermined in the worst possible way by the cheesily happy ending) will stop it from being remembered or re-watched in the same way his far superior crowd pleasing efforts like “Raiders” or “Jaws” are. Its a B movie, but if you can get over the few but fatal shortcomings it has – WHAT a B movie."
"Oct 29, 2006",neutral,The film is dark and bleak with little real sense of wonder--the thing that should be Spielberg's forte.
"Sep 10, 2006",positive,click to read review [Greek]
"Jun 24, 2006",positive," By entering your email address you agree to our Terms of Use and Privacy Policy and consent to receive emails from Time Out about news, events, offers and partner promotions. Our newsletter hand-delivers the best bits to your inbox. Sign up to unlock our digital magazines and also receive the latest news, events, offers and partner promotions. By entering your email address you agree to our Terms of Use and Privacy Policy and consent to receive emails from Time Out about news, events, offers and partner promotions. By entering your email address you agree to our Terms of Use and Privacy Policy and consent to receive emails from Time Out about news, events, offers and partner promotions. Given the clampdown on timely press screenings and its star's assorted diversionary tactics, you'd suspect 'War of the Worlds'had something to hide. Yet this update of HG Wells' 1898 novel of alien attack is vintage latter-day Spielberg, re-establishing the director as reigning architect of disaster porn, unleashing a frenzy of the visible to metronomic rhythms of set-up and money shot, set-up and money shot.Divorced bad dad Ray Ferrier (Tom Cruise) has his two kids for the weekend when a freak lightning storm hits his blue-collar New Jersey neighbourhood. Next, an apocalypse: the ground cracks and yawns open, the basso-groan of alien-built tripods begins a terrifying industrial symphony, and crackling beams vapourise the fleeing herds one by one, their suddenly body-less clothes borne into the air like kites. (The mass-panicked humans can pose as much a threat as their predators, as when a deranged zombie mob descends on the Ferriers' car.) Like its characters,'War'is always on the run: no time to explain the alien infrastructure or the crimson kudzu-like vines choking the landscape; when a burning train screams past, we pause to stare wordlessly at its smoking streak, then it's on to the next catastrophe. September 11 signifiers abound – in the thick film of white death-dust veiling Cruise after a narrow escape, and the Red Cross volunteer megaphoning 'We have more blood than we can use' – but any social context or family pathos (yes, Ray rises to the occasion, but so did the dread Giuliani) is thin and wobbly. Nevertheless, the film succeeds as pure sensation, an exacting distillation of fear. By entering your email address you agree to our Terms of Use and Privacy Policy and consent to receive emails from Time Out about news, events, offers and partner promotions. By entering your email address you agree to our Terms of Use and Privacy Policy and consent to receive emails from Time Out about news, events, offers and partner promotions."
"May 12, 2006",positive,"Steven Spielberg's War of the Worlds is huge and scary, moving and funny-another capper to a career that seems like an unending succession of captivations."
"Dec 6, 2005",positive," Before you start promoting your film, ensure you have a clear visual and verbal identity in place. A compelling poster or key image is crucial to grab... In an age where digital entertainment is more accessible than ever, movie marathons have become a favorite pastime for many. Yet, as we indulge in... Irish bookmaker Paddy Power’s cheeky humor and bold marketing tactics have helped the company become one of the biggest iGaming brands in the world.
The... Film Threat cares about your privacy and the security of your information. Visit our full length Privacy Policy to get informed on our policies regarding the collection, use and disclosure of information we receive from users."
"Nov 27, 2005",positive,"No es la gran película de la década, pero sí es un claro ejemplo de entretenimiento del más alto nivel que te mantendrá, literalmente, en el filo de la butaca."
"Nov 11, 2005",positive,"Spielberg's Worlds is filled with terrific scenes but ultimately, he draws the film to a predictable and utterly disappointing conclusion."
"Oct 27, 2005",negative,"A basic rule of thumb is - if you see Tim Robbins, you've stayed too long."
"Sep 26, 2005",positive,"There likely won't be a more gripping film this year than Spielberg's War Of The Worlds, which at its best glides along like choreography with a camera, slowly parsing out information while shrouding the rest in shadow and suggestion."
"Aug 2, 2005",positive,"Certainly a grab-bag of Spielberg's Greatest Hits, but like The Beatles, there's a reason a lot of those Hits were #1 when they came out."
"Aug 2, 2005",positive,[A]s much a disaster movie as it is a straight sci-fi horror film ... there are very good performances in the film ... but the movie leaves you feeling let-down and quarrelsome.
"Jul 31, 2005",negative,"(...) La primera media hora de Guerra de los Mundos es una maravilla de suspenso, tensión, horror y drama..."
"Jul 25, 2005",positive,"I liked it a lot, aside from the ending, which made me want to burn down the theater."
"Jul 22, 2005",positive,"Just as Jaws made us fear the water, WOTW makes us wary of the weather. You'll never again look at lightning in quite the same way."
"Jul 22, 2005",positive,An adrenaline pumping disaster movie told within the context of a small scale family drama ... is an entertaining thrill ride.
"Jul 21, 2005",positive,All summer blockbusters should be as loud and scary -- and deliver -- like this.
"Jul 19, 2005",positive,"Until its final act, the film is lean and alive, a visceral thrill ride designed to move audiences to the edge of their seats or maybe into their parents' laps."
"Jul 18, 2005",positive,War of the Worlds shows that Steven Spielberg remains one of the best shooters in Hollywood.
"Jul 17, 2005",negative,The narrative miscalculation is extraordinary and ruinous to the extent that I can't conjure an example of a similarly enjoyable movie being beheaded so efficiently.
"Jul 16, 2005",negative,
"Jul 15, 2005",positive,"War of the Worlds is thoughtful, but don't let that worry you. This is an action film concerned more with delivering thrills than making bold statements."
"Jul 14, 2005",positive,"WotW is a great film and entertainment that can be taken seriously; Shyamalan and Emmerich must be quietly shaking their fists, realizing he still does it better."
"Jul 14, 2005",negative,"Overall, the film is too lacking in feeling to provide a recognizably human experience."
"Jul 14, 2005",positive,The movie is the anti-Independence Day; the aliens are kicking our butts and we can't do anything but wait for our turn to become kibble.
"Jul 13, 2005",positive,It's worth every penny.
"Jul 13, 2005",positive," The visual effects are impressive and the crew does a technically competent job. The heart and warmth we've come to expect from Spielberg is missing.  Didn't I already see this in 1996, and wasn't it called Independence Day? (I'm only half-joking.) Actually, this movie is better than the aforementioned schlockfest, but to my surprise, it wasn't all that much better. I haven't read the book by H.G. Wells, on which this movie and its previous incarnations were based, but after seeing this latest remake, I really want to read the book. I suspect I'll enjoy it more than I enjoyed this movie.   Before I really delve into the review, I want to lament the loss of the old Steven Spielberg, the one who gave us such classics as The Goonies, the Indiana Jones series and, of course, E.T. I remember watching A.I. a few years ago and expressing surprise at how bad it was. I still feel that way, but despite that, what really permeates throughout A.I. is a high dose of sentimentality, and yes, even some warmth at times. But since then, Spielberg movies have been almost entirely devoid of warmth. I thought Minority Report was a decent movie, but it had almost no warmth at all. Even Schindler's List had some warmth to it at times, but War of the Worlds is almost completely devoid of the heart and warmth we have come to expect from Spielberg's movies. (Vic wrote an article about Spielberg's changing directorial style here.) Of course, Spielberg is free to do as he chooses, but he would do well to remember why he became one of the most successful directors in Hollywood.   Tom Cruise plays Ray Ferrier, a dock worker in New York City. He's cocky and has a chip on his shoulder (sound familiar?). He's also divorced with two kids, and he's not much of a father to them. His son Robbie (played by Justin Chatwin) basically won't even speak to him, and his daughter Rachel (played by Dakota Fanning) is growing more estranged from him every day. Ray's ex-wife Mary Ann (played by Miranda Otto) has married a rich guy named Tim (played by David Alan Basche), which only adds to the stress a working-class guy like Ray must feel. Long story short, this family puts the ""fun"" in dysfunctional.   Not long after Mary Ann drops the kids off at Ray's house for a visit, strange things start happening. The sky becomes very overcast, and a fierce wind starts blowing towards a big hole in the sky. Shortly after that, a series of lightning knocks out pretty much anything electrical in the area (except a few choice objects of the filmmakers' choosing — bah!). Wanting to find out what happened, Ray heads down to where the lightning struck. As it turns out, all the lightning bolts hit the same location, causing a big crater in the road. The crowd gathering around the crater doesn't have to wait long to see some action, though, because a huge alien vessel with three legs (henceforth called a tripod) pops out of the ground. Despite their fear at the fact that several city blocks have already been destroyed, the crowd's mentality is still one of curiosity, at least until the tripod starts shooting a laser beam at everyone in sight, instantly cremating them (but not their clothes, oddly enough). Ray immediately high-tails it back home, just barely avoiding the laser beams on several occasions. He quickly has his kids pack whatever they can, and since Ray knows where a working vehicle can be found (of course), they head for Boston to find Mary Ann and Tim.   Of course, as you might guess, the trip to Boston doesn't go exactly as planned, and they end up losing the vehicle because when you have the only working vehicle in New York City, people tend to get a little envious. They end up trying other methods to reach their destination, primarily walking and the ferry, all of which put them in harm's way because it turns out that there are quite a few tripods in quite a few locations throughout Earth. The vast majority of the movie features Ray and his kids trying to avoid being killed by the aliens. There are a few scenes where they hide out, but most of the time they are running for their lives. There are so many questions throughout this movie. Will Ray and his kids survive? Will humanity be able to defeat the powerful aliens, and will it somehow involve Ray? Will the audience groan in disbelief at an ending that feels like it was pulled right out of thin air?   The technical aspects of this film are very well done. The special effects are great, and most of the actors did fine jobs. I didn't really like Dakota Fanning's portrayal of Rachel. It seemed like half the time she was wise beyond her years, while the other half she was screaming her head off. I'm certainly no expert on what a ten-year-old should act like, but somehow I thought it should be more consistent. It's not all Dakota Fanning's fault, primarily because many of her mannerisms were script-driven. Tom Cruise does an admirable job of acting; you can always tell he works hard, and I see that as a good thing. He also does a good job of integrating one-liners into his scenes without making them seem cheesy or out of place.   So is the movie worth seeing? That depends on what you're expecting. If you're expecting to walk out of the theater with a big grin on your face while shouting, ""That was AWESOME!"" this movie won't fit the bill. It's too dark, somewhat depressing and very bloody and violent. (The PG-13 rating is well-deserved, so please do the little ones a favor and leave them at home.) If you're after great special effects and a high adrenaline rush and you don't mind the fact that the storyline takes a back seat, by all means go and see it. To be honest, this movie is better than most of the dreck coming out of Hollywood these days. The only problem is, considering the high caliber of talent behind the camera (and in front of it), I was expecting quite a bit more.  Obi-Wan Kenobi is a character with many different abilities, both in Star Wars canon and in Legends. However, not all of these powers are canon. Dune 2's ending delivers an epic conclusion to this chapter of Paul Atreides' story, as the sequel also teases what is next for the sci-fi franchise."
"Jul 12, 2005",negative,"... A visual and technical achievement, but underwhelming on every other level."
"Jul 10, 2005",negative,"It doesn't work as a science fiction epic, it doesn't work as a tale of families bonding in the face of tragedy, and it certainly doesn't work as a mingling of the two."
"Jul 8, 2005",positive,You don't think a walking tripod can be scary?
"Jul 8, 2005",positive,Don't expect Reese's Pieces or mashed potatoes to be on the menu in Spielberg's shock-and-awesome version of Wells.
"Jul 8, 2005",positive,A summer spectacular in which human relationships and emotions refuse to be overwhelmed by (admittedly awesome) computer-generated mayhem.
"Jul 7, 2005",positive,It's a thrilling ride...[but] this bountiful pot of signifiers leaves a caustic aftertaste.
"Jul 7, 2005",positive,A thrilling but frivolous ride.
"Jul 7, 2005",positive,"War of the Worlds is taut, gripping and surprisingly dark filmmaking."
"Jul 7, 2005",negative,"A rather primitive demolition derby, with little of the human solidarity that was corny but meaningful in the 1953 picture."
"Jul 7, 2005",positive,"H.G. Wells wouldn't recognize his 1898 alien-invasion novel, The War of the Worlds, in Steven Spielberg's updated film version. But Wells could probably relate to the ensuing fear and panic."
"Jul 7, 2005",negative,There's stuff to make you go 'Wow!' but nothing you'll remember the next day.
"Jul 7, 2005",positive,"This was one really intense, terrifying film that must be seen on the big screen!"
"Jul 7, 2005",positive,"I just thought it was unrealistic when they killed the aliens with a chemical imbalance, because we all know there's no such thing as a chemical imbalance."
"Jul 7, 2005",positive,"Spielberg remains the consummate storyteller, even if the material he has chosen to work with simply doesn't pack the emotional wallop of a ""Schindler's List""......"
"Jul 7, 2005",positive,an impressive display of sound and fury that falls apart the minute any scrutiny is applied to the machinations of its plot.
"Jul 7, 2005",positive,"War, what is it good for? Absolutely nothing but a good couple of hours at the theater."
