Dates,Scores,Reviews
"Aug 15, 2013",positive," “Is it the terrorists?” a frightened child asks, because that is the scariest thing she knows. But what makes this thing scary is that it is something no one knows. It is beyond our knowledge, even beyond our imagination. Earth is under attack and no one knows by whom or what they want. These are not the “let’s play musical notes together” aliens of Close Encounters of the Third Kind or the Reese’s Pieces-loving, bicycle-flying botanist alien from E.T.: The Extraterrestrial. There’s no “Take me to your leader,” or Klaatu Barada Niktu. These aliens don’t even want to keep humans on as slave labor as in Battlefield Earth. They don’t want us to understand or negotiate with them. It does not seem to be about power or plunder. They just want to destroy us. As one character says, “This is not a war any more than there’s a war between men and maggots. It’s an extermination.” Steven Spielberg knows two things better than anyone else who ever made a movie, and both are in top form here. First is his extraordinarily evocative sense of family life, the way every detail of home and connection (even, maybe especially the most frayed of connections) tell the story and make us care about it. A ribbon, a mirror, a boot, a box of family photographs, a Beach Boys song –- the juxtaposition of the ordinary with the unthinkable sustains a “golly” factor that grabs our throats and our hearts at the same time. The special effects in the movie are dazzling. Just when we thought that we were so accustomed to the limitless wonders of CGI that we could never be stunned in a theater again, Spielberg just plain knocks our socks off. My husband counted eight spontaneous “Oh my Gods” coming from me during the movie. It isn’t just that it all looks real, seamlessly integrating the effects. It’s that what looks so real is so “Oh my God.” The images are fresh and imaginative and yet perfectly believable, mixing the normal with the inconceivable, from the vast alien machines to the buckling of the earth and the apocalyptic landscapes. The most vivid images are when we see the trappings of everyday life transformed. In one moment of complete insanity, the bells at a railroad crossing start to clang, and the striped barriers come down as though it is a perfectly ordinary day and the commuter train is about to arrive on schedule. Everyone stops and takes a breath and then the train comes in, filled with flames. Spielberg’s other great trick is his mastery of scale, and again, that use of context brings the story literally home. At least half of the “Oh my Gods” were responses to wow-style reveals of new threats, new invasions. And Spielberg makes invasion into a theme, from the very beginning, when with stunning economy he sets the stage for all that is to come. Our hero-to-be, Ray (Tom Cruise) arrives home late. His ex-wife Mary Ann (Miranda Otto), pregnant by her new husband, is standing there with a hand on her hip. The new husband is handsome, a little sleek-looking in a black turtleneck, but clearly so nice you can’t even bring yourself to hate him, though Ray has clearly tried. Even though the ex-wife is late, she decides to carry their daughter’s suitcase into Ray’s house. Ray is very uncomfortable as she opens his all-but-empty refrigerator and peeks into his messy bedroom. He feels invaded. His children seem alien. And yet, in one of the most understated but meaningful moments in the movie, a shared joke between Ray and Mary Ann shows us a glimpse of Ray’s asperity and resolve. But all of that is under the surface. When we meet him, Ray has long been used to disappointing people. It is not clear which is worse, the sullen animosity of his son Robbie (Ray wears a Yankees baseball cap; Robbie pulls out one with a Red Sox logo) or the patient lack of expectations from his daughter, Rachel (Dakota Fanning). But when it becomes clear that something very, very bad is happening, Ray will do anything to keep his family safe. This will be his story more than it is the story of the battles. The movie is at heart, well, heart. And Cruise does heart well. He and Fanning anchor the film with outstanding performances of conviction and charisma. Rachel’s protection of her “space” and Ray’s efforts to care for her memory and spirit all echo the invasion theme. The story moves well from the large scale destruction of a city to a small-scale intrusion into a shattered basement retreat occupied by three people. Throughout, the focus is on Spielberg’s favorite subject, the family as fortress. The government barely exists, the army is dedicated and honorable but overmatched. And, as Ray points out, the humans are almost as dangerous as the aliens. Ray is not the only one who will do anything to keep his family alive and the ochlochratic chaos means that nowhere is safe. The story is affecting, the action scenes are thrilling, the issues are resonant. Yet it is not ultimately as satisfying as less skillful movies like Independence Day. It may be wiser and it may have more artistic validity, but summer explosion movies call out for a more complete resolution than the Wells book allows. A valid but subtle point is lost, not for lack of respectful presentation, but perhaps because ot it. Spoilers alert: Parents should know that this is an extremely tense and intense movie, with constant peril and violence. Many characters are killed. Many are neatly vaporized, but there are scenes with dead bodies, a brutal off-camera murder, a death by impalement, guns, grenades, lasers, and other weapons, and some grisly images. Characters use brief strong language. There are tense confrontations between family members. Some viewers will find the behavior of the humans more disturbing than that of the aliens. Someone once said that the aliens in movies tell us more about what we are thinking about than about any likely real-life extraterrestrials. The UFO movies of the cold war era were, under this analysis, a reflection of our fears about communism and the atomic bomb — with the 1956 version of Invasion of the Body Snatchers and The Day the Earth Stood Still as examples, contrasted with the more benign aliens of Spielberg’s other movies. What does this movie tell us about our current fears? Families who see this movie should talk about how the story has changed since it was originally written by H.G. Wells more than 100 years ago. How was that era’s interest in the relatively recent scientific discoveries reflected in the book and how has the current version used modern concerns to connect to a contemporary audience? What do you think about the balance of the story between the action and the personal drama as Ray’s character has to become more responsible and
find a way to communicate with his children. How did both parts of the story help each other? In a situation like this, who do you help? Who do you accept help from? Families who appreciate this film may enjoy listening to the legendary Orson Welles broadcast. This version of the book has the radio script as well. The text is also available online at Project Gutenberg. The new version has a small tribute to the George Pal movie. They will also enjoy Independence Day, one of the all-time best alien invasion movies, and they might get a kick out of Battlefield Earth, one of the worst, and Signs, one that has a bit of both. For the first time after reading many, many of your excellent reviews, I finally saw a movie for which my review is quite different than yours. I saw the movie today, then looked up your review for the first time, thinking you’d probably have given it a “D”. I was surprised to see how highly you rated it. Of course, art is in the eye of the beholder and all are entitled to their perspectives.
Pardon me for saying, but I felt that this was one of the worst movies I’ve seen. I think that Tom Cruise and Dakota Fanning are capable of good acting, but I feel that the script for this movie was horrible. To me, the movie consisted mainly of “Aliens attack earth: worst case scenario” for 99 pct of the movie, then 1 pct of “dying alien seen in spacecraft” before end of movie. I felt there was little plot other than this, and found myself fast-forwarding through a lot of the mayhem – explosions, wreckage, vaporizing bodies. I honestly would recommend that people not rent this movie. I felt my time was wasted.
I’ve found Steven Spielberg to be a good director, but inconsistent. Some of his movies have been great while others such as A.I., I felt were big duds. There is something disconnected about both A.I. and W.O.T.W.: their storylines are weak and the characters in them are not as dynamic as characters in better-made films. In E.T. and Indiana Jones (1), the characters are well-developed and dynamic. By contrast, characters in both A.I. and W.O.T.W. seemed more unidimensional. Stanley Kubrick managed to take themes of people dealing with disaster and make the characters come to life to a greater degree than Spielberg makes them. As Brad Bird of Pixar is fond of saying, special effects can only take a movie so far: in the end, it is the story that is the most important. Thanks very much, Brian.  This is a movie I like less and less as I get further away from seeing it.  You make some very good points and I will re-think my rating."
"May 27, 2011",positive,An unstoppable juggernaut of action and anxiety that will have you blundering from the cinema in a state of nervous exhaustion. Don't expect any soft drink promotional tie-ins with this summer blockbuster.
"Mar 7, 2011",positive,"War of the Worlds is that most rare of screen adaptations - a film that is faithful to its origins and at the same time, its own separate creature. The first half is better than the second, but what a first half."
"Dec 17, 2010",positive,Alien invasion thriller too scary for young kids.
"Aug 17, 2010",positive," HugeDomains provides a 100% satisfaction guarantee on every domain name that we sell through our website. If you buy a domain and are unhappy with it, we will accept the return within 30 days and issue a full refund – no questions asked. In most cases access to the domain will be available within one to two hours of purchase, however access to domains purchased after business hours will be available within the next business day. Yes, you can transfer your domain to any registrar or hosting company once you have purchased it. Since domain transfers are a manual process, it can take up to 5 days to transfer the domain. Domains purchased with payment plans are not eligible to transfer until all payments have been made. Please remember that our 30-day money back guarantee is void once a domain has been transferred. Once you purchase the domain we will push it into an account for you at our registrar, NameBright.com, we will then send you an email with your NameBright username and password. In most cases access to the domain will be available within one to two hours of purchase, however access to domains purchased after business hours will be available within the next business day. Nothing else is included with the purchase of the domain name. Our registrar NameBright.com does offer email packages for a yearly fee, however you will need to find hosting and web design services on your own. If you wish the domain ownership information to be private, add WhoIs Privacy Protection to your domain. This hides your personal information from the general public. To add privacy protection to your domain, do so within your registrar account. NameBright offers WhoIs Privacy Protection for free for the first year, and then for a small fee for subsequent years. Whois information is not updated immediately. It typically takes several hours for Whois data to update, and different registrars are faster than others. Usually your Whois information will be fully updated within two days."
"May 19, 2010",positive,...in its own right it works well enough most of the time to pass an entertaining couple of hours.
"Apr 29, 2009",positive,"An exciting, intense, gruesome, and awfully subversive piece of science fiction escapism..."
"Oct 18, 2008",positive,"See it, but lower your expectations."
"Feb 28, 2008",negative,"This is Spielberg at his unabashedly commercial worst %u2014 bland, unimaginative, and more interested in his bang than his brain."
"Jul 23, 2007",positive," Steven Spielberg, in the first hour or so of War of the Worlds, summons the apocalypse with all his genius for suspense and sadism. Yes, sadism. I’ve long felt that Spielberg has a lot of anger to work off — it’s come out in the oddest ways in some of his films — and here he gets to kill most of us off via tripod-riding aliens who squash millions of people as if they were less than ants. Knocking over buildings, flinging cars in the air, up-ending ferries, zapping screaming humans into ash, Spielberg is, make no mistake, having the time of his life. War of the Worlds differs from a callow destruct-a-thon like Independence Day in that the large-scale carnage, with catastrophe building on catastrophe, thrills as much as it hurts. This is really the first whack Spielberg has had at depicting mass destruction since 1941 over twenty-five years ago, and he shows all the summer-movie whippersnappers how it’s done. When the aliens emerge from the cracked asphalt of New Jersey and begin their brutal business, you can safely strap in for some of the most awe-inspiring work Spielberg has done in years. The rest of War of the Worlds, though, is hit or miss. The problems, for some, may begin with Tom Cruise as the film’s default hero — Ray Ferrier, a divorced dad who never grew up. Spielberg’s portfolio is full of men like Ray, and they were more believable when smaller-scale actors like Richard Dreyfuss were playing them. In Close Encounters of the Third Kind, Dreyfuss, playing an equally childlike father, gave off a schlumpy Everyman vibe, but with a manic gleam that kept you unsure what he was going to do. Certainly Spielberg wouldn’t find it in himself these days to give us a hero who leaves his wife and kids behind, as Dreyfuss did; and Tom Cruise is not the sort of actor who makes you nervous in that way, at least not in this kind of role. Cruise hurts the film because you don’t buy for a minute that a summer movie starring Tom Cruise will end with him or his two kids (Dakota Fanning and Justin Chatwin) anywhere near dead. A remake of War of the Worlds directed by Spielberg would have sold itself; it didn’t need star power, and if Spielberg had cast someone like Paul Giamatti — an actor who can play someone who might fail — the movie would be more successfully terrifying. As it is, we’re not sure why Ray, running with hundreds of others on the chaotic streets, doesn’t get zapped along with the dozens who get reduced to ash constantly on either side of him, other than the fact that he’s Tom Cruise. As written and played, Ray has nothing much going for him aside from bulldog determination. He has to protect his kids at all times and at all costs, thwarted by one crisis or another (sometimes it’s aliens, sometimes it’s panicked mobs of people), and you get the sense that he’s being punished for being an absentee father. Millions of humans perish by fire so that Ray the deadbeat dad can redeem himself through action — or action-movie action. Apparently it wouldn’t be a Spielberg film these days without a stretch of film that makes little sense and could be deleted with no harm done, and here we have Ray and his little daughter holing up in a basement with a grim-faced survivalist played by Tim Robbins. The climax of this plot thread serves no purpose other than to prove that Ray will do anything to keep his daughter alive, except that the proof is kept behind a closed door. For Robbins’ part, playing a gun-toting redneck, he gives the sort of crude performance — to paraphrase Pauline Kael — only a very dedicated liberal would give. His character is Bad News the second we lay eyes on him, because he’s rural and he’s armed. Spielberg and Robbins are both capable of more subtlety than this. Some viewers have been bothered by the film’s wealth of 9/11-inspired imagery — the missing-person posters, the flakes of ash that used to be flesh falling everywhere. Spielberg gets a pass there — 9/11 showed us all what real disaster looks like, and it would be disingenuous of the movie to go back to the relatively clean zap-zap of something like Independence Day or, for that matter, the original 1953 War of the Worlds. If the destruction is unavoidably exciting, the aftermath is by necessity sobering and chilling. A director can be of two minds about the carnage he wreaks — we saw it in the famous “Ride of the Valkyries” helicopter-attack sequence in Francis Coppola’s Apocalypse Now, equal parts invigorating and appalling. Spielberg, following H.G. Wells’ book, eschews the ID4 formula of “Aliens attack; we hit back.” The power of our military is shown to be haplessly meaningless against the well-shielded aliens; the aliens’ downfall, as relevant today as in Wells’ day, is simply the arrogance of dominion. Too confident in their ability to wipe out big foes, they don’t account for smaller ones. In the end, this War of the Worlds plays on American fears much the same way earlier versions of the story (including Orson Welles’ notorious 1938 radio hoax) did — in this case, terrorism, with a side order of unease about the way things are going in Iraq. (Talk about the arrogance of dominion; if anyone finds it implausible that aliens would invade a planet they know fatally little about, how about a country that starts a war on bullshit pretenses with an insufficient number of troops and threadbare equipment, hoping that the people will greet us as liberators? We have met the aliens, and they are us.) It’s fun to analyze summer entertainment this way, if not terribly satisfying; it doesn’t make the movie larger than it is. I still prefer Tim Burton’s flamboyantly goofy Mars Attacks, which had no agenda other than to blow stuff up for fun. Spielberg blows stuff up better than anyone — he proves himself the maestro of that by-now-degraded game. But he does it so well that it’s a hard act for even the maestro to follow."
"Jul 14, 2007",neutral,"Just when it seemed like Mr. Spielberg might be maturing into a filmmaker with some much-needed cynicism, you realize he's still just out there rounding up the dollars."
"Jun 27, 2007",positive,Spielberg flips the E.T. script with this sci-fi flick which reverts to the pulp fiction notion of aliens as the enemies of earthlings.
"Jun 8, 2007",negative,"Spielberg's calculations turn out to be more prominent than any effects they could possibly produce, and the less pretentious 1953 version by producer George Pal emerges as more likable."
"Feb 26, 2007",positive,"Reconfirms Spielberg as a master of action, here seamlessly integrating spectacular visual magic into the most mundane and familiar settings."
"Nov 17, 2006",positive,"Like disasters in real life, the film hits you in the gut with a vision of catastrophe, and leaves you to sort out what it all means."
